simplified	FR	example_FR
软件	le logiciel	Ce logiciel est facile à utiliser.
弱	faible	Sa santé est relativement fragile.
洒	renverser; répandre	Il a renversé l'eau par accident.
嗓子	la gorge; la voix	J'ai un peu mal à la gorge.
色彩	les couleurs	Ce tableau a des couleurs très riches.
杀	tuer	Il n'y a pas de scène de meurtre dans ce film.
沙漠	le désert	L'eau dans le désert est très précieuse.
沙滩	la plage	Les enfants jouent sur la plage.
傻	bête; idiot	Ne fais pas de bêtises.
晒	faire sécher au soleil	Les vêtements sèchent au soleil sur le balcon.
删除	supprimer	Supprime ce courriel, s'il te plaît.
闪电	l'éclair	Des éclairs sont apparus pendant la nuit.
善良	gentil; bienveillant	C'est une personne bienveillante.
善于	être doué pour	Il est doué pour résoudre les problèmes.
扇子	l'éventail	J'utilise souvent un éventail en été.
伤害	blesser; nuire	Ne blesse pas les sentiments des autres.
商品	la marchandise	Cette boutique a beaucoup de marchandises.
商务	les affaires; commercial	Il participera demain à une réunion d'affaires.
商业	le commerce	Le commerce est bien développé dans cette région.
上当	se faire avoir	Il a failli se faire avoir.
蛇	le serpent	Il y a un serpent dans l'herbe.
舍不得	avoir du mal à quitter; regretter de se séparer	J'ai du mal à quitter cet endroit.
射击	le tir; tirer	Il s'entraîne au tir.
摄影	la photographie	Elle s'intéresse beaucoup à la photographie.
设备	l'équipement	L'équipement du laboratoire est très avancé.
设计	le design; concevoir	Ce design est très créatif.
设施	les installations	Les installations sportives de l'école sont bonnes.
伸	tendre; étendre	Tends la main, s'il te plaît.
深刻	profond	Cette expérience m'a laissé une impression profonde.
身材	la silhouette; la carrure	Elle a une silhouette saine.
身份	l'identité	Veuillez présenter une preuve d'identité.
神话	le mythe	Les enfants aiment écouter des récits mythologiques.
神秘	mystérieux	Cette ville ancienne est très mystérieuse.
升	le litre; monter	Le prix du carburant a augmenté un peu par litre.
声调	le ton	Le chinois a quatre tons de base.
生产	produire	Cette usine produit des téléphones portables.
生动	vivant; expressif	Le professeur explique les choses de façon très vivante.
生长	pousser; grandir	Cette plante pousse très vite.
绳子	la corde	Attache bien la boîte avec une corde, s'il te plaît.
省略	omettre	On peut omettre un caractère ici.
胜利	la victoire	Ils ont finalement remporté la victoire.
失眠	l'insomnie	Il souffre souvent d'insomnie ces derniers temps.
失去	perdre	Ne perds pas confiance.
失业	perdre son emploi; le chômage	Après avoir perdu son emploi, il a commencé à apprendre de nouvelles compétences.
湿润	humide	L'air après la pluie est très humide.
狮子	le lion	Il y a deux lions au zoo.
诗	le poème; la poésie	Il a écrit un poème.
实话	la vérité	Dis la vérité, s'il te plaît.
实践	la pratique; mettre en pratique	La théorie doit être vérifiée par la pratique.
实习	faire un stage	Elle fera un stage à l'hôpital pendant les vacances d'été.
实现	réaliser; accomplir	Il a finalement réalisé son rêve.
实验	l'expérience	Les étudiants sont en train de faire une expérience.
实用	pratique	Cet outil est très pratique.
时差	le décalage horaire	Il ne s'est pas encore adapté au décalage horaire.
时代	l'époque	Nous vivons à l'ère de l'information.
时刻	le moment	Souviens-toi de ce moment important, s'il te plaît.
时髦	à la mode	Ce vêtement est très à la mode.
时期	la période	Sa période universitaire a eu une grande influence sur lui.
时尚	la mode	Elle s'intéresse beaucoup à la mode.
石头	la pierre	Il y a une pierre au bord de la route.
食物	la nourriture	Mets la nourriture au réfrigérateur, s'il te plaît.
使劲儿	forcer; utiliser sa force	Il faut forcer pour ouvrir cette bouteille.
始终	toujours; du début à la fin	Il a toujours cru qu'il pouvait réussir.
事实	le fait	Les faits prouvent qu'il avait raison.
事物	la chose; le phénomène	Les enfants sont très curieux des choses nouvelles.
事先	à l'avance	Dis-moi l'heure à l'avance, s'il te plaît.
似的	comme si	Il était si fatigué qu'il semblait ne pas vouloir dire un mot.
士兵	le soldat	Les soldats s'entraînent.
市场	le marché	Ce marché est très animé.
试卷	la copie d'examen	Le professeur corrige les copies d'examen.
收获	le gain; la récolte	Ce voyage m'a beaucoup apporté.
收据	le reçu	Garde le reçu après avoir payé, s'il te plaît.
手工	fait main; manuel	Ce cadeau est fait main.
手术	l'opération chirurgicale	Le médecin l'opérera demain.
手套	le gant	Il faut porter des gants quand on sort en hiver.
手续	les formalités	Il faut une pièce d'identité pour accomplir les formalités.
手指	le doigt	Son doigt est blessé.
首	classificateur pour les chansons et poèmes	Elle a chanté une chanson.
受伤	être blessé	Il s'est blessé pendant le match.
寿命	la durée de vie	Ce type de machine a une longue durée de vie.
书架	la bibliothèque; l'étagère à livres	L'étagère à livres est pleine de livres.
梳子	le peigne	Elle se coiffe avec un peigne.
舒适	confortable	Cette pièce est très confortable.
蔬菜	les légumes	Manger plus de légumes est bon pour la santé.
输入	saisir; entrer	Saisis le mot de passe dans l'ordinateur, s'il te plaît.
熟练	habile; maîtrisé	Il sait utiliser l'ordinateur avec aisance.
属于	appartenir à	Ce livre appartient à la bibliothèque.
数	compter	Compte combien il y a de personnes, s'il te plaît.
鼠标	la souris d'ordinateur	Ma souris d'ordinateur est cassée.
数据	les données	Ces données sont très importantes.
数码	numérique	Il a acheté un appareil photo numérique.
摔倒	tomber	Elle est tombée sur la route.
甩	secouer; lancer	Il a secoué l'eau de ses mains.
双方	les deux parties	Les deux parties ont accepté ce plan.
税	la taxe; l'impôt	Il faut payer la taxe quand on achète des choses.
说不定	peut-être	Peut-être qu'il neigera demain.
说服	persuader; convaincre	Il a finalement persuadé ses parents.
丝绸	la soie	Cette écharpe est en soie.
丝毫	pas du tout; le moindre	Il n'a pas du tout changé d'avis.
思考	réfléchir	Réfléchis sérieusement à ce problème, s'il te plaît.
思想	la pensée	Sa pensée est très ouverte.
撕	déchirer	Ne déchire pas cette feuille, s'il te plaît.
私人	privé	C'est mon espace privé.
似乎	sembler	Il ne semble pas très content.
搜索	rechercher; chercher	J'ai cherché des documents en ligne.
宿舍	le dortoir	Les étudiants vivent dans le dortoir de l'école.
随身	sur soi; avec soi	Garde bien ton passeport avec toi, s'il te plaît.
随时	à tout moment	Tu peux m'appeler à tout moment.
随手	en passant; au passage	Ferme la porte derrière toi en partant, s'il te plaît.
碎	se casser; en morceaux	La tasse est tombée par terre et s'est cassée.
损失	la perte; le dommage	Cet accident a causé de grandes pertes.
缩短	raccourcir	Le nouveau trajet a raccourci la distance.
所	classificateur pour les écoles et bâtiments	Cette école est très connue.
锁	fermer à clé	Ferme bien la porte à clé avant de sortir, s'il te plaît.
台阶	la marche; les marches	La personne âgée a monté lentement les marches.
太极拳	le tai-chi	Des gens pratiquent le tai-chi dans le parc.
太太	Madame; l'épouse	Madame Wang est en train de cuisiner.
谈判	la négociation; négocier	Les deux parties sont en train de négocier.
坦率	franc	Il a exprimé ses idées franchement.
烫	brûlant; très chaud	Cette tasse de thé est très chaude.
桃	la pêche	L'arbre a donné beaucoup de pêches.
淘气	espiègle; turbulent	Cet enfant est un peu turbulent.
逃	s'enfuir	Le chiot s'est enfui de la cour.
逃避	éviter; fuir	Ne fuis pas tes responsabilités.
讨价还价	marchander	Il aime marchander quand il fait des achats.
套	l'ensemble; le jeu	Il a acheté un nouvel ensemble de vêtements.
特色	la caractéristique; la spécialité	Ce restaurant a des spécialités locales.
特殊	spécial	Aujourd'hui est un jour spécial.
特征	la caractéristique	Cette espèce animale a des caractéristiques évidentes.
疼爱	aimer tendrement	Les grands-parents aiment beaucoup l'enfant.
提倡	prôner; encourager	L'école encourage les économies d'eau.
提纲	le plan; les grandes lignes	Fais d'abord un plan avant d'écrire l'article.
提问	poser une question	Les étudiants peuvent poser des questions à tout moment.
题目	la question; le sujet	Cette question n'est pas très difficile.
体会	comprendre par expérience; le ressenti	Grâce au voyage, j'ai acquis une nouvelle compréhension.
体贴	attentionné	Il est très attentionné envers sa famille.
体现	refléter; incarner	Cette affaire reflète l'esprit d'équipe.
体验	faire l'expérience de	Je veux faire l'expérience de la vie locale.
天空	le ciel	Le ciel est très bleu aujourd'hui.
天真	naïf; innocent	L'idée de l'enfant est très innocente.
调皮	espiègle	Ce chat est très espiègle.
调整	ajuster; l'ajustement	Nous devons ajuster le plan.
挑战	le défi	C'est un très grand défi.
通常	d'habitude; habituellement	Il se lève habituellement à sept heures.
统一	unifier; harmoniser	Il faut harmoniser les avis de tout le monde.
痛苦	la douleur; la souffrance	Perdre son ami l'a rendu très triste.
痛快	avec plaisir; très bien	On s'est vraiment bien amusés aujourd'hui.
偷	voler	Ne vole pas les affaires des autres.
投入	se consacrer à; concentré	Il travaille avec beaucoup de concentration.
投资	investir; l'investissement	Ils ont investi dans un nouveau projet.
透明	transparent	Cette tasse est transparente.
突出	remarquable; saillant	Ses qualités sont très remarquables.
土地	la terre	Cette terre est très fertile.
土豆	la pomme de terre	J'ai acheté plusieurs pommes de terre.
兔子	le lapin	L'enfant élève un lapin.
吐	vomir	Il ne se sent pas bien et a envie de vomir.
团	le groupe	Nous avons rejoint un groupe de voyage.
推辞	refuser poliment	Il a refusé l'invitation de son ami.
推广	promouvoir; diffuser	L'entreprise est en train de promouvoir un nouveau produit.
推荐	recommander	Le professeur a recommandé ce livre.
退	reculer	Recule d'un pas, s'il te plaît.
退步	régresser; reculer	Si tu ne t'entraînes pas, ton niveau va baisser.
退休	prendre sa retraite	Il prendra sa retraite l'année prochaine.
歪	de travers	Ce tableau est accroché de travers.
外公	le grand-père maternel	Mon grand-père maternel a quatre-vingts ans cette année.
外交	la diplomatie	Il étudie les relations internationales et la diplomatie.
完美	parfait	Ce plan n'est pas parfait.
完善	améliorer; perfectionner	Nous devons améliorer le processus de service.
完整	complet	Donne-moi un rapport complet, s'il te plaît.
玩具	le jouet	L'enfant a mis les jouets dans la boîte.
万一	au cas où; si jamais	S'il pleut, nous irons un autre jour.
王子	le prince	Le prince de l'histoire est très courageux.
往返	l'aller-retour	Ce billet permet de faire l'aller-retour le même jour.
网络	le réseau; Internet	La connexion Internet ici est très stable.
危害	nuire à; mettre en danger	Fumer nuit à la santé.
威胁	menacer	La pollution menace la rivière.
微笑	le sourire; sourire	Elle m'a souri.
唯一	unique; le seul	C'est la seule solution.
围巾	l'écharpe	Il porte une écharpe en hiver.
围绕	tourner autour de; porter sur	La discussion a porté sur cette question.
维修	réparer; l'entretien	L'ascenseur est en réparation.
违反	enfreindre; violer	Faire cela enfreint les règles.
伟大	grand; remarquable	C'est une grande découverte.
委屈	se sentir lésé	Elle s'est sentie très lésée.
尾巴	la queue	Le chiot remuait la queue.
位于	se situer	L'école se situe au centre-ville.
位置	l'endroit; la position	Cet endroit est très calme.
未必	pas forcément	Ce qu'il dit n'est pas forcément vrai.
未来	l'avenir	Nous devons nous préparer pour l'avenir.
胃	l'estomac	J'ai un peu mal à l'estomac.
胃口	l'appétit	Il a bon appétit aujourd'hui.
温暖	chaud; doux	Le soleil du printemps est très doux.
温柔	doux; tendre	Elle parle très doucement.
文件	le document; le fichier	Envoie-moi le document, s'il te plaît.
文具	les fournitures scolaires	Il y a beaucoup de fournitures scolaires dans le cartable.
文明	civilisé	Faire la queue est un comportement civilisé.
文学	la littérature	Elle aime la littérature chinoise.
文字	l'écriture; les caractères	Ces caractères sont difficiles à lire.
闻	sentir; entendre	J'ai senti un parfum de fleurs.
吻	embrasser; le baiser	La mère a embrassé le visage de l'enfant.
稳定	stable	Les prix restent stables.
问候	saluer; transmettre ses salutations	Transmets mes salutations à ta famille, s'il te plaît.
卧室	la chambre	Il y a un grand lit dans la chambre.
握手	serrer la main	Ils se sont serré la main quand ils se sont rencontrés.
屋子	la pièce; la maison	Il fait chaud dans la pièce.
无奈	impuissant; sans pouvoir rien y faire	Il a secoué la tête d'un air impuissant.
无数	innombrable	Il y a d'innombrables étoiles dans le ciel nocturne.
无所谓	peu importe	Peu importe ce que tu veux manger.
武术	les arts martiaux	Il étudie les arts martiaux depuis l'enfance.
勿	ne pas; défense de	Défense de fumer ici.
物理	la physique	Le cours de physique est très intéressant.
物质	la substance; la matière	L'eau est une substance importante.
雾	le brouillard	Il y avait un épais brouillard le matin.
吸取	tirer; apprendre	Nous devons tirer une leçon de cette expérience.
吸收	absorber	Les plantes absorbent l'eau.
戏剧	le théâtre; le drame	Il aime regarder du théâtre traditionnel.
系	le département universitaire	Elle étudie au département de chinois.
系统	le système	Ce système fonctionne de manière stable.
细节	le détail	Fais attention à ces détails, s'il te plaît.
瞎	à l'aveuglette; sans raison	Ne devine pas au hasard, regarde d'abord les documents.
下载	télécharger	J'ai téléchargé ce logiciel.
吓	effrayer	Le bruit soudain m'a fait peur.
夏令营	le camp d'été	L'enfant a participé à un camp d'été de chinois.
鲜艳	vif; éclatant	La couleur de cette jupe est très vive.
显得	avoir l'air; faire paraître	Ce vêtement le fait paraître très jeune.
显然	évidemment	Évidemment, il connaît déjà le résultat.
显示	afficher; montrer	L'écran n'affiche pas la bonne heure.
县	le district; le xian	Ce district compte beaucoup de plantations de thé.
现代	moderne	La vie moderne est inséparable d'Internet.
现实	la réalité	Nous devons faire face à la réalité.
现象	le phénomène	Ce phénomène est très courant.
限制	limiter; restreindre	L'entrée des véhicules est limitée ici.
相处	bien s'entendre	Ils s'entendent très bien.
相当	assez; considérablement	Ce livre est assez intéressant.
相对	relativement	Les prix ici sont relativement bas.
相关	pertinent; lié	Fournis les documents pertinents, s'il te plaît.
相似	similaire	Le sens de ces deux caractères est très similaire.
香肠	la saucisse	Il y a des oeufs et des saucisses au petit-déjeuner.
享受	profiter de	Ils profitent des vacances.
想念	manquer à; regretter	Ma famille me manque beaucoup.
想象	imaginer	Je ne peux pas imaginer ce genre de vie.
象棋	les échecs chinois	Grand-père aime jouer aux échecs chinois.
象征	symboliser	Le blanc symbolise souvent la pureté.
项	l'élément; la tâche	Cette tâche est très importante.
项链	le collier	Elle porte un collier en argent.
项目	le projet	Ce projet demande trois mois.
消费	la consommation	La consommation a augmenté pendant les fêtes.
消化	la digestion; digérer	Marcher après le repas aide la digestion.
消极	négatif; passif	Ne regarde pas les problèmes avec une attitude négative.
消失	disparaître	Le soleil a lentement disparu derrière la montagne.
销售	vendre; les ventes	Cette entreprise vend des produits électroniques.
小麦	le blé	On cultive beaucoup de blé dans le nord.
小气	radin; mesquin	Ne sois pas si radin.
孝顺	filial; respectueux envers ses parents	Il est très respectueux envers ses parents.
效率	l'efficacité	Faire ainsi peut améliorer l'efficacité.
歇	se reposer	Reposons-nous d'abord un moment.
斜	incliné; en pente	Cette route est un peu en pente.
写作	l'écriture	Écrire demande une pratique de longue durée.
心理	psychologique; mental	Il faut ajuster son état mental avant l'examen.
心脏	le coeur	La santé du coeur est très importante.
欣赏	apprécier; admirer	Nous avons admiré un beau paysage.
信号	le signal	Le signal du téléphone portable est mauvais ici.
信任	la confiance; faire confiance	L'amitié a besoin de confiance.
形成	se former	Les bonnes habitudes se forment peu à peu.
形容	décrire	Je ne sais pas comment décrire ce sentiment.
形势	la situation	La situation actuelle est relativement complexe.
形式	la forme	La réunion peut prendre une forme en ligne.
形象	l'image	Son image publique est très bonne.
形状	la forme	La forme de cette boîte est très spéciale.
行动	l'action; agir	Nous devons agir immédiatement.
行人	le piéton	Fais attention aux piétons en traversant la route.
行为	le comportement	Ce type de comportement est impoli.
幸亏	heureusement	Heureusement, tu me l'as rappelé.
幸运	chanceux	Il a eu la chance de trouver un travail.
性质	la nature; le caractère	La nature de ce problème est très grave.
兄弟	les frères	Les deux frères ont une bonne relation.
胸	la poitrine	Il ressent une oppression dans la poitrine.
休闲	le loisir; la détente	Le week-end est un bon moment pour se détendre.
修改	modifier; réviser	Révise cet article, s'il te plaît.
虚心	modeste; ouvert d'esprit	Nous devons écouter les avis avec modestie.
叙述	raconter; narrer	Il a clairement raconté ce qui s'est passé.
宣布	annoncer	L'école a annoncé les nouvelles règles.
宣传	promouvoir; diffuser	Ils diffusent des connaissances sur la protection de l'environnement.
学历	le niveau d'études	Ce poste exige un diplôme de licence.
学术	académique	Cette conférence discute de questions académiques.
学问	le savoir; les connaissances	Il a beaucoup de savoir.
血	le sang	Sa main a un peu saigné.
寻找	chercher	Nous cherchons une nouvelle méthode.
询问	se renseigner; demander	Il a demandé au professeur l'heure de l'examen.
训练	s'entraîner; l'entraînement	L'athlète s'entraîne tous les jours.
迅速	rapide; rapidement	La nouvelle s'est rapidement répandue.
押金	la caution	Pour louer un logement, il faut payer une caution.
牙齿	les dents	Prends bien soin de tes dents tous les jours.
严肃	sérieux	L'expression du professeur est très sérieuse.
延长	prolonger	La réunion a été prolongée d'une demi-heure.
演讲	le discours	Il prépare le discours de demain.
宴会	le banquet	Ils ont participé à un banquet.
阳台	le balcon	Il y a plusieurs pots de fleurs sur le balcon.
痒	démanger	Mon bras me démange un peu.
样式	le style; le modèle	Ce style est très populaire.
腰	la taille; le bas du dos	Le bas du dos peut faire mal après être resté assis longtemps.
摇	secouer	Le vent secouait les branches d'avant en arrière.
咬	mordre	Ce chien ne mord pas les gens.
要不	ou bien; sinon	Et si nous y allions plutôt demain ?
业务	les affaires; l'activité	Les activités de l'entreprise augmentent.
业余	pendant son temps libre	Il étudie la photographie pendant son temps libre.
夜	la nuit	La rue est très calme la nuit.
依然	toujours	Il habite toujours à Pékin.
一辈子	toute la vie	Elle a aimé la musique toute sa vie.
一旦	une fois que	Une fois que tu as décidé, il faut persévérer.
一律	tous sans exception	Pendant la réunion, tous les téléphones doivent être éteints.
一再	à plusieurs reprises	Il nous a rappelé à plusieurs reprises de faire attention à la sécurité.
一致	unanime; cohérent	Les avis de tout le monde sont parfaitement concordants.
疑问	la question; le doute	J'ai une question au sujet de cette réponse.
移动	déplacer	Déplace un peu la table, s'il te plaît.
移民	immigrer; émigrer	Ils prévoient d'émigrer à l'étranger.
遗憾	regretter; le regret	Je regrette de ne pas avoir pu te voir.
乙	la partie B	Dans le contrat, la partie B est responsable du paiement.
以及	ainsi que	J'ai acheté des livres ainsi que des fournitures scolaires.
以来	depuis	Depuis l'obtention de son diplôme, il travaille toujours à Pékin.
义务	l'obligation; le devoir	Protéger l'environnement est le devoir de chacun.
亿	cent millions; milliard	Ce pays compte plus d'un milliard d'habitants.
意外	inattendu; l'accident	Ce retard était complètement inattendu.
意义	le sens; la signification	Cette activité a beaucoup de sens.
议论	discuter; commenter	Tout le monde discute de cette affaire.
因而	par conséquent	Il étudie avec sérieux, par conséquent ses notes sont bonnes.
因素	le facteur	Le temps est un facteur important.
银	l'argent; argenté	Elle porte un bracelet en argent.
印刷	l'impression	Ce livre est imprimé très clairement.
英俊	beau; élégant	Il est très beau.
英雄	le héros	Les pompiers sont de vrais héros.
营养	la nutrition	Le petit-déjeuner doit être suffisamment nutritif.
营业	ouvrir; faire des affaires	Cette boutique ouvre à neuf heures.
迎接	accueillir	Nous sommes allés à l'aéroport accueillir les invités.
影子	l'ombre	Son ombre est sous le lampadaire.
应付	faire face à; gérer	Il peut gérer ce problème.
应用	appliquer; l'application	Cette méthode peut être appliquée à l'enseignement.
硬	dur	Cette chaise est trop dure.
硬件	le matériel informatique	Cet ordinateur a un bon matériel.
拥抱	serrer dans ses bras	L'enfant a couru serrer sa maman dans ses bras.
拥挤	bondé	Le métro est très bondé à l'heure de pointe du matin.
勇气	le courage	Il a le courage de reconnaître son erreur.
用功	étudier avec application	Elle étudie avec beaucoup d'application.
用途	l'utilisation; l'usage	Ce matériau a de nombreux usages.
优惠	la réduction; avantageux	Cette boutique propose une réduction aujourd'hui.
优美	beau; élégant	L'environnement ici est très beau.
优势	l'avantage	Son avantage est sa grande expérience.
悠久	long; ancien	La Chine a une longue histoire.
油炸	frit	Je mange rarement des aliments frits.
游览	visiter; faire du tourisme	Nous visiterons la Cité interdite demain.
犹豫	hésiter	Il a hésité un moment avant de répondre.
有利	favorable	Cette condition nous est favorable.
幼儿园	le jardin d'enfants	L'enfant ira au jardin d'enfants l'année prochaine.
娱乐	le divertissement	Regarder des films est une forme de divertissement.
与其	plutôt que	Plutôt que de se plaindre, mieux vaut agir.
语气	le ton	Son ton est très doux quand il parle.
玉米	le maïs	Il y a une soupe de maïs au dîner.
预报	la prévision	La météo annonce qu'il pleuvra demain.
预订	réserver	J'ai déjà réservé l'hôtel.
预防	prévenir	Se laver souvent les mains peut prévenir le rhume.
元旦	le jour de l'An	Nous avons un jour de congé pour le jour de l'An.
原料	la matière première	La principale matière première du pain est la farine.
原则	le principe	Il faut avoir des principes dans la vie.
员工	l'employé; le personnel	L'entreprise compte trois cents employés.
圆	rond	La lune est grande et ronde.
愿望	le souhait	Son souhait est de faire le tour du monde.
乐器	l'instrument de musique	Elle sait jouer de plusieurs instruments de musique.
晕	avoir le vertige; être étourdi	J'ai un peu le mal de mer quand je prends le bateau.
运气	la chance	J'ai de la chance aujourd'hui.
运输	le transport	Ces marchandises doivent être transportées par train.
运用	utiliser; employer	Utilise ces mots avec souplesse, s'il te plaît.
灾害	la catastrophe	L'inondation est une catastrophe naturelle.
再三	à plusieurs reprises	Le professeur nous a rappelé à plusieurs reprises de réviser.
在乎	se soucier de	Il se soucie beaucoup de l'avis de ses amis.
在于	résider dans	Le succès réside dans la persévérance.
赞成	approuver; être d'accord	Je suis d'accord avec ta suggestion.
赞美	louer; faire l'éloge de	Tout le monde a loué son courage.
糟糕	terrible; mauvais	Le temps est vraiment terrible aujourd'hui.
造成	causer	La forte pluie a causé un embouteillage.
则	alors; dans ce cas	Si l'on travaille dur, alors il y aura des progrès.
责备	reprocher; blâmer	Le professeur ne lui a pas fait de reproches.
摘	cueillir	Elle a cueilli une fleur dans le jardin.
窄	étroit	Cette route est trop étroite.
粘贴	coller	Colle la photo ici, s'il te plaît.
展开	commencer; se développer	La discussion a vite commencé.
展览	l'exposition	Le musée a une nouvelle exposition.
占	occuper; prendre de la place	Cette table prend de la place.
战争	la guerre	La guerre apporte de la souffrance au peuple.
掌握	maîtriser	Il maîtrise déjà la grammaire de base.
涨	augmenter; monter	Le loyer a encore augmenté récemment.
长辈	les aînés	Il faut saluer les aînés pendant le Nouvel An.
账户	le compte	Vérifie ton compte bancaire, s'il te plaît.
招待	recevoir; accueillir	L'hôte a accueilli chaleureusement les invités.
着火	prendre feu	La cuisine a soudain pris feu.
着凉	prendre froid	Il fait froid, ne prends pas froid.
召开	convoquer; tenir	L'école tiendra une réunion demain.
照常	comme d'habitude	Le magasin ouvrira comme d'habitude demain.
哲学	la philosophie	Il a étudié la philosophie à l'université.
珍惜	chérir; apprécier	Nous devons apprécier le temps.
真实	vrai; réel	Cette histoire est vraie.
针对	viser; s'adresser à	Cette suggestion s'adresse aux nouveaux étudiants.
诊断	le diagnostic	Le médecin a rapidement posé un diagnostic.
