simplified	FR	example_FR
振动	vibrer	Le téléphone vibre sur la table.
阵	une courte période; une averse	Il y a eu une courte averse dehors.
争论	débattre; se disputer	Ils ont débattu longtemps de cette question.
争取	s'efforcer d'obtenir	Nous devons nous efforcer d'obtenir plus d'occasions.
征求	solliciter; demander	Le professeur a demandé l'avis de tout le monde.
挣	se libérer; gagner	L'oiseau s'est libéré de la corde.
睁	ouvrir les yeux	Ouvre les yeux un peu plus grand, s'il te plaît.
整个	tout; entier	Toute la ville est très calme.
整齐	bien rangé; ordonné	Les livres sont rangés très proprement.
整体	l'ensemble; global	Nous devons considérer l'effet global.
政府	le gouvernement	Le gouvernement a publié un nouvel avis.
政治	la politique	Il s'intéresse beaucoup à la politique.
正	correct; juste	Cette réponse est correcte.
证件	la pièce d'identité	Présente ta pièce d'identité, s'il te plaît.
证据	la preuve	La police a trouvé de nouvelles preuves.
支	classificateur pour les stylos et objets longs	Il y a un stylo sur la table.
支票	le chèque	Il a payé par chèque.
执照	le permis; la licence	Pour conduire, il faut un permis de conduire.
直	tout droit; droit	Continue tout droit sur cette route.
指导	guider; encadrer	Le professeur nous a guidés pour rédiger le mémoire.
指挥	diriger; commander	Il est chargé de diriger cette opération.
制定	élaborer; formuler	L'entreprise a élaboré un nouveau plan.
制度	le système; le règlement	L'école a un règlement strict.
制造	fabriquer	Cette usine fabrique des machines.
制作	faire; fabriquer	Elle est en train de préparer un gâteau d'anniversaire.
志愿者	le bénévole	Beaucoup de bénévoles ont participé à l'activité.
智慧	la sagesse	Cette personne âgée a une grande sagesse.
治疗	traiter; soigner	Le médecin soigne le patient.
秩序	l'ordre	Veuillez maintenir l'ordre.
至今	jusqu'à aujourd'hui	Ce problème n'est toujours pas résolu à ce jour.
至于	quant à	Quant aux frais, nous en parlerons demain.
中介	l'agence; l'intermédiaire	Il a loué l'appartement par une agence.
中心	le centre	L'hôpital est au centre-ville.
中旬	la mi-mois	La réunion est prévue à la mi-mai.
种类	le type; la sorte	Il y a beaucoup de sortes de fruits ici.
重大	majeur; important	C'est une décision majeure.
重量	le poids	Quel est le poids de cette boîte ?
周到	attentionné; prévenant	Son service est très attentionné.
猪	le cochon	Il y a beaucoup de cochons à la ferme.
竹子	le bambou	Les pandas aiment manger du bambou.
逐步	progressivement; étape par étape	Le plan sera mis en oeuvre progressivement.
逐渐	progressivement	Le temps est devenu progressivement plus froid.
主持	animer; présider	Elle anime la réunion d'aujourd'hui.
主动	prendre l'initiative	Il a pris l'initiative d'aider son camarade.
主观	subjectif	Cette évaluation est un peu subjective.
主人	l'hôte; le propriétaire	L'hôte nous a accueillis chaleureusement.
主任	le directeur; le responsable	Le directeur est dans son bureau.
主题	le thème	Le thème de la discussion d'aujourd'hui est la protection de l'environnement.
主席	le président de séance	Le président a annoncé le début de la réunion.
主张	préconiser; soutenir	Il préconise de résoudre d'abord le problème de la circulation.
煮	cuire; faire bouillir	Maman est en train de cuire des nouilles.
注册	s'inscrire; enregistrer	Les nouveaux utilisateurs doivent d'abord s'inscrire.
祝福	les voeux; les bénédictions	Les amis ont envoyé leurs voeux.
抓	attraper; saisir	L'enfant a saisi la main de sa maman.
抓紧	se dépêcher; bien utiliser	Nous devons bien utiliser le temps.
专家	l'expert	L'expert a fait des suggestions.
专心	se concentrer	Il faut écouter attentivement en classe.
转变	changer; se transformer	Son attitude a changé.
转告	transmettre; faire savoir	Dis-lui qu'il y aura une réunion demain, s'il te plaît.
装	mettre; charger	Mets les livres dans le sac, s'il te plaît.
装饰	décorer	Ils ont décoré la pièce avec des fleurs.
装修	rénover; aménager	La nouvelle maison est en rénovation.
撞	heurter; entrer en collision	Deux voitures sont entrées en collision au carrefour.
状况	la situation; l'état	La situation actuelle est relativement stable.
状态	l'état	Il est en très bonne forme aujourd'hui.
追	poursuivre; courir après	L'enfant court après le petit chien.
追求	poursuivre; rechercher	Il a toujours poursuivi son rêve.
咨询	consulter; demander conseil	Tu peux consulter un médecin spécialiste.
姿势	la posture	Garde une posture correcte, s'il te plaît.
资格	la qualification	Il est qualifié pour participer à la compétition.
资金	les fonds; le financement	Le projet a besoin de plus de fonds.
资料	les documents; les informations	Envoie-moi les documents, s'il te plaît.
资源	les ressources	L'eau est une ressource naturelle importante.
紫	violet	Elle aime le violet.
字母	la lettre	L'anglais compte vingt-six lettres.
字幕	les sous-titres	Ce film a des sous-titres chinois.
自从	depuis	Depuis l'obtention de son diplôme, il revient rarement.
自动	automatique	Cette porte s'ouvre automatiquement.
自豪	être fier	Je suis fier de mes progrès.
自觉	de sa propre initiative	Il a terminé ses devoirs de sa propre initiative.
自私	égoïste	Il ne faut pas être trop égoïste dans la vie.
自由	la liberté	Chacun chérit la liberté.
自愿	volontaire	Ils ont participé volontairement à l'activité.
综合	intégrer; considérer globalement	Nous devons considérer globalement toutes sortes de facteurs.
总裁	le PDG	Le PDG a prononcé un discours aujourd'hui.
总共	au total	Ce voyage a coûté trois mille yuans au total.
总理	le Premier ministre	Le Premier ministre a assisté à la réunion.
总算	enfin	Le problème a enfin été résolu.
总统	le président	Le président a prononcé un discours télévisé.
总之	en bref; en somme	En bref, nous devons terminer à temps.
组	le groupe	Le professeur nous a divisés en trois groupes.
组成	être composé de	L'eau est composée d'hydrogène et d'oxygène.
组合	la combinaison	Cette combinaison de couleurs est jolie.
组织	organiser; l'organisation	L'école a organisé un voyage.
阻止	empêcher; arrêter	La police a empêché un comportement dangereux.
最初	au début	Au début, je ne comprenais pas très bien.
醉	ivre	Il a trop bu et il est un peu ivre.
尊敬	respecter	Les élèves respectent tous le professeur.
遵守	respecter; obéir à	Nous devons respecter le code de la route.
作品	l'oeuvre	Ce tableau est son oeuvre.
作为	en tant que	En tant que professeur, il est très patient.
作文	la rédaction; la composition	Le professeur nous a demandé d'écrire une rédaction.
