simplified	TH	example_TH
向	ไปทาง; หันไปทาง	กรุณาเดินไปทางซ้าย
小心	ระวัง	ฝนตกแล้ว ระวังบนถนนด้วย
校长	ครูใหญ่; ผู้อำนวยการโรงเรียน	ผู้อำนวยการอยู่ในสำนักงาน
新闻	ข่าว	พ่อดูข่าวทุกวัน
新鲜	สด; ใหม่	ผลไม้นี้สดมาก
信用卡	บัตรเครดิต	ฉันจ่ายด้วยบัตรเครดิตได้ไหม
行李箱	กระเป๋าเดินทาง	กระเป๋าเดินทางของฉันหนักมาก
熊猫	แพนด้า	เด็กๆ ชอบดูแพนด้า
需要	ต้องการ; จำเป็นต้อง	ฉันต้องการความช่วยเหลือของคุณ
选择	เลือก; ทางเลือก	คุณเลือกเสื้อเชิ้ตตัวไหน
要求	ขอร้อง; เรียกร้อง; กำหนด	ครูขอให้พวกเราทำการบ้านอย่างตั้งใจ
爷爷	ปู่; คุณปู่	คุณปู่ไปสวนสาธารณะทุกวัน
一直	ตลอด; เรื่อยมา	เขารอคุณอยู่ตลอด
一定	แน่นอน; ต้อง	ฉันจะมาแน่นอน
一共	ทั้งหมด; รวม	หนังสือพวกนี้รวมทั้งหมดเท่าไร
一会儿	สักครู่; เดี๋ยว	กรุณารอฉันสักครู่
一样	เหมือนกัน	แก้วสองใบนี้ขนาดเท่ากัน
以前	เมื่อก่อน; ก่อนหน้านี้	เมื่อก่อนฉันอยู่ปักกิ่ง
一般	ทั่วไป; ธรรมดา	อาหารของร้านนี้ธรรมดา
一边	ด้านหนึ่ง; ขณะเดียวกัน	เขาฟังเพลงไปด้วย ทำการบ้านไปด้วย
音乐	ดนตรี; เพลง	ฉันชอบเพลงจีน
银行	ธนาคาร	ธนาคารอยู่ข้างซูเปอร์มาร์เก็ต
饮料	เครื่องดื่ม	เครื่องดื่มนี้อร่อย
应该	ควร; น่าจะ	คุณควรพักผ่อนให้มากขึ้น
影响	ผลกระทบ; ส่งผลต่อ	อากาศจะส่งผลต่อการแข่งขัน
用	ใช้	ฉันใช้คอมพิวเตอร์ทำการบ้าน
游戏	เกม; การเล่น	เด็กๆ กำลังเล่นเกม
有名	มีชื่อเสียง	ร้านอาหารนี้มีชื่อเสียงมาก
又	อีก; อีกแล้ว	วันนี้เขามาสายอีกแล้ว
遇到	พบ; เจอ	ฉันเจอครูบนถนน
元	หยวน	พจนานุกรมเล่มนี้ห้าสิบหยวน
愿意	ยินดี; เต็มใจ	คุณยินดีเข้าร่วมไหม
月亮	ดวงจันทร์	คืนนี้ดวงจันทร์สว่างมาก
越	ยิ่ง…ยิ่ง…	ยิ่งเรียนภาษาจีนก็ยิ่งน่าสนใจ
站	สถานี; ยืน	เขายืนอยู่หน้าประตู
张	คำลักษณนามสำหรับของแบน; แผ่น	กรุณาให้แผนที่ฉันหนึ่งแผ่น
长	เติบโต; โตขึ้น	เด็กๆ โตเร็วมาก
着急	ร้อนใจ; กังวล	อย่าร้อนใจ ลิฟต์จะมาเดี๋ยวนี้
照顾	ดูแล	เธอดูแลคุณย่าที่ป่วย
照片	รูปถ่าย	รูปถ่ายนี้ดูดีมาก
照相机	กล้องถ่ายรูป	ฉันใช้กล้องถ่ายรูปถ่ายภาพ
283:只	แค่; เพียง	ฉันดื่มชาแค่หนึ่งแก้ว
284:只	คำลักษณนามสำหรับสัตว์	ใต้โต๊ะมีแมวหนึ่งตัว
只有…才…	มีเพียง…จึงจะ…	ต้องทบทวนอย่างตั้งใจเท่านั้น จึงจะสอบได้ดี
中间	ตรงกลาง; ระหว่าง	โต๊ะอยู่กลางห้อง
中文	ภาษาจีน; ตัวอักษรจีน	ฉันเรียนภาษาจีนทุกวัน
终于	ในที่สุด	ในที่สุดพวกเราก็มาถึง
种	ชนิด; ประเภท	คุณชอบเครื่องดื่มชนิดไหน
重要	สำคัญ	หนังสือเดินทางสำคัญมาก
周末	สุดสัปดาห์	สุดสัปดาห์ฉันอยากไปสวนสาธารณะ
主要	หลัก; สำคัญ	งานอดิเรกหลักของเขาคือดนตรี
注意	ระวัง; ใส่ใจ	กรุณาตั้งใจฟังครูพูด
自己	ตัวเอง	ฉันอยากทำการบ้านเอง
自行车	จักรยาน	จักรยานของฉันอยู่ชั้นล่าง
总是	มักจะ; เสมอ	เขามักมาถึงสำนักงานแต่เช้า
嘴	ปาก	กรุณาอ้าปาก
最后	สุดท้าย; ในที่สุด	สุดท้ายพวกเราทุกคนเห็นด้วย
最近	ช่วงนี้; เมื่อเร็วๆ นี้	ช่วงนี้ฉันยุ่งมาก
作业	การบ้าน; งาน	ฉันยังทำการบ้านไม่เสร็จ
