hsk_key	source_word	simplified	ML	example_ML	KK	example_KK
4464:路程	路程	路程	ദൂരം; യാത്രാമാർഗം	ഇവിടെ നിന്ന് സ്കൂളിലേക്ക് ദൂരം അധികമല്ല.	жол қашықтығы; сапар	Бұл жерден мектепке дейінгі қашықтық алыс емес.
4465:路况	路况	路况	റോഡിന്റെ അവസ്ഥ	ഡ്രൈവർ മുൻകൂട്ടി റോഡിന്റെ അവസ്ഥ പരിശോധിച്ചു.	жол жағдайы	Жүргізуші жол жағдайын алдын ала тексерді.
4466:路面	路面	路面	റോഡ് ഉപരിതലം	മഴയ്ക്കുശേഷം റോഡ് ഉപരിതലം വഴുക്കലാണ്.	жол беті	Жаңбырдан кейін жол беті тайғақ.
4467:录像	录像	录像	വീഡിയോ റെക്കോർഡിംഗ്	യോഗം മുഴുവൻ വീഡിയോയായി രേഖപ്പെടുത്തിയിട്ടുണ്ട്.	бейнежазба	Жиналыстың бәрі бейнежазбаға түсірілді.
4468:录用	录用	录用	നിയമിക്കുക; ജോലിക്ക് എടുക്കുക	കമ്പനി അവനെ ജോലിക്ക് എടുക്കാൻ തീരുമാനിച്ചു.	жұмысқа алу; қабылдау	Компания оны жұмысқа алуға шешім қабылдады.
4469:录制	录制	录制	റെക്കോർഡ് ചെയ്യുക	അവർ പരിപാടി റെക്കോർഡ് ചെയ്യുകയാണ്.	жазу; түсіру	Олар бағдарламаны жазып жатыр.
4470:旅程	旅程	旅程	യാത്ര	ഈ യാത്ര എനിക്ക് മറക്കാനാവാത്തതായിരുന്നു.	сапар; жол	Бұл сапар мен үшін ұмытылмас болды.
4471:旅途	旅途	旅途	യാത്രാമധ്യം; യാത്ര	യാത്രയിൽ സുരക്ഷ ശ്രദ്ധിക്കണം.	сапар; жол үсті	Сапар кезінде қауіпсіздікке назар аударыңыз.
4473:率	率	率	നിരക്ക്; അനുപാതം	ഈ പ്രദേശത്തെ തൊഴിൽനിരക്ക് ഉയർന്നതാണ്.	мөлшерлеме; көрсеткіш	Бұл аймақта жұмыспен қамту көрсеткіші жоғары.
4474:绿化	绿化	绿化	പച്ചപ്പിക്കൽ; സസ്യാവരണം	നഗരത്തിലെ പച്ചപ്പിക്കൽ വായു മെച്ചപ്പെടുത്തുന്നു.	көгалдандыру; жасылдандыру	Қаланы көгалдандыру ауаны жақсартады.
4475:轮	轮	轮	റൗണ്ട്; വട്ടം; ചക്രം	ഈ മത്സര റൗണ്ടിൽ അവൻ നന്നായി പ്രകടനം കാഴ്ചവച്ചു.	кезек; айналым; дөңгелек	Жарыстың осы айналымында ол жақсы өнер көрсетті.
4478:轮椅	轮椅	轮椅	വീൽചെയർ	വയോധികൻ വീൽചെയറിൽ എലിവേറ്ററിൽ കയറി.	мүгедектер арбасы	Қарт адам мүгедектер арбасымен лифтке кірді.
4479:轮子	轮子	轮子	ചക്രം	സ്യൂട്ട്കേസിന്റെ ചക്രം തകരാറായി.	дөңгелек	Чемоданның дөңгелегі сынып қалды.
4481:落地	落地	落地	ഭൂമിയിൽ ഇറങ്ങുക; നിലത്ത് തൊടുക	വിമാനം സുരക്ഷിതമായി നിലത്തിറങ്ങി.	жерге түсу; қону	Ұшақ қауіпсіз қонды.
4487:埋	埋	埋	മൂടിവയ്ക്കുക; മണ്ണിൽ കുഴിച്ചിടുക	കുഞ്ഞ് ചിപ്പി മണലിൽ മൂടിവച്ചു.	көму; жасыру	Бала қабыршақты құмға көмді.
4492:盲人	盲人	盲人	കാഴ്ചയില്ലാത്ത വ്യക്തി	ഈ ചുരത്തിൽ കാഴ്ചയില്ലാത്തവർക്ക് വഴിയുണ്ട്.	зағип адам	Бұл қиылыста зағип адамдарға арналған жол бар.
4493:冒	冒	冒	പുറത്തുവരുക; അപകടം ഏറ്റെടുക്കുക	ചട്ടിയിൽ നിന്ന് ചൂട് വാതകം ഉയരുന്നു.	шығу; тәуекел ету	Қазаннан бу шығып тұр.
4496:煤	煤	煤	കൽക്കരി	ഈ ഫാക്ടറി മുമ്പ് വൈദ്യുതി ഉൽപ്പാദിപ്പിക്കാൻ കൽക്കരി ഉപയോഗിച്ചിരുന്നു.	көмір	Бұл зауыт бұрын электр өндіру үшін көмір қолданған.
4497:梅花	梅花	梅花	പ്ലം പുഷ്പം	ശീതകാലത്ത് പ്ലം പുഷ്പങ്ങൾ മനോഹരമായി വിരിയുന്നു.	қара өрік гүлі	Қыста қара өрік гүлдері әдемі гүлдейді.
4502:密	密	密	സാന്ദ്രമായ; അടുക്കിയ	ഈ കാട് വളരെ സാന്ദ്രമാണ്.	тығыз; жақын	Бұл орман өте тығыз.
4505:密集	密集	密集	സാന്ദ്രമായ; കുത്തിനിറഞ്ഞ	ഇവിടെ ജനസംഖ്യ സാന്ദ്രമാണ്.	тығыз; шоғырланған	Мұнда халық тығыз орналасқан.
4506:棉	棉	棉	പരുത്തി	ഈ വസ്ത്രം പരുത്തിയിലാണ്.	мақта	Бұл киім мақтадан жасалған.
4507:免	免	免	ഒഴിവാക്കുക; ഒഴിവ് നൽകുക	കുട്ടികൾക്ക് ടിക്കറ്റ് ഇല്ലാതെ പ്രവേശിക്കാം.	босату; төлемнен босату	Балалар тегін кіре алады.
4509:免税	免税	免税	നികുതിയില്ലാത്ത	വിമാനത്താവളത്തിൽ നികുതിയില്ലാത്ത കടകളുണ്ട്.	салықсыз	Әуежайда салықсыз дүкендер бар.
4511:面部	面部	面部	മുഖഭാഗം	ഡോക്ടർ അവന്റെ മുഖത്തിലെ മുറിവ് പരിശോധിച്ചു.	бет бөлігі	Дәрігер оның бетіндегі жараны тексерді.
4512:面粉	面粉	面粉	മാവ്	ബ്രെഡ് ഉണ്ടാക്കാൻ എനിക്ക് ഒരു ചാക്ക് മാവ് വേണം.	ұн	Нан пісіру үшін маған бір қап ұн керек.
4516:妙	妙	妙	അദ്ഭുതകരമായ; ബുദ്ധിയുള്ള	ഈ മാർഗം ശരിക്കും ബുദ്ധിയുള്ളതാണ്.	керемет; тапқыр	Бұл тәсіл шынымен тапқыр.
4517:灭	灭	灭	അണയ്ക്കുക; കെടുത്തുക	കാറ്റ് മെഴുകുതിരി അണച്ചു.	өшіру; сөну	Жел шамды өшірді.
4518:民歌	民歌	民歌	ജനപാട്ട്	അവൾക്ക് നിരവധി ജനപാട്ടുകൾ പാടാൻ കഴിയും.	халық әні	Ол көптеген халық әндерін айта алады.
4520:民俗	民俗	民俗	ജനപരമ്പര്യങ്ങൾ; നാട്ടുചടങ്ങുകൾ	ഈ പ്രദർശനം പ്രാദേശിക ജനപരമ്പര്യങ്ങൾ പരിചയപ്പെടുത്തുന്നു.	халық салты; дәстүр	Бұл көрме жергілікті халық салтын таныстырады.
4521:民宿	民宿	民宿	ഹോംസ്റ്റേ; ഗസ്റ്റ് ഹൗസ്	വാരാന്ത്യത്തിൽ ഞങ്ങൾ മലമുകളിലെ ഹോംസ്റ്റേയിൽ താമസിച്ചു.	шағын қонақүй; үй қонақжайы	Демалыста біз таудағы шағын қонақүйде тұрдық.
4522:民众	民众	民众	ജനങ്ങൾ; പൊതുജനം	പുതിയ നയത്തെക്കുറിച്ച് ജനങ്ങൾ വളരെ ശ്രദ്ധിക്കുന്നു.	халық; жұрт	Халық жаңа саясатқа қатты назар аударып отыр.
4525:明亮	明亮	明亮	പ്രകാശമുള്ള; തെളിഞ്ഞ	ക്ലാസ്മുറി വളരെ പ്രകാശമുള്ളതാണ്.	жарық; ашық	Сынып өте жарық.
4527:名气	名气	名气	പ്രശസ്തി; പേരുകേൾവി	ഈ എഴുത്തുകാരന് വലിയ പേരുകേൾവിയുണ്ട്.	атақ; бедел	Бұл жазушының атағы зор.
4528:名胜	名胜	名胜	പ്രസിദ്ധ കാഴ്ചസ്ഥലം	ബെയ്ജിംഗിൽ നിരവധി പ്രസിദ്ധ കാഴ്ചസ്ഥലങ്ങളുണ്ട്.	көрікті жер	Бейжіңде көптеген көрікті жер бар.
4532:模拟	模拟	模拟	അനുകരിക്കുക; സിമുലേറ്റ് ചെയ്യുക	വിദ്യാർത്ഥികൾ ക്ലാസിൽ അഭിമുഖം അനുകരിച്ചു.	модельдеу; имитациялау	Оқушылар сабақта сұхбатты имитациялады.
4533:模特儿	模特儿	模特儿	മോഡൽ	പുതിയ വസ്ത്രം ധരിച്ച മോഡൽ വേദിയിലേക്ക് നടന്നു.	модель	Модель жаңа киім киіп сахнаға шықты.
4538:母	母	母	സ്ത്രീ; അമ്മ	ഈ പെൺപൂച്ച ഇപ്പോഴേ കുഞ്ഞുങ്ങൾക്ക് ജന്മം നൽകി.	ұрғашы; ана	Бұл ұрғашы мысық жаңа ғана марғаулады.
4540:木材	木材	木材	മരം; മരംവസ്തു	ഈ മരവസ്തുക്കൾ ഫർണിച്ചർ ഉണ്ടാക്കാൻ ഉപയോഗിക്കാം.	ағаш материалы; сүрек	Бұл ағаш материалынан жиһаз жасауға болады.
4542:奶粉	奶粉	奶粉	പാൽപ്പൊടി	അമ്മ കുട്ടിക്കായി പാൽപ്പൊടി കലക്കി.	құрғақ сүт	Анасы балаға құрғақ сүт дайындады.
4543:难点	难点	难点	ബുദ്ധിമുട്ടുള്ള ഭാഗം	വ്യാകരണം ഈ പാഠത്തിലെ ബുദ്ധിമുട്ടുള്ള ഭാഗമാണ്.	қиын тұс; қиындық	Грамматика осы сабақтың қиын тұсы.
4544:南极洲	南极洲	南极洲	അന്റാർട്ടിക്ക	അന്റാർട്ടിക്കയിലെ കാലാവസ്ഥ അത്യന്തം തണുപ്പാണ്.	Антарктида	Антарктиданың климаты өте суық.
4545:南美洲	南美洲	南美洲	തെക്കേ അമേരിക്ക	തെക്കേ അമേരിക്കയിൽ സമൃദ്ധമായ പ്രകൃതി വിഭവങ്ങളുണ്ട്.	Оңтүстік Америка	Оңтүстік Америкада табиғи ресурстар мол.
4548:脑子	脑子	脑子	മസ്തിഷ്കം; മനസ്	അവന്റെ മനസ് വളരെ വേഗത്തിൽ പ്രവർത്തിക്കുന്നു.	ми; ақыл	Оның миы өте жылдам жұмыс істейді.
4551:内外	内外	内外	അകത്തും പുറത്തും	ഈ കെട്ടിടം അകത്തും പുറത്തും വൃത്തിയുള്ളതാണ്.	іші-сырты	Бұл ғимараттың іші-сырты таза.
4552:内衣	内衣	内衣	അടിവസ്ത്രം	അവൾ അടിവസ്ത്രം ഡ്രോയറിൽ വെച്ചു.	іш киім	Ол іш киімді тартпаға салды.
4555:泥	泥	泥	ചളി	മഴയ്ക്കുശേഷം റോഡെല്ലാം ചളിയായിരുന്നു.	балшық	Жаңбырдан кейін жолдың бәрі балшық болды.
4557:年终	年终	年终	വർഷാവസാനം	വർഷാവസാന സംഗ്രഹം അടുത്ത ആഴ്ച സമർപ്പിക്കണം.	жыл соңы	Жыл соңындағы қорытынды келесі аптада тапсырылады.
4558:念书	念书	念书	പഠിക്കുക; സ്കൂളിൽ പഠിക്കുക	കുട്ടിയായിരിക്കുമ്പോൾ അവൻ ഗ്രാമത്തിൽ പഠിച്ചു.	оқу; мектепке бару	Ол бала кезінде ауылда оқыды.
4559:扭	扭	扭	മുരുക്കുക; ഉളുക്കുക	അവൾ അബദ്ധത്തിൽ കാൽ ഉളുക്കി.	бұрау; созып алу	Ол абайсызда аяғын созып алды.
4560:农产品	农产品	农产品	കാർഷിക ഉൽപ്പന്നങ്ങൾ	മാർക്കറ്റിൽ നിരവധി പുതിയ കാർഷിക ഉൽപ്പന്നങ്ങളുണ്ട്.	ауыл шаруашылық өнімі	Базарда көп жаңа ауыл шаруашылық өнімі бар.
4562:农田	农田	农田	കൃഷിയിടം	വസന്തത്തിൽ കൃഷിയിടം മുഴുവൻ പച്ചയായി.	егістік; ауылшаруашылық жері	Көктемде егістік түгел жасыл болады.
4563:暖	暖	暖	ചൂടുള്ള; ചൂടാകുക	കാലാവസ്ഥ ചൂടായി, പൂക്കളും വിരിഞ്ഞു.	жылы; жылыну	Ауа жылыды, гүлдер де ашылды.
4564:暖气	暖气	暖气	ഹീറ്റിംഗ്; ചൂടാക്കൽ സംവിധാനം	വടക്കൻ പ്രദേശങ്ങളിൽ ശീതകാലത്ത് പലപ്പോഴും ഹീറ്റിംഗ് ഉപയോഗിക്കുന്നു.	жылыту жүйесі	Солтүстікте қыста жылыту жүйесі жиі қолданылады.
4569:排名	排名	排名	റാങ്ക്; റാങ്കിംഗ്	ഈ മത്സരം ഫലങ്ങൾ അനുസരിച്ച് റാങ്ക് ചെയ്യും.	рейтинг; орын белгілеу	Бұл жарыста орын нәтиже бойынша анықталады.
4570:盘	盘	盘	തളിക; പാത്രം	വെയിറ്റർ ഒരു തളിക പഴങ്ങൾ കൊണ്ടുവന്നു.	табақ; тәрелке	Даяшы бір табақ жеміс әкелді.
4573:抛	抛	抛	എറിക്കുക; മുകളിലേക്ക് എറിയുക	അവൻ പന്ത് ഉയരത്തിൽ എറിഞ്ഞു.	лақтыру; тастау	Ол допты жоғары лақтырды.
4574:泡	泡	泡	നനയ്ക്കുക; കുമ്പിള്	പയർ രാത്രി മുഴുവൻ വെള്ളത്തിൽ നനയ്ക്കുക.	жібіту; көпіршік	Бұршақты түні бойы суға жібітіңіз.
4576:陪同	陪同	陪同	കൂടെ പോകുക; അനുഗമിക്കുക	ഗൈഡ് അതിഥികളോടൊപ്പം മ്യൂസിയം സന്ദർശിച്ചു.	еріп жүру; бірге бару	Гид қонақтарды мұражайға ертіп барды.
4581:喷	喷	喷	തളിക്കുക; പീറിക്കുക	ഫൗണ്ടൻ ആകാശത്തേക്ക് വെള്ളം പീറിക്കുന്നു.	шашу; бүрку	Субұрқақ аспанға су шашады.
4583:碰撞	碰撞	碰撞	കൂട്ടിയിടിക്കുക; കൂട്ടിയിടി	രണ്ട് കാറുകൾ ചുരത്തിൽ കൂട്ടിയിടിച്ചു.	соқтығысу; қақтығыс	Екі көлік қиылыста соқтығысты.
4585:皮	皮	皮	തൊലി; തോൽ	ഈ ചെരുപ്പ് തോലിലാണ്.	тері; былғары	Бұл аяқкиім былғарыдан жасалған.
4589:骗子	骗子	骗子	വഞ്ചകൻ; കബളിപ്പിക്കുന്നവൻ	പോലീസ് ആ വഞ്ചകനെ പിടിച്ചു.	алаяқ; алдамшы	Полиция сол алаяқты ұстады.
4591:漂	漂	漂	ഒഴുകുക; പൊങ്ങുക	ചെറിയ വള്ളം വെള്ളത്തിൽ പൊങ്ങിക്കിടക്കുന്നു.	қалқу; жүзу	Кішкентай қайық су бетінде қалқып тұр.
4600:平方米	平方米	平方米	ചതുരശ്ര മീറ്റർ	ഈ അപ്പാർട്ട്മെന്റിന് തൊണ്ണൂറ് ചതുരശ്ര മീറ്റർ വിസ്തീർണ്ണമുണ്ട്.	шаршы метр	Бұл пәтер тоқсан шаршы метр.
4603:评选	评选	评选	മൂല്യനിർണ്ണയിച്ച് തിരഞ്ഞെടുക്കുക	സ്കൂൾ മികച്ച അധ്യാപകരെ തിരഞ്ഞെടുക്കുകയാണ്.	бағалап таңдау	Мектеп үздік мұғалімдерді таңдап жатыр.
4610:扑灭	扑灭	扑灭	അണയ്ക്കുക; കെടുത്തുക	അഗ്നിശമനസേന വലിയ തീ വേഗത്തിൽ അണച്ചു.	сөндіру; басу	Өрт сөндірушілер үлкен өртті тез сөндірді.
4615:其间	其间	其间	ആ കാലയളവിൽ; അതിനിടെ	യോഗം മൂന്ന് ദിവസം നീണ്ടു, അതിനിടെ പല ചര്‍ച്ചകളും ക്രമീകരിച്ചു.	сол уақытта; арасында	Жиналыс үш күн болды, сол уақытта бірнеше талқылау ұйымдастырылды.
4617:棋子	棋子	棋子	കളിപ്പാവ; ചെസ് കല്ല്	മേശയിൽ ഒരു ചെസ് കല്ല് കുറവായിരുന്നു.	шахмат тасы; ойын тасы	Үстелде бір ойын тасы жетіспейді.
4619:起点	起点	起点	ആരംഭബിന്ദു	ഈ റോഡിന്റെ ആരംഭബിന്ദു സ്കൂൾ കവാടത്തിലാണ്.	басталу нүктесі	Бұл жолдың басталу нүктесі мектеп қақпасында.
4620:启动	启动	启动	ആരംഭിക്കുക; ലോഞ്ച് ചെയ്യുക	പദ്ധതി അടുത്ത മാസം ഔദ്യോഗികമായി ആരംഭിക്കും.	іске қосу; бастау	Жоба келесі айда ресми түрде іске қосылады.
4626:气体	气体	气体	വാതകം	ഈ വാതകത്തിന് നിറമില്ല.	газ	Бұл газдың түсі жоқ.
4630:恰好	恰好	恰好	യാദൃശ്ചികമായി; ശരിയായി	അവനും യാദൃശ്ചികമായി ഓഫീസിലുണ്ടായിരുന്നു.	дәл; кездейсоқ	Ол да дәл сол кезде кеңседе болды.
4631:恰恰	恰恰	恰恰	തികച്ചും; കൃത്യമായി	പ്രശ്നം കൃത്യമായി ഇവിടെ തന്നെയാണ്.	дәл; нақ	Мәселе дәл осы жерде.
4633:千家万户	千家万户	千家万户	എല്ലാ വീടുകളും; അനവധി കുടുംബങ്ങൾ	വസന്തോത്സവത്തിൽ എല്ലാ വീടുകളും ചുന്ലിയൻ ഒട്ടിക്കുന്നു.	мыңдаған үй; әр отбасы	Көктем мерекесінде әр отбасы мерекелік жазулар іледі.
4637:前期	前期	前期	ആദ്യഘട്ടം	പദ്ധതിയുടെ ആദ്യഘട്ടത്തിൽ വലിയ തയ്യാറെടുപ്പ് വേണം.	алғашқы кезең	Жобаның алғашқы кезеңінде көп дайындық қажет.
4639:前者	前者	前者	മുമ്പിലുള്ളത്; ആദ്യത്തേത്	ആദ്യത്തേത് വിലകുറവാണ്, രണ്ടാമത്തേതിന്റെ ഗുണമേന്മ മെച്ചമാണ്.	алдыңғысы; біріншісі	Алдыңғысы арзанырақ, ал соңғысының сапасы жақсырақ.
4641:墙壁	墙壁	墙壁	ഭിത്തി	ഭിത്തിയിൽ ഒരു ചിത്രം തൂങ്ങിയിരിക്കുന്നു.	қабырға	Қабырғада бір сурет ілулі тұр.
4642:强化	强化	强化	ശക്തിപ്പെടുത്തുക	കമ്പനി സുരക്ഷാ മാനേജ്മെന്റ് ശക്തിപ്പെടുത്തണം.	күшейту; нығайту	Компания қауіпсіздік басқаруын күшейтеді.
4643:强壮	强壮	强壮	ബലമുള്ള; കരുത്തുള്ള	നിയമിത വ്യായാമം അവനെ കൂടുതൽ കരുത്തനാക്കുന്നു.	күшті; мығым	Тұрақты жаттығу оны күштірек етеді.
4650:亲属	亲属	亲属	ബന്ധു; കുടുംബാംഗം	അവന്റെ ബന്ധുക്കൾ എല്ലാവരും വിവാഹത്തിൽ പങ്കെടുത്തു.	туыс; отбасы мүшесі	Оның туыстарының бәрі тойға келді.
4652:清	清	清	തെളിഞ്ഞ; ശുദ്ധമായ	നദിജലം വളരെ തെളിഞ്ഞതാണ്.	мөлдір; таза	Өзен суы өте мөлдір.
4655:青春期	青春期	青春期	കൗമാരപ്രായം; യൗവനാരംഭം	കൗമാരപ്രായത്തിലുള്ള കുട്ടികൾക്ക് മനസ്സിലാക്കലും പിന്തുണയും വേണം.	жасөспірімдік кезең; жыныстық жетілу	Жасөспірімдік кезеңдегі балаларға түсіністік пен қолдау керек.
4659:清扫	清扫	清扫	വാരിവൃത്തിയാക്കുക; വൃത്തിയാക്കുക	സ്വയംസേവകർ തെരുവ് വൃത്തിയാക്കി.	сыпыру; тазалау	Еріктілер көшені тазалады.
4661:清洗	清洗	清洗	കഴുകി വൃത്തിയാക്കുക	ദയവായി പഴങ്ങൾ നന്നായി കഴുകുക.	жуу; тазалау	Жемістерді жақсылап жуыңыз.
4668:求	求	求	അഭ്യർത്ഥിക്കുക; തേടുക	അവൻ അധ്യാപകനോട് മറ്റൊരു അവസരം അഭ്യർത്ഥിച്ചു.	сұрау; іздеу	Ол мұғалімнен тағы бір мүмкіндік сұрады.
4669:求婚	求婚	求婚	വിവാഹാഭ്യർത്ഥന നടത്തുക	അവൻ കടൽത്തീരത്ത് പ്രണയിനിയോട് വിവാഹാഭ്യർത്ഥന നടത്തി.	үйленуге ұсыныс жасау	Ол теңіз жағасында сүйіктісіне үйленуге ұсыныс жасады.
4670:求救	求救	求救	സഹായം വിളിക്കുക; രക്ഷയ്ക്കായി വിളിക്കുക	കപ്പൽക്കാർ റേഡിയോ വഴി സഹായം അഭ്യർത്ഥിച്ചു.	көмек сұрау; құтқару шақыру	Кеме экипажы радио арқылы көмек сұрады.
4671:求职	求职	求职	ജോലി അന്വേഷിക്കുക	അവൾ ഓൺലൈനിൽ ജോലി അന്വേഷിക്കുന്നു.	жұмыс іздеу	Ол интернеттен жұмыс іздеп жүр.
4672:求助	求助	求助	സഹായം തേടുക	ബുദ്ധിമുട്ടുകൾ നേരിടുമ്പോൾ അധ്യാപകനോട് സഹായം തേടാം.	көмек сұрау	Қиындық кездессе, мұғалімнен көмек сұрауға болады.
