hsk_key	source_word	simplified	ES	example_ES	FR	example_FR	DE	example_DE	IT	example_IT	PT	example_PT	RU	example_RU
479:有意思	有意思	有意思	interesante	Este libro es muy interesante.	intéressant	Ce livre est très intéressant.	interessant	Dieses Buch ist sehr interessant.	interessante	Questo libro è molto interessante.	interessante	Este livro é muito interessante.	интересный	Эта книга очень интересная.
480:有时	有时	有时	a veces	A veces voy a la escuela en autobús.	parfois; de temps en temps	Je prends parfois le bus pour aller à l'école.	manchmal	Manchmal fahre ich mit dem Bus zur Schule.	a volte	A volte vado a scuola in autobus.	às vezes	Às vezes vou para a escola de autocarro.	иногда	Иногда я езжу в школу на автобусе.
481:右	右	右	la derecha; el lado derecho	Por favor, mira a la derecha.	la droite; le côté droit	Regarde à droite, s'il te plaît.	rechts; die rechte Seite	Schau bitte nach rechts.	la destra; il lato destro	Per favore, guarda a destra.	a direita; o lado direito	Por favor, olha para a direita.	право; правая сторона	Пожалуйста, посмотрите направо.
488:这么	这么	这么	tan; tanto	Este libro es tan caro.	si; autant	Ce livre est si cher.	so; so viel	Dieses Buch ist so teuer.	così; tanto	Questo libro è così caro.	tão; tanto	Este livro é tão caro.	так; настолько	Эта книга такая дорогая.
489:这样	这样	这样	así; de esta manera	Hacerlo de esta manera está bastante bien.	ainsi; de cette façon	Faire ainsi est plutôt bien.	so; auf diese Weise	Es so zu machen ist ziemlich gut.	così; in questo modo	Farlo così non è male.	assim; desta maneira	Fazer assim é bastante bom.	так; таким образом	Так делать вполне неплохо.
492:周	周	周	la semana	La semana que viene voy a Pekín.	la semaine	La semaine prochaine, je vais à Pékin.	die Woche	Nächste Woche fahre ich nach Peking.	la settimana	La prossima settimana vado a Pechino.	a semana	Na próxima semana vou a Pequim.	неделя	На следующей неделе я поеду в Пекин.
496:走路	走路	走路	caminar	Voy a la escuela caminando todos los días.	marcher	Je vais à l'école à pied tous les jours.	zu Fuß gehen	Ich gehe jeden Tag zu Fuß zur Schule.	camminare	Ogni giorno vado a scuola a piedi.	andar a pé	Todos os dias vou a pé para a escola.	ходить пешком	Каждый день я хожу в школу пешком.
497:足球	足球	足球	el fútbol; el balón de fútbol	Él está jugando al fútbol.	le football; le ballon de football	Il joue au football.	der Fußball	Er spielt Fußball.	il calcio; il pallone da calcio	Lui sta giocando a calcio.	o futebol; a bola de futebol	Ele está a jogar futebol.	футбол; футбольный мяч	Он играет в футбол.
499:左	左	左	la izquierda; el lado izquierdo	Por favor, gira a la izquierda.	la gauche; le côté gauche	Tournez à gauche, s'il vous plaît.	links; die linke Seite	Gehen Sie bitte nach links.	la sinistra; il lato sinistro	Per favore, vai a sinistra.	a esquerda; o lado esquerdo	Por favor, vira à esquerda.	лево; левая сторона	Пожалуйста, поверните налево.
