hsk_key	source_word	simplified	ES	example_ES	FR	example_FR	DE	example_DE	IT	example_IT	PT	example_PT	RU	example_RU
5210:预定	预定	预定	reservar; fijar de antemano	Ya reservé asientos para mañana por la noche.	réserver; prévoir	J'ai déjà réservé des places pour demain soir.	reservieren; vorbestimmen	Ich habe bereits Plätze für morgen Abend reserviert.	prenotare; stabilire in anticipo	Ho già prenotato i posti per domani sera.	reservar; programar	Já reservei lugares para amanhã à noite.	забронировать; заранее назначить	Я уже забронировал места на завтрашний вечер.
5213:浴室	浴室	浴室	baño	El suelo del baño está un poco resbaladizo.	salle de bain	Le sol de la salle de bain est un peu glissant.	Badezimmer	Der Boden im Badezimmer ist etwas rutschig.	bagno	Il pavimento del bagno è un po' scivoloso.	banheiro	O piso do banheiro está um pouco escorregadio.	ванная комната	Пол в ванной немного скользкий.
5215:原本	原本	原本	originalmente; en principio	Originalmente planeaba ir a Pekín el fin de semana.	à l'origine; initialement	Au départ, j'avais prévu d'aller à Pékin le week-end.	ursprünglich; eigentlich	Ursprünglich hatte ich geplant, am Wochenende nach Peking zu fahren.	originariamente; inizialmente	In origine avevo programmato di andare a Pechino nel fine settimana.	originalmente; inicialmente	Originalmente eu planejava ir a Pequim no fim de semana.	изначально; первоначально	Изначально я планировал поехать в Пекин на выходных.
5216:原材料	原材料	原材料	materia prima	La fábrica necesita un suministro estable de materias primas.	matière première	L'usine a besoin d'un approvisionnement stable en matières premières.	Rohmaterial; Rohstoff	Die Fabrik braucht eine stabile Versorgung mit Rohstoffen.	materia prima	La fabbrica ha bisogno di una fornitura stabile di materie prime.	matéria-prima	A fábrica precisa de um fornecimento estável de matérias-primas.	сырье	Заводу нужны стабильные поставки сырья.
5224:元宵	元宵	元宵	yuanxiao; bola dulce de arroz glutinoso	Comimos yuanxiao el día del Festival de los Faroles.	yuanxiao; boulette sucrée de riz gluant	Nous avons mangé des yuanxiao le jour de la fête des Lanternes.	Yuanxiao; süße Klebreisbällchen	Am Laternenfest aßen wir Yuanxiao.	yuanxiao; pallina dolce di riso glutinoso	Abbiamo mangiato gli yuanxiao il giorno della Festa delle Lanterne.	yuanxiao; bolinho doce de arroz glutinoso	Comemos yuanxiao no dia do Festival das Lanternas.	юаньсяо; сладкий шарик из клейкого риса	В день Праздника фонарей мы ели юаньсяо.
5225:源于	源于	源于	originarse en; provenir de	Esta tradición proviene de un festival antiguo.	provenir de; tirer son origine de	Cette tradition vient d'une ancienne fête.	stammen aus; herrühren von	Diese Tradition stammt von einem alten Fest ab.	derivare da; avere origine da	Questa tradizione deriva da un'antica festa.	originar-se de; vir de	Esta tradição vem de um festival antigo.	происходить от; брать начало	Эта традиция берет начало в древнем празднике.
5226:远程	远程	远程	remoto; a distancia	La empresa organizó una entrevista remota.	à distance; distant	L'entreprise a organisé un entretien à distance.	Fern-; entfernt	Das Unternehmen organisierte ein Vorstellungsgespräch aus der Ferne.	remoto; a distanza	L'azienda ha organizzato un colloquio a distanza.	remoto; a distância	A empresa organizou uma entrevista remota.	удаленный; дистанционный	Компания организовала дистанционное собеседование.
5227:远方	远方	远方	lugar lejano; lejos	A menudo piensa en su familia lejana.	lieu lointain; au loin	Il pense souvent à sa famille au loin.	Ferne; weit entfernter Ort	Er denkt oft an seine Familie in der Ferne.	luogo lontano; lontananza	Pensa spesso alla sua famiglia lontana.	lugar distante; ao longe	Ele muitas vezes pensa na família distante.	даль; далекое место	Он часто думает о своей семье вдали.
5229:月光	月光	月光	luz de la luna	La luz de la luna brillaba sobre el lago tranquilo.	clair de lune	Le clair de lune brillait sur le lac tranquille.	Mondlicht	Das Mondlicht schien auf den stillen See.	chiaro di luna	Il chiaro di luna illuminava il lago tranquillo.	luz da lua	A luz da lua brilhava sobre o lago tranquilo.	лунный свет	Лунный свет падал на тихое озеро.
5231:月球	月球	月球	la Luna	Los científicos estudian la superficie de la Luna.	la Lune	Les scientifiques étudient la surface de la Lune.	Mond	Wissenschaftler untersuchen die Oberfläche des Mondes.	la Luna	Gli scienziati studiano la superficie della Luna.	Lua	Cientistas estudam a superfície da Lua.	Луна	Ученые изучают поверхность Луны.
5232:乐曲	乐曲	乐曲	pieza musical	Esta pieza musical suena muy bonita.	morceau de musique; composition	Cette composition est très belle.	Musikstück; Komposition	Dieses Musikstück klingt sehr schön.	brano musicale; composizione	Questo brano musicale suona molto bello.	peça musical; composição	Esta peça musical soa muito bonita.	музыкальное произведение	Это музыкальное произведение звучит очень красиво.
5234:晕车	晕车	晕车	marearse en el coche	Ella se marea fácilmente en los viajes largos en autobús.	avoir le mal des transports	Elle a facilement le mal des transports lors des longs trajets en bus.	reisekrank werden; autokrank werden	Auf langen Busfahrten wird ihr leicht schlecht.	soffrire il mal d'auto	Nei lunghi viaggi in autobus soffre facilmente il mal d'auto.	enjoar no carro	Ela fica enjoada facilmente em viagens longas de ônibus.	укачиваться в машине	Ее легко укачивает во время долгих поездок на автобусе.
5235:运送	运送	运送	transportar; entregar	Estos suministros serán transportados a la zona del desastre.	transporter; livrer	Ces fournitures seront transportées vers la zone sinistrée.	transportieren; liefern	Diese Hilfsgüter werden in das Katastrophengebiet transportiert.	trasportare; consegnare	Questi materiali saranno trasportati nella zona colpita dal disastro.	transportar; entregar	Estes suprimentos serão transportados para a área atingida pelo desastre.	перевозить; доставлять	Эти припасы доставят в зону бедствия.
5237:运营	运营	运营	operar; gestionar	Esta plataforma es gestionada por un equipo profesional.	exploiter; gérer	Cette plateforme est gérée par une équipe professionnelle.	betreiben; führen	Diese Plattform wird von einem professionellen Team betrieben.	gestire; operare	Questa piattaforma è gestita da un team professionale.	operar; gerir	Esta plataforma é operada por uma equipe profissional.	управлять; эксплуатировать	Этой платформой управляет профессиональная команда.
5238:杂	杂	杂	mezclado; variado	Hay muchos objetos variados en este cajón.	mélangé; divers	Il y a beaucoup d'objets divers dans ce tiroir.	gemischt; verschieden	In dieser Schublade liegen viele verschiedene Kleinigkeiten.	misto; vario	In questo cassetto ci sono molti oggetti vari.	misto; variado	Há muitos objetos variados nesta gaveta.	смешанный; разный	В этом ящике много разных мелких вещей.
5239:灾	灾	灾	desastre; calamidad	Este desastre causó grandes pérdidas al pueblo.	catastrophe; désastre	Cette catastrophe a causé de lourdes pertes au village.	Katastrophe; Unglück	Diese Katastrophe verursachte im Dorf große Verluste.	disastro; calamità	Questo disastro ha causato grandi perdite al villaggio.	desastre; calamidade	Este desastre causou grandes perdas à aldeia.	бедствие; катастрофа	Это бедствие нанесло деревне большие потери.
5242:灾区	灾区	灾区	zona de desastre	Los voluntarios llevaron comida a la zona de desastre.	zone sinistrée	Les bénévoles ont livré de la nourriture dans la zone sinistrée.	Katastrophengebiet	Freiwillige brachten Lebensmittel in das Katastrophengebiet.	zona disastrata	I volontari hanno consegnato cibo nella zona colpita dal disastro.	área atingida pelo desastre	Voluntários levaram comida para a área atingida pelo desastre.	зона бедствия	Волонтеры доставили еду в зону бедствия.
5244:再生	再生	再生	reciclar; regenerar	Estos materiales pueden reciclarse y reutilizarse.	recycler; régénérer	Ces matériaux peuvent être recyclés et réutilisés.	recyceln; regenerieren	Diese Materialien können recycelt und wiederverwendet werden.	rigenerare; riciclare	Questi materiali possono essere riciclati e riutilizzati.	regenerar; reciclar	Estes materiais podem ser reciclados e reutilizados.	восстанавливать; перерабатывать	Эти материалы можно переработать и использовать повторно.
5246:赞赏	赞赏	赞赏	apreciar; admirar	El profesor apreció su actitud seria.	apprécier; admirer	Le professeur a apprécié son attitude sérieuse.	schätzen; bewundern	Der Lehrer schätzte seine ernsthafte Haltung.	apprezzare; ammirare	L'insegnante ha apprezzato il suo atteggiamento serio.	apreciar; admirar	O professor apreciou sua atitude séria.	ценить; восхищаться	Учитель высоко оценил его серьезное отношение.
5247:赞同	赞同	赞同	estar de acuerdo; aprobar	La mayoría de los miembros está de acuerdo con esta decisión.	approuver; être d'accord	La plupart des membres approuvent cette décision.	zustimmen; befürworten	Die meisten Mitglieder stimmen dieser Entscheidung zu.	essere d'accordo; approvare	La maggior parte dei membri è d'accordo con questa decisione.	concordar; aprovar	A maioria dos membros concorda com esta decisão.	соглашаться; одобрять	Большинство участников согласны с этим решением.
5248:遭到	遭到	遭到	sufrir; ser objeto de	Este plan encontró cierta oposición.	subir; faire l'objet de	Ce plan a rencontré une certaine opposition.	erleiden; ausgesetzt sein	Dieser Plan stieß auf einigen Widerstand.	subire; essere oggetto di	Questo piano ha incontrato una certa opposizione.	sofrer; ser alvo de	Este plano encontrou certa oposição.	подвергнуться; столкнуться с	Этот план встретил некоторое сопротивление.
5251:噪声	噪声	噪声	ruido	El ruido de la construcción afectó a los residentes cercanos.	bruit	Le bruit du chantier a affecté les habitants voisins.	Lärm; Geräusch	Der Baulärm beeinträchtigte die Anwohner.	rumore	Il rumore dei lavori ha disturbato i residenti vicini.	ruído	O ruído da obra afetou os moradores próximos.	шум	Шум стройки повлиял на ближайших жителей.
5255:炸	炸	炸	explotar; freír	El petardo explotó de repente y todos se asustaron.	exploser; frire	Le pétard a soudain explosé, et tout le monde a sursauté.	explodieren; frittieren	Der Feuerwerkskörper explodierte plötzlich, und alle erschraken.	esplodere; friggere	Il petardo è esploso all'improvviso e tutti si sono spaventati.	explodir; fritar	O rojão explodiu de repente, e todos se assustaram.	взрываться; жарить во фритюре	Петарда внезапно взорвалась, и все испугались.
5256:粘	粘	粘	pegar; adherir	El pegamento unió los papeles.	coller; adhérer	La colle a collé les papiers ensemble.	kleben	Der Kleber klebte die Papiere zusammen.	incollare; aderire	La colla ha attaccato insieme i fogli.	colar; grudar	A cola grudou os papéis.	клеить; прилипать	Клей склеил бумаги.
5259:占比	占比	占比	proporción; porcentaje	La proporción de ventas en línea ya superó la mitad.	proportion; part	La part des ventes en ligne a déjà dépassé la moitié.	Anteil; Quote	Der Anteil der Onlineverkäufe hat bereits die Hälfte überschritten.	proporzione; quota	La quota delle vendite online ha già superato la metà.	proporção; participação	A participação das vendas online já passou da metade.	доля; процент	Доля онлайн-продаж уже превысила половину.
5262:战胜	战胜	战胜	vencer; superar	Finalmente superaron todas las dificultades.	vaincre; surmonter	Ils ont finalement surmonté toutes les difficultés.	besiegen; überwinden	Sie überwanden schließlich alle Schwierigkeiten.	sconfiggere; superare	Alla fine hanno superato tutte le difficoltà.	vencer; superar	Eles finalmente superaram todas as dificuldades.	победить; преодолеть	В конце концов они преодолели все трудности.
5263:占有	占有	占有	poseer; ocupar	Esta empresa posee una gran cuota de mercado.	posséder; occuper	Cette entreprise détient une grande part de marché.	besitzen; einnehmen	Dieses Unternehmen hält einen großen Marktanteil.	possedere; occupare	Questa azienda detiene una grande quota di mercato.	possuir; ocupar	Esta empresa detém uma grande participação de mercado.	владеть; занимать	Эта компания занимает большую долю рынка.
5265:章	章	章	capítulo; sección	Por favor, lee el contenido del capítulo tres.	chapitre; section	Veuillez lire le contenu du troisième chapitre.	Kapitel; Abschnitt	Bitte lesen Sie den Inhalt von Kapitel drei.	capitolo; sezione	Per favore, leggi il contenuto del capitolo tre.	capítulo; seção	Por favor, leia o conteúdo do capítulo três.	глава; раздел	Пожалуйста, прочитайте содержание третьей главы.
5268:账单	账单	账单	cuenta; factura	El camarero puso la cuenta sobre la mesa.	addition; facture	Le serveur a posé l'addition sur la table.	Rechnung; Abrechnung	Der Kellner legte die Rechnung auf den Tisch.	conto; fattura	Il cameriere ha messo il conto sul tavolo.	conta; fatura	O garçom colocou a conta sobre a mesa.	счет; выписка	Официант положил счет на стол.
5269:招	招	招	reclutar; atraer	La empresa está reclutando empleados nuevos.	recruter; attirer	L'entreprise recrute de nouveaux employés.	rekrutieren; anwerben	Das Unternehmen stellt neue Mitarbeiter ein.	reclutare; attirare	L'azienda sta assumendo nuovi dipendenti.	recrutar; atrair	A empresa está recrutando novos funcionários.	набирать; привлекать	Компания набирает новых сотрудников.
5271:招生	招生	招生	admitir estudiantes; matricular	Esta escuela planea admitir quinientos estudiantes este año.	recruter des élèves; inscrire	Cette école prévoit d'inscrire cinq cents élèves cette année.	Schüler aufnehmen; Studierende einschreiben	Diese Schule plant, in diesem Jahr fünfhundert Schüler aufzunehmen.	iscrivere studenti; ammettere	Questa scuola prevede di ammettere cinquecento studenti quest'anno.	matricular alunos; admitir estudantes	Esta escola planeja matricular quinhentos alunos este ano.	набирать учащихся	Эта школа планирует набрать пятьсот учеников в этом году.
5272:招手	招手	招手	saludar con la mano; hacer señas	Ella nos saludó con la mano en la estación.	faire signe de la main	Elle nous a fait signe de la main à la gare.	winken	Sie winkte uns am Bahnhof zu.	fare un cenno con la mano	Ci ha salutati con la mano alla stazione.	acenar	Ela acenou para nós na estação.	махать рукой	Она помахала нам рукой на станции.
5274:照明	照明	照明	iluminación	La iluminación de esta habitación es muy buena.	éclairage	L'éclairage de cette pièce est très bon.	Beleuchtung	Die Beleuchtung in diesem Raum ist sehr gut.	illuminazione	L'illuminazione di questa stanza è molto buona.	iluminação	A iluminação deste cômodo é muito boa.	освещение	Освещение в этой комнате очень хорошее.
5276:针	针	针	aguja; inyección	La enfermera le puso una inyección al paciente.	aiguille; injection	L'infirmière a fait une injection au patient.	Nadel; Spritze	Die Krankenschwester gab dem Patienten eine Spritze.	ago; iniezione	L'infermiera ha fatto un'iniezione al paziente.	agulha; injeção	A enfermeira aplicou uma injeção no paciente.	игла; укол	Медсестра сделала пациенту укол.
5280:镇	镇	镇	pueblo; calmar	Este pueblo está cerca del mar.	bourg; calmer	Ce bourg est près de la mer.	Kleinstadt; beruhigen	Diese Kleinstadt liegt am Meer.	cittadina; calmare	Questa cittadina è vicino al mare.	vila; acalmar	Esta vila fica perto do mar.	поселок; успокаивать	Этот поселок находится у моря.
5281:阵雨	阵雨	阵雨	chubasco; lluvia pasajera	Puede haber chubascos por la tarde.	averse	Il pourrait y avoir des averses l'après-midi.	Schauer; Regenschauer	Am Nachmittag kann es Regenschauer geben.	acquazzone; rovescio	Nel pomeriggio potrebbero esserci rovesci.	pancada de chuva	Pode haver pancadas de chuva à tarde.	кратковременный дождь; ливень	Во второй половине дня возможны кратковременные дожди.
5283:争吵	争吵	争吵	discutir; pelearse	Empezaron a discutir por un asunto pequeño.	se disputer; querelle	Ils ont commencé à se disputer pour une petite affaire.	streiten	Sie begannen wegen einer Kleinigkeit zu streiten.	litigare	Hanno iniziato a litigare per una piccola cosa.	discutir; brigar	Eles começaram a brigar por uma coisa pequena.	ссориться; спорить	Они начали ссориться из-за пустяка.
5290:正面	正面	正面	frente; lado positivo	Por favor, coloca el frente de la foto hacia arriba.	face avant; côté positif	Veuillez placer la face avant de la photo vers le haut.	Vorderseite; positive Seite	Bitte legen Sie die Vorderseite des Fotos nach oben.	lato anteriore; positivo	Per favore, metti la parte anteriore della foto rivolta verso l'alto.	frente; lado positivo	Por favor, coloque a frente da foto virada para cima.	лицевая сторона; положительная сторона	Положите фотографию лицевой стороной вверх.
5299:之所以	之所以	之所以	la razón por la que	La razón por la que llegó tarde fue el tráfico en el camino.	la raison pour laquelle	La raison pour laquelle il était en retard, c'est qu'il y avait des embouteillages en route.	der Grund, warum	Der Grund, warum er zu spät kam, war der Verkehr unterwegs.	il motivo per cui	Il motivo per cui era in ritardo era il traffico lungo la strada.	a razão pela qual	A razão pela qual ele se atrasou foi o trânsito no caminho.	причина, по которой	Причина, по которой он опоздал, была в пробках по дороге.
5303:职员	职员	职员	empleado; miembro del personal	Todos los empleados de la empresa asistieron a la capacitación.	employé; membre du personnel	Tous les employés de l'entreprise ont participé à la formation.	Angestellter; Mitarbeiter	Alle Mitarbeiter des Unternehmens nahmen an der Schulung teil.	impiegato; membro del personale	Tutti i dipendenti dell'azienda hanno partecipato alla formazione.	funcionário; membro da equipe	Todos os funcionários da empresa participaram do treinamento.	сотрудник; служащий	Все сотрудники компании прошли обучение.
5304:职责	职责	职责	deber; responsabilidad	El deber de un médico es proteger la salud de los pacientes.	devoir; responsabilité	Le devoir d'un médecin est de protéger la santé des patients.	Pflicht; Verantwortung	Die Pflicht eines Arztes ist es, die Gesundheit der Patienten zu schützen.	dovere; responsabilità	Il dovere di un medico è proteggere la salute dei pazienti.	dever; responsabilidade	O dever de um médico é proteger a saúde dos pacientes.	обязанность; ответственность	Обязанность врача - защищать здоровье пациентов.
5306:只得	只得	只得	no tener más remedio que	La lluvia era demasiado fuerte, así que no tuvimos más remedio que cancelar la actividad.	ne pas avoir d'autre choix que	La pluie était trop forte, alors nous n'avons pas eu d'autre choix que d'annuler l'activité.	keine andere Wahl haben als	Der Regen war zu stark, daher mussten wir die Aktivität absagen.	non avere altra scelta che	La pioggia era troppo forte, quindi non abbiamo avuto altra scelta che annullare l'attività.	não ter escolha senão	A chuva estava forte demais, então não tivemos escolha senão cancelar a atividade.	быть вынужденным; не оставалось ничего, кроме	Дождь был слишком сильным, поэтому нам пришлось отменить мероприятие.
5308:只顾	只顾	只顾	preocuparse solo por; estar absorto en	Él solo miraba el teléfono y no oyó lo que dije.	ne s'occuper que de; être absorbé par	Il ne faisait que regarder son téléphone et ne m'a pas entendu parler.	nur an etwas denken; vertieft sein	Er schaute nur auf sein Handy und hörte mich nicht sprechen.	pensare solo a; essere assorbito da	Guardava solo il telefono e non mi ha sentito parlare.	só se importar com; estar absorvido em	Ele só olhava para o celular e não me ouviu falar.	думать только о; быть поглощенным	Он смотрел только в телефон и не услышал, что я сказал.
5312:制	制	制	fabricar; sistema	Este medicamento es fabricado por una farmacéutica local.	fabriquer; système	Ce médicament est fabriqué par une usine pharmaceutique locale.	herstellen; System	Dieses Medikament wird von einer örtlichen Pharmafabrik hergestellt.	produrre; sistema	Questo medicinale è prodotto da una fabbrica farmaceutica locale.	fabricar; sistema	Este medicamento é fabricado por uma indústria farmacêutica local.	производить; система	Это лекарство производится местной фармацевтической фабрикой.
5313:至关重要	至关重要	至关重要	crucial; de suma importancia	La capacitación en seguridad es crucial para los empleados nuevos.	crucial; d'une importance capitale	La formation à la sécurité est cruciale pour les nouveaux employés.	äußerst wichtig; entscheidend	Sicherheitsschulungen sind für neue Mitarbeiter äußerst wichtig.	di importanza cruciale	La formazione sulla sicurezza è di importanza cruciale per i nuovi dipendenti.	extremamente importante; crucial	O treinamento de segurança é extremamente importante para novos funcionários.	крайне важный; жизненно важный	Обучение безопасности крайне важно для новых сотрудников.
5316:制品	制品	制品	producto; artículo manufacturado	Esta tienda vende todo tipo de productos de madera.	produit; article manufacturé	Ce magasin vend toutes sortes de produits en bois.	Produkt; Erzeugnis	Dieses Geschäft verkauft alle Arten von Holzprodukten.	prodotto; manufatto	Questo negozio vende ogni tipo di prodotti in legno.	produto; artigo manufaturado	Esta loja vende todos os tipos de produtos de madeira.	изделие; продукция	Этот магазин продает разные изделия из дерева.
5318:质疑	质疑	质疑	cuestionar; dudar	El reportero cuestionó los datos de este informe.	mettre en doute; questionner	Le journaliste a mis en doute les données de ce rapport.	anzweifeln; infrage stellen	Der Reporter stellte die Daten in diesem Bericht infrage.	mettere in dubbio; contestare	Il giornalista ha messo in dubbio i dati di questo rapporto.	questionar; duvidar	O repórter questionou os dados deste relatório.	подвергать сомнению; сомневаться	Репортер усомнился в данных этого отчета.
5320:中等	中等	中等	mediano; promedio	Esta prenda es de talla mediana.	moyen; intermédiaire	Ce vêtement est de taille moyenne.	mittel; durchschnittlich	Dieses Kleidungsstück hat mittlere Größe.	medio; intermedio	Questo capo è di taglia media.	médio; mediano	Esta peça de roupa é de tamanho médio.	средний	Этот предмет одежды среднего размера.
5324:钟头	钟头	钟头	hora	Esperamos dos horas.	heure	Nous avons attendu deux heures.	Stunde	Wir haben zwei Stunden gewartet.	ora	Abbiamo aspettato due ore.	hora	Esperamos duas horas.	час	Мы ждали два часа.
5327:肿	肿	肿	hincharse; hinchado	Se le hinchó el tobillo.	enfler; gonflé	Sa cheville a enflé.	anschwellen; geschwollen	Sein Knöchel schwoll an.	gonfiarsi; gonfio	Gli si è gonfiata la caviglia.	inchar; inchado	O tornozelo dele inchou.	опухать; опухший	У него опухла щиколотка.
