hsk_key	source_word	simplified	SI	example_SI	TA	example_TA
5265:章	章	章	පරිච්ඡේදය; කොටස	කරුණාකර තුන්වන පරිච්ඡේදයේ අන්තර්ගතය කියවන්න.	அதிகாரம்; பகுதி	தயவுசெய்து மூன்றாம் அதிகாரத்தின் உள்ளடக்கத்தை படியுங்கள்.
5268:账单	账单	账单	බිල්පත; ගිණුම් ප්‍රකාශය	සේවකයා බිල්පත මේසය මත තැබුවේය.	பில்; கணக்கு அறிக்கை	பணியாளர் பில்லைக் மேசையின் மீது வைத்தார்.
5269:招	招	招	බඳවා ගැනීම; ආකර්ෂණය කිරීම	සමාගම නව සේවකයන් බඳවා ගනිමින් සිටී.	ஆட்கள் சேர்த்தல்; ஈர்த்தல்	நிறுவனம் புதிய ஊழியர்களை வேலைக்கு எடுக்கிறது.
5271:招生	招生	招生	සිසුන් බඳවා ගැනීම	මෙම පාසල මේ වසරේ සිසුන් පන්සිය දෙනෙකු බඳවා ගැනීමට සැලසුම් කරයි.	மாணவர் சேர்க்கை நடத்துதல்	இந்த பள்ளி இந்த ஆண்டு ஐநூறு மாணவர்களை சேர்க்க திட்டமிடுகிறது.
5272:招手	招手	招手	අත වැනීම	ඇය දුම්රිය ස්ථානයේදී අපට අත වැනුවාය.	கையசைத்தல்	அவள் நிலையத்தில் எங்களுக்கு கையசைத்தாள்.
5274:照明	照明	照明	ආලෝකකරණය	මෙම කාමරයේ ආලෝකකරණය ඉතා හොඳයි.	ஒளியமைப்பு; விளக்கு அமைப்பு	இந்த அறையின் ஒளியமைப்பு மிகவும் நன்றாக உள்ளது.
5276:针	针	针	ඉඳිකටුව; එන්නත	හෙදිය රෝගියාට එන්නතක් ලබා දුන්නාය.	ஊசி; ஊசி மருந்து	செவிலியர் நோயாளிக்கு ஒரு ஊசி போட்டார்.
5280:镇	镇	镇	කුඩා නගරය; සන්සුන් කිරීම	මෙම කුඩා නගරය මුහුදට ආසන්නයි.	சிறுநகரம்; அமைதிப்படுத்துதல்	இந்த சிறுநகரம் கடலுக்கு அருகில் உள்ளது.
5281:阵雨	阵雨	阵雨	හදිසි වැස්ස; වැසි වාරයක්	පස්වරුවේ හදිසි වැසි ඇති විය හැක.	திடீர் மழை; மழைச் சாரல்	மதியம் திடீர் மழை பெய்ய வாய்ப்பு உள்ளது.
5283:争吵	争吵	争吵	රණ්ඩු වීම; වාද කිරීම	ඔවුහු සුළු දෙයක් නිසා රණ්ඩු වීමට පටන් ගත්හ.	சண்டையிடுதல்; வாக்குவாதம்	அவர்கள் சிறிய விஷயத்துக்காக வாக்குவாதம் செய்யத் தொடங்கினர்.
5290:正面	正面	正面	ඉදිරි පැත්ත; ධනාත්මක පැත්ත	කරුණාකර ඡායාරූපයේ ඉදිරි පැත්ත ඉහළට තබන්න.	முன்பக்கம்; நேர்மறை பக்கம்	தயவுசெய்து புகைப்படத்தின் முன்பக்கத்தை மேலே பார்த்தபடி வையுங்கள்.
5299:之所以	之所以	之所以	හේතුව; එසේ වීමට හේතුව	ඔහු ප්‍රමාද වූ හේතුව මාර්ගයේ වාහන තදබදයයි.	காரணம் என்னவென்றால்	அவர் தாமதமானதற்குக் காரணம் வழியில் போக்குவரத்து நெரிசல் இருந்தது.
5303:职员	职员	职员	සේවකයා; කාර්ය මණ්ඩල සාමාජිකයා	සමාගමේ සියලු සේවකයෝ පුහුණුවට සහභාගී වූහ.	ஊழியர்; பணியாளர்	நிறுவன ஊழியர்கள் அனைவரும் பயிற்சியில் கலந்து கொண்டனர்.
5304:职责	职责	职责	වගකීම; රාජකාරිය	වෛද්‍යවරයාගේ වගකීම රෝගීන්ගේ සෞඛ්‍යය ආරක්ෂා කිරීමයි.	கடமை; பொறுப்பு	மருத்துவரின் கடமை நோயாளிகளின் ஆரோக்கியத்தை பாதுகாப்பதாகும்.
5306:只得	只得	只得	වෙනත් විකල්පයක් නැතිව කිරීම	වැස්ස ඉතා තද නිසා අපට ක්‍රියාකාරකම අවලංගු කිරීමට සිදු විය.	வேறு வழியின்றி செய்யுதல்	மழை மிகவும் பலமாக இருந்ததால், நிகழ்ச்சியை ரத்து செய்ய வேண்டியதாகிவிட்டது.
5308:只顾	只顾	只顾	එක දෙයකට පමණක් අවධානය යොමු කිරීම	ඔහු දුරකථනය බැලීමේ පමණක් නිරත වී, මා කතා කළ දේ ඇසුණේ නැත.	ஒன்றில் மட்டும் கவனம் செலுத்துதல்	அவன் கைபேசியைப் பார்ப்பதிலேயே இருந்ததால், நான் பேசியதை கேட்கவில்லை.
5312:制	制	制	නිපදවීම; පද්ධතිය	මෙම ඖෂධය දේශීය ඖෂධ කර්මාන්තශාලාවක් විසින් නිපදවනු ලැබේ.	தயாரித்தல்; முறைமை	இந்த மருந்து உள்ளூர் மருந்துத் தொழிற்சாலையால் தயாரிக்கப்படுகிறது.
5313:至关重要	至关重要	至关重要	අතිශය වැදගත්	නව සේවකයන්ට ආරක්ෂක පුහුණුව අතිශය වැදගත්ය.	மிக முக்கியமான	புதிய ஊழியர்களுக்கு பாதுகாப்புப் பயிற்சி மிக முக்கியமானது.
5316:制品	制品	制品	නිෂ්පාදන; සාදන ලද භාණ්ඩ	මෙම වෙළඳසැල විවිධ ලී නිෂ්පාදන විකුණයි.	தயாரிப்புகள்; உற்பத்திப் பொருட்கள்	இந்த கடை பலவகை மர தயாரிப்புகளை விற்கிறது.
5318:质疑	质疑	质疑	ප්‍රශ්න කිරීම; සැක කිරීම	වාර්තාකරු මෙම වාර්තාවේ දත්ත ප්‍රශ්න කළේය.	கேள்வி எழுப்புதல்; சந்தேகித்தல்	செய்தியாளர் இந்த அறிக்கையின் தரவுகளை கேள்வி எழுப்பினார்.
5320:中等	中等	中等	මධ්‍යම; සාමාන්‍ය	මෙම ඇඳුම මධ්‍යම ප්‍රමාණයේය.	நடுத்தர; சராசரி	இந்த உடை நடுத்தர அளவுடையது.
5324:钟头	钟头	钟头	පැය	අපි පැය දෙකක් බලා සිටියෙමු.	மணி நேரம்	நாங்கள் இரண்டு மணி நேரம் காத்திருந்தோம்.
5327:肿	肿	肿	ඉදිමීම; ඉදිමුණු	ඔහුගේ කකුල් සන්ධිය ඉදිමී ගියේය.	வீங்குதல்; வீங்கிய	அவரது கணுக்கால் வீங்கியது.
5328:中	中	中	දිනීම; වැදීම	ඔහු ත්‍යාගයක් දිනාගෙන කතා කළ නොහැකි තරම් සතුටු විය.	பரிசு அடைதல்; தாக்கப்படுதல்	அவர் பரிசு வென்று பேச முடியாத அளவுக்கு மகிழ்ந்தார்.
5329:种地	种地	种地	ගොවිතැන කිරීම; ඉඩම් වගා කිරීම	සීයා තරුණ කාලයේ ගම්මානයේ ගොවිතැන කරමින් සිටියේය.	விவசாயம் செய்தல்; நிலம் பயிரிடுதல்	தாத்தா இளமையில் கிராமப்புறத்தில் விவசாயம் செய்தார்.
5330:中毒	中毒	中毒	විෂ වීම	නරක් වූ ආහාර විෂ වීමට හේතු විය හැක.	விஷம் ஏறுதல்	கெட்டுப்போன உணவு விஷம் ஏறக் காரணமாகலாம்.
5331:中奖	中奖	中奖	ත්‍යාගයක් දිනා ගැනීම	ඇය ලොතරැයියක් මිලදී ගත් පළමු වතාවේම ත්‍යාගයක් දිනා ගත්තාය.	பரிசு வெல்லுதல்	அவள் லாட்டரி சீட்டு வாங்கிய முதல் முறையிலேயே பரிசு வென்றாள்.
5332:众人	众人	众人	සියලු දෙනා; ජනතාව	පුවත ඇසූ පසු සියලු දෙනාම පුදුම වූහ.	அனைவரும்; கூட்டம்	செய்தியை கேட்ட பிறகு அனைவரும் ஆச்சரியப்பட்டனர்.
5333:中暑	中暑	中暑	උෂ්ණාඝාතය; අධික උණුසුමෙන් අසනීප වීම	කාලගුණය ඉතා උණුසුම් වූ විට වැඩිහිටියන්ට උෂ්ණාඝාතය ඇති වීමට පහසුය.	வெப்பநோய்; வெயிலால் மயக்கம்	காலநிலை மிகவும் சூடாக இருக்கும்போது முதியவர்களுக்கு வெப்பநோய் எளிதில் ஏற்படும்.
5342:珠宝	珠宝	珠宝	ආභරණ	මෙම වෙළඳසැල ආභරණ නිර්මාණය කිරීමේ විශේෂත්වයක් දරයි.	நகை; ஆபரணம்	இந்த கடை நகை வடிவமைப்பில் சிறப்பு பெற்றது.
5343:诸多	诸多	诸多	බොහෝ; නොයෙක්	මෙම ව්‍යාපෘතිය බොහෝ අභියෝගවලට මුහුණ දෙයි.	பல; ஏராளமான	இந்தத் திட்டம் பல சவால்களை எதிர்கொள்கிறது.
5345:主播	主播	主播	වැඩසටහන් ඉදිරිපත් කරන්නා; සජීවී ප්‍රවාහකයා	ඇය මෙම වැඩසටහනේ ඉදිරිපත් කරන්නියයි.	தொகுப்பாளர்; நேரலை வழங்குபவர்	அவள் இந்த நிகழ்ச்சியின் தொகுப்பாளர்.
5348:主角	主角	主角	ප්‍රධාන චරිතය; ප්‍රමුඛ භූමිකාව	මෙම චිත්‍රපටයේ ප්‍රධාන චරිතය වෛද්‍යවරයෙකි.	முக்கிய கதாபாத்திரம்; முன்னணி வேடம்	இந்த திரைப்படத்தின் முக்கிய கதாபாத்திரம் ஒரு மருத்துவர்.
5350:主演	主演	主演	ප්‍රධාන චරිතය රඟපානවා; ප්‍රධාන නළුවා	මෙම වේදිකා නාට්‍යයේ තරුණ නළුවෝ ප්‍රධාන චරිත රඟපාති.	முதன்மை வேடத்தில் நடிப்பது; முன்னணி நடிகர்	இந்த நாடகத்தில் இளம் நடிகர்கள் முதன்மை வேடத்தில் நடிக்கிறார்கள்.
5355:祝愿	祝愿	祝愿	සුභ පතීම; හදවතින් ප්‍රාර්ථනා කිරීම	මම ඔබලාට සතුට හදවතින්ම ප්‍රාර්ථනා කරමි.	வாழ்த்துதல்; மனமார விரும்புதல்	நீங்கள் மகிழ்ச்சியாக இருக்க மனமார வாழ்த்துகிறேன்.
5359:专科	专科	专科	විශේෂිත අංශය; කනිෂ්ඨ විද්‍යාලය	මෙම රෝහලේ ඇස් රෝග සඳහා විශේෂිත බාහිර රෝගී සායනයක් ඇත.	சிறப்பு துறை; ஜூனியர் கல்லூரி	இந்த மருத்துவமனையில் கண் மருத்துவ சிறப்பு வெளிநோயாளர் பிரிவு உள்ளது.
5362:专用	专用	专用	විශේෂ භාවිතයට; වෙන් කළ	මෙම මාර්ගය සේවකයන් සඳහා පමණක් වෙන් කර ඇත.	சிறப்பு பயன்பாட்டுக்கான; ஒதுக்கப்பட்ட	இந்த வழி பணியாளர்களுக்கான பயன்பாட்டிற்கு மட்டுமே ஒதுக்கப்பட்டுள்ளது.
5363:专注	专注	专注	අවධානය යොමු කළ; එකග්‍ර	ඇය පරීක්ෂණ කරන විට ඉතා එකග්‍රව සිටී.	கவனமாக; ஒருமுகப்படுதல்	அவள் பரிசோதனை செய்யும்போது மிகவும் கவனமாக இருக்கிறாள்.
5364:转换	转换	转换	පරිවර්තනය කිරීම; මාරු කිරීම	කරුණාකර ගොනුව PDF ආකෘතියට පරිවර්තනය කරන්න.	மாற்றுதல்; உருமாற்றுதல்	தயவுசெய்து கோப்பை PDF வடிவத்திற்கு மாற்றுங்கள்.
5365:转交	转交	转交	භාර දීම; පවරා දීම	කරුණාකර මෙම ලිපිය කළමනාකරුට භාර දෙන්න.	ஒப்படைத்தல்; மாற்றி கொடுத்தல்	தயவுசெய்து இந்த கடிதத்தை மேலாளரிடம் ஒப்படையுங்கள்.
5367:转身	转身	转身	හැරීම; පිටුපසට හැරීම	ඔහු ශබ්දය ඇසූ වහාම හැරුණේය.	திரும்புதல்; உடலைத் திருப்புதல்	அவன் சத்தம் கேட்டவுடன் உடனே திரும்பினான்.
5370:转动	转动	转动	කරකැවීම; භ්‍රමණය වීම	යන්ත්‍රයේ රෝදය කරකැවීමට පටන් ගත්තේය.	சுழலுதல்; திருப்புதல்	இயந்திரத்தின் சக்கரம் சுழலத் தொடங்கியது.
5374:捉	捉	捉	අල්ලා ගැනීම	ළමයින් මිදුලේ සමනලයන් අල්ලා ගත්හ.	பிடித்தல்; பிடித்து வைத்தல்	குழந்தைகள் முற்றத்தில் பட்டாம்பூச்சிகளைப் பிடித்தனர்.
5378:自来水	自来水	自来水	නළ ජලය	මෙහි නළ ජලය සෘජුවම පානය කළ හැක.	குழாய் நீர்	இங்குள்ள குழாய் நீரை நேரடியாக குடிக்கலாம்.
5379:自律	自律	自律	ස්වයං විනය	ස්වයං විනය පවත්වා ගැනීම අධ්‍යයනයට වැදගත්ය.	சுய ஒழுக்கம்	சுய ஒழுக்கத்தை பேணுவது படிப்பிற்கு முக்கியமானது.
5381:自杀	自杀	自杀	සියදිවි නසා ගැනීම	පුවත් වාර්තා සියදිවි නසා ගැනීමේ සිදුවීම් ඉතා සැලකිල්ලෙන් හැසිරවිය යුතුය.	தற்கொலை	செய்தி அறிக்கைகள் தற்கொலை சம்பவங்களை கவனமாக கையாள வேண்டும்.
5382:自我	自我	自我	ස්වයං; තමන්	සංචාරය ඔහුට තමන්ව වඩා හොඳින් තේරුම් ගැනීමට උපකාර කළේය.	சுயம்; தன்னை	பயணம் அவன் தன்னை மேலும் நன்றாக புரிந்துகொள்ள உதவியது.
5383:自言自语	自言自语	自言自语	තනිවම කතා කිරීම	ඇය පොත් රාක්කය සකස් කරමින් තනිවම කතා කළාය.	தன்னிடமே பேசுதல்	அவள் புத்தக அலமாரியை ஒழுங்குபடுத்திக்கொண்டே தன்னிடமே பேசினாள்.
5385:自助	自助	自助	ස්වයං සේවා	මෙම අවන්හල ස්වයං සේවා උදෑසන ආහාරය සපයයි.	சுய சேவை	இந்த உணவகம் சுய சேவை காலை உணவை வழங்குகிறது.
5388:总计	总计	总计	මුළු එකතුව; එකතුව	මෙම ක්‍රියාකාරකමට මුළු එකතුව දෙසිය දෙනෙක් සහභාගී වූහ.	மொத்தம்; மொத்த எண்ணிக்கை	இந்த நிகழ்வில் மொத்தம் இருநூறு பேர் கலந்து கொண்டனர்.
5391:粽子	粽子	粽子	සොංසි; කොළවල ඔතන ලද සහල් කැවිලි	ඩ්‍රැගන් බෝට් උත්සවයට අපි සොංසි බොහොමයක් සෑදුවෙමු.	சொங்சி; இலைகளில் மடக்கிய அரிசி உருண்டை	டிராகன் படகு திருவிழாவிற்கு நாங்கள் பல சொங்சிகளை செய்தோம்.
5393:足	足	足	ප්‍රමාණවත්; සෑහෙන	මෙම මුදල ටිකට්පතක් මිලදී ගැනීමට ප්‍රමාණවත්ය.	போதுமான; நிறைவான	இந்தத் தொகை டிக்கெட் வாங்க போதுமானது.
5396:阻挡	阻挡	阻挡	අවහිර කිරීම; නවත්වීම	බර හිම වාහන ඉදිරියට යාම අවහිර කළේය.	தடுத்தல்; நிறுத்துதல்	கனமான பனி வாகனங்கள் முன்னே செல்லத் தடை செய்தது.
5399:钻	钻	钻	විදීම; ඇතුළට රිංගා යාම	ළමයා මේසය යටට රිංගා ගියේය.	துளையிடுதல்; உள்ளே நுழைதல்	குழந்தை மேசையின் கீழே நுழைந்தது.
5400:罪	罪	罪	අපරාධය; වරද	ඔහු තම අපරාධය පිළිගත්තේය.	குற்றம்; தவறு	அவன் தனது குற்றத்தை ஒப்புக்கொண்டான்.
