hsk_key	source_word	simplified	ES	example_ES	FR	example_FR	DE	example_DE	IT	example_IT	PT	example_PT	RU	example_RU
5114:炎症	炎症	炎症	inflamación	Este medicamento puede reducir la inflamación.	l'inflammation	Ce médicament peut réduire l'inflammation.	Entzündung	Dieses Medikament kann Entzündungen lindern.	infiammazione	Questo medicinale può ridurre l'infiammazione.	inflamação	Este medicamento pode reduzir a inflamação.	воспаление	Это лекарство может уменьшить воспаление.
5116:眼看	眼看	眼看	casi; pronto	Ya casi oscurece, así que deberíamos volver.	bientôt; presque	Il va bientôt faire nuit, alors nous devrions rentrer.	bald; fast	Es wird gleich dunkel, also sollten wir zurückgehen.	quasi; tra poco	Sta per fare buio, quindi dovremmo tornare indietro.	quase; logo	Está quase escurecendo, então devemos voltar.	вот-вот; на глазах	Уже темнеет, нам пора возвращаться.
5120:仰	仰	仰	mirar hacia arriba	El niño levantó la vista hacia las estrellas.	lever les yeux	L'enfant a levé les yeux vers les étoiles.	aufblicken	Das Kind blickte zu den Sternen hinauf.	guardare in alto	Il bambino guardò le stelle in alto.	olhar para cima	A criança olhou para as estrelas.	смотреть вверх	Ребенок поднял голову и посмотрел на звезды.
5122:养老	养老	养老	prepararse para la vejez; mantener a los mayores	Están planificando su vida de vejez después de la jubilación.	préparer sa vieillesse; subvenir aux vieux jours	Ils préparent leur vie de vieillesse après la retraite.	Altersvorsorge; für das Alter vorsorgen	Sie planen ihr Leben im Alter nach der Pensionierung.	provvedere alla vecchiaia; assistenza agli anziani	Stanno pianificando la vita da anziani dopo la pensione.	preparar a velhice; cuidar dos idosos	Eles estão planejando a vida na velhice depois da aposentadoria.	обеспечивать старость; готовиться к старости	Они планируют жизнь в старости после выхода на пенсию.
5123:养老院	养老院	养老院	residencia de ancianos	Esta residencia de ancianos está muy cerca del hospital.	maison de retraite; EHPAD	Cette maison de retraite est très proche de l'hôpital.	Pflegeheim; Seniorenheim	Dieses Seniorenheim liegt ganz in der Nähe des Krankenhauses.	casa di riposo	Questa casa di riposo è molto vicina all'ospedale.	casa de repouso; lar de idosos	Este lar de idosos fica muito perto do hospital.	дом престарелых; пансионат для пожилых	Этот дом престарелых находится очень близко к больнице.
5125:样	样	样	tipo; clase	Compró tres tipos de bocadillos.	sorte; type	Il a acheté trois sortes de snacks.	Art; Sorte	Er kaufte drei Sorten Snacks.	tipo; genere	Ha comprato tre tipi di snack.	tipo; variedade	Ele comprou três tipos de lanches.	вид; тип	Он купил три вида закусок.
5128:要么	要么	要么	o... o...; ya sea	O sales ahora o esperas hasta mañana.	soit... soit...	Soit tu pars maintenant, soit tu attends jusqu'à demain.	entweder... oder...	Entweder du gehst jetzt, oder du wartest bis morgen.	o... o...	O parti adesso o aspetti fino a domani.	ou... ou...	Ou você sai agora, ou espera até amanhã.	либо... либо...	Либо уходи сейчас, либо жди до завтра.
5130:野	野	野	silvestre; salvaje	En esta zona montañosa hay muchas flores silvestres.	sauvage; inculte	Il y a beaucoup de fleurs sauvages dans cette région montagneuse.	wild; unbebaut	In dieser Bergregion gibt es viele wilde Blumen.	selvatico; incolto	In questa zona montuosa ci sono molti fiori selvatici.	selvagem; silvestre	Há muitas flores silvestres nesta região montanhosa.	дикий; необработанный	В этом горном районе много диких цветов.
5131:也好	也好	也好	sea... o...; también está bien	Vayas o no, tienes que decírmelo.	que ce soit... ou...	Que tu y ailles ou non, tu dois me le dire.	ob... oder...	Ob du gehst oder nicht, du musst es mir sagen.	che... o...	Che tu vada o no, devi dirmelo.	quer... quer...	Quer você vá ou não, precisa me avisar.	будь то; ли... или...	Пойдешь ты или нет, ты должен мне сказать.
5132:野生	野生	野生	salvaje; silvestre	Aquí está prohibido capturar animales salvajes.	sauvage	Il est interdit de capturer des animaux sauvages ici.	wild; wildlebend	Hier ist es verboten, wilde Tiere zu fangen.	selvatico	Qui è vietato catturare animali selvatici.	selvagem; silvestre	É proibido capturar animais silvestres aqui.	дикий; дикорастущий	Здесь запрещено ловить диких животных.
5133:野外	野外	野外	campo; aire libre	Los estudiantes observaron plantas en el campo.	plein air; terrain	Les élèves ont observé des plantes sur le terrain.	Feld; freie Natur	Die Schüler beobachteten Pflanzen im Freien.	all'aperto; sul campo	Gli studenti hanno osservato le piante sul campo.	campo; ar livre	Os estudantes observaram plantas no campo.	полевая местность; на природе	Студенты наблюдали за растениями в полевых условиях.
5134:业	业	业	industria; sector	El sector servicios necesita más profesionales.	secteur; industrie	Le secteur des services a besoin de plus de professionnels.	Branche; Gewerbe	Die Dienstleistungsbranche braucht mehr Fachkräfte.	settore; industria	Il settore dei servizi ha bisogno di più professionisti.	setor; indústria	O setor de serviços precisa de mais profissionais.	отрасль; сфера	Сфере услуг нужно больше специалистов.
5139:衣食住行	衣食住行	衣食住行	necesidades básicas: ropa, comida, vivienda y transporte	Este informe analiza las necesidades básicas de los residentes urbanos.	besoins essentiels: habillement, nourriture, logement et transport	Ce rapport analyse les besoins essentiels des habitants de la ville.	Grundbedürfnisse des Alltags	Dieser Bericht analysiert die Grundbedürfnisse der Stadtbewohner.	bisogni essenziali della vita quotidiana	Questo rapporto analizza i bisogni essenziali dei residenti urbani.	necessidades básicas da vida	Este relatório analisa as necessidades básicas dos moradores urbanos.	базовые жизненные потребности	В этом отчете анализируются основные жизненные потребности городских жителей.
5140:医药	医药	医药	medicina; productos farmacéuticos	Los costos médicos y farmacéuticos han subido algo en los últimos años.	médecine; produits pharmaceutiques	Les coûts médicaux et pharmaceutiques ont un peu augmenté ces dernières années.	Medizin; Arzneimittel	Die Kosten für Medizin und Arzneimittel sind in den letzten Jahren etwas gestiegen.	medicina; farmaci	I costi medici e farmaceutici sono aumentati un po' negli ultimi anni.	medicina; produtos farmacêuticos	Os custos médicos e farmacêuticos subiram um pouco nos últimos anos.	медицина; фармацевтика	Расходы на медицину и лекарства за последние годы немного выросли.
5141:一一	一一	一一	uno por uno	El profesor explicó las preguntas una por una.	un par un	Le professeur a expliqué les questions une par une.	einzeln; nacheinander	Der Lehrer erklärte die Fragen einzeln.	uno per uno	L'insegnante ha spiegato le domande una per una.	um por um	O professor explicou as perguntas uma por uma.	один за другим; по очереди	Учитель разобрал вопросы один за другим.
5142:姨	姨	姨	tía materna	Mi tía viene hoy a cenar a mi casa.	tante maternelle	Ma tante vient dîner chez moi aujourd'hui.	Tante mütterlicherseits	Meine Tante kommt heute zum Abendessen zu mir.	zia materna	Mia zia viene a cena da me oggi.	tia materna	Minha tia vem jantar na minha casa hoje.	тетя по материнской линии	Сегодня моя тетя придет ко мне домой на ужин.
5146:一带	一带	一带	zona; área	Hay muchas librerías por la zona de la escuela.	secteur; région	Il y a beaucoup de librairies dans le secteur de l'école.	Gegend; Bereich	In der Gegend um die Schule gibt es viele Buchhandlungen.	zona; area	Nella zona della scuola ci sono molte librerie.	região; área	Há muitas livrarias na região da escola.	район; окрестности	В районе школы много книжных магазинов.
5147:一道	一道	一道	juntos; al mismo tiempo	Vamos juntos a ver la exposición.	ensemble; en même temps	Allons voir l'exposition ensemble.	zusammen; zugleich	Lass uns zusammen die Ausstellung ansehen.	insieme; allo stesso tempo	Andiamo insieme a vedere la mostra.	juntos; ao mesmo tempo	Vamos ver a exposição juntos.	вместе; одновременно	Давай вместе сходим на выставку.
5155:一系列	一系列	一系列	una serie de	La empresa lanzó una serie de productos nuevos.	une série de	L'entreprise a lancé une série de nouveaux produits.	eine Reihe von	Das Unternehmen brachte eine Reihe neuer Produkte auf den Markt.	una serie di	L'azienda ha lanciato una serie di nuovi prodotti.	uma série de	A empresa lançou uma série de novos produtos.	ряд; серия	Компания выпустила серию новых продуктов.
5157:一阵	一阵	一阵	una ráfaga; un rato	Entró una brisa fresca por la ventana.	une bouffée; un moment	Une brise fraîche est entrée par la fenêtre.	ein Windstoß; eine Weile	Ein kühler Windstoß kam durch das Fenster herein.	una folata; un breve periodo	Una brezza fresca entrò dalla finestra.	uma rajada; um período curto	Uma brisa fresca entrou pela janela.	порыв; промежуток	Из окна подул прохладный ветерок.
5158:遗址	遗址	遗址	ruinas; sitio histórico	Este sitio de una ciudad antigua ha atraído a muchos turistas.	ruines; site historique	Ce site d'une ancienne ville a attiré beaucoup de touristes.	Ruinen; historische Stätte	Diese alte Stadtanlage hat viele Touristen angezogen.	rovine; sito storico	Questo sito di un'antica città ha attirato molti turisti.	ruínas; sítio histórico	Este sítio de uma cidade antiga atraiu muitos turistas.	руины; историческое место	Это место древнего города привлекло много туристов.
5163:益处	益处	益处	beneficio; ventaja	Hacer ejercicio a diario tiene muchos beneficios para la salud.	avantage; bienfait	Faire de l'exercice tous les jours a de nombreux bienfaits pour la santé.	Nutzen; Vorteil	Tägliche Bewegung hat viele Vorteile für die Gesundheit.	beneficio; vantaggio	Fare esercizio ogni giorno ha molti benefici per la salute.	benefício; vantagem	Fazer exercício diariamente traz muitos benefícios para a saúde.	польза; преимущество	Ежедневные упражнения приносят много пользы здоровью.
5164:一帆风顺	一帆风顺	一帆风顺	ir todo sobre ruedas; éxito sin contratiempos	Te deseo que todo vaya sobre ruedas en tu nuevo trabajo.	que tout se passe sans encombre	Je te souhaite que tout se passe sans encombre dans ton nouveau travail.	reibungslos verlaufen	Ich wünsche dir, dass in deinem neuen Job alles reibungslos verläuft.	andare tutto liscio	Ti auguro che nel nuovo lavoro vada tutto liscio.	correr tudo bem; sem contratempos	Desejo que tudo corra bem no seu novo trabalho.	все идет гладко; без помех	Желаю, чтобы на новой работе у тебя все шло гладко.
5165:一口气	一口气	一口气	de una sola vez; sin parar	Corrió hasta la cima de la montaña sin parar.	d'un seul souffle; sans s'arrêter	Il a couru jusqu'au sommet de la montagne sans s'arrêter.	in einem Zug; ohne Pause	Er lief ohne Pause bis auf den Gipfel des Berges.	tutto d'un fiato; senza fermarsi	È corso fino in cima alla montagna senza fermarsi.	de uma vez; sem parar	Ele correu até o topo da montanha sem parar.	одним духом; без остановки	Он без остановки добежал до вершины горы.
5167:一模一样	一模一样	一模一样	exactamente igual	Estas dos fotos parecen exactamente iguales.	exactement pareil	Ces deux photos se ressemblent exactement.	genau gleich	Diese beiden Fotos sehen genau gleich aus.	identico; esattamente uguale	Queste due foto sembrano identiche.	exatamente igual	Estas duas fotos parecem exatamente iguais.	точь-в-точь одинаковый	Эти две фотографии выглядят совершенно одинаково.
5168:艺人	艺人	艺人	artista; intérprete	Este artista se muestra muy seguro en el escenario.	artiste; interprète	Cet artiste est très sûr de lui sur scène.	Künstler; Darsteller	Dieser Künstler wirkt auf der Bühne sehr selbstbewusst.	artista; performer	Questo artista è molto sicuro di sé sul palco.	artista; performer	Este artista é muito confiante no palco.	артист; исполнитель	Этот артист очень уверенно держится на сцене.
5169:一身	一身	一身	conjunto; todo el cuerpo	Llevaba un conjunto completamente negro.	tenue complète; tout le corps	Il portait une tenue entièrement noire.	am ganzen Körper; ein kompletter Anzug	Er trug ganz Schwarz.	completo; tutto il corpo	Indossava un completo tutto nero.	roupa completa; corpo inteiro	Ele vestia um conjunto todo preto.	весь; полный комплект одежды	На нем была полностью черная одежда.
5170:一时	一时	一时	por el momento; por un rato	Por un momento no pude recordar su nombre.	pour le moment; un instant	Sur le moment, je n'ai pas pu me souvenir de son nom.	vorübergehend; im Moment	Mir fiel sein Name im Moment nicht ein.	per il momento; per un attimo	Per un momento non sono riuscito a ricordare il suo nome.	por um momento; por enquanto	Por um momento não consegui lembrar o nome dele.	на время; в данный момент	Я не смог сразу вспомнить его имя.
5171:一同	一同	一同	juntos	Completamos este proyecto juntos.	ensemble	Nous avons terminé ce projet ensemble.	gemeinsam	Wir haben dieses Projekt gemeinsam abgeschlossen.	insieme	Abbiamo completato questo progetto insieme.	juntos	Concluímos este projeto juntos.	вместе; совместно	Мы вместе завершили этот проект.
5172:易于	易于	易于	fácil de; propenso a	Este software es fácil de usar.	facile à; susceptible de	Ce logiciel est facile à utiliser.	leicht zu; neigt dazu	Diese Software ist leicht zu bedienen.	facile da; incline a	Questo software è facile da usare.	fácil de; propenso a	Este software é fácil de operar.	легко поддается; легко	Эта программа проста в использовании.
5173:抑制	抑制	抑制	inhibir; contener	Este medicamento puede reducir el dolor.	inhiber; réprimer	Ce médicament peut atténuer la douleur.	hemmen; unterdrücken	Dieses Medikament kann Schmerzen lindern.	inibire; contenere	Questo medicinale può attenuare il dolore.	inibir; conter	Este medicamento pode aliviar a dor.	подавлять; сдерживать	Это лекарство может подавлять боль.
5174:因	因	因	debido a; por	La reunión se aplazó debido a la fuerte lluvia.	en raison de; à cause de	La réunion a été reportée à cause de la forte pluie.	wegen; aufgrund	Die Besprechung wurde wegen des starken Regens verschoben.	a causa di; per	La riunione è stata rinviata a causa della forte pioggia.	devido a; por causa de	A reunião foi adiada por causa da chuva forte.	из-за; по причине	Встречу отложили из-за сильного дождя.
5175:音节	音节	音节	sílaba	Esta palabra tiene tres sílabas.	syllabe	Ce mot compte trois syllabes.	Silbe	Dieses Wort hat drei Silben.	sillaba	Questa parola ha tre sillabe.	sílaba	Esta palavra tem três sílabas.	слог	В этом слове три слога.
5177:银牌	银牌	银牌	medalla de plata	Ella ganó una medalla de plata en la competencia.	médaille d'argent	Elle a remporté une médaille d'argent dans la compétition.	Silbermedaille	Sie gewann im Wettbewerb eine Silbermedaille.	medaglia d'argento	Ha vinto una medaglia d'argento nella gara.	medalha de prata	Ela ganhou uma medalha de prata na competição.	серебряная медаль	Она завоевала серебряную медаль на соревновании.
5178:引	引	引	citar; conducir	El profesor citó un poema antiguo para explicar la idea.	citer; guider	Le professeur a cité un ancien poème pour expliquer ce point.	zitieren; führen	Der Lehrer zitierte ein altes Gedicht, um den Punkt zu erklären.	citare; guidare	L'insegnante ha citato un'antica poesia per spiegare il punto.	citar; conduzir	O professor citou um poema antigo para explicar esse ponto.	цитировать; вести	Учитель процитировал старое стихотворение, чтобы объяснить мысль.
5179:隐藏	隐藏	隐藏	esconder; ocultar	El archivo estaba oculto en la carpeta del sistema.	cacher; dissimuler	Le fichier était caché dans le dossier système.	verstecken; verbergen	Die Datei war im Systemordner versteckt.	nascondere; celare	Il file era nascosto nella cartella di sistema.	esconder; ocultar	O arquivo estava escondido na pasta do sistema.	скрывать; прятать	Файл был скрыт в системной папке.
5181:引发	引发	引发	provocar; desencadenar	Esta noticia provocó una discusión acalorada.	déclencher; provoquer	Cette nouvelle a déclenché une vive discussion.	auslösen; verursachen	Diese Nachricht löste eine hitzige Diskussion aus.	provocare; innescare	Questa notizia ha provocato una discussione accesa.	provocar; desencadear	Esta notícia provocou uma discussão acalorada.	вызвать; спровоцировать	Эта новость вызвала горячее обсуждение.
5182:引入	引入	引入	introducir; incorporar	La escuela planea introducir un nuevo método de enseñanza.	introduire; faire entrer	L'école prévoit d'introduire une nouvelle méthode d'enseignement.	einführen; hereinbringen	Die Schule plant, eine neue Lehrmethode einzuführen.	introdurre; inserire	La scuola prevede di introdurre un nuovo metodo didattico.	introduzir; trazer	A escola planeja introduzir um novo método de ensino.	вводить; внедрять	Школа планирует внедрить новый метод обучения.
5184:饮用水	饮用水	饮用水	agua potable	El agua potable de aquí pasó pruebas estrictas.	eau potable	L'eau potable ici a passé des contrôles stricts.	Trinkwasser	Das Trinkwasser hier hat strenge Tests bestanden.	acqua potabile	L'acqua potabile qui ha superato controlli rigorosi.	água potável	A água potável daqui passou por testes rigorosos.	питьевая вода	Местная питьевая вода прошла строгую проверку.
5185:印	印	印	imprimir; estampar	Por favor, imprime aquí el logotipo de la empresa.	imprimer; apposer	Veuillez imprimer le logo de l'entreprise ici.	drucken; stempeln	Bitte drucken Sie hier das Logo des Unternehmens.	stampare; imprimere	Per favore, stampa qui il logo dell'azienda.	imprimir; estampar	Por favor, imprima o logotipo da empresa aqui.	печатать; ставить печать	Пожалуйста, напечатайте здесь логотип компании.
5192:用餐	用餐	用餐	comer; tomar una comida	Los invitados están comiendo en el restaurante.	prendre un repas; dîner	Les invités prennent leur repas au restaurant.	essen; speisen	Die Gäste speisen im Restaurant.	mangiare; consumare un pasto	Gli ospiti stanno mangiando al ristorante.	fazer uma refeição; comer	Os convidados estão fazendo uma refeição no restaurante.	есть; принимать пищу	Гости обедают в ресторане.
5193:用处	用处	用处	utilidad; uso	Este cuchillo pequeño tiene muchos usos.	utilité; usage	Ce petit couteau a de nombreux usages.	Nutzen; Verwendung	Dieses kleine Messer hat viele Verwendungen.	utilità; uso	Questo coltellino ha molti usi.	utilidade; uso	Esta faca pequena tem muitos usos.	польза; применение	У этого маленького ножа много применений.
5195:用人	用人	用人	contratar personal; emplear gente	Esta empresa es muy cuidadosa al contratar personal.	recruter; employer du personnel	Cette entreprise est très prudente lorsqu'elle recrute du personnel.	Personal einstellen; Menschen beschäftigen	Dieses Unternehmen ist bei der Einstellung von Mitarbeitern sehr sorgfältig.	assumere personale; impiegare persone	Questa azienda è molto attenta quando assume personale.	contratar pessoas; empregar	Esta empresa é muito cuidadosa ao contratar pessoas.	нанимать людей; использовать кадры	Эта компания очень тщательно подходит к найму сотрудников.
5196:用心	用心	用心	con esmero; atento	Se nota que este regalo fue preparado con mucho esmero.	avec soin; attentif	On voit que ce cadeau a été préparé avec beaucoup de soin.	sorgfältig; mit Bedacht	Man merkt, dass dieses Geschenk mit viel Sorgfalt vorbereitet wurde.	con cura; attento	Si vede che questo regalo è stato preparato con molta cura.	com cuidado; atento	Dá para ver que este presente foi preparado com muito cuidado.	старательно; внимательно	Видно, что этот подарок подготовили с большой заботой.
5197:优化	优化	优化	optimizar	El ingeniero está optimizando la velocidad del sistema.	optimiser	L'ingénieur optimise la vitesse du système.	optimieren	Der Ingenieur optimiert die Geschwindigkeit des Systems.	ottimizzare	L'ingegnere sta ottimizzando la velocità del sistema.	otimizar	O engenheiro está otimizando a velocidade do sistema.	оптимизировать	Инженер оптимизирует скорость системы.
5200:由来	由来	由来	origen; procedencia	El origen de esta costumbre es muy interesante.	origine; provenance	L'origine de cette coutume est très intéressante.	Ursprung; Herkunft	Der Ursprung dieses Brauchs ist sehr interessant.	origine; provenienza	L'origine di questa usanza è molto interessante.	origem; procedência	A origem deste costume é muito interessante.	происхождение; причина	Происхождение этого обычая очень интересно.
5201:游人	游人	游人	turista; visitante	En primavera hay especialmente muchos visitantes en el parque.	touriste; visiteur	Au printemps, il y a particulièrement beaucoup de visiteurs dans le parc.	Tourist; Besucher	Im Frühling gibt es im Park besonders viele Besucher.	turista; visitatore	In primavera ci sono particolarmente molti visitatori nel parco.	turista; visitante	Na primavera há especialmente muitos visitantes no parque.	турист; посетитель	Весной в парке особенно много посетителей.
5203:有机	有机	有机	orgánico	Esta granja vende solo verduras orgánicas.	biologique	Cette ferme ne vend que des légumes biologiques.	biologisch; organisch	Dieser Bauernhof verkauft nur Bio-Gemüse.	biologico; organico	Questa fattoria vende solo verdure biologiche.	orgânico	Esta fazenda vende apenas verduras orgânicas.	органический	Эта ферма продает только органические овощи.
5204:有劲	有劲	有劲	interesante; con energía	Esta película se vuelve más interesante cuanto más la ves.	intéressant; plein d'énergie	Plus on regarde ce film, plus il devient intéressant.	spannend; kraftvoll	Dieser Film wird umso spannender, je länger man ihn sieht.	interessante; energico	Questo film diventa più interessante man mano che lo guardi.	interessante; com energia	Este filme fica mais interessante quanto mais você assiste.	энергичный; интересный	Этот фильм становится тем интереснее, чем дольше его смотришь.
5205:有序	有序	有序	ordenado	El público entró al recinto de manera ordenada.	ordonné; organisé	Le public est entré dans la salle de façon ordonnée.	geordnet; ordentlich	Das Publikum betrat den Veranstaltungsort geordnet.	ordinato	Il pubblico è entrato nel luogo dell'evento in modo ordinato.	ordenado; organizado	O público entrou no local de forma ordenada.	упорядоченный; организованный	Зрители организованно вошли в зал.
5206:于	于	于	en; a	La reunión empieza a las nueve de la mañana.	à; dans	La réunion commence à neuf heures du matin.	um; in; bei	Die Besprechung beginnt um neun Uhr morgens.	a; in	La riunione inizia alle nove del mattino.	em; a	A reunião começa às nove da manhã.	в; на; к	Встреча начинается в девять утра.
5207:余额	余额	余额	saldo	Primero revisa el saldo de la tarjeta bancaria.	solde	Veuillez d'abord vérifier le solde de la carte bancaire.	Kontostand; Restbetrag	Bitte prüfen Sie zuerst den Kontostand der Bankkarte.	saldo	Controlla prima il saldo della carta bancaria.	saldo	Verifique primeiro o saldo do cartão bancário.	остаток; баланс	Сначала проверьте баланс банковской карты.
