hsk_key	source_word	simplified	ES	example_ES	FR	example_FR	DE	example_DE	IT	example_IT	PT	example_PT	RU	example_RU
5001:物体	物体	物体	el objeto; cuerpo físico	Este objeto se hundió lentamente en el agua.	l'objet; corps physique	Cet objet a lentement coulé dans l'eau.	das Objekt; der physische Körper	Dieses Objekt sank langsam im Wasser.	l'oggetto; il corpo fisico	Questo oggetto è affondato lentamente nell'acqua.	o objeto; corpo físico	Este objeto afundou lentamente na água.	предмет; физическое тело	Этот предмет медленно погрузился в воду.
5005:喜剧	喜剧	喜剧	la comedia	Esta comedia hizo reír sin parar a todo el público.	la comédie	Cette comédie a fait rire tout le public sans arrêt.	die Komödie	Diese Komödie brachte das ganze Publikum ununterbrochen zum Lachen.	la commedia	Questa commedia ha fatto ridere senza sosta tutto il pubblico.	a comédia	Esta comédia fez toda a plateia rir sem parar.	комедия	Эта комедия заставила весь зал смеяться без остановки.
5006:喜事	喜事	喜事	el acontecimiento feliz; celebración	Hubo una celebración en casa y todos los parientes vinieron a felicitar.	l'heureux événement; fête	Il y a eu un heureux événement à la maison, et tous les proches sont venus féliciter.	das freudige Ereignis; die Feier	Zu Hause gab es ein freudiges Ereignis, und alle Verwandten kamen zum Gratulieren.	il lieto evento; la festa	In famiglia c'è stato un lieto evento e tutti i parenti sono venuti a fare gli auguri.	o acontecimento feliz; celebração	Houve uma celebração em casa, e todos os parentes vieram dar os parabéns.	радостное событие; праздник	В семье было радостное событие, и все родственники пришли поздравить.
5007:洗漱	洗漱	洗漱	asearse; lavarse	Ella se levanta a las seis cada mañana para asearse.	faire sa toilette	Elle se lève à six heures chaque matin pour faire sa toilette.	sich waschen; Morgentoilette machen	Sie steht jeden Morgen um sechs Uhr auf, um sich zu waschen.	lavarsi; fare toilette	Si alza alle sei ogni mattina per lavarsi.	lavar-se; fazer a higiene matinal	Ela se levanta às seis todas as manhãs para se lavar.	умываться; приводить себя в порядок	Она каждый день в шесть утра встает, чтобы умыться.
5011:戏曲	戏曲	戏曲	la ópera tradicional china	Al abuelo le gusta especialmente escuchar ópera tradicional local.	l'opéra traditionnel chinois	Grand-père aime particulièrement écouter l'opéra traditionnel local.	die traditionelle chinesische Oper	Großvater hört besonders gern lokale traditionelle Oper.	l'opera tradizionale cinese	Al nonno piace particolarmente ascoltare l'opera tradizionale locale.	a ópera tradicional chinesa	O avô gosta especialmente de ouvir ópera tradicional local.	традиционная китайская опера	Дедушка особенно любит слушать местную традиционную оперу.
5014:下功夫	下功夫	下功夫	esforzarse; dedicar mucho trabajo	Ella está dispuesta a esforzarse para escribir bien los caracteres chinos.	faire des efforts; s'appliquer	Elle est prête à faire des efforts pour bien écrire les caractères chinois.	sich Mühe geben; viel Arbeit investieren	Sie ist bereit, sich Mühe zu geben, um chinesische Zeichen gut zu schreiben.	impegnarsi; dedicare molto lavoro	È disposta a impegnarsi per scrivere bene i caratteri cinesi.	esforçar-se; dedicar esforço	Ela está disposta a se esforçar para escrever bem os caracteres chineses.	усердно работать над чем-либо; приложить усилия	Она готова приложить усилия, чтобы хорошо писать китайские иероглифы.
5015:下单	下单	下单	hacer un pedido	Ya hice un pedido en línea para comprar el manual.	passer une commande	J'ai déjà passé une commande en ligne pour acheter le manuel.	eine Bestellung aufgeben	Ich habe das Lehrbuch bereits online bestellt.	fare un ordine	Ho già fatto un ordine online per comprare il manuale.	fazer um pedido	Eu já fiz um pedido online para comprar o material didático.	оформить заказ	Я уже оформил онлайн-заказ на учебник.
5017:下线	下线	下线	desconectarse; retirar de servicio	Esta función antigua se retirará oficialmente mañana.	être mis hors ligne; être retiré	Cette ancienne fonction sera officiellement retirée demain.	offline gehen; eingestellt werden	Diese alte Funktion wird morgen offiziell eingestellt.	andare offline; essere dismesso	Questa vecchia funzione verrà ufficialmente dismessa domani.	sair do ar; ser descontinuado	Este recurso antigo será oficialmente descontinuado amanhã.	уйти офлайн; быть снятым с эксплуатации	Эта старая функция завтра официально будет отключена.
5018:下旬	下旬	下旬	la última decena del mes	La exposición se inaugurará a finales de agosto.	la dernière décade du mois	L'exposition ouvrira dans la dernière partie du mois d'août.	das letzte Monatsdrittel	Die Ausstellung wird Ende August eröffnet.	l'ultima decade del mese	La mostra aprirà nell'ultima parte di agosto.	o último decêndio do mês	A exposição será inaugurada no final de agosto.	последняя декада месяца	Выставка откроется в конце августа.
5023:显	显	显	mostrar; parecer	Esta ropa lo hace parecer lleno de energía.	paraître; faire paraître	Ce vêtement le fait paraître plein d'énergie.	wirken lassen; erscheinen	Diese Kleidung lässt ihn sehr energiegeladen wirken.	far sembrare; apparire	Questo vestito lo fa sembrare pieno di energia.	fazer parecer; mostrar	Esta roupa faz ele parecer cheio de energia.	показывать; казаться	Эта одежда делает его вид очень бодрым.
5024:险	险	险	peligroso; arriesgado	El camino de montaña es peligroso, así que hay que conducir más despacio.	dangereux; risqué	La route de montagne est dangereuse, il faut donc conduire plus lentement.	gefährlich; riskant	Die Bergstraße ist gefährlich, deshalb muss man langsamer fahren.	pericoloso; rischioso	La strada di montagna è pericolosa, quindi bisogna guidare più piano.	perigoso; arriscado	A estrada da montanha é perigosa, então é preciso dirigir mais devagar.	опасный; рискованный	Горная дорога опасная, поэтому за рулем нужно ехать медленнее.
5026:限	限	限	limitar; restringir	Cada persona puede comprar como máximo dos boletos.	limiter; restreindre	Chaque personne est limitée à deux billets.	begrenzen; einschränken	Jede Person darf höchstens zwei Tickets kaufen.	limitare; restringere	Ogni persona può comprare al massimo due biglietti.	limitar; restringir	Cada pessoa pode comprar no máximo dois ingressos.	ограничивать	Каждому человеку разрешено купить не больше двух билетов.
5027:线	线	线	la línea; el hilo	Por favor, corta siguiendo esta línea.	la ligne; le fil	Veuillez couper le long de cette ligne.	die Linie; der Faden	Bitte schneiden Sie entlang dieser Linie.	la linea; il filo	Per favore, taglia lungo questa linea.	a linha; o fio	Por favor, corte ao longo desta linha.	линия; нить	Пожалуйста, режьте вдоль этой линии.
5028:现存	现存	现存	existente; conservado actualmente	Los datos existentes no bastan para demostrar esta conclusión.	existant; conservé actuellement	Les documents existants ne suffisent pas à prouver cette conclusion.	vorhanden; erhalten	Die vorhandenen Unterlagen reichen nicht aus, um diese Schlussfolgerung zu belegen.	esistente; attualmente conservato	I materiali esistenti non bastano a dimostrare questa conclusione.	existente; preservado atualmente	Os materiais existentes não bastam para provar esta conclusão.	существующий; сохранившийся	Существующих материалов недостаточно, чтобы доказать этот вывод.
5029:限度	限度	限度	el límite; grado	Su paciencia ya llegó al límite.	la limite; le degré	Sa patience a déjà atteint sa limite.	die Grenze; das Maß	Seine Geduld hat bereits ihre Grenze erreicht.	il limite; il grado	La sua pazienza ha già raggiunto il limite.	o limite; grau	A paciência dele já chegou ao limite.	предел; степень	Его терпение уже достигло предела.
5030:现货	现货	现货	mercancía en stock; disponible	Este modelo de teléfono está en stock y puede enviarse hoy.	en stock; disponible	Ce modèle de téléphone est en stock et peut être expédié aujourd'hui.	Lagerware; verfügbar	Dieses Handymodell ist vorrätig und kann heute verschickt werden.	merce disponibile; in stock	Questo modello di telefono è disponibile e può essere spedito oggi.	produto em estoque; disponível	Este modelo de celular está em estoque e pode ser enviado hoje.	товар в наличии	Эта модель телефона есть в наличии и может быть отправлена сегодня.
5033:限于	限于	限于	limitarse a; estar limitado a	La inscripción está limitada a treinta personas.	se limiter à; être limité à	Les inscriptions sont limitées à trente personnes.	beschränkt sein auf; begrenzt sein auf	Die Anmeldung ist auf dreißig Personen begrenzt.	limitarsi a; essere limitato a	L'iscrizione è limitata a trenta persone.	limitar-se a; estar limitado a	A inscrição está limitada a trinta pessoas.	ограничиваться; быть ограниченным	Регистрация ограничена тридцатью участниками.
5036:相传	相传	相传	según la tradición; se dice	Se dice que este puente tiene trescientos años de historia.	dit-on; selon la tradition	On dit que ce pont a trois cents ans d'histoire.	der Überlieferung nach; es heißt	Der Überlieferung nach ist diese Brücke dreihundert Jahre alt.	secondo la tradizione; si dice	Si dice che questo ponte abbia trecento anni di storia.	segundo a tradição; dizem que	Dizem que esta ponte tem trezentos anos de história.	по преданию; говорят, что	По преданию, этому мосту триста лет.
5038:相连	相连	相连	estar conectado; unirse	Las dos ciudades están conectadas por tren de alta velocidad.	être relié; être connecté	Les deux villes sont reliées par le train à grande vitesse.	verbunden sein	Die beiden Städte sind durch eine Hochgeschwindigkeitsbahn verbunden.	essere collegato; essere connesso	Le due città sono collegate dalla ferrovia ad alta velocità.	estar conectado; estar ligado	As duas cidades são ligadas por trem de alta velocidade.	быть соединенным	Два города соединены высокоскоростной железной дорогой.
5039:香水	香水	香水	el perfume	A ella no le gustan los perfumes con un olor demasiado fuerte.	le parfum	Elle n'aime pas les parfums à l'odeur trop forte.	das Parfüm	Sie mag kein Parfüm mit zu starkem Duft.	il profumo	A lei non piacciono i profumi dall'odore troppo intenso.	o perfume	Ela não gosta de perfume com cheiro forte demais.	духи; парфюм	Она не любит духи со слишком сильным запахом.
5052:小偷儿	小偷儿	小偷儿	el ladrón	El ladrón fue atrapado rápidamente por la policía.	le voleur	Le voleur a été rapidement arrêté par la police.	der Dieb	Der Dieb wurde schnell von der Polizei gefasst.	il ladro	Il ladro è stato preso rapidamente dalla polizia.	o ladrão	O ladrão foi rapidamente pego pela polícia.	вор	Вора быстро поймала полиция.
5053:笑容	笑容	笑容	la sonrisa	La sonrisa en su rostro tranquilizó a todos.	le sourire	Le sourire sur son visage a rassuré tout le monde.	das Lächeln	Das Lächeln auf ihrem Gesicht beruhigte alle.	il sorriso	Il sorriso sul suo viso ha rassicurato tutti.	o sorriso	O sorriso no rosto dela tranquilizou todos.	улыбка	Улыбка на ее лице всех успокоила.
5054:效应	效应	效应	el efecto	Todavía hay que observar el efecto de esta política.	l'effet	Il faut encore observer l'effet de cette politique.	die Wirkung; der Effekt	Die Wirkung dieser Politik muss noch beobachtet werden.	l'effetto	Bisogna ancora osservare l'effetto di questa politica.	o efeito	O efeito desta política ainda precisa ser observado.	эффект	Эффект этой политики еще нужно наблюдать.
5060:心爱	心爱	心爱	querido; favorito	Llevó su cámara favorita al viaje.	cher; bien-aimé	Il a emporté son appareil photo préféré en voyage.	geliebt; liebgewonnen	Er nahm seine geliebte Kamera mit auf die Reise.	amato; preferito	Ha portato in viaggio la sua macchina fotografica preferita.	querido; favorito	Ele levou sua câmera favorita para a viagem.	любимый	Он взял в поездку любимую камеру.
5061:心底	心底	心底	el fondo del corazón	Ella agradeció la ayuda del profesor desde el fondo del corazón.	le fond du cœur	Elle a remercié le professeur du fond du cœur pour son aide.	tief im Herzen	Sie dankte dem Lehrer tief im Herzen für seine Hilfe.	il fondo del cuore	Ha ringraziato l'insegnante dal profondo del cuore per l'aiuto.	o fundo do coração	Ela agradeceu a ajuda do professor do fundo do coração.	глубина души	Она от всего сердца поблагодарила учителя за помощь.
5062:新款	新款	新款	el nuevo modelo; nuevo estilo	Esta tienda acaba de poner a la venta un lote de zapatos nuevos.	le nouveau modèle; le nouveau style	Ce magasin vient de mettre en rayon un lot de nouvelles chaussures.	das neue Modell; die neue Ausführung	Dieses Geschäft hat gerade eine Reihe neuer Schuhmodelle ins Sortiment aufgenommen.	il nuovo modello; il nuovo stile	Questo negozio ha appena messo in vendita una serie di scarpe nuove.	o novo modelo; novo estilo	Esta loja acabou de colocar à venda um lote de sapatos novos.	новая модель; новинка	В этом магазине только что выставили партию новой обуви.
5064:新媒体	新媒体	新媒体	los nuevos medios	Los nuevos medios cambiaron la forma en que la gente obtiene información.	les nouveaux médias	Les nouveaux médias ont changé la façon dont les gens obtiennent l'information.	die neuen Medien	Neue Medien haben verändert, wie Menschen Informationen erhalten.	i nuovi media	I nuovi media hanno cambiato il modo in cui le persone ottengono informazioni.	as novas mídias	As novas mídias mudaram a forma como as pessoas obtêm informações.	новые медиа	Новые медиа изменили способ получения информации людьми.
5065:心目	心目	心目	en la mente; a los ojos de alguien	En mi mente, ella es una escritora excelente.	dans l'esprit; aux yeux de quelqu'un	Dans mon esprit, elle est une excellente écrivaine.	in jemandes Augen; in der Vorstellung	In meinen Augen ist sie eine ausgezeichnete Schriftstellerin.	nella mente; agli occhi di qualcuno	Nella mia mente, lei è un'eccellente scrittrice.	na opinião de alguém; na mente	Na minha opinião, ela é uma excelente escritora.	в представлении; в глазах	В моем представлении она отличный писатель.
5066:新能源	新能源	新能源	las nuevas energías; energía renovable	La industria de nuevas energías se está desarrollando rápidamente.	les nouvelles énergies	Le secteur des nouvelles énergies se développe rapidement.	die neuen Energien	Die Branche der neuen Energien entwickelt sich schnell.	le nuove energie	Il settore delle nuove energie si sta sviluppando rapidamente.	as novas energias	O setor de novas energias está se desenvolvendo rapidamente.	новая энергетика; новые источники энергии	Отрасль новой энергетики быстро развивается.
5069:新兴	新兴	新兴	emergente	Las industrias emergentes han atraído a muchos jóvenes.	émergent	Les secteurs émergents attirent beaucoup de jeunes.	aufstrebend; neu entstehend	Aufstrebende Branchen ziehen viele junge Menschen an.	emergente	I settori emergenti attirano molti giovani.	emergente	Setores emergentes atraem muitos jovens.	новый; развивающийся	Новые развивающиеся отрасли привлекают многих молодых людей.
5071:心愿	心愿	心愿	el deseo profundo	Por fin cumplió un deseo que tenía desde hacía muchos años.	le souhait profond	Elle a enfin réalisé un souhait qu'elle portait depuis des années.	der Herzenswunsch	Sie erfüllte endlich einen langjährigen Herzenswunsch.	il desiderio profondo	Ha finalmente realizzato un desiderio coltivato per molti anni.	o desejo profundo	Ela finalmente realizou um desejo de muitos anos.	заветное желание	Она наконец исполнила свое многолетнее желание.
5075:兴起	兴起	兴起	surgir; cobrar auge	El aprendizaje en línea ha surgido en muchas regiones.	émerger; prendre son essor	L'apprentissage en ligne prend son essor dans de nombreuses régions.	aufkommen; entstehen	Online-Lernen ist in vielen Regionen aufgekommen.	sorgere; affermarsi	L'apprendimento online si è affermato in molte regioni.	surgir; ganhar força	O aprendizado online surgiu em muitas regiões.	возникать; набирать силу	Онлайн-обучение стало активно развиваться во многих регионах.
5076:型号	型号	型号	el modelo	Por favor, escribe el modelo de la computadora en el formulario.	le modèle	Veuillez écrire le modèle de l'ordinateur dans le formulaire.	das Modell	Bitte tragen Sie das Computermodell in das Formular ein.	il modello	Per favore, scrivi il modello del computer nel modulo.	o modelo	Por favor, escreva o modelo do computador no formulário.	модель; номер модели	Пожалуйста, впишите модель компьютера в форму.
5078:性价比	性价比	性价比	la relación calidad-precio	Este hotel tiene una muy buena relación calidad-precio.	le rapport qualité-prix	Cet hôtel offre un très bon rapport qualité-prix.	das Preis-Leistungs-Verhältnis	Dieses Hotel hat ein sehr gutes Preis-Leistungs-Verhältnis.	il rapporto qualità-prezzo	Questo hotel ha un ottimo rapporto qualità-prezzo.	o custo-benefício	Este hotel tem um ótimo custo-benefício.	соотношение цены и качества	У этого отеля очень хорошее соотношение цены и качества.
5081:修订	修订	修订	revisar; corregir	El editor está revisando este manual.	réviser; corriger	L'éditeur révise ce manuel.	überarbeiten; revidieren	Der Redakteur überarbeitet dieses Lehrbuch.	revisionare; correggere	L'editor sta revisionando questo manuale.	revisar; corrigir	O editor está revisando este material didático.	пересматривать; редактировать	Редактор сейчас пересматривает этот учебник.
5083:袖子	袖子	袖子	la manga	Las mangas de esta chaqueta son un poco largas.	la manche	Les manches de cette veste sont un peu longues.	der Ärmel	Die Ärmel dieser Jacke sind etwas lang.	la manica	Le maniche di questa giacca sono un po' lunghe.	a manga	As mangas deste casaco são um pouco compridas.	рукав	У этой куртки рукава немного длинные.
5088:选修	选修	选修	cursar como optativa	El próximo semestre quiero cursar psicología como optativa.	suivre comme option	Je veux suivre la psychologie comme option le semestre prochain.	als Wahlfach belegen	Ich möchte nächstes Semester Psychologie als Wahlfach belegen.	scegliere come corso opzionale	Il prossimo semestre voglio scegliere psicologia come corso opzionale.	cursar como eletiva	No próximo semestre quero cursar psicologia como disciplina eletiva.	выбрать факультативно	В следующем семестре я хочу выбрать психологию как факультатив.
5089:学会	学会	学会	la asociación académica	Se unió a la asociación local de lingüística.	la société savante; l'association	Il a rejoint la société locale de linguistique.	die Fachgesellschaft	Er trat der örtlichen sprachwissenschaftlichen Fachgesellschaft bei.	l'associazione scientifica	È entrato nell'associazione locale di linguistica.	a sociedade acadêmica; associação	Ele entrou na associação local de linguística.	научное общество; ассоциация	Он вступил в местное лингвистическое общество.
5092:学员	学员	学员	el alumno; participante	En el curso de formación hay veinte alumnos.	le stagiaire; l'apprenant	Il y a vingt stagiaires dans la formation.	der Kursteilnehmer	In dem Schulungskurs gibt es zwanzig Teilnehmer.	il corsista; partecipante	Nel corso di formazione ci sono venti corsisti.	o aluno; participante	Na turma de treinamento há vinte alunos.	слушатель курса; учащийся	На курсе обучения двадцать слушателей.
5093:血管	血管	血管	el vaso sanguíneo	El médico dijo que este vaso sanguíneo necesita un examen adicional.	le vaisseau sanguin	Le médecin a dit que ce vaisseau sanguin nécessite un examen supplémentaire.	das Blutgefäß	Der Arzt sagte, dieses Blutgefäß müsse weiter untersucht werden.	il vaso sanguigno	Il medico ha detto che questo vaso sanguigno richiede ulteriori controlli.	o vaso sanguíneo	O médico disse que este vaso sanguíneo precisa de mais exames.	кровеносный сосуд	Врач сказал, что этот кровеносный сосуд нужно дополнительно обследовать.
5094:血型	血型	血型	el grupo sanguíneo	Al registrarse, hay que indicar el grupo sanguíneo.	le groupe sanguin	Lors de l'inscription, il faut indiquer son groupe sanguin.	die Blutgruppe	Bei der Anmeldung muss man seine Blutgruppe angeben.	il gruppo sanguigno	Al momento dell'iscrizione bisogna indicare il proprio gruppo sanguigno.	o tipo sanguíneo	Ao se inscrever, é preciso informar o tipo sanguíneo.	группа крови	При регистрации нужно указать свою группу крови.
5096:血液	血液	血液	la sangre	El ejercicio puede favorecer la circulación de la sangre.	le sang	L'exercice peut favoriser la circulation du sang.	das Blut	Bewegung kann die Blutzirkulation fördern.	il sangue	L'esercizio può favorire la circolazione del sangue.	o sangue	O exercício pode melhorar a circulação do sangue.	кровь	Физические упражнения способствуют кровообращению.
5098:寻求	寻求	寻求	buscar; procurar	Están buscando una solución mejor.	chercher; rechercher	Ils cherchent une meilleure solution.	suchen; anstreben	Sie suchen nach einer besseren Lösung.	cercare; ricercare	Stanno cercando una soluzione migliore.	buscar; procurar	Eles estão buscando uma solução melhor.	искать; стремиться найти	Они ищут лучшее решение.
5101:淹	淹	淹	inundar; sumergir	La lluvia intensa inundó la carretera en la zona baja.	inonder; submerger	La forte pluie a inondé la route en contrebas.	überfluten; unter Wasser setzen	Der starke Regen überschwemmte die tiefer gelegene Straße.	allagare; sommergere	La forte pioggia ha allagato la strada più bassa.	inundar; submergir	A chuva forte inundou a estrada na parte baixa.	затопить; залить	Сильный дождь затопил низкий участок дороги.
5103:严	严	严	estricto; severo	La escuela es muy estricta con la disciplina en los exámenes.	strict; sévère	L'école est très stricte sur la discipline pendant les examens.	streng; schwerwiegend	Die Schule ist bei der Prüfungsdisziplin sehr streng.	severo; rigoroso	La scuola è molto rigorosa sulla disciplina degli esami.	rigoroso; severo	A escola é muito rigorosa quanto à disciplina nos exames.	строгий; суровый	В школе очень строго относятся к дисциплине на экзаменах.
5111:研讨	研讨	研讨	debatir; estudiar	Los expertos están debatiendo un nuevo plan de tratamiento.	discuter et étudier	Les experts étudient et discutent un nouveau plan de traitement.	beraten; erörtern	Fachleute beraten über einen neuen Behandlungsplan.	discutere; esaminare	Gli esperti stanno discutendo un nuovo piano di cura.	discutir; estudar	Especialistas estão discutindo um novo plano de tratamento.	обсуждать; прорабатывать	Эксперты обсуждают новый план лечения.
5113:言语	言语	言语	palabras; lenguaje	Sus palabras fueron muy sinceras.	paroles; langage	Ses paroles étaient très sincères.	Worte; Sprache	Seine Worte waren sehr aufrichtig.	parole; linguaggio	Le sue parole erano molto sincere.	palavras; fala	As palavras dele foram muito sinceras.	слова; речь	Его слова были очень искренними.
