hsk_key	source_word	simplified	SI	example_SI	TA	example_TA
5001:物体	物体	物体	වස්තුව; භෞතික දේ	මේ වස්තුව ජලයේ සෙමින් ගිලුණා.	பொருள்; உடல்பொருள்	இந்த பொருள் நீரில் மெதுவாக மூழ்கியது.
5005:喜剧	喜剧	喜剧	හාස්‍ය නාට්‍ය; හාස්‍ය චිත්‍රපටය	මේ හාස්‍ය චිත්‍රපටය බලලා කාමරයේ සියලු දෙනාම හිනා වුණා.	நகைச்சுவை நாடகம்; காமெடி	இந்த நகைச்சுவை படத்தை பார்த்து அறையில் இருந்த எல்லோரும் சிரித்தனர்.
5006:喜事	喜事	喜事	සතුටුදායක සිදුවීම; මංගල කටයුත්ත	මංගල කටයුත්තක් නිසා පවුලේ හැමෝම එක්වුණා.	மகிழ்ச்சியான நிகழ்வு; மங்கள நிகழ்வு	மகிழ்ச்சியான நிகழ்வு இருந்ததால் குடும்பமெல்லாம் கூடியது.
5007:洗漱	洗漱	洗漱	මුහුණ සෝදා දත් මැදීම; පිරිසිදු වීම	සෑම උදෑසනකම ඔහු මුලින්ම මුහුණ සෝදා දත් මදිනවා.	முகம் கழுவி பல் துலக்குதல்	ஒவ்வொரு காலையிலும் அவர் முதலில் முகம் கழுவி பல் துலக்குகிறார்.
5011:戏曲	戏曲	戏曲	සම්ප්‍රදායික චීන ඔපෙරාව; ජන රඟහල	සීයාට සම්ප්‍රදායික චීන ඔපෙරාව අහන්න ඉතා කැමතියි.	பாரம்பரிய சீன ஓபரா; பாரம்பரிய நாடகம்	தாத்தாவுக்கு பாரம்பரிய சீன ஓபராவைக் கேட்க மிகவும் பிடிக்கும்.
5014:下功夫	下功夫	下功夫	මහන්සි දැරීම; උත්සාහය යෙදීම	මේ කුසලතාව ඉගෙනගන්න බොහෝ මහන්සි දැරිය යුතුයි.	முயற்சி செலுத்துதல்; கடினமாக உழைத்தல்	இந்த திறனை கற்க நிறைய முயற்சி செலுத்த வேண்டும்.
5015:下单	下单	下单	ඇණවුම් කිරීම; වෙන්කර ගැනීම	පාරිභෝගිකයා යෙදුම තුළම ඉක්මනින් ඇණවුමක් කළා.	ஆர்டர் செய்தல்; கொள்முதல் பதிவு செய்தல்	வாடிக்கையாளர் செயலியில் உடனே ஆர்டர் செய்தார்.
5017:下线	下线	下线	නොබැඳි වීම; නතර කිරීම	මේ සේවාව මාසය අවසානයේ නතර කරනු ඇත.	ஆஃப்லைனாகுதல்; நிறுத்தப்படுதல்	இந்த சேவை மாத இறுதியில் நிறுத்தப்படும்.
5018:下旬	下旬	下旬	මාසයේ අවසාන දින දහය; මාස අවසානය	සම්මන්ත්‍රණය මේ මාසයේ අවසාන දින දහය තුළ පැවැත්වේ.	மாதத்தின் கடைசி பத்து நாட்கள்	மாநாடு இந்த மாதத்தின் கடைசி பத்து நாட்களுக்குள் நடைபெறும்.
5023:显	显	显	පෙනෙන්නට වීම; පැහැදිලි වීම	මේ වර්ණය කාමරය තවත් විශාල ලෙස පෙන්වයි.	தோன்றுதல்; வெளிப்படுதல்	இந்த நிறம் அறையை இன்னும் பெரியதாகத் தோன்றச் செய்கிறது.
5024:险	险	险	අනතුරුදායක; ටිකෙන් බේරුණු	මේ කඳු මාර්ගය අනතුරුදායක නිසා සෙමින් ධාවනය කරන්න.	ஆபத்தான; நெருக்கடியாக	இந்த மலைச் சாலை ஆபத்தானது, மெதுவாக ஓட்டுங்கள்.
5026:限	限	限	සීමා කිරීම; සීමාවක් තැබීම	මෙම සැලැස්ම සහභාගීවන්නන් පනස් දෙනෙකුට සීමා කරයි.	வரையறுத்தல்; கட்டுப்படுத்தல்	இந்த திட்டம் பங்கேற்பாளர்களின் எண்ணிக்கையை ஐம்பது பேராக வரையறுக்கிறது.
5027:线	线	线	රේඛාව; නූල	සිතියමේ රතු රේඛාව බස් මාර්ගය පෙන්වයි.	கோடு; நூல்	வரைபடத்தில் உள்ள சிவப்பு கோடு பேருந்து வழியை காட்டுகிறது.
5028:现存	现存	现存	දැනට පවතින; ඉතිරිව ඇති	දැනට ඉතිරිව ඇති ඡායාරූප ඉතා අඩුයි.	தற்போதுள்ள; மீதமுள்ள	தற்போது மீதமுள்ள புகைப்படங்கள் மிகவும் குறைவாக உள்ளன.
5029:限度	限度	限度	සීමාව; ප්‍රමාණය	වේගය සඳහා ගුණාත්මකභාවය සීමාවක් නැතිව අඩු කළ නොහැක.	வரம்பு; அளவு	வேகத்திற்காக தரத்தை எல்லையில்லாமல் குறைக்க முடியாது.
5030:现货	现货	现货	ගබඩාවේ ඇති භාණ්ඩ; සූදානම් භාණ්ඩ	මේ මාදිලිය ගබඩාවේ ඇති නිසා අදම යවන්න පුළුවන්.	கையிருப்பு பொருள்; உடனடி பொருள்	இந்த மாடல் கையிருப்பில் உள்ளது, ஆகவே இன்று அனுப்பலாம்.
5033:限于	限于	限于	සීමා වීම; ඇතුළත පමණක් වීම	සාකච්ඡාව අයවැය ගැටලුවලට පමණක් සීමා වුණා.	வரையறுக்கப்படுதல்; மட்டுப்படுத்தப்படுதல்	விவாதம் பட்ஜெட் பிரச்சினைகளுக்கு மட்டும் வரையறுக்கப்பட்டது.
5036:相传	相传	相传	ජනප්‍රවාදයට අනුව; කියැවෙන පරිදි	ජනප්‍රවාදයට අනුව, මේ වැව අසල මකරාක් ජීවත් වී ඇත.	புராணப்படி; சொல்லப்படுவதுபோல்	புராணப்படி, இந்த ஏரிக்கரையில் ஒருகாலத்தில் ஒரு நாகம் வாழ்ந்ததாகச் சொல்லப்படுகிறது.
5038:相连	相连	相连	සම්බන්ධව තිබීම; එක්ව තිබීම	නගර දෙක දුම්රිය මාර්ගයකින් සම්බන්ධ කර ඇත.	இணைந்திருத்தல்; தொடர்புடையது	இரு நகரங்களும் ரயில் பாதையால் இணைக்கப்பட்டுள்ளன.
5039:香水	香水	香水	සුවඳ විලවුන්	ඇය මල් සුවඳ ඇති සුවඳ විලවුන් බෝතලයක් මිලදී ගත්තා.	வாசனைத் திரவியம்	அவள் மலர்மணம் கொண்ட வாசனைத் திரவிய பாட்டிலை வாங்கினாள்.
5052:小偷儿	小偷儿	小偷儿	හොරෙක්; සොරෙක්	පොලිසිය දුම්රිය ස්ථානයේ හොරෙක් අල්ලා ගත්තේය.	திருடன்	போலீசார் நிலையத்தில் ஒரு திருடனை பிடித்தனர்.
5053:笑容	笑容	笑容	සිනහව; සිනාමුසු මුහුණ	ඔහුගේ සිනහව මිනිසුන්ට සන්සුන් හැඟීමක් දෙයි.	புன்னகை	அவரின் புன்னகை மக்களுக்கு அமைதியான உணர்வை தருகிறது.
5054:效应	效应	效应	බලපෑම; ප්‍රතිඵලය	මේ ප්‍රතිපත්තියේ බලපෑම ලබන වසරේ තවත් පැහැදිලි වේ.	விளைவு; தாக்கம்	இந்த கொள்கையின் தாக்கம் அடுத்த ஆண்டு மேலும் தெளிவாகும்.
5060:心爱	心爱	心爱	ආදරණීය; ඉතා ප්‍රියතම	ඔහු තම ආදරණීය ගිටාරය සැමවිටම හොඳින් රැකබලා ගනී.	அன்புக்குரிய; மிகவும் பிடித்த	அவர் தன் அன்புக்குரிய கிதாரை எப்போதும் நன்றாக பராமரிக்கிறார்.
5061:心底	心底	心底	හදවතේ ගැඹුර; සිතේ ඇතුළත	හදවතේ ගැඹුරින් ඔහු මේ මිතුරාට බොහෝ ගරු කරයි.	மனத்தின் ஆழம்; உள்ளம்	மனத்தின் ஆழத்தில் அவர் இந்த நண்பரை மிகவும் மதிக்கிறார்.
5062:新款	新款	新款	නව මාදිලිය; නව විලාසය	මේ නව දුරකථන මාදිලිය හෙට විකිණීම ආරම්භ කරයි.	புதிய மாடல்; புதிய வடிவம்	இந்த புதிய தொலைபேசி மாடல் நாளை விற்பனைக்கு வரும்.
5064:新媒体	新媒体	新媒体	නව මාධ්‍ය; ඩිජිටල් මාධ්‍ය	සමාගම පාරිභෝගිකයන් සමඟ සම්බන්ධ වීමට නව මාධ්‍ය භාවිතා කරයි.	புதிய ஊடகம்; டிஜிட்டல் ஊடகம்	நிறுவனம் வாடிக்கையாளர்களுடன் தொடர்பு கொள்ள புதிய ஊடகத்தைப் பயன்படுத்துகிறது.
5065:心目	心目	心目	සිත තුළ; මතයේ	ප්‍රේක්ෂකයන්ගේ සිත තුළ ඔහු ඉතා විශ්වාසදායක නළුවෙකි.	மனதில்; பார்வையில்	பார்வையாளர்களின் மனதில் அவர் மிகவும் நம்பகமான நடிகர்.
5066:新能源	新能源	新能源	නව බලශක්තිය; පුනර්ජනනීය බලශක්තිය	මේ නගරය නව බලශක්ති කර්මාන්තයට සහය දක්වයි.	புதிய ஆற்றல்; புதுப்பிக்கத்தக்க ஆற்றல்	இந்த நகரம் புதிய ஆற்றல் தொழில்துறைக்கு ஆதரவு தருகிறது.
5069:新兴	新兴	新兴	මතුවෙමින් පවතින; නව	ඒ මතුවෙමින් පවතින වෙළඳපොළ ආයෝජකයන් ආකර්ෂණය කරයි.	உருவெடுத்து வரும்; புதிதாக எழும்	அந்த உருவெடுத்து வரும் சந்தை முதலீட்டாளர்களை ஈர்க்கிறது.
5071:心愿	心愿	心愿	හෘදයාංගම කැමැත්ත; සිතේ පැතුම	ගුරුවරයෙකු වීමට තිබූ ආසාව ඔහුගේ දිගුකාලීන පැතුමයි.	இதய விருப்பம்; மனப்பாங்கு	ஆசிரியராக வேண்டும் என்பதே அவரது நீண்டகால மனவிருப்பம்.
5075:兴起	兴起	兴起	මතුවීම; වර්ධනය වීම	පසුගිය වසර කිහිපයේදී මාර්ගගත අධ්‍යාපනය වේගයෙන් මතුවී ඇත.	எழுச்சி பெறுதல்; உருவாகுதல்	கடந்த சில ஆண்டுகளில் ஆன்லைன் கல்வி வேகமாக எழுச்சி பெற்றுள்ளது.
5076:型号	型号	型号	මාදිලි අංකය; මාදිලිය	කරුණාකර පරිගණකයේ මාදිලි අංකය ලියන්න.	மாடல் எண்; வகை	தயவுசெய்து கணினியின் மாடல் எண்ணை எழுதுங்கள்.
5078:性价比	性价比	性价比	මිලට සාපේක්ෂ වටිනාකම; වටිනාකම් අනුපාතය	මේ කැමරාවේ මිලට සාපේක්ෂ වටිනාකම ඉතා හොඳයි.	விலை-திறன் விகிதம்; பணத்திற்கு மதிப்பு	இந்த கேமரா பணத்திற்கு மிக நல்ல மதிப்பைக் கொடுக்கிறது.
5081:修订	修订	修订	සංශෝධනය කිරීම; නැවත සකස් කිරීම	ලේඛකයා අවසාන පරිච්ඡේදය සංශෝධනය කරමින් සිටී.	திருத்துதல்; மறுபரிசீலனை செய்தல்	எழுத்தாளர் கடைசி அத்தியாயத்தை திருத்திக் கொண்டிருக்கிறார்.
5083:袖子	袖子	袖子	අත් කොටස; ඇඳුමේ අත	මේ කමිසයේ අත් කොටස ටිකක් දිගයි.	சட்டையின் கைப்பகுதி; ஆஸ்தினம்	இந்த சட்டையின் கைப்பகுதி கொஞ்சம் நீளமாக உள்ளது.
5088:选修	选修	选修	තෝරාගත් පාඨමාලාවක් ලෙස ගැනීම; විකල්ප පාඨමාලාව	මෙම වසරේ ඔහු සංගීතය විකල්ප පාඨමාලාවක් ලෙස ගෙන ඇත.	விருப்பப் பாடமாக எடுத்தல்	இந்த ஆண்டு அவர் இசையை விருப்பப் பாடமாக எடுத்துள்ளார்.
5089:学会	学会	学会	සංගමය; විද්වත් සංගමය	මේ විද්වත් සංගමය සෑම වසරකම සම්මන්ත්‍රණයක් පවත්වයි.	சங்கம்; அறிவியல் கழகம்	இந்த அறிவியல் சங்கம் ஒவ்வொரு ஆண்டும் மாநாடு நடத்துகிறது.
5092:学员	学员	学员	පුහුණුව ලබන්නා; ශිෂ්‍යයා	පුහුණුව ලබන්නන් ප්‍රායෝගික අභ්‍යාසය සම්පූර්ණ කළ යුතුයි.	பயிற்சி மாணவர்; கற்றவர்	பயிற்சி மாணவர்கள் நடைமுறைப் பயிற்சியை முடிக்க வேண்டும்.
5093:血管	血管	血管	රුධිර නාලය	වෛද්‍යවරයා රෝගියාගේ රුධිර නාල තත්ත්වය පරීක්ෂා කළේය.	இரத்த நாளம்	மருத்துவர் நோயாளியின் இரத்த நாள நிலையைச் சோதித்தார்.
5094:血型	血型	血型	රුධිර කාණ්ඩය	ලියාපදිංචි වීමේදී තම රුධිර කාණ්ඩය සඳහන් කළ යුතුය.	இரத்த வகை	பதிவு செய்யும்போது உங்கள் இரத்த வகையை நிரப்ப வேண்டும்.
5096:血液	血液	血液	රුධිරය	ව්‍යායාම කිරීම රුධිර සංසරණය වැඩි දියුණු කරයි.	இரத்தம்	உடற்பயிற்சி இரத்த ஓட்டத்தை மேம்படுத்துகிறது.
5098:寻求	寻求	寻求	සෙවීම; ඉල්ලා සොයා බැලීම	ඔවුන් වඩා හොඳ විසඳුමක් සොයමින් සිටිති.	தேடுதல்; நாடுதல்	அவர்கள் சிறந்த தீர்வைத் தேடுகிறார்கள்.
5101:淹	淹	淹	ජලයෙන් යට කිරීම; ගිල්වීම	අධික වැස්ස පහත් මාර්ගය ජලයෙන් යට කළේය.	மூழ்கடித்தல்; வெள்ளத்தில் ஆழ்த்துதல்	கனமழை தாழ்வான சாலையை வெள்ளத்தில் ஆழ்த்தியது.
5103:严	严	严	දැඩි; බරපතළ	පාසල විභාග විනය පිළිබඳ ඉතා දැඩිය.	கடுமையான; தீவிரமான	பள்ளி தேர்வு ஒழுக்கம் குறித்து மிகவும் கடுமையாக உள்ளது.
5111:研讨	研讨	研讨	සාකච්ඡා කර අධ්‍යයනය කිරීම	විශේෂඥයෝ නව ප්‍රතිකාර සැලැස්මක් සාකච්ඡා කරමින් අධ්‍යයනය කරමින් සිටිති.	விவாதித்து ஆய்வு செய்தல்	நிபுணர்கள் புதிய சிகிச்சைத் திட்டத்தை விவாதித்து ஆய்வு செய்கிறார்கள்.
5113:言语	言语	言语	වචන; කථනය	ඔහුගේ වචන ඉතා අවංක විය.	சொற்கள்; பேச்சு	அவரது சொற்கள் மிகவும் உண்மையானவை.
5114:炎症	炎症	炎症	ප්‍රදාහය	මේ ඖෂධය ප්‍රදාහය අඩු කළ හැක.	அழற்சி	இந்த மருந்து அழற்சியை குறைக்கலாம்.
5116:眼看	眼看	眼看	ඇස් ඉදිරිපිට; ඉක්මනින්	දැන් අඳුරු වීමට ආසන්න නිසා අපි ආපසු යා යුතුයි.	கண்ணுக்கு முன்னால்; விரைவில்	இருள் ஆகப் போகிறது, நாம் திரும்பிச் செல்ல வேண்டும்.
5120:仰	仰	仰	උඩ බලීම; මුහුණ ඉහළට හැරවීම	දරුවා හිස උඩට හරවා තාරකා බැලුවේය.	மேலே நோக்குதல்; தலைநீட்டி பார்க்குதல்	குழந்தை தலையை உயர்த்தி நட்சத்திரங்களை பார்த்தது.
5122:养老	养老	养老	මහලු වියේ රැකවරණය; විශ්‍රාම ජීවිතය	ඔවුහු විශ්‍රාමයෙන් පසු මහලු වියේ ජීවිතය සැලසුම් කරමින් සිටිති.	முதியோர் பராமரிப்பு; ஓய்வுக்கால வாழ்க்கை	அவர்கள் ஓய்வுக்குப் பிறகான முதியோர் வாழ்க்கையைத் திட்டமிடுகின்றனர்.
5123:养老院	养老院	养老院	වැඩිහිටි නිවාසය	මේ වැඩිහිටි නිවාසය රෝහලට ඉතා ආසන්නයි.	முதியோர் இல்லம்	இந்த முதியோர் இல்லம் மருத்துவமனைக்கு மிகவும் அருகில் உள்ளது.
5125:样	样	样	වර්ගය; අයිතමය	ඔහු කෙටි කෑම වර්ග තුනක් මිලදී ගත්තේය.	வகை; பொருள்	அவர் மூன்று வகை சிற்றுண்டிகள் வாங்கினார்.
5128:要么	要么	要么	නැත්නම්; හෝ	ඔබට දැන් යාමට හෝ හෙට දක්වා බලා සිටීමට හැක.	இல்லை என்றால்; அல்லது	நீ இப்போது போகலாம், இல்லையெனில் நாளை வரை காத்திருக்கலாம்.
5130:野	野	野	වල්; අස්වද්දා නැති	මේ කඳුකර ප්‍රදේශයේ වල් මල් බොහෝ ඇත.	காட்டுச்; பயிரிடப்படாத	இந்த மலைப்பகுதியில் பல காட்டுப் பூக்கள் உள்ளன.
5131:也好	也好	也好	ගියත් නොගියත්; එසේ වුවත්	ඔබ ගියත් නොගියත්, මට කියන්න.	சென்றாலும் சரி, செல்லாவிட்டாலும் சரி	நீ சென்றாலும் சரி, செல்லாவிட்டாலும் சரி, எனக்கு சொல்ல வேண்டும்.
5132:野生	野生	野生	වල්; ස්වභාවිකව වැවෙන	මෙහි වල් සතුන් අල්ලා ගැනීම තහනම්ය.	காட்டு; இயற்கையாக வளரும்	இங்கு காட்டு விலங்குகளைப் பிடிப்பது தடைசெய்யப்பட்டுள்ளது.
5133:野外	野外	野外	එළිමහන; ක්ෂේත්‍රය	සිසුන් එළිමහනේ ශාක නිරීක්ෂණය කළහ.	வெளி நிலம்; வெளிப்புறம்	மாணவர்கள் வெளியில் தாவரங்களை கவனித்தனர்.
5134:业	业	业	කර්මාන්තය; වෘත්තිය	සේවා කර්මාන්තයට තවත් වෘත්තීය නිපුණයන් අවශ්‍ය වේ.	தொழில்; துறை	சேவைத் துறைக்கு மேலும் தொழில்முறை நிபுணர்கள் தேவை.
5139:衣食住行	衣食住行	衣食住行	ජීවිතයේ මූලික අවශ්‍යතා	මෙම වාර්තාව නගර වාසීන්ගේ මූලික ජීවන අවශ්‍යතා විශ්ලේෂණය කරයි.	அடிப்படை வாழ்க்கைத் தேவைகள்	இந்த அறிக்கை நகர வாசிகளின் அடிப்படை வாழ்க்கைத் தேவைகளை பகுப்பாய்வு செய்கிறது.
5140:医药	医药	医药	වෛද්‍ය ඖෂධ; ඖෂධ ක්ෂේත්‍රය	පසුගිය වසර කිහිපයේදී වෛද්‍ය හා ඖෂධ වියදම් යම් තරමකට ඉහළ ගොස් ඇත.	மருத்துவம் மற்றும் மருந்து; மருந்துத் துறை	சமீப ஆண்டுகளில் மருத்துவ மற்றும் மருந்துச் செலவுகள் ஓரளவு உயர்ந்துள்ளன.
