hsk_key	source_word	simplified	SI	example_SI	TA	example_TA
5141:一一	一一	一一	එකින් එක	ගුරුවරයා ප්‍රශ්න එකින් එක පැහැදිලි කළේය.	ஒன்றன் பின் ஒன்றாக	ஆசிரியர் கேள்விகளை ஒன்றன் பின் ஒன்றாக தெளிவாக விளக்கினார்.
5142:姨	姨	姨	අම්මාගේ සහෝදරිය; පුංචි අම්මා	මගේ පුංචි අම්මා අද ගෙදරට කෑමට එයි.	சித்தி; தாயின் சகோதரி	என் சித்தி இன்று வீட்டிற்கு உணவுக்கு வருகிறார்.
5146:一带	一带	一带	ප්‍රදේශය; අවට පළාත	පාසල අවට ප්‍රදේශයේ පොත් සාප්පු බොහොමයක් ඇත.	பகுதி; சுற்றுவட்டாரம்	பள்ளி சுற்றுவட்டாரத்தில் பல புத்தகக் கடைகள் உள்ளன.
5147:一道	一道	一道	එක්ව; එකට	අපි එක්ව ප්‍රදර්ශනය බලන්න යමු.	சேர்ந்து; ஒன்றாக	நாம் சேர்ந்து கண்காட்சியைப் பார்க்கலாம்.
5155:一系列	一系列	一系列	මාලාවක්; අනුපිළිවෙළක්	සමාගම නව නිෂ්පාදන මාලාවක් හඳුන්වා දුන්නේය.	தொடர்ச்சி; வரிசை	நிறுவனம் புதிய தயாரிப்புகளின் ஒரு தொடரை வெளியிட்டது.
5157:一阵	一阵	一阵	හදිසි රැල්ලක්; කෙටි කාලයක්	ජනේලයෙන් සිසිල් සුළං රැල්ලක් ඇතුළු විය.	ஒரு வீச்சு; குறுகிய நேரம்	ஜன்னலுக்கு வெளியே இருந்து ஒரு குளிர் காற்று வீசியது.
5158:遗址	遗址	遗址	පුරාවිද්‍යා ස්ථානය; නටබුන්	මේ පුරාණ නගර නටබුන් ස්ථානය බොහෝ සංචාරකයන් ආකර්ෂණය කරයි.	இடிபாடுகள்; வரலாற்று தளம்	இந்தப் பண்டைய நகரத் தளம் பல சுற்றுலாப் பயணிகளை ஈர்க்கிறது.
5163:益处	益处	益处	ප්‍රතිලාභය; වාසිය	දිනපතා ව්‍යායාම කිරීම සෞඛ්‍යයට බොහෝ ප්‍රතිලාභ ගෙන දෙයි.	நன்மை; பலன்	தினமும் உடற்பயிற்சி செய்வது ஆரோக்கியத்திற்கு பல நன்மைகள் தருகிறது.
5164:一帆风顺	一帆风顺	一帆风顺	සියල්ල සාර්ථකව සිදුවීම; බාධාවකින් තොරව යාම	ඔබේ නව රැකියාව බාධාවකින් තොරව සාර්ථක වේවා.	எல்லாம் சீராக நடப்பது; தடையின்றி வெற்றி பெறுதல்	உங்கள் புதிய வேலை தடையின்றி வெற்றியடைய வாழ்த்துகிறேன்.
5165:一口气	一口气	一口气	එක හුස්මට; නොනවත්වා	ඔහු එක හුස්මට කඳු මුදුනට දිව ගියේය.	ஒரே மூச்சில்; நிறுத்தாமல்	அவன் ஒரே மூச்சில் மலை உச்சிக்கு ஓடினான்.
5167:一模一样	一模一样	一模一样	හරියටම එකම; සම්පූර්ණයෙන් සමාන	මේ ඡායාරූප දෙක හරියටම එකම ලෙස පෙනේ.	அப்படியே ஒரே மாதிரி; முற்றிலும் ஒன்று போல	இந்த இரண்டு புகைப்படங்களும் அப்படியே ஒரே மாதிரி தெரிகின்றன.
5168:艺人	艺人	艺人	කලාකරුවා; රංගන ශිල්පියා	මේ කලාකරුවා වේදිකාවේ ඉතා විශ්වාසයෙන් සිටී.	கலைஞர்; நிகழ்த்துபவர்	இந்தக் கலைஞர் மேடையில் மிகவும் தன்னம்பிக்கையுடன் இருக்கிறார்.
5169:一身	一身	一身	මුළු ශරීරය; සම්පූර්ණ ඇඳුමක්	ඔහු සම්පූර්ණ කළු ඇඳුමක් ඇඳ සිටියේය.	முழு உடல்; முழு உடை	அவர் முழுக்க கருப்பு நிற உடை அணிந்திருந்தார்.
5170:一时	一时	一时	මොහොතකට; ඒ මොහොතේ	මට ඒ මොහොතේ ඔහුගේ නම මතක් වුණේ නැත.	சிறிது நேரம்; அந்த நேரத்தில்	அந்த நேரத்தில் அவரது பெயர் எனக்கு நினைவுக்கு வரவில்லை.
5171:一同	一同	一同	එක්ව; එකට	අපි මෙම ව්‍යාපෘතිය එකට සම්පූර්ණ කළෙමු.	ஒன்றாக; சேர்ந்து	நாங்கள் இந்தத் திட்டத்தை ஒன்றாக முடித்தோம்.
5172:易于	易于	易于	පහසුවෙන් කළ හැකි; හට ගැනීමට ඉඩ ඇති	මේ මෘදුකාංගය භාවිත කිරීමට පහසුය.	எளிதாக; செய்ய எளிதான	இந்த மென்பொருள் பயன்படுத்த எளிதானது.
5173:抑制	抑制	抑制	පාලනය කිරීම; මැඩපැවැත්වීම	මෙම ඖෂධය වේදනාව මැඩපැවැත්විය හැක.	அடக்குதல்; தடுக்குதல்	இந்த மருந்து வலியை அடக்க முடியும்.
5174:因	因	因	නිසා; හේතුවෙන්	අධික වැසි නිසා රැස්වීම කල් දැමුණි.	காரணமாக; ஏனெனில்	கனமழை காரணமாக கூட்டம் ஒத்திவைக்கப்பட்டது.
5175:音节	音节	音节	ශබ්ද ඛණ්ඩය; අක්ෂර මාත්‍රාව	මෙම වචනයට ශබ්ද ඛණ්ඩ තුනක් ඇත.	அசை; ஒலிக்கூறு	இந்தச் சொல்லில் மூன்று அசைகள் உள்ளன.
5177:银牌	银牌	银牌	රිදී පදක්කම	ඇය තරගයේදී රිදී පදක්කමක් දිනා ගත්තාය.	வெள்ளிப் பதக்கம்	அவள் போட்டியில் வெள்ளிப் பதக்கம் வென்றாள்.
5178:引	引	引	උපුටා දැක්වීම; මඟ පෙන්වීම	ගුරුවරයා අදහස පැහැදිලි කිරීමට පැරණි කවියක පදයක් උපුටා දැක්වීය.	மேற்கோள் காட்டுதல்; வழிநடத்துதல்	ஆசிரியர் கருத்தை விளக்க பழைய கவிதை வரியை மேற்கோள் காட்டினார்.
5179:隐藏	隐藏	隐藏	සැඟවීම; සඟවා තැබීම	ගොනුව පද්ධති ෆෝල්ඩරයේ සැඟවී තිබුණි.	மறைத்தல்; ஒளித்துவைத்தல்	கோப்பு கணினி கோப்புறையில் மறைக்கப்பட்டிருந்தது.
5181:引发	引发	引发	ඇති කිරීම; හේතු වීම	මෙම පුවත උණුසුම් සාකච්ඡාවක් ඇති කළේය.	தூண்டுதல்; ஏற்படுத்துதல்	இந்த செய்தி சூடான விவாதத்தை ஏற்படுத்தியது.
5182:引入	引入	引入	හඳුන්වා දීම; ගෙන ඒම	පාසල නව ඉගැන්වීම් ක්‍රමයක් හඳුන්වා දීමට සැලසුම් කරයි.	அறிமுகப்படுத்துதல்; கொண்டு வருதல்	பள்ளி புதிய கற்பித்தல் முறையை அறிமுகப்படுத்த திட்டமிடுகிறது.
5184:饮用水	饮用水	饮用水	පානය කළ හැකි ජලය	මෙහි පානය කළ හැකි ජලය දැඩි පරීක්ෂණයකින් සමත් වී ඇත.	குடிநீர்	இங்குள்ள குடிநீர் கடுமையான பரிசோதனையை கடந்துள்ளது.
5185:印	印	印	මුද්‍රණය කිරීම; මුද්‍රාව තැබීම	කරුණාකර මෙහි සමාගමේ ලාංඡනය මුද්‍රණය කරන්න.	அச்சிடுதல்; முத்திரை பதித்தல்	தயவுசெய்து இங்கே நிறுவனத்தின் சின்னத்தை அச்சிடுங்கள்.
5192:用餐	用餐	用餐	ආහාර ගැනීම	අමුත්තෝ අවන්හලේ ආහාර ගනිමින් සිටිති.	உணவருந்துதல்	விருந்தினர்கள் உணவகத்தில் உணவருந்துகின்றனர்.
5193:用处	用处	用处	ප්‍රයෝජනය; භාවිතය	මෙම කුඩා පිහියට බොහෝ ප්‍රයෝජන ඇත.	பயன்பாடு; பயன்	இந்தச் சிறிய கத்திக்கு பல பயன்பாடுகள் உள்ளன.
5195:用人	用人	用人	සේවකයන් බඳවා ගැනීම	මෙම සමාගම සේවකයන් බඳවා ගැනීමේදී ඉතා සැලකිලිමත්ය.	ஆட்களை வேலைக்கு எடுப்பது	இந்த நிறுவனம் ஆட்களை வேலைக்கு எடுப்பதில் மிகவும் கவனமாக உள்ளது.
5196:用心	用心	用心	සැලකිල්ලෙන්; හිත යොමු කර	මෙම තෑග්ග සඳහා බොහෝ සැලකිල්ලක් දැක්වූ බව පෙනේ.	அக்கறையுடன்; கவனமாக	இந்தப் பரிசில் அதிக அக்கறை செலுத்தப்பட்டதை காணலாம்.
5197:优化	优化	优化	ප්‍රශස්තිකරණය කිරීම; වැඩි දියුණු කිරීම	ඉංජිනේරුවා පද්ධතියේ වේගය ප්‍රශස්තිකරණය කරමින් සිටී.	மேம்படுத்துதல்; சீராக்குதல்	பொறியாளர் அமைப்பின் வேகத்தை மேம்படுத்துகிறார்.
5200:由来	由来	由来	ආරම්භය; හේතුව	මෙම සිරිතේ ආරම්භය ඉතා රසවත්ය.	தோற்றம்; காரணம்	இந்த வழக்கத்தின் தோற்றம் மிகவும் சுவாரஸ்யமானது.
5201:游人	游人	游人	සංචාරකයා; අමුත්තා	වසන්තයේදී උද්‍යානයේ සංචාරකයන් විශේෂයෙන් බොහෝය.	சுற்றுலாப் பயணி; வருகையாளர்	வசந்த காலத்தில் பூங்காவில் வருகையாளர்கள் மிகவும் அதிகமாக இருப்பார்கள்.
5203:有机	有机	有机	කාබනික; ස්වභාවික ක්‍රමයෙන් වගා කළ	මෙම ගොවිපළ කාබනික එළවළු පමණක් විකුණයි.	கரிம; இயற்கை முறையில் விளைந்த	இந்தப் பண்ணை கரிம காய்கறிகள் மட்டுமே விற்கிறது.
5204:有劲	有劲	有劲	උද්යෝගිමත්; රසවත්	මෙම චිත්‍රපටය බලන තරමට තවත් රසවත් වේ.	சுவாரஸ்யமான; உற்சாகமுள்ள	இந்தப் படம் பார்க்கப் பார்க்க இன்னும் சுவாரஸ்யமாகிறது.
5205:有序	有序	有序	ක්‍රමවත්; පිළිවෙළට	ප්‍රේක්ෂකයෝ ක්‍රමවත් ලෙස රැස්වීම් ශාලාවට ඇතුළු වූහ.	ஒழுங்கான; ஒழுங்காக	பார்வையாளர்கள் ஒழுங்காக கூட்ட அரங்கிற்குள் சென்றனர்.
5206:于	于	于	හි; දී; වෙත	රැස්වීම උදෑසන නවයට ආරම්භ වේ.	இல்; அன்று; நோக்கி	கூட்டம் காலை ஒன்பது மணிக்கு தொடங்குகிறது.
5207:余额	余额	余额	ශේෂය; ඉතිරි මුදල	කරුණාකර පළමුව බැංකු කාඩ්පතේ ශේෂය පරීක්ෂා කරන්න.	இருப்பு; மீதித் தொகை	தயவுசெய்து முதலில் வங்கி அட்டையின் இருப்பைச் சரிபாருங்கள்.
5210:预定	预定	预定	වෙන්කරවා ගැනීම; පෙර සැලසුම් කිරීම	මම හෙට රාත්‍රියේ ආසන දැනටමත් වෙන්කරවා ගෙන ඇත.	முன்பதிவு செய்தல்; முன்கூட்டியே ஏற்பாடு செய்தல்	நான் நாளை இரவுக்கான இருக்கைகளை ஏற்கனவே முன்பதிவு செய்துள்ளேன்.
5213:浴室	浴室	浴室	නාන කාමරය	නාන කාමරයේ බිම ටිකක් ලිස්සන සුළුය.	குளியலறை	குளியலறையின் தரை கொஞ்சம் வழுக்கலாக உள்ளது.
5215:原本	原本	原本	මුලින්; ආරම්භයේදී	මම මුලින් සති අන්තයේ බෙයිජිං යාමට සැලසුම් කර තිබුණි.	முதலில்; ஆரம்பத்தில்	நான் முதலில் வார இறுதியில் பெய்ஜிங்கிற்கு செல்ல திட்டமிட்டிருந்தேன்.
5216:原材料	原材料	原材料	අමු ද්‍රව්‍ය	කර්මාන්තශාලාවට ස්ථාවර අමු ද්‍රව්‍ය සැපයුමක් අවශ්‍ය වේ.	மூலப்பொருள்	தொழிற்சாலைக்கு நிலையான மூலப்பொருள் விநியோகம் தேவை.
5224:元宵	元宵	元宵	යුවාන්ෂියාඕ; පහන් උත්සවයේ පැණි සහල් බෝලය	පහන් උත්සව දිනයේ අපි යුවාන්ෂියාඕ කෑවෙමු.	யுவான்ஷியாவ்; விளக்கு விழா இனிப்பு அரிசி உருண்டை	விளக்கு விழா நாளில் நாங்கள் யுவான்ஷியாவ் சாப்பிட்டோம்.
5225:源于	源于	源于	ආරම්භ වීම; මූලය වීම	මෙම සම්ප්‍රදාය පුරාණ උත්සවයකින් ආරම්භ වී ඇත.	தோன்றுதல்; மூலமாக இருத்தல்	இந்த மரபு ஒரு பண்டைய திருவிழாவிலிருந்து தோன்றியது.
5226:远程	远程	远程	දුරස්ථ; දුරකින් සිදු වන	සමාගම දුරස්ථ සම්මුඛ පරීක්ෂණයක් සැලසුම් කළේය.	தொலைநிலை; தூர	நிறுவனம் தொலைநிலை நேர்முகத் தேர்வை ஏற்பாடு செய்தது.
5227:远方	远方	远方	දුර ප්‍රදේශය; ඈත තැන	ඔහු නිතරම ඈත සිටින තම පවුලේ අය සිහි කරයි.	தூர இடம்; தொலைதூரம்	அவர் தொலைதூரத்தில் உள்ள குடும்பத்தினரை அடிக்கடி நினைக்கிறார்.
5229:月光	月光	月光	සඳ එළිය	සඳ එළිය නිහඬ වැව මත වැටුණි.	நிலவொளி	நிலவொளி அமைதியான ஏரியின் மேல் விழுந்தது.
5231:月球	月球	月球	සඳ; චන්ද්‍රයා	විද්‍යාඥයෝ සඳ මතුපිට අධ්‍යයනය කරමින් සිටිති.	நிலா; சந்திரன்	விஞ்ஞானிகள் நிலாவின் மேற்பரப்பை ஆய்வு செய்கிறார்கள்.
5232:乐曲	乐曲	乐曲	සංගීත කෘතිය; සංගීත ඛණ්ඩය	මෙම සංගීත කෘතිය ඉතා සුන්දර ලෙස ඇසේ.	இசை அமைப்பு; இசைப் பகுதி	இந்த இசைப் பகுதி மிகவும் அழகாக ஒலிக்கிறது.
5234:晕车	晕车	晕车	වාහනයේ යන විට අසනීප වීම	ඇයට දිගු බස් ගමන්වලදී පහසුවෙන් වාහන අසනීපය ඇති වේ.	வாகனத்தில் மயக்கம் வருதல்	அவளுக்கு நீண்ட பேருந்து பயணங்களில் எளிதாக வாகன மயக்கம் வரும்.
5235:运送	运送	运送	ප්‍රවාහනය කිරීම; යැවීම	මෙම සැපයුම් ආපදා ප්‍රදේශයට ප්‍රවාහනය කරනු ඇත.	கொண்டு செல்லுதல்; அனுப்புதல்	இந்தப் பொருட்கள் பேரழிவு பகுதிக்கு கொண்டு செல்லப்படும்.
5237:运营	运营	运营	මෙහෙයවීම; ක්‍රියාත්මක කිරීම	මෙම වේදිකාව වෘත්තීය කණ්ඩායමක් විසින් මෙහෙයවනු ලැබේ.	இயக்குதல்; செயல்படுத்துதல்	இந்த தளம் தொழில்முறை குழுவால் இயக்கப்படுகிறது.
5238:杂	杂	杂	මිශ්‍ර; විවිධ	මෙම ලාච්චුවේ විවිධ දේවල් බොහෝ ඇත.	கலந்த; பலவகை	இந்த டிராயரில் பலவகை பொருட்கள் உள்ளன.
5239:灾	灾	灾	විපත; ආපදාව	මෙම විපත ගමට විශාල හානියක් කළේය.	பேரழிவு; அனர்த்தம்	இந்த பேரழிவு கிராமத்திற்கு பெரிய இழப்பை ஏற்படுத்தியது.
5242:灾区	灾区	灾区	ආපදා ප්‍රදේශය	ස්වේච්ඡා සේවකයෝ ආහාර ආපදා ප්‍රදේශයට ගෙන ගියහ.	பேரழிவு பகுதி; அனர்த்தப் பகுதி	தன்னார்வலர்கள் உணவை பேரழிவு பகுதிக்கு கொண்டு சென்றனர்.
5244:再生	再生	再生	නැවත භාවිතයට සැකසීම; පුනර්ජනනය	මෙම ද්‍රව්‍ය නැවත භාවිතයට සකසා භාවිත කළ හැක.	மறுசுழற்சி செய்தல்; மீளுருவாக்கம்	இந்தப் பொருட்களை மறுசுழற்சி செய்து மீண்டும் பயன்படுத்தலாம்.
5246:赞赏	赞赏	赞赏	අගය කිරීම; ප්‍රශංසා කිරීම	ගුරුවරයා ඔහුගේ බැරෑරුම් ආකල්පය අගය කළේය.	பாராட்டுதல்; மதித்தல்	ஆசிரியர் அவரது தீவிரமான அணுகுமுறையைப் பாராட்டினார்.
5247:赞同	赞同	赞同	එකඟ වීම; අනුමත කිරීම	බහුතර සාමාජිකයෝ මෙම තීරණයට එකඟ වෙති.	ஒப்புக்கொள்வது; சம்மதித்தல்	பெரும்பாலான உறுப்பினர்கள் இந்த முடிவை ஒப்புக்கொள்கிறார்கள்.
5248:遭到	遭到	遭到	මුහුණ දීම; ලක් වීම	මෙම සැලැස්මට යම් විරෝධයක් එල්ල විය.	எதிர்கொள்ளுதல்; ஆளாகுதல்	இந்தத் திட்டம் சில எதிர்ப்பை எதிர்கொண்டது.
5251:噪声	噪声	噪声	ඝෝෂාව; කරදරකාරී ශබ්දය	ඉදිකිරීම් ඝෝෂාව අසල්වැසි පදිංචිකරුවන්ට බලපෑවේය.	சத்தம்; இரைச்சல்	கட்டுமான இரைச்சல் அருகிலுள்ள குடியிருப்பாளர்களை பாதித்தது.
5255:炸	炸	炸	පුපුරා යාම	රතිඤ්ඤාව හදිසියේ පුපුරා ගිය අතර සියලු දෙනාම බිය වූහ.	வெடித்தல்	பட்டாசு திடீரென வெடித்ததால் அனைவரும் திடுக்கிட்டனர்.
5256:粘	粘	粘	ඇලවීම; අලවා තැබීම	මැලියම් කඩදාසි එකට ඇලවීය.	ஒட்டுதல்; ஒட்டவைத்தல்	பசை காகிதங்களை ஒன்றாக ஒட்டியது.
5259:占比	占比	占比	අනුපාතය; කොටස	මාර්ගගත විකුණුම් අනුපාතය දැනටමත් අඩකට වඩා ඉක්මවා ඇත.	விகிதம்; பங்கு	ஆன்லைன் விற்பனையின் பங்கு ஏற்கனவே பாதியை கடந்துவிட்டது.
5262:战胜	战胜	战胜	ජය ගැනීම; පරාජය කිරීම	ඔවුහු අවසානයේ සියලු දුෂ්කරතා ජය ගත්හ.	வெல்லுதல்; கடந்து செல்வது	அவர்கள் இறுதியில் அனைத்து சிரமங்களையும் வென்றனர்.
5263:占有	占有	占有	හිමි කර ගැනීම; අත්පත් කර ගැනීම	මෙම සමාගම විශාල වෙළඳපොළ කොටසක් හිමි කරගෙන ඇත.	கைப்பற்றுதல்; உடையிருத்தல்	இந்த நிறுவனம் பெரிய சந்தைப் பங்கைக் கொண்டுள்ளது.
