hsk_key	source_word	simplified	JA	example_JA	KO	example_KO	VI	example_VI	TH	example_TH	MS	example_MS	ID	example_ID
2358:丰富多彩	丰富多彩	丰富多彩	豊かで多彩な	大学生活は豊かで多彩です。	풍부하고 다채롭다	대학 생활은 풍부하고 다채롭습니다.	phong phú đa dạng	Cuộc sống đại học rất phong phú đa dạng.	หลากหลายและมีสีสัน	ชีวิตมหาวิทยาลัยหลากหลายและมีสีสัน.	kaya dan berwarna-warni	Kehidupan universiti kaya dan berwarna-warni.	kaya dan berwarna-warni	Kehidupan universitas kaya dan berwarna-warni.
2367:福	福	福	福; 幸運	春節には、人々は福の字を貼るのが好きです。	복; 행운	설날에는 사람들이 복을 뜻하는 글자를 붙이기 좋아합니다.	phúc; may mắn	Dịp Tết, mọi người thích dán chữ biểu thị phúc lành.	โชคดี; ความสุข	ช่วงตรุษจีน ผู้คนชอบติดตัวอักษรที่หมายถึงโชคดี.	tuah; keberkatan	Semasa Tahun Baharu Cina, orang suka menampal aksara yang melambangkan tuah.	keberuntungan; berkah	Saat Tahun Baru Imlek, orang suka menempel tulisan yang melambangkan keberuntungan.
2371:付出	付出	付出	払う; 注ぐ	成功には長期的な努力を払う必要があります。	바치다; 들이다	성공하려면 오랫동안 노력을 들여야 합니다.	bỏ ra; cống hiến	Thành công cần bỏ ra nỗ lực lâu dài.	ทุ่มเท; จ่ายออก	ความสำเร็จต้องอาศัยการทุ่มเทความพยายามระยะยาว.	mencurahkan; membayar	Kejayaan memerlukan usaha yang dicurahkan dalam jangka panjang.	mencurahkan; mengorbankan	Keberhasilan membutuhkan usaha jangka panjang.
2374:富有	富有	富有	豊かな; 富んだ	この文章は感情に富んでいます。	풍부하다; 부유하다	이 글은 감정이 풍부합니다.	giàu; đầy	Bài viết này giàu cảm xúc.	เต็มไปด้วย; ร่ำรวย	บทความนี้เต็มไปด้วยอารมณ์ความรู้สึก.	kaya dengan; kaya	Artikel ini kaya dengan perasaan.	kaya; penuh	Artikel ini penuh dengan perasaan.
2379:改天	改天	改天	別の日に	今日は忙しすぎるので、別の日にまた会いましょう。	다른 날; 나중에	오늘은 너무 바쁘니 우리 다른 날에 다시 만납시다.	hôm khác; ngày khác	Hôm nay bận quá, chúng ta gặp nhau hôm khác nhé.	วันอื่น; คราวหน้า	วันนี้ยุ่งมาก ไว้เราเจอกันวันอื่นเถอะ.	hari lain; lain kali	Hari ini terlalu sibuk; kita jumpa hari lain.	lain hari; kapan-kapan	Hari ini terlalu sibuk; mari bertemu lain hari.
2384:敢于	敢于	敢于	あえてする; 勇気を持つ	彼は自分の意見を言う勇気があります。	감히 하다; 용기를 내다	그는 자신의 의견을 말할 용기가 있습니다.	dám; dám làm	Anh ấy dám nói ra ý kiến của mình.	กล้าที่จะ	เขากล้าที่จะแสดงความคิดเห็นของตนเอง.	berani untuk; sanggup	Dia berani menyatakan pendapat sendiri.	berani untuk	Ia berani menyampaikan pendapatnya sendiri.
2385:刚好	刚好	刚好	ちょうど; ぴったり	私が駅に着いた時、ちょうどバスが来ました。	마침; 딱 좋다	제가 역에 도착했을 때 차가 마침 왔습니다.	vừa đúng; vừa hay	Khi tôi đến ga, xe vừa hay tới.	พอดี; พอดิบพอดี	ตอนฉันถึงสถานี รถก็มาพอดี.	kebetulan; tepat sekali	Apabila saya tiba di stesen, bas baru sahaja sampai.	kebetulan; tepat	Saat saya tiba di stasiun, bus baru saja datang.
2386:高大	高大	高大	高くて大きい	入口には高く大きな木が二本あります。	크고 높다	입구에는 크고 높은 나무 두 그루가 있습니다.	cao lớn	Ở cửa có hai cây cao lớn.	สูงใหญ่	หน้าประตูมีต้นไม้สูงใหญ่สองต้น.	tinggi dan besar	Di pintu masuk ada dua pokok yang tinggi dan besar.	tinggi besar	Di pintu masuk ada dua pohon tinggi besar.
2388:高度	高度	高度	高さ; 高度	この建物の高さは百メートルを超えています。	높이; 고도	이 건물의 높이는 100미터가 넘습니다.	chiều cao; độ cao	Chiều cao của tòa nhà này vượt quá một trăm mét.	ความสูง; ระดับสูง	ความสูงของอาคารนี้เกินหนึ่งร้อยเมตร.	ketinggian; tahap tinggi	Ketinggian bangunan ini melebihi seratus meter.	ketinggian; tingkat tinggi	Ketinggian gedung ini melebihi seratus meter.
2390:高科技	高科技	高科技	ハイテク; 高度技術	ハイテク製品は生活をより便利にします。	첨단 기술; 하이테크	첨단 기술 제품은 생활을 더 편리하게 만듭니다.	công nghệ cao	Các sản phẩm công nghệ cao làm cuộc sống tiện lợi hơn.	เทคโนโลยีขั้นสูง; ไฮเทค	ผลิตภัณฑ์ไฮเทคทำให้ชีวิตสะดวกขึ้น.	teknologi tinggi	Produk teknologi tinggi menjadikan kehidupan lebih mudah.	teknologi tinggi	Produk berteknologi tinggi membuat hidup lebih mudah.
2391:高效	高效	高效	効率的な	この方法は簡単で効率的です。	효율적이다	이 방법은 간단하고 효율적입니다.	hiệu quả cao	Phương pháp này đơn giản và hiệu quả cao.	มีประสิทธิภาพสูง	วิธีนี้เรียบง่ายและมีประสิทธิภาพสูง.	cekap; berkesan	Kaedah ini ringkas dan cekap.	efisien	Metode ini sederhana dan efisien.
2394:歌词	歌词	歌词	歌詞	私はこの歌の歌詞がとても好きです。	가사	저는 이 노래의 가사를 아주 좋아합니다.	lời bài hát	Tôi rất thích lời bài hát này.	เนื้อเพลง	ฉันชอบเนื้อเพลงของเพลงนี้มาก.	lirik lagu	Saya sangat suka lirik lagu ini.	lirik lagu	Saya sangat menyukai lirik lagu ini.
2395:歌曲	歌曲	歌曲	歌曲; 歌	この歌はネットでとても人気があります。	노래; 곡	이 노래는 인터넷에서 매우 인기가 있습니다.	bài hát	Bài hát này rất được yêu thích trên mạng.	เพลง	เพลงนี้ได้รับความนิยมมากทางออนไลน์.	lagu	Lagu ini sangat popular dalam talian.	lagu	Lagu ini sangat populer di internet.
2396:隔	隔	隔	隔てる; 離れている	私の家と学校の間には川が一本あります。	사이에 두다; 떨어져 있다	우리 집과 학교 사이에는 강 하나가 있습니다.	cách; ngăn cách	Nhà tôi và trường học bị ngăn cách bởi một con sông.	กั้น; ห่างกัน	บ้านฉันกับโรงเรียนมีแม่น้ำคั่นอยู่สายหนึ่ง.	memisahkan; berjauhan	Rumah saya dan sekolah dipisahkan oleh sebatang sungai.	memisahkan; berjarak	Rumah saya dan sekolah terpisah oleh sebuah sungai.
2399:各行各业	各行各业	各行各业	あらゆる業界; 各分野	あらゆる業界で真面目で責任感のある人が必要です。	각계각층; 모든 업종	모든 업종에는 성실하고 책임감 있는 사람이 필요합니다.	mọi ngành nghề	Mọi ngành nghề đều cần người nghiêm túc và có trách nhiệm.	ทุกสาขาอาชีพ; ทุกวงการ	ทุกสาขาอาชีพต้องการคนจริงจังและรับผิดชอบ.	semua bidang pekerjaan; semua industri	Semua bidang pekerjaan memerlukan orang yang bersungguh-sungguh dan bertanggungjawab.	semua bidang usaha; semua profesi	Semua bidang usaha membutuhkan orang yang serius dan bertanggung jawab.
2405:更换	更换	更换	交換する; 取り替える	エアコンのフィルターは定期的に交換する必要があります。	교체하다; 바꾸다	에어컨 필터는 정기적으로 교체해야 합니다.	thay; thay thế	Bộ lọc điều hòa cần được thay định kỳ.	เปลี่ยน; เปลี่ยนใหม่	แผ่นกรองแอร์ต้องเปลี่ยนเป็นประจำ.	mengganti; menukar	Penapis penghawa dingin perlu diganti secara berkala.	mengganti; menukar	Filter AC perlu diganti secara berkala.
2408:工程	工程	工程	工事; プロジェクト; エンジニアリング	このプロジェクトは来年完成する予定です。	공사; 프로젝트; 공학	이 공사는 내년에 완공될 계획입니다.	công trình; dự án	Công trình này dự kiến hoàn thành vào năm sau.	โครงการ; งานวิศวกรรม	โครงการนี้วางแผนว่าจะเสร็จปีหน้า.	projek; kerja kejuruteraan	Projek ini dirancang siap pada tahun depan.	proyek; pekerjaan teknik	Proyek ini direncanakan selesai tahun depan.
2413:公务员	公务员	公务员	公務員	彼は卒業後、公務員試験に合格しました。	공무원	그는 졸업 후 공무원 시험에 합격했습니다.	công chức	Sau khi tốt nghiệp, anh ấy thi đỗ công chức.	ข้าราชการ	หลังเรียนจบเขาสอบได้เป็นข้าราชการ.	penjawat awam; pegawai kerajaan	Selepas tamat pengajian, dia lulus peperiksaan penjawat awam.	pegawai negeri; aparatur sipil	Setelah lulus, ia lolos ujian pegawai negeri.
2416:工艺	工艺	工艺	工芸; 技術	この伝統工芸は長年受け継がれてきました。	공예; 기술	이 전통 공예는 여러 해 동안 전해져 왔습니다.	nghề thủ công; kỹ thuật	Nghề thủ công truyền thống này đã được truyền lại nhiều năm.	งานฝีมือ; เทคนิค	งานฝีมือดั้งเดิมชนิดนี้สืบทอดมาหลายปีแล้ว.	kraf; teknik	Kraf tradisional ini telah diwarisi selama bertahun-tahun.	kerajinan; teknik	Kerajinan tradisional ini telah diwariskan selama bertahun-tahun.
2419:共享	共享	共享	共有する	この都市にはシェア自転車がたくさんあります。	공유하다	이 도시에는 공유 자전거가 많습니다.	chia sẻ; dùng chung	Thành phố này có rất nhiều xe đạp dùng chung.	ใช้ร่วมกัน; แบ่งปัน	เมืองนี้มีจักรยานใช้ร่วมกันจำนวนมาก.	berkongsi; guna bersama	Bandar ini mempunyai banyak basikal kongsi.	berbagi; menggunakan bersama	Kota ini memiliki banyak sepeda berbagi.
2422:古	古	古	古い; 古代の	この橋は昔の姿を残しています。	옛날의; 고대의	이 다리는 옛날 모습을 보존하고 있습니다.	cổ; xưa	Cây cầu này vẫn giữ dáng vẻ thời xưa.	โบราณ; เก่าแก่	สะพานนี้ยังคงรูปลักษณ์สมัยโบราณไว้.	kuno; lama	Jambatan ini mengekalkan rupa zaman dahulu.	kuno; lama	Jembatan ini mempertahankan bentuk zaman dahulu.
2423:鼓	鼓	鼓	太鼓	子どもたちは太鼓の音を聞いて走って来ました。	북	아이들은 북소리를 듣고 달려왔습니다.	trống	Bọn trẻ nghe tiếng trống liền chạy tới.	กลอง	เด็ก ๆ ได้ยินเสียงกลองก็วิ่งเข้ามา.	gendang	Kanak-kanak berlari datang apabila mendengar bunyi gendang.	drum; gendang	Anak-anak berlari datang saat mendengar suara gendang.
2425:古老	古老	古老	古い; 古代からの	この古い都市は多くの観光客を引きつけています。	오래된; 고대의	이 오래된 도시는 많은 관광객을 끌어들입니다.	cổ kính; lâu đời	Thành phố cổ kính này thu hút rất nhiều du khách.	เก่าแก่; โบราณ	เมืองเก่าแก่แห่งนี้ดึงดูดนักท่องเที่ยวจำนวนมาก.	tua; kuno	Bandar kuno ini menarik ramai pelancong.	kuno; tua	Kota kuno ini menarik banyak wisatawan.
2430:怪	怪	怪	変だ; 不思議だ	今日の天気は少し変です。	이상하다; 탓하다	오늘 날씨가 좀 이상합니다.	lạ; kỳ lạ	Thời tiết hôm nay hơi lạ.	แปลก; ประหลาด	อากาศวันนี้แปลกนิดหน่อย.	pelik; aneh	Cuaca hari ini agak pelik.	aneh; menyalahkan	Cuaca hari ini agak aneh.
2438:光线	光线	光线	光; 明るさ	部屋の光が暗すぎて、本を読むのに向いていません。	빛; 채광	방의 빛이 너무 어두워 책 읽기에 적합하지 않습니다.	ánh sáng	Ánh sáng trong phòng quá tối, không thích hợp để đọc sách.	แสง; แสงสว่าง	แสงในห้องมืดเกินไป ไม่เหมาะกับการอ่านหนังสือ.	cahaya; pencahayaan	Cahaya bilik terlalu malap dan tidak sesuai untuk membaca.	cahaya; pencahayaan	Cahaya kamar terlalu redup dan tidak cocok untuk membaca.
2439:广	广	广	広い	彼の興味はとても広いです。	넓다; 광범위하다	그의 관심사는 매우 넓습니다.	rộng; rộng rãi	Sở thích của anh ấy rất rộng.	กว้าง; กว้างขวาง	ความสนใจของเขากว้างมาก.	luas	Minatnya sangat luas.	luas	Minatnya sangat luas.
2446:贵姓	贵姓	贵姓	ご苗字; お名前の姓	失礼ですが、ご苗字をお伺いしてもよろしいですか。	성함의 성; 성씨	실례지만 성함이 어떻게 되십니까?	quý danh; họ của ông/bà	Xin hỏi quý họ của ông/bà là gì?	นามสกุลของท่าน	ขอถามหน่อยครับ ท่านนามสกุลอะไร?	nama keluarga tuan/puan; nama keluarga	Maaf, boleh saya tahu nama keluarga tuan?	nama keluarga Anda	Maaf, boleh saya tahu nama keluarga Anda?
2447:柜子	柜子	柜子	戸棚; キャビネット	書類はすべて戸棚の中にあります。	캐비닛; 찬장	서류는 모두 캐비닛 안에 있습니다.	tủ; tủ đựng	Tài liệu đều được để trong tủ.	ตู้; ตู้เก็บของ	เอกสารทั้งหมดอยู่ในตู้.	kabinet; almari	Dokumen semuanya diletakkan di dalam kabinet.	lemari; kabinet	Semua dokumen ada di dalam lemari.
2450:国画	国画	国画	中国画	祖父は中国画を描くのが好きです。	중국화	할아버지는 중국화를 그리는 것을 좋아하십니다.	tranh truyền thống Trung Quốc	Ông nội thích vẽ tranh truyền thống Trung Quốc.	ภาพวาดจีนโบราณ	คุณปู่ชอบวาดภาพจีนแบบดั้งเดิม.	lukisan tradisional Cina	Datuk suka melukis lukisan tradisional Cina.	lukisan tradisional Tiongkok	Kakek suka melukis lukisan tradisional Tiongkok.
2451:国庆	国庆	国庆	国慶節; 建国記念日	国慶節の休みに私たちは杭州へ行きました。	국경절; 건국 기념일	국경절 연휴에 우리는 항저우에 갔습니다.	Quốc khánh; ngày quốc khánh	Kỳ nghỉ Quốc khánh, chúng tôi đã đi Hàng Châu.	วันชาติ	ช่วงวันหยุดวันชาติ พวกเราไปหางโจว.	Hari Kebangsaan	Semasa cuti Hari Kebangsaan, kami pergi ke Hangzhou.	Hari Nasional	Selama libur Hari Nasional, kami pergi ke Hangzhou.
2461:海外	海外	海外	海外; 外国	この会社には海外の顧客がたくさんいます。	해외	이 회사는 해외 고객이 많습니다.	nước ngoài; hải ngoại	Công ty này có nhiều khách hàng ở nước ngoài.	ต่างประเทศ; โพ้นทะเล	บริษัทนี้มีลูกค้าต่างประเทศจำนวนมาก.	luar negara; seberang laut	Syarikat ini mempunyai ramai pelanggan luar negara.	luar negeri; seberang laut	Perusahaan ini memiliki banyak klien luar negeri.
2463:含	含	含	含む; 口に含む	この飲み物は糖分を多く含んでいます。	포함하다; 머금다	이 음료는 당분을 많이 포함하고 있습니다.	chứa; ngậm	Đồ uống này chứa rất nhiều đường.	มี; อมไว้	เครื่องดื่มขวดนี้มีน้ำตาลสูง.	mengandungi; menahan dalam mulut	Minuman ini mengandungi kandungan gula yang tinggi.	mengandung; menahan di mulut	Minuman ini mengandung banyak gula.
2464:含量	含量	含量	含有量	この果物はビタミンの含有量が高いです。	함량	이 과일은 비타민 함량이 높습니다.	hàm lượng	Hàm lượng vitamin của loại trái cây này rất cao.	ปริมาณที่มีอยู่; ปริมาณ	ผลไม้ชนิดนี้มีปริมาณวิตามินสูง.	kandungan	Kandungan vitamin buah ini sangat tinggi.	kandungan	Kandungan vitamin buah ini tinggi.
2465:含有	含有	含有	含有する; 含む	牛乳は豊富な栄養を含んでいます。	함유하다; 포함하다	우유는 풍부한 영양을 함유하고 있습니다.	chứa; có chứa	Sữa chứa nhiều chất dinh dưỡng.	มี; มีอยู่	นมมีสารอาหารมากมาย.	mengandungi	Susu mengandungi nutrien yang kaya.	mengandung	Susu mengandung banyak nutrisi.
2466:汗水	汗水	汗水	汗	選手の汗で服はびっしょり濡れました。	땀	선수의 땀이 옷을 흠뻑 적셨습니다.	mồ hôi	Mồ hôi của vận động viên thấm ướt áo.	เหงื่อ	เหงื่อของนักกีฬาทำให้เสื้อผ้าเปียกโชก.	peluh	Peluh atlet membasahi pakaiannya.	keringat	Keringat atlet membasahi pakaiannya.
2467:行	行	行	業界; 職業分野	彼は飲食業界で十年働いています。	업종; 직업 분야	그는 외식업 분야에서 10년 동안 일했습니다.	ngành nghề; lĩnh vực	Anh ấy đã làm trong ngành dịch vụ ăn uống mười năm.	สายงาน; วงการอาชีพ	เขาทำงานในสายงานอาหารและเครื่องดื่มมาสิบปี.	bidang kerja; industri	Dia telah bekerja dalam bidang makanan dan minuman selama sepuluh tahun.	bidang pekerjaan; industri	Ia telah bekerja di bidang layanan makanan selama sepuluh tahun.
2469:好评	好评	好评	好評; 良い評価	このレストランは多くの好評を得ています。	호평; 좋은 평가	이 식당은 많은 호평을 받았습니다.	đánh giá tốt; lời khen	Nhà hàng này đã nhận được rất nhiều đánh giá tốt.	คำชม; รีวิวดี	ร้านอาหารนี้ได้รับคำชมมากมาย.	ulasan baik; pujian	Restoran ini menerima banyak ulasan baik.	ulasan positif; pujian	Restoran ini menerima banyak ulasan positif.
2470:好运	好运	好运	幸運	試験で幸運を祈ります。	행운	시험에서 행운을 빕니다.	may mắn	Chúc bạn may mắn trong kỳ thi.	โชคดี	ขอให้คุณโชคดีในการสอบ.	nasib baik; tuah	Semoga berjaya dalam peperiksaan.	keberuntungan; semoga sukses	Semoga sukses dalam ujian.
2471:好转	好转	好转	好転する; 良くなる	治療を受けた後、彼の病状は良くなり始めました。	호전되다; 좋아지다	치료를 받은 뒤 그의 병세가 좋아지기 시작했습니다.	chuyển biến tốt; khá lên	Sau điều trị, tình trạng bệnh của anh ấy bắt đầu khá lên.	ดีขึ้น; อาการดีขึ้น	หลังการรักษา อาการป่วยของเขาเริ่มดีขึ้น.	bertambah baik	Selepas rawatan, keadaannya mula bertambah baik.	membaik	Setelah pengobatan, kondisinya mulai membaik.
2474:合	合	合	閉じる; 合わせる	本を閉じて、私の話を聞いてください。	닫다; 합치다	책을 덮고 제 말을 들어 주세요.	đóng lại; hợp lại	Xin hãy gấp sách lại và nghe tôi nói.	ปิด; รวมกัน	กรุณาปิดหนังสือแล้วฟังฉันพูด.	menutup; menggabungkan	Sila tutup buku dan dengar saya bercakap.	menutup; menggabungkan	Silakan tutup buku dan dengarkan saya.
2476:盒饭	盒饭	盒饭	弁当; 箱入りの食事	昼に私たちは駅で弁当を買いました。	도시락; 포장 식사	점심에 우리는 역에서 도시락을 샀습니다.	cơm hộp; suất ăn hộp	Buổi trưa chúng tôi mua cơm hộp ở nhà ga.	ข้าวกล่อง; อาหารกล่อง	ตอนเที่ยงพวกเราซื้อข้าวกล่องที่สถานี.	makanan kotak; makanan berbungkus	Pada tengah hari, kami membeli makanan berbungkus di stesen.	nasi kotak; makanan kotak	Siang hari kami membeli nasi kotak di stasiun.
2478:河流	河流	河流	川; 河川	この川は三つの都市を通ります。	강; 하천	이 강은 세 도시를 지나갑니다.	dòng sông; sông ngòi	Dòng sông này chảy qua ba thành phố.	แม่น้ำ; ลำน้ำ	แม่น้ำสายนี้ไหลผ่านสามเมือง.	sungai; aliran sungai	Sungai ini melalui tiga bandar.	sungai; aliran sungai	Sungai ini melewati tiga kota.
2485:厚度	厚度	厚度	厚さ	このガラスの厚さは五ミリです。	두께	이 유리의 두께는 5밀리미터입니다.	độ dày	Độ dày của tấm kính này là năm milimét.	ความหนา	ความหนาของกระจกแผ่นนี้คือห้ามิลลิเมตร.	ketebalan	Ketebalan kaca ini ialah lima milimeter.	ketebalan	Ketebalan kaca ini lima milimeter.
2489:湖	湖	湖	湖; みずうみ	湖のほとりでは多くの人が散歩しています。	호수	호숫가에서 많은 사람들이 산책하고 있습니다.	hồ; hồ nước	Có nhiều người đang đi dạo bên hồ.	ทะเลสาบ	มีคนจำนวนมากเดินเล่นริมทะเลสาบ.	tasik	Ramai orang berjalan-jalan di tepi tasik.	danau	Banyak orang berjalan-jalan di tepi danau.
2492:互动	互动	互动	やり取り; 相互作用	授業中のやり取りで学生はもっと積極的になります。	상호작용; 소통	수업 중의 상호작용은 학생들을 더 적극적으로 만듭니다.	tương tác	Tương tác trong lớp làm học sinh tích cực hơn.	ปฏิสัมพันธ์; การโต้ตอบ	ปฏิสัมพันธ์ในชั้นเรียนทำให้นักเรียนกระตือรือร้นขึ้น.	interaksi; tindak balas bersama	Interaksi dalam kelas menjadikan pelajar lebih aktif.	interaksi	Interaksi di kelas membuat siswa lebih aktif.
2493:户外	户外	户外	屋外; アウトドア	週末、私たちは屋外へ山登りに行きました。	야외; 바깥	주말에 우리는 야외로 등산을 갔습니다.	ngoài trời	Cuối tuần chúng tôi ra ngoài trời leo núi.	กลางแจ้ง; นอกอาคาร	สุดสัปดาห์พวกเราไปปีนเขากลางแจ้ง.	di luar bangunan; luar rumah	Pada hujung minggu, kami pergi mendaki di luar rumah.	luar ruangan; di luar rumah	Akhir pekan kami pergi mendaki di luar ruangan.
2494:花费	花费	花费	費用がかかる; 使う	この車を修理するのにかなりお金がかかりました。	비용이 들다; 쓰다	이 차를 수리하는 데 돈이 꽤 들었습니다.	tốn; chi phí	Sửa chiếc xe này tốn khá nhiều tiền.	เสียค่าใช้จ่าย; ใช้เงิน	การซ่อมรถคันนี้ใช้เงินไม่น้อย.	memerlukan kos; membelanjakan	Membaiki kereta ini memerlukan kos yang agak banyak.	menghabiskan biaya; membelanjakan uang	Memperbaiki mobil ini menghabiskan biaya cukup banyak.
2497:化	化	化	溶ける; 変わる	氷は太陽の下でゆっくり溶けました。	녹다; 변하다	얼음은 햇빛 아래에서 천천히 녹았습니다.	tan chảy; biến đổi	Băng tan chảy chậm dưới nắng.	ละลาย; เปลี่ยนเป็น	น้ำแข็งค่อย ๆ ละลายใต้แสงแดด.	mencair; berubah	Ais mencair perlahan-lahan di bawah matahari.	mencair; berubah	Es perlahan mencair di bawah matahari.
2498:话费	话费	话费	電話料金; 通話料	今月の電話料金は少し高いです。	전화 요금; 통신 요금	이번 달 전화 요금이 조금 높습니다.	cước điện thoại; tiền điện thoại	Tiền điện thoại của tôi tháng này hơi cao.	ค่าโทรศัพท์	ค่าโทรศัพท์ของฉันเดือนนี้ค่อนข้างสูง.	bil telefon; kredit panggilan	Bayaran telefon saya bulan ini agak tinggi.	tagihan telepon; pulsa	Tagihan telepon saya bulan ini agak tinggi.
