source_headword	TR	example_TR
absorb	emmek	Havlu suyu hızla emer.
abstract	soyut	Ders soyut fikirleri tartıştı.
accent	aksan	Onun aksanını anlamak kolaydır.
accidentally	yanlışlıkla	Dosyayı yanlışlıkla sildim.
accommodate	uyum sağlamak	Otel büyük aileleri barındırabilir.
accomplish	başarmak	Hedefine hazirandan önce ulaştı.
accountant	muhasebeci	Muhasebeci faturayı kontrol etti.
accuracy	doğruluk	Test okuma doğruluğunu ölçer.
accurately	doğru bir şekilde	Harita rotayı doğru bir şekilde gösteriyor.
acid	asit	Asit metal yüzeye zarar verdi.
activate	etkinleştirmek	Alarmı etkinleştirmek için düğmeye basın.
addiction	bağımlılık	Bağımlılığı işini etkiledi.
additionally	ek olarak	Ayrıca, daha fazla sandalyeye ihtiyacımız var.
adequate	yeterli	Odada yeterli ışık var.
adequately	yeterli derecede	Rapor sorunu yeterince açıkladı.
adjust	ayarlamak	Sürüşten önce koltuğu ayarlayın.
affordable	uygun fiyatlı	Daire öğrenciler için uygun fiyatlı.
agriculture	tarım	Tarım birçok kırsal aileyi destekler.
AIDS	AIDS	Doktorlar AIDS'i modern tıpla tedavi ediyor.
alien	uzaylı	Film uzaylı bir gezegeni gösteriyor.
alongside	yanında	Bisiklet yolu nehrin yanında uzanıyor.
altogether	tamamen	Proje toplamda altı hafta sürdü.
ambulance	ambulans	Ambulans dakikalar içinde geldi.
amusing	eğlenceli	Hikaye eğlenceli ve hafifti.
analyst	analist	Analist satış verilerini inceledi.
ancestor	ata	Atam bu köyün yakınında yaşadı.
animation	animasyon	Animasyon dersi daha net hale getirdi.
annually	yıllık olarak	Festival her yıl düzenlenmektedir.
anticipate	öngörmek	Yarın yoğun trafik öngörüyoruz.
anxiety	endişe	Kaygı uykuyu zorlaştırabilir.
apology	özür	İçten bir özür diledi.
applicant	başvuru sahibi	Başvuru sahibi yeni bir özgeçmiş gönderdi.
appropriately	uygun şekilde	Lütfen mülakat için uygun şekilde giyinin.
arrow	ok	Ok çıkışı gösteriyor.
artwork	sanat eseri	Müze yerel sanat eserlerini sergiledi.
aside	bir kenara	Geçmesine izin vermek için bir kenara çekildi.
asset	varlık	Deneyim değerli bir varlıktır.
assign	atamak	Öğretmen bugün ev ödevi verdi.
assistance	yardım	Lütfen personelden yardım isteyin.
assumption	varsayım	Bu varsayım yanlış olabilir.
assure	garanti etmek	Kapının kilitli olduğunu temin ederim.
astonishing	şaşırtıcı	Uçurumdan manzara şaşırtıcıydı.
attachment	eklenti	E-posta bir eklenti içeriyor.
auction	müzayede	Tablo açık artırmada satıldı.
audio	işitsel	Ses kaydı net geliyor.
automatic	otomatik	Kapının otomatik bir kilidi var.
automatically	otomatik olarak	Işıklar otomatik olarak açılır.
awareness	farkındalık	Kampanya halkın farkındalığını artırdı.
awkward	tuhaf	Sessizlik tuhaf hissettirdi.
badge	rozet	Ziyaretçiler rozet takmalıdır.
balanced	dengeli	Dengeli bir diyet sebzeleri içerir.
ballet	bale	Okuldan sonra bale öğreniyor.
balloon	balon	Balon masanın üzerinde süzüldü.
barely	zar zor	Anonsu zar zor duydu.
bargain	kelepir	O ceket tam bir kelepirdi.
basement	bodrum	Kutular bodrumda.
basket	sepet	Elmaları sepete koydu.
bat	sopa	Yarasa mağaradan dışarı uçtu.
beneficial	faydalı	Düzenli egzersiz sağlık için faydalıdır.
beside	yanında	Lamba kanepenin yanında duruyor.
besides	ayrıca	Matematikten başka kimya da çalışıyor.
bias	önyargı	Makale açık bir önyargı gösteriyordu.
bid	teklif	Şirket daha yüksek bir teklif verdi.
biological	biyolojik	Biyolojik test sonucu doğruladı.
blanket	battaniye	Çocuk battaniyenin altında uyudu.
blow	darbe	Güçlü darbe pencereyi kırdı.
bold	cesur	Manşette kalın harfler kullanıldı.
bombing	bombalama	Bombalama birkaç binaya zarar verdi.
booking	rezervasyon	Otel rezervasyonunu onayladım.
boost	artış	Galibiyet takımın güvenini artırdı.
bound	bağlayıcı	Paket iple bağlıydı.
brick	tuğla	Duvar tuğladan yapılmış.
briefly	kısaca	Öğle yemeğinden sonra kısaca konuştu.
broadcaster	yayıncı	Yayıncı belediye başkanıyla röportaj yaptı.
broadly	genel olarak	İki plan genel olarak benzer.
bug	böcek	Uygulama bir hata yüzünden çöktü.
cabin	kulübe	Küçük bir kulübede kaldık.
canal	kanal	Tekneler kanal boyunca yavaşça ilerledi.
candle	mum	Mum masanın üzerinde yandı.
carbon	karbon	Ağaçlar havadaki karbonu emer.
casual	rahat	İşe günlük kıyafetler giydi.
cave	mağara	Yürüyüşçüler mağaraya girdi.
certainty	kesinlik	Kesinlikle bilemeyiz.
certificate	sertifika	Bir eğitim sertifikası aldı.
challenging	zorlu	Kurs zorlu ama faydalıydı.
championship	şampiyona	Takımımız şampiyona finaline ulaştı.
charming	büyüleyici	Eski sokak büyüleyici görünüyordu.
chase	takip	Köpek topu kovaladı.
cheek	yanak	Yanağından bir damla yaş süzüldü.
cheer	tezahürat	Kalabalık yüksek sesle tezahürat yapmaya başladı.
choir	koro	Koro güzelce şarkı söyledi.
chop	kesmek	Soğanları küçük parçalara doğrayın.
circuit	devre	Koşucu turu tamamladı.
civilization	medeniyet	Antik medeniyet bu bölgeyi şekillendirdi.
clarify	açıklığa kavuşturmak	Lütfen son noktayı açıklığa kavuşturun.
classify	sınıflandırmak	Bilim insanları hayvanları türlerine göre sınıflandırır.
clerk	memur	Memur makbuzu yazdırdı.
cliff	uçurum	Patika bir uçurumun yakınında bitiyor.
clinic	klinik	Klinik sekizde açılır.
clip	klips	Klipsi kağıda taktı.
coincidence	tesadüf	Onunla orada karşılaşmak bir tesadüftü.
collector	koleksiyoncu	Koleksiyoncu nadir paralar satın aldı.
colony	koloni	Karıncalar büyük bir koloni kurdu.
colourful	renkli	Pazar parlak ve renkliydi.
comic	komik	Komik sahne bizi güldürdü.
commander	komutan	Komutan net emirler verdi.
comparative	karşılaştırmalı	Makale karşılaştırmalı veriler kullanıyor.
completion	tamamlanma	Köprü tamamlanmak üzere.
compose	oluşturmak	Film için müzik besteleyecek.
composer	besteci	Besteci yeni bir şarkı yazdı.
compound	bileşik	Bileşik iki kimyasal içeriyor.
comprehensive	kapsamlı	Kılavuz kapsamlı talimatlar verir.
comprise	içermek	Takım beş üyeden oluşuyor.
compulsory	zorunlu	Bu ders için katılım zorunludur.
concrete	somut	Zemin betondan yapılmıştır.
confess	itiraf etmek	Hatayı öğretmenine itiraf etti.
confusion	kafa karışıklığı	Gecikme kafa karışıklığına neden oldu.
consequently	sonuç olarak	Yağmur yağdı; sonuç olarak maç durdu.
conservation	koruma	Doğa koruma nadir hayvanları korur.
considerable	önemli	Onarım hatırı sayılır bir zaman aldı.
considerably	önemli ölçüde	Fiyatlar bu yıl önemli ölçüde arttı.
consistently	tutarlı bir şekilde	Tutarlı bir şekilde iyi performans gösteriyor.
conspiracy	komplo	Polis komployu soruşturdu.
consult	danışmak	İlaç almadan önce doktorunuza danışın.
consultant	danışman	Danışman yeni bir strateji önerdi.
consumption	tüketim	Enerji tüketimi geçen ay düştü.
controversial	tartışmalı	Politika tartışmalı olmaya devam ediyor.
controversy	tartışma	Karar tartışmaya neden oldu.
convenience	kolaylık	Mağaza büyük kolaylık sağlıyor.
convention	kongre	Yıllık kongre Pazartesi başlıyor.
conventional	geleneksel	Geleneksel bir tasarım seçti.
convey	iletmek	Mesaj sempati iletiyordu.
convincing	inandırıcı	Açıklaması ikna ediciydi.
cope	başa çıkmak	Stresle başa çıkmayı öğrendi.
corporation	şirket	Şirket yeni bir ofis açtı.
corridor	koridor	Koridor dar ve sessizdi.
counter (long flat surface)	tezgah	Anahtarlar mutfak tezgahının üzerinde.
coverage	kapsam	Haber kapsamı tüm akşam sürdü.
crack	çatlamak	Duvarda bir çatlak belirdi.
craft	zanaat	İnternette el yapımı el sanatları satıyor.
creativity	yaratıcılık	Yaratıcılık sorunları çözmeye yardımcı olur.
critically	eleştirel olarak	Makale son derece önemliydi.
cruise	gemi seyahati	Yunanistan'a bir gemi seyahati rezervasyonu yaptırdılar.
cue	ipucu	Aktör işaretini kaçırdı.
curious	meraklı	Çocuk uzayı merak ediyordu.
curriculum	müfredat	Okul müfredatını güncelledi.
cute	sevimli	Yavru köpek sevimli görünüyordu.
dairy	mandıra	Çiftlik süt ürünleri üretiyor.
dare	cesaret etmek	Sana bunu denemen için meydan okuyorum.
darkness	karanlık	Oda karanlıkla doldu.
database	veritabanı	Veritabanı müşteri kayıtlarını depolar.
deadline	son teslim tarihi	Son teslim tarihi Cuma.
deadly	ölümcül	Yılanın ölümcül zehri var.
dealer	satıcı	Araba satıcısı indirim teklif etti.
deck	güverte	Sandalyeler güvertede.
defender	savunma oyuncusu	Savunma oyuncusu şutu engelledi.
delete	silmek	Eski mesajı sil.
democracy	demokrasi	Demokrasi özgür seçimlere bağlıdır.
democratic	demokratik	Oylama demokratik kuralları izledi.
demonstration	gösteri	Öğrenciler bir gösteriye katıldı.
depart	ayrılmak	Tren öğlen ayrılacak.
dependent	bağımlı	Çocuk yetişkinlere bağımlıdır.
deposit	depozito	Daire için depozito ödedi.
depression	depresyon	Depresyon profesyonel destek gerektirir.
derive	türetmek	Birçok kelime Latince'den türer.
desperately	umutsuzca	Umutsuzca suya ihtiyacı vardı.
destruction	yıkım	Fırtına geniş çaplı yıkıma neden oldu.
determination	kararlılık	Kararlılığı koçu etkiledi.
devote	adamak	Hafta sonlarını çalışmaya adar.
differ	farklılık göstermek	Görüşleri keskin bir şekilde farklılık gösteriyor.
disability	engellilik	Binanın engelli erişimi var.
disabled	devre dışı	Engelli atlet madalya kazandı.
disagreement	anlaşmazlık	Toplantı anlaşmazlıkla sonuçlandı.
disappoint	hayal kırıklığına uğratmak	Sonuç hayranları hayal kırıklığına uğratabilir.
disappointment	hayal kırıklığı	Derin bir hayal kırıklığı hissetti.
discourage	cesaret kırmak	Genç öğrencilerin cesaretini kırmayın.
disorder	bozukluk	Doktor uyku bozukluğu teşhisi koydu.
distant	uzak	Dağlar uzak görünüyordu.
distinct	belirgin	İki ses birbirinden farklıdır.
distinguish	ayırt etmek	Bu renkleri ayırt edebilir misin?
distract	dikkat dağıtmak	Gürültü öğrencilerin dikkatini dağıtabilir.
disturb	rahatsız etmek	Lütfen hastayı rahatsız etmeyin.
dive	dalış	Resifin yakınında dalacaklar.
diverse	çeşitli	Şehir çeşitli kültürlere sahip.
diversity	çeşitlilik	Kültürel çeşitliliği kutluyoruz.
divorce	boşanma	Boşanma herkes için zordu.
dominant	baskın	Baskın takım oyunu kontrol etti.
donation	bağış	Yardım kurumu bir bağış aldı.
dot	nokta	Sayıdan sonra bir nokta koyun.
downtown	şehir merkezi	İşten sonra şehir merkezinde buluştuk.
dramatically	çarpıcı biçimde	Fiyat önemli ölçüde düştü.
drought	kuraklık	Kuraklık mahsullere zarar verdi.
dull	sıkıcı	Ders sıkıcıydı.
dump	çöpe atmak	Çöpü buraya dökmeyin.
duration	süre	Uçuş süresi üç saattir.
dynamic	dinamik	Sınıf dinamik hissettirdi.
economics	ekonomi	Üniversitede ekonomi okuyor.
economist	ekonomist	Ekonomist daha yavaş bir büyüme öngördü.
editorial	başyazı	Başyazı yasayı eleştirdi.
efficiently	verimli biçimde	Takım verimli bir şekilde çalıştı.
elbow	dirsek	Dirseğini incitti.
electronics	elektronik	Mağaza elektronik satıyor.
elegant	zarif	Elbise zarif görünüyordu.
elementary	temel	Kitap temel dilbilgisini açıklıyor.
eliminate	ortadan kaldırmak	Ekip birkaç hatayı ortadan kaldırdı.
embrace	benimsemek	Yeni fikri benimsedi.
emission	emisyon	Araç emisyon seviyeleri düştü.
emotionally	duygusal olarak	Ailesi hakkında duygusal olarak konuştu.
empire	imparatorluk	İmparatorluk yüzyıllarca sürdü.
enjoyable	zevkli	Gezi zevkliydi.
entertaining	eğlenceli	Gösteri eğlenceliydi.
entrepreneur	girişimci	Girişimci bir kafe açtı.
envelope	zarf	Mektubu bir zarfa koyun.
equip	donatmak	Okul laboratuvarı donatacak.
equivalent	eşdeğer	Bir dolar burada eşdeğer değildir.
era	çağ	Keşif yeni bir çağ başlattı.
erupt	patlamak	Yanardağ yakında patlayabilir.
essentially	esasen	İki yöntem esasen aynıdır.
ethic	ahlak	Çalışma ahlakı güçlüdür.
ethnic	etnik	Festival etnik gelenekleri kutluyor.
evaluation	değerlendirme	Kurs bir final değerlendirmesi içerir.
evident	belirgin	Gerginliği belirgindi.
evolution	evrim	Evrim birçok biyolojik değişikliği açıklar.
evolve	evrilmek	Diller zamanla gelişir.
exceed	aşmak	Talep arzı aşabilir.
exception	istisna	Bir istisna var.
excessive	aşırı	Aşırı gürültü komşuları rahatsız eder.
exclude	hariç tutmak	Liste geçici işçileri hariç tutuyor.
exhibit	sergi	Müze nadir fotoğrafları sergileyecek.
exit	çıkış	Çıkış sahnenin arkasındadır.
exotic	egzotik	Dükkan egzotik meyveler satıyor.
expansion	genişleme	Şirket bir genişleme planladı.
expertise	uzmanlık	Uzmanlığı projeyi geliştirdi.
exploit	kullanmak	Suçlular zayıf şifreleri kötüye kullanır.
exposure	maruziyet	Güneşe maruz kalma cilde zarar verebilir.
extension	uzatma	Son teslim tarihi uzatması herkese yardımcı oldu.
extensive	kapsamlı	Kütüphanenin kapsamlı kaynakları var.
extensively	kapsamlı bir şekilde	Konu kapsamlı bir şekilde incelendi.
extract	alıntı	Vanilya özütü tat verir.
fabric	kumaş	Kumaş yumuşak hissettiriyor.
fabulous	muhteşem	Yemek harikaydı.
failed	başarısız	Başarısız girişim bize bir şeyler öğretti.
fake	sahte	Web sitesi sahte biletler sattı.
fame	şöhret	Ün özel hayatını değiştirdi.
fantasy	fantezi	Roman bir fantezidir.
fare	ücret	Otobüs ücreti arttı.
federal	federal	Federal hükümet finansman duyurdu.
fever	ateş	Çocuğun ateşi var.
firefighter	itfaiyeci	İtfaiyeci köpeği kurtardı.
firework	havai fişek	Parkın üzerinde bir havai fişek patladı.
firm	sıkı	Yatak serttir.
firmly	kesin olarak	Kapıyı sıkıca kapattı.
flavour	tat	Çorbanın zengin bir lezzeti var.
fond	sevgi dolu	Caza düşkündür.
fool	aptal	Aptal gibi davranma.
forbid	yasaklamak	Kanun burada sigara içmeyi yasaklıyor.
forecast	tahmin	Hava durumu tahmini yağmur bekliyor.
format	format	Doğru dosya biçimini kullanın.
formation	oluşum	Bulut oluşumu hızla değişir.
formerly	eskiden	Bina eskiden bir okuldu.
fortunate	şanslı	Erken vardığımız için şanslıydık.
forum	forum	Forumda iklim politikası tartışıldı.
fossil	fosil	Fosil taşın içinde bulundu.
foundation	temel	Evin sağlam bir temeli var.
founder	kurucu	Kurucu misafirleri karşıladı.
fraction	kesir	Öğrencilerin sadece küçük bir kısmı geldi.
fragment	parça	Yerde bir cam parçası duruyordu.
framework	çerçeve	Yasa net bir çerçeve oluşturur.
fraud	dolandırıcılık	Banka dolandırıcılık tespit etti.
freely	özgürce	Çocuklar dışarıda özgürce oynadılar.
frequent	sık	Sık molalar odaklanmayı geliştirir.
fulfil	yerine getirmek	Sözümü yerine getirmeyi umuyorum.
full-time	tam zamanlı	Tam zamanlı bir işi var.
fundamentally	temel olarak	Plan temelden farklıdır.
furious	öfkeli	Gecikme konusunda öfkeliydi.
gaming	oyun	Oyun oynama tepki hızını artırabilir.
gay	eşcinsel	Eşcinsel haklarını destekliyor.
gender	cinsiyet	Anket cinsiyeti sordu.
gene	gen	Gen göz rengini etkiler.
genetic	genetik	Hastalığın genetik nedenleri var.
genius	dahi	Genç piyanist bir dahidir.
genuine	hakiki	Gülümsemesi içten görünüyordu.
genuinely	içtenlikle	Gerçekten yardım etmek istedi.
gesture	jest	Dostça bir jest yaptı.
gig	konser	Grup şehir merkezinde bir konser verdi.
globalization	küreselleşme	Küreselleşme yerel işletmeleri etkiler.
globe	küre	Küre her kıtayı gösterir.
golden	altın	Gün batımı altın rengine döndü.
goodness	iyilik	İnsanlığın iyiliğine inanır.
gorgeous	muhteşem	Bahçe muhteşem görünüyordu.
governor	vali	Vali tasarıyı imzaladı.
graphic	grafik	Grafik görüntü izleyicileri şoke etti.
graphics	grafikler	Oyunun basit grafikleri var.
greatly	büyük ölçüde	Tavsiyeniz büyük ölçüde yardımcı oldu.
greenhouse	sera	Domatesler seranın içinde büyür.
grocery	bakkal	İşten sonra market ürünleri aldı.
guideline	yönerge	Yönerge güvenli uygulamayı açıklar.
habitat	doğal yaşam alanı	Orman bir kuş yaşam alanıdır.
harbour	liman	Tekne limana girdi.
headquarters	merkez	Şirket merkezi şehir merkezine taşındı.
