source_headword	IS	example_IS
absolutely	alveg	Ég er alveg sammála þér.
academic	akademískur	Akademíska árið hefst í september.
access	aðgangur	Nemendur þurfa aðgang að bókasafninu.
accommodation	gisting	Við bókuðum gistingu nálægt stöðinni.
account	reikningur	Hún opnaði nýjan bankareikning.
achievement	árangur	Að ljúka námskeiðinu var mikill árangur.
ad	auglýsing	Auglýsingin sýndi nýjan síma.
addition	viðbót	Sundlaugin er nytsamleg viðbót.
admire	dást að	Ég dáist að rólegu viðhorfi hennar.
admit	viðurkenna	Hann viðurkenndi mistök sín.
advanced	framhalds-	Þetta er framhaldstími í ensku.
advise	ráðleggja	Læknar ráðleggja reglulega hreyfingu.
afford	hafa efni á	Við höfum ekki efni á leigubíl.
aged	á aldrinum	Námskeiðið er fyrir börn á aldrinum tíu ára.
agent	umboðsmaður	Ferðaumboðsmaðurinn breytti miðunum okkar.
agreement	samkomulag	Þau náðu samkomulagi í dag.
ahead	fram undan	Vegurinn fram undan er auður.
aim	stefna að	Við stefnum að því að klára fljótlega.
alarm	vekjaraklukka	Vekjaraklukkan hringdi klukkan sex.
album	plata	Á þessari plötu eru tíu lög.
alcohol	áfengi	Hótelið býður ekki upp á áfengi.
alcoholic	áfengur	Þessi drykkur er ekki áfengur.
amazed	undrandi	Hún var undrandi á niðurstöðunni.
ambition	metnaður	Metnaður hans er að verða flugmaður.
ambitious	metnaðarfullur	Hún hefur metnaðarfulla áætlun.
analyse	greina	Við þurfum að greina niðurstöðurnar.
analysis	greining	Greining hennar var skýr og nákvæm.
announce	tilkynna	Þau tilkynna sigurvegarann á morgun.
announcement	tilkynning	Tilkynningin kom öllum á óvart.
annoy	pirra	Há tónlist getur pirrað nágrannana.
annoyed	pirraður	Hann virtist pirraður eftir seinkunina.
annoying	pirrandi	Þetta hljóð er mjög pirrandi.
apart	í sundur	Húsin standa tvo metra í sundur.
apologize	biðjast afsökunar	Ég biðst afsökunar á seinkuninni.
application	umsókn	Vinsamlegast fylltu út umsóknina á netinu.
appointment	tími	Ég á tíma hjá tannlækni á morgun.
appreciate	meta	Ég met hjálp þína.
approximately	um það bil	Gangan tekur um það bil tuttugu mínútur.
arrest	handtaka	Lögreglan handtók ökumanninn.
arrival	koma	Koma okkar var seinni en búist var við.
assignment	verkefni	Verkefninu á að skila á föstudag.
assist	aðstoða	Hjúkrunarfræðingar aðstoða lækninn.
atmosphere	andrúmsloft	Kaffihúsið hefur rólegt andrúmsloft.
attach	festa við	Festu skrána við tölvupóstinn.
attitude	viðhorf	Viðhorf hans breyttist eftir fundinn.
attract	laða að	Björtu blómin laða að býflugur.
attraction	aðdráttarafl	Kastalinn er vinsælt aðdráttarafl.
authority	yfirvald	Yfirvaldið á staðnum lagfærði veginn.
aware	meðvitaður	Hún er meðvituð um áhættuna.
backwards	aftur á bak	Hann gekk varlega aftur á bak.
bake	baka	Ég baka brauð á hverjum sunnudegi.
balance	jafnvægi	Góðir skór hjálpa til við að halda jafnvægi.
ban	banna	Borgin bannar bíla.
bank (river)	árbakki	Við sátum á árbakkanum.
base	bækistöð	Liðið sneri aftur til bækistöðvarinnar.
basic	grunn-	Allir þurfa grunnfærni í tölvum.
basis	grundvöllur	Traust er grundvöllur vináttu.
battery	rafhlaða	Rafhlaðan í símanum mínum er tóm.
battle	orrusta	Orrustan stóð alla nóttina.
beauty	fegurð	Við dáðumst að fegurð fjallanna.
bee	býfluga	Býflugan settist á blómið.
belief	trú	Trú hans gaf honum hugrekki.
bell	bjalla	Skólabjallan hringdi hátt.
bend	beygja	Beygðu hnén þegar þú lyftir.
bite	bíta	Hundurinn getur bitið ókunnuga.
block	loka	Fallið tré lokaði veginum.
bomb	sprengja	Sprengjan skemmdi nokkrar byggingar.
border	landamæri	Þau fóru yfir landamærin um nóttina.
bother	trufla	Vinsamlegast ekki trufla systur þína.
branch	grein	Greinin brotnaði í storminum.
brand	vörumerki	Þetta vörumerki er vinsælt meðal nemenda.
brave	hugrakkur	Hugrakkur maður bjargaði barninu.
breath	andardráttur	Dragðu djúpt andann.
breathe	anda	Ég get ekki andað í þessum reyk.
breathing	öndun	Öndun hennar var hæg.
bride	brúður	Brúðurin var í hvítum kjól.
bubble	bóla	Bólan svifaði yfir glasinu.
bury	grafa	Þau grófu kassann í sandinn.
calm	rólegur	Vertu rólegur í prófinu.
campaign	herferð	Herferðin safnaði peningum fyrir skóla.
campus	háskólasvæði	Nemendur búa nálægt háskólasvæðinu.
candidate	frambjóðandi	Hver frambjóðandi svaraði þremur spurningum.
cap	húfa	Hann var með hafnaboltahúfu.
captain	skipstjóri	Skipstjórinn talaði við áhöfnina.
careless	kærulaus	Kærulaus mistök kostuðu okkur tíma.
category	flokkur	Veldu réttan flokk.
ceiling	loft	Loftið var málað hvítt.
celebration	hátíð	Hátíðin stóð allt kvöldið.
central	miðlægur	Hótelið er á miðlægum stað.
ceremony	athöfn	Athöfnin hófst um hádegi.
chain	keðja	Hún var með silfurkeðju.
challenge	áskorun	Þetta verkefni er raunveruleg áskorun.
champion	meistari	Meistarinn þakkaði þjálfaranum sínum.
channel	rás	Vinsamlegast skiptu um rás.
chapter	kafli	Lestu næsta kafla í kvöld.
charge	gjald	Börn greiða ekkert gjald.
cheat	svindla	Ekki svindla í prófinu.
cheerful	glaðlegur	Hún hljómaði glaðleg í morgun.
chemical	efnafræðilegur	Efnafræðileg lyktin var sterk.
chest	brjóst	Hann fann til í brjóstinu eftir hlaupið.
childhood	bernska	Ég man heimilið frá bernsku minni.
claim	fullyrða	Þau fullyrða að varan sé örugg.
clause	setningarliður	Þessi setningarliður breytir merkingunni.
click	smella	Smelltu á bláa hnappinn.
client	viðskiptavinur	Viðskiptavinurinn bað um fleiri upplýsingar.
cloth	klútur	Þurrkaðu borðið með þessum klút.
clue	vísbending	Vísbendingin hjálpaði okkur að leysa þetta.
coal	kol	Gamla lestin notaði kol.
coin	mynt	Hún fann mynt á gólfinu.
collection	safn	Frímerkjasafnið hans er stórt.
coloured	litaður	Hún var með litaðan trefil.
combine	sameina	Sameinaðu hveiti og vatn.
commercial	auglýsinga-	Auglýsingahléið tók fimm mínútur.
commit	skuldbinda sig	Við verðum að skuldbinda okkur áætluninni.
communication	samskipti	Góð samskipti koma í veg fyrir mistök.
comparison	samanburður	Þessi samanburður er gagnlegur.
competitive	samkeppnishæfur	Markaðurinn er mjög samkeppnishæfur.
competitor	keppinautur	Helsti keppinautur okkar lækkaði verðin.
complaint	kvörtun	Hún lagði fram kvörtun vegna hávaða.
complex	flókinn	Leiðbeiningarnar eru of flóknar.
concentrate	einbeita sér	Ég get ekki einbeitt mér þegar tónlistin er í gangi.
conclude	ljúka	Við ljúkum fundinum núna.
conclusion	niðurstaða	Niðurstaða hennar virtist skynsamleg.
confident	sjálfsöruggur	Hún var sjálfsörugg fyrir viðtalið.
confirm	staðfesta	Vinsamlegast staðfestu netfangið þitt.
confuse	rugla	Þessi tvö nöfn rugla mig.
confused	ringlaður	Ég var ringlaður vegna kortsins.
connection	tenging	Nettengingin er hæg.
consequence	afleiðing	Svefnleysi hefur afleiðingar.
consist	samanstanda	Máltíðin samanstendur af þremur réttum.
consume	neyta	Stórir bílar neyta meira eldsneytis.
consumer	neytandi	Neytandinn vill skýrar upplýsingar.
contact	samband	Hafðu samband við mig eftir hádegi.
container	ílát	Settu súpuna í ílátið.
content1	efni	Efni námskeiðsins er gagnlegt.
continuous	stöðugur	Vélin gaf frá sér stöðugan hávaða.
contrast	andstæða	Andstæðan milli þeirra er skýr.
convenient	þægilegur	Stöðin er mjög þægileg.
convince	sannfæra	Hún sannfærði hann um að reyna aftur.
costume	búningur	Hún var í sjóræningjabúningi.
cottage	sumarbústaður	Þau leigðu lítinn sumarbústað.
cotton	bómull	Þessi skyrta er úr bómull.
countryside	sveit	Við gengum um sveitina.
court	dómstóll	Málið fór fyrir dómstól.
covered	þakinn	Borðið var þakið pappírum.
cruel	grimmur	Það var grimmt að hlæja.
cultural	menningarlegur	Safnið býður upp á menningarviðburði.
currency	gjaldmiðill	Gjaldmiðillinn á staðnum er evra.
current	núverandi	Núverandi staða er betri.
currently	núna	Hún vinnur núna heima.
curtain	gluggatjald	Gluggatjaldið huldi gluggann.
custom	siður	Þessi siður er mjög gamall.
damage	tjón	Stormurinn olli alvarlegu tjóni.
decade	áratugur	Þau bjuggu þar í áratug.
decorate	skreyta	Við skreytum herbergið saman.
define	skilgreina	Geturðu skilgreint þetta hugtak?
definite	ákveðinn	Við þurfum ákveðið svar.
definition	skilgreining	Skrifaðu skilgreininguna í bókina þína.
deliver	afhenda	Þau afhenda mat heim til okkar.
departure	brottför	Brottfarartíminn breyttist.
despite	þrátt fyrir	Þrátt fyrir rigninguna fórum við í göngu.
destination	áfangastaður	París var lokáfangastaður þeirra.
determine	ákvarða	Prófin ákvarða stig þitt.
determined	ákveðinn	Hún var ákveðin í að ná árangri.
development	þróun	Þróun borgarinnar var hröð.
diagram	skýringarmynd	Teiknaðu einfalda skýringarmynd.
diamond	demantur	Hringurinn var með lítinn demant.
difficulty	erfiðleiki	Hann átti í erfiðleikum með að opna dyrnar.
directly	beint	Vinsamlegast talaðu beint við mig.
dirt	óhreinindi	Skórnir hans voru þaktir óhreinindum.
disadvantage	ókostur	Langa ferðin er ókostur.
disappointed	vonsvikinn	Hún var vonsvikin yfir niðurstöðunni.
disappointing	vonbrigðavaldandi	Endirinn var vonbrigðavaldandi.
discount	afsláttur	Nemendur fá afslátt hér.
dislike	líka ekki	Mér líkar ekki mjög há tónlist.
divide	skipta	Skiptu kökunni í bita.
documentary	heimildarmynd	Við horfðum á heimildarmynd um geiminn.
donate	gefa	Margir gefa gömul föt.
doubt	vafi	Ég hef engan vafa um þetta.
dressed	klæddur	Hún var klædd í svart.
drum	tromma	Tromman hljómaði um herbergið.
drunk	drukkinn	Ökumaðurinn var drukkinn.
due	á skilum	Skýrslunni á að skila á morgun.
dust	ryk	Ryk huldi gömlu bækurnar.
duty	skylda	Það er skylda mín að hjálpa.
earthquake	jarðskjálfti	Jarðskjálftinn skemmdi brúna.
eastern	austur-	Austurströndin er vindasöm.
economic	efnahagslegur	Landið stendur frammi fyrir efnahagslegum vandamálum.
economy	hagkerfi	Hagkerfið óx á þessu ári.
edge	brún	Stattu frá brúninni.
editor	ritstjóri	Ritstjórinn fór yfir greinina.
educate	mennta	Skólar mennta ungt fólk.
educated	menntaður	Hún er mjög menntuð.
educational	fræðandi	Leikurinn er fræðandi.
effective	áhrifaríkur	Lyfið er áhrifaríkt.
effectively	áhrifaríkt	Hún útskýrði regluna áhrifaríkt.
effort	átak	Átak þitt breytti miklu.
election	kosningar	Úrslit kosninganna voru jöfn.
element	þáttur	Traust er mikilvægur þáttur.
embarrassed	vandræðalegur	Hann varð vandræðalegur eftir fallið.
embarrassing	vandræðalegt	Þetta voru vandræðaleg mistök.
emergency	neyðartilvik	Í neyðartilviki skaltu hringja í þetta númer.
emotion	tilfinning	Ótti er sterk tilfinning.
employment	atvinnuþátttaka	Atvinnuþátttaka jókst í þessum mánuði.
encourage	hvetja	Kennarar hvetja nemendur til að lesa.
enemy	óvinur	Löndin tvö voru óvinir.
engaged	trúlofaður	Þau trúlofuðust síðasta vor.
engineering	verkfræði	Hún lærir verkfræði í háskóla.
entertain	skemmta	Söngvarinn skemmtir gestunum.
entertainment	skemmtun	Borgin býður upp á kvöldskemmtun.
entrance	inngangur	Hittu mig við innganginn.
entry	aðgangur	Aðgangur er ókeypis fyrir börn.
environmental	umhverfis-	Við ræddum umhverfisvandamál.
episode	þáttur	Síðasti þátturinn var spennandi.
equal	jafn	Þau fá jöfn laun.
equally	jafnt	Vinnunni er skipt jafnt.
escape	flýja	Fangarnir reyndu að flýja.
essential	nauðsynlegur	Vatn er nauðsynlegt fyrir líf.
eventually	að lokum	Að lokum fundum við hótelið.
examine	skoða	Læknirinn skoðaði höndina mína.
exchange	skipti	Við gerðum skipti í búðinni.
excitement	spenna	Leikurinn var fullur af spennu.
exhibition	sýning	Listsýningin opnar á morgun.
expand	stækka	Fyrirtækið ætlar að stækka.
expected	væntanlegur	Væntanlegur kostnaður er mikill.
expedition	leiðangur	Leiðangurinn fór yfir eyðimörkina.
experienced	reyndur	Hún er reynd hjúkrunarkona.
explode	springa	Flaskan getur sprungið í hita.
explore	kanna	Við könnuðum gamla bæinn.
explosion	sprenging	Sprengingin braut nokkra glugga.
export	útflutningur	Kaffi er mikilvægur útflutningur.
fairly	frekar	Prófið var frekar auðvelt.
familiar	kunnuglegur	Andlit hans virtist kunnuglegt.
fancy	langa í	Langar þig í kaffi?
fascinating	heillandi	Sagan var heillandi.
fashionable	tískulegur	Þessir skór eru tískulegir.
fasten	festa	Festu öryggisbeltið.
favour	greiði	Geturðu gert mér greiða?
fence	girðing	Girðingin umlykur garðinn.
fighting	bardagi	Bardaginn lauk í dögun.
file	skrá	Vistaðu skrána áður en þú lokar.
financial	fjárhagslegur	Hún þarf fjárhagslega ráðgjöf.
fitness	líkamsrækt	Hlaup bæta líkamsrækt þína.
fixed	fastur	Verðið er fast.
flag	fáni	Fáninn blakti yfir skólanum.
flood	flóð	Flóðið skemmdi mörg heimili.
flour	hveiti	Bættu hveiti í skálina.
flow	flæða	Áin flæðir í gegnum bæinn.
fold	brjóta	Brjóttu pappírinn í tvennt.
folk	þjóðlagatónlist	Þjóðlagatónlist fyllti salinn.
force	afl	Vindurinn hafði mikið afl.
forever	að eilífu	Ég mun muna þetta að eilífu.
frame	rammi	Myndin þarf ramma.
freeze	frjósa	Vatn frýs á nóttunni.
frequently	oft	Hún heimsækir foreldra sína oft.
friendship	vinátta	Vinátta þeirra entist í mörg ár.
frighten	hræða	Há hljóð hræða barnið.
frightened	hræddur	Barnið virtist hrætt.
frightening	ógnvekjandi	Stormurinn var ógnvekjandi.
frozen	frosinn	Vatnið var frosið.
fry	steikja	Steiktu laukinn í fimm mínútur.
fuel	eldsneyti	Bíllinn þarf meira eldsneyti.
function	virkni	Þessi hnappur hefur eina virkni.
fur	feldur	Kötturinn er með mjúkan feld.
garage	bílskúr	Bíllinn er í bílskúrnum.
gather	safnast	Við söfnuðumst í kringum borðið.
generally	almennt	Hún kemur almennt snemma.
generation	kynslóð	Hver kynslóð stendur frammi fyrir nýjum vandamálum.
generous	örlátur	Hún er örlát á tíma sinn.
gentle	mildur	Notaðu milda rödd.
gentleman	herramaður	Herramaðurinn opnaði dyrnar.
ghost	draugur	Sagan nefnir draug.
giant	risastór	Risastór skjár fyllti sviðið.
glad	glaður	Ég er glaður að þú komst.
global	alþjóðlegur	Loftslagsbreytingar eru alþjóðlegt vandamál.
glove	hanski	Ég týndi einum hanska.
goods	vörur	Vörurnar komu seint.
grade	einkunn	Hún fékk háa einkunn.
graduate	útskrifaður nemandi	Hann er nýlega útskrifaður nemandi.
grain	korn	Hrísgrjónakorn féll á gólfið.
grateful	þakklátur	Ég er þakklátur fyrir stuðninginn þinn.
growth	vöxtur	Plantan sýndi stöðugan vöxt.
guard	vörður	Vörðurinn athugaði miðana okkar.
guilty	sekur	Hann fann til sektar fyrir lygina.
hang	hengja	Hengdu kápuna hér.
happiness	hamingja	Peningar geta ekki keypt hamingju.
hardly	varla	Ég heyrði varla í þér.
headline	fyrirsögn	Fyrirsögnin vakti athygli mína.
heating	hitun	Hitunin hætti að virka.
heavily	mikið	Það rigndi mikið alla nóttina.
helicopter	þyrla	Þyrla lenti nálægt.
highlight	leggja áherslu á	Vinsamlegast leggðu áherslu á aðalhugmyndina.
highly	mjög	Hún er mjög virt.
hire	leigja	Við þurfum að leigja bíl.
historic	sögulegur	Við heimsóttum sögulega byggingu.
historical	sögulegur	Henni líkar sögulegar skáldsögur.
honest	heiðarlegur	Vinsamlegast gefðu heiðarlegt svar.
horrible	hræðilegur	Lyktin var hræðileg.
horror	hryllingur	Honum líkar hryllingsmyndir.
host	gestgjafi	Gestgjafinn heilsaði hverjum gesti.
