source_headword	TE	example_TE
purely	పూర్తిగా	ఎంపిక పూర్తిగా ఆచరణాత్మకమైనది.
pursuit	అన్వేషణ	అతను న్యాయం కోసం తన అన్వేషణను కొనసాగించాడు.
puzzle	పజిల్	పజిల్ పరిష్కరించడానికి ఒక గంట పట్టింది.
questionnaire	ప్రశ్నావళి	దయచేసి ప్రశ్నావళిని పూర్తి చేయండి.
racial	జాతిపరమైన	ఈ నివేదిక జాతిపరమైన అసమానతలను చర్చించింది.
racism	జాత్యహంకారం	జాత్యహంకారం సమాజాలకు హాని చేస్తుంది.
racist	జాత్యహంకార	ఆ వ్యాఖ్య జాత్యహంకారంతో కూడుకున్నది.
radiation	రేడియేషన్	రేడియేషన్ కణాలను దెబ్బతీస్తుంది.
rail	రెయిల్	మెట్ల మీద ఉన్న రెయిల్‌ను పట్టుకోండి.
random	యాదృచ్ఛిక	కంప్యూటర్ ఒక యాదృచ్ఛిక సంఖ్యను ఎంచుకుంది.
rat	ఎలుక	చెత్త కుండీల వెనుక ఒక ఎలుక పరిగెత్తింది.
rating	రేటింగ్	ఈ హోటల్ కు మంచి రేటింగ్ ఉంది.
reasonably	సహేతుకంగా	గది ఒక మోస్తరుగా శుభ్రంగా ఉంది.
rebuild	పునర్నిర్మించడం	వారు వంతెనను పునర్నిర్మిస్తారు.
receiver	రిసీవర్	రిసీవర్ బంతిని పట్టుకున్నాడు.
recession	మాంద్యం	ఆర్థిక మాంద్యం ఖర్చులను తగ్గించింది.
reckon	భావించడం	రైలు ఆలస్యంగా వస్తుందని నేను అనుకుంటున్నాను.
recognition	గుర్తింపు	ఆమె చేసిన పనికి గుర్తింపు లభించింది.
recovery	కోలుకోవడం	కోలుకోవడానికి చాలా వారాలు పట్టింది.
recruit	నియమించుకోవడం	కంపెనీ ఇంజనీర్లను నియమించుకుంటుంది.
recruitment	నియామకం	నియామకాలు వచ్చే సోమవారం ప్రారంభమవుతాయి.
referee	రిఫరీ	రిఫరీ మ్యాచ్‌ను ఆపాడు.
refugee	శరణార్థి	శరణార్థికి సురక్షితమైన ఇల్లు దొరికింది.
registration	నమోదు	నమోదు ప్రక్రియ శుక్రవారంతో ముగుస్తుంది.
regulate	నియంత్రించడం	చట్టం ఉద్గారాలను నియంత్రిస్తుంది.
reinforce	బలోపేతం చేయడం	అదనపు కిరణాలు పైకప్పును పటిష్టం చేస్తాయి.
relieve	ఉపశమనం కలిగించడం	మందు నొప్పి నుండి ఉపశమనం కలిగిస్తుంది.
relieved	ఉపశమనం పొందిన	ఫోన్ మాట్లాడిన తర్వాత ఆమెకు ఉపశమనం కలిగింది.
remarkable	విశేషమైన	ఆ కోలుకోవడం విశేషమైనది.
remarkably	ఆశ్చర్యకరంగా	అతను ఆశ్చర్యకరంగా చాలా త్వరగా కోలుకున్నాడు.
reporting	రిపోర్టింగ్	ఖచ్చితమైన రిపోర్టింగ్ ముఖ్యం.
resign	రాజీనామా చేయడం	మేనేజర్ రేపు రాజీనామా చేస్తారు.
resolution	రిజల్యూషన్	స్క్రీన్ అధిక రిజల్యూషన్‌ను కలిగి ఉంది.
restore	పునరుద్ధరించడం	కార్మికులు పాత పెయింటింగ్‌ను పునరుద్ధరిస్తున్నారు.
restrict	పరిమితం చేయడం	నిబంధనలు పార్కింగ్‌ను పరిమితం చేస్తాయి.
restriction	ఆంక్ష	పరిమితి రేపటితో ముగుస్తుంది.
retail	రిటైల్	రిటైల్ అమ్మకాలు పెరిగాయి.
retirement	పదవీ విరమణ	ఆమె తన పదవీ విరమణను జాగ్రత్తగా ప్లాన్ చేసుకుంది.
revenue	ఆదాయం	టిక్కెట్ల ద్వారా వచ్చిన ఆదాయం మరమ్మతులకు చెల్లించబడింది.
revision	పునశ్చరణ	పరీక్షకు ముందు పునశ్చరణ సహాయపడింది.
ridiculous	హాస్యాస్పదమైన	ఆ ధర హాస్యాస్పదంగా ఉంది.
risky	ప్రమాదకరమైన	ఆ ప్రణాళిక ప్రమాదకరంగా అనిపించింది.
rival	ప్రత్యర్థి	మా ప్రత్యర్థి కొత్త దుకాణాన్ని తెరిచాడు.
rob	దోచుకోవడం	ఆ వ్యక్తులు బ్యాంకును దోచుకోవడానికి ప్రయత్నించారు.
robbery	దోపిడీ	దోపిడీ రాత్రి పూట జరిగింది.
rocket	రాకెట్	రాకెట్ విజయవంతంగా ప్రయోగించబడింది.
romance	శృంగారం	ఈ నవలలో రొమాన్స్ ఉంది.
rose	గులాబీ	కంచె పక్కన ఒక ఎర్ర గులాబీ పెరిగింది.
roughly	సుమారుగా	సుమారు ఇరవై మంది హాజరయ్యారు.
ruin	పాడుచేయడం	వర్షం పిక్నిక్‌ను పాడుచేయవచ్చు.
satisfaction	సంతృప్తి	కస్టమర్ సంతృప్తి మెరుగుపడింది.
scandal	కుంభకోణం	కుంభకోణం అతని కెరీర్‌ను దెబ్బతీసింది.
scare	భయపెట్టడం	ఆ పెద్ద శబ్దం నాకు భయం కలిగించింది.
scenario	దృశ్యం	చెత్త పరిస్థితి ఎదురయ్యే అవకాశం తక్కువ.
scholar	పండితుడు	ఆ పండితుడు ప్రాచీన గ్రంథాలను అధ్యయనం చేశాడు.
scholarship	స్కాలర్‌షిప్	ఆమె స్కాలర్‌షిప్ గెలుచుకుంది.
scratch	గీత	పిల్లి ఒక గీతను పెట్టింది.
screening	స్క్రీనింగ్	ఈ ఆసుపత్రి క్యాన్సర్ స్క్రీనింగ్‌ను అందిస్తుంది.
seeker	అన్వేషకుడు	ఉద్యోగాన్వేషకుడు దరఖాస్తులను పంపాడు.
seminar	సెమినార్	సెమినార్ తొమ్మిది గంటలకు ప్రారంభమవుతుంది.
settler	స్థిరపడినవాడు	స్థిరపడినవాడు ఒక చిన్న వ్యవసాయ క్షేత్రాన్ని నిర్మించాడు.
severely	తీవ్రంగా	తుఫాను రహదారులను తీవ్రంగా దెబ్బతీసింది.
sexy	సెక్సీ	ఆ దుస్తులు ఆకర్షణీయంగా పరిగణించబడ్డాయి.
shocking	దిగ్భ్రాంతికరమైన	ఆ వార్త దిగ్భ్రాంతికరమైనది.
shore	తీరం	మేము తీరం వెంబడి నడిచాము.
shortage	కొరత	నగరంలో నీటి కొరత ఏర్పడింది.
shortly	కొద్దిసేపట్లో	మధ్యాహ్నం అయిన కొద్దిసేపటికే బస్సు వచ్చింది.
short-term	స్వల్పకాలిక	ఈ ప్రణాళిక స్వల్పకాలిక ప్రయోజనాలను కలిగి ఉంది.
sibling	తోబుట్టువు	ప్రతి తోబుట్టువుకు బహుమతి లభించింది.
signature	సంతకం	దయచేసి మీ సంతకాన్ని జోడించండి.
significance	ప్రాముఖ్యత	ఈ ఆవిష్కరణకు గొప్ప ప్రాముఖ్యత ఉంది.
skilled	నైపుణ్యం గల	నైపుణ్యం గల కార్మికులు పైకప్పును మరమ్మతు చేశారు.
slogan	నినాదం	ప్రచారం ఒక సాధారణ నినాదాన్ని ఉపయోగించింది.
so-called	అని పిలవబడే	నిపుణుడని పిలవబడే వ్యక్తి తప్పులు చేశాడు.
somehow	ఎలాగోలా	ఎలాగోలా, తాళాలు మాయమయ్యాయి.
sometime	ఎప్పుడైనా	వచ్చే వారం ఎప్పుడైనా మమ్మల్ని సందర్శించండి.
sophisticated	అధునాతనమైన	ఆ సాఫ్ట్‌వేర్ అధునాతనమైనది.
spare	అదనపు	మేము ఒక అదనపు కీని ఉంచుకుంటాము.
specialize	నైపుణ్యం సాధించడం	వైద్యులు వివిధ రంగాలలో నైపుణ్యం సాధిస్తారు.
specify	పేర్కొనడం	దయచేసి మీరు వచ్చే సమయాన్ని పేర్కొనండి.
spectacular	అద్భుతమైన	బాణసంచా అద్భుతంగా ఉంది.
spectator	ప్రేక్షకుడు	ప్రతి ప్రేక్షకుడికి ఒక ప్రోగ్రామ్ లభించింది.
speculate	ఊహించడం	నిపుణులు కారణం గురించి ఊహించారు.
speculation	ఊహాగానం	ఆ వ్యాసం ఊహాగానాలను ప్రోత్సహించింది.
spice	మసాలా	ఒకేసారి ఒక మసాలాను మాత్రమే జోడించండి.
spill	చిందించడం	జ్యూస్ చిందించవద్దు.
spite	ఉన్నప్పటికీ	సమస్యలు ఉన్నప్పటికీ అతను విజయం సాధించాడు.
spoil	పాడుచేయడం	ఎక్కువ ఉప్పు సూప్‌ను పాడుచేస్తుంది.
spokesman	అధికార ప్రతినిధి	అధికార ప్రతినిధి ప్రశ్నలకు సమాధానమిచ్చాడు.
spokesperson	అధికార ప్రతినిధి	అధికార ప్రతినిధి ఒక ప్రకటన చదివారు.
spokeswoman	అధికార ప్రతినిధి	మహిళా అధికార ప్రతినిధి పత్రికలతో మాట్లాడారు.
sponsorship	స్పాన్సర్‌షిప్	జట్టుకు స్పాన్సర్‌షిప్ అవసరం.
sporting	క్రీడా	నగరం క్రీడా కార్యక్రమాలకు ఆతిథ్యం ఇస్తుంది.
stall	స్టాల్	మార్కెట్ స్టాల్ పండ్లను అమ్ముతుంది.
stance	వైఖరి	మంత్రి తన వైఖరిని మార్చుకున్నారు.
starve	ఆకలితో మాడటం	ఆహారం లేకుండా, జంతువులు ఆకలితో అలమటించవచ్చు.
steadily	క్రమంగా	కంపెనీ క్రమంగా అభివృద్ధి చెందింది.
steam	ఆవిరి	సూప్ నుండి ఆవిరి వచ్చింది.
stimulate	ప్రేరేపించడం	ప్రకాశవంతమైన రంగులు ఆసక్తిని ప్రేరేపిస్తాయి.
