source_headword	TH	example_TH
flood	น้ำท่วม	น้ำท่วมทำให้บ้านหลายหลังเสียหาย.
flour	แป้ง	เติมแป้งลงในชาม.
flow	ไหล	แม่น้ำไหลผ่านเมือง.
fold	พับ	พับกระดาษครึ่งหนึ่ง.
folk	พื้นบ้าน	ดนตรีพื้นบ้านดังทั่วห้องโถง.
force	แรง	ลมมีแรงมาก.
forever	ตลอดไป	ฉันจะจดจำสิ่งนี้ตลอดไป.
frame	กรอบ	รูปถ่ายต้องการกรอบ.
freeze	แข็งตัว	น้ำจะแข็งตัวในคืนนี้.
frequently	บ่อยครั้ง	เขาไปเยี่ยมพ่อแม่บ่อยครั้ง.
friendship	มิตรภาพ	มิตรภาพของพวกเขายาวนานหลายปี.
frighten	ทำให้กลัว	เสียงดังทำให้ทารกกลัว.
frightened	ตกใจกลัว	เด็กดูตกใจกลัว.
frightening	น่ากลัว	พายุน่ากลัว.
frozen	แข็งเป็นน้ำแข็ง	ทะเลสาบแข็งเป็นน้ำแข็ง.
fry	ทอด	ทอดหัวหอมห้านาที.
fuel	เชื้อเพลิง	รถต้องการเชื้อเพลิงเพิ่ม.
function	หน้าที่	ปุ่มนี้มีหน้าที่เดียว.
fur	ขนสัตว์	แมวมีขนนุ่ม.
garage	โรงรถ	รถอยู่ในโรงรถ.
gather	รวมตัว	เรารวมตัวรอบโต๊ะ.
generally	โดยทั่วไป	โดยทั่วไปเธอมาถึงเร็ว.
generation	รุ่น; เจเนอเรชัน	แต่ละรุ่นเผชิญปัญหาใหม่.
generous	ใจกว้าง	เขาใจกว้างกับเวลาของเขา.
gentle	อ่อนโยน	ใช้น้ำเสียงอ่อนโยน.
gentleman	สุภาพบุรุษ	สุภาพบุรุษคนนั้นเปิดประตู.
ghost	ผี	เรื่องราวกล่าวถึงผี.
giant	ยักษ์; ใหญ่มาก	จอยักษ์เต็มเวที.
glad	ดีใจ	ฉันดีใจที่คุณมา.
global	ทั่วโลก	การเปลี่ยนแปลงสภาพภูมิอากาศเป็นปัญหาทั่วโลก.
glove	ถุงมือ	ฉันทำถุงมือหายข้างหนึ่ง.
goods	สินค้า	สินค้ามาถึงช้า.
grade	คะแนน	เธอได้คะแนนสูง.
graduate	บัณฑิต	เขาเป็นบัณฑิตใหม่.
grain	เมล็ด	เมล็ดข้าวตกลงมา.
grateful	รู้สึกขอบคุณ	ฉันรู้สึกขอบคุณสำหรับการสนับสนุนของคุณ.
growth	การเติบโต	ต้นไม้แสดงการเติบโตอย่างมั่นคง.
guard	ยาม	ยามตรวจตั๋วของเรา.
guilty	รู้สึกผิด	เขารู้สึกผิดที่โกหก.
hang	แขวน	แขวนเสื้อโค้ตของคุณไว้ที่นี่.
happiness	ความสุข	เงินซื้อความสุขไม่ได้.
hardly	แทบจะไม่	ฉันแทบจะไม่ได้ยินคุณ.
headline	พาดหัวข่าว	พาดหัวข่าวดึงดูดความสนใจของฉัน.
heating	เครื่องทำความร้อน	เครื่องทำความร้อนหยุดทำงาน.
heavily	อย่างหนัก	ฝนตกหนักตลอดคืน.
helicopter	เฮลิคอปเตอร์	เฮลิคอปเตอร์ลงจอดใกล้ๆ.
highlight	เน้น	กรุณาเน้นใจความหลัก.
highly	อย่างมาก	เธอได้รับความเคารพอย่างมาก.
hire	เช่า	เราต้องเช่ารถ.
historic	มีความสำคัญทางประวัติศาสตร์	เราไปเยี่ยมอาคารที่มีความสำคัญทางประวัติศาสตร์.
historical	ทางประวัติศาสตร์	เธอชอบนวนิยายทางประวัติศาสตร์.
honest	ซื่อสัตย์	กรุณาให้คำตอบที่ซื่อสัตย์.
horrible	แย่มาก	กลิ่นนั้นแย่มาก.
horror	สยองขวัญ	เขาชอบภาพยนตร์สยองขวัญ.
host	เจ้าภาพ	เจ้าภาพต้อนรับแขกทุกคน.
