source_headword	display_translation	example_translation
explanation	คำอธิบาย	คำอธิบายของเธอชัดเจน.
express	แสดงออก;แสดงความคิดเห็น	โปรดแสดงความคิดเห็นของคุณ.
expression	สำนวน;การแสดงออก	สำนวนนี้พบบ่อย.
extreme	สุดขีด;รุนแรง	ความร้อนรุนแรงมาก.
extremely	อย่างยิ่ง;มากๆ	มันหนาวมากๆ.
factor	ปัจจัย	ค่าใช้จ่ายเป็นปัจจัยหนึ่ง.
factory	โรงงาน	โรงงานปิดตอนห้าโมง.
fail	ล้มเหลว;สอบตก	ฉันไม่ได้ล้มเหลว.
fair	ยุติธรรม;เหมาะสม	ราคายุติธรรม.
fan	พัดลม;แฟน	เปิดพัดลม.
farming	การทำฟาร์ม;เกษตรกรรม	การทำฟาร์มเป็นงานหนัก.
fashion	แฟชั่น	แฟชั่นเปลี่ยนทุกปี.
fear	ความกลัว;กลัว	ความกลัวหยุดคนได้.
feature	คุณลักษณะ;ฟีเจอร์	โทรศัพท์นี้มีฟีเจอร์มีประโยชน์.
feed	ให้อาหาร;เลี้ยง	ให้อาหารแมวตอนนี้.
female	เพศหญิง;ผู้หญิง	นักกีฬาหญิงชนะ.
fiction	นิยาย;เรื่องแต่ง	เธออ่านนิยายตอนกลางคืน.
field	ทุ่ง;สาขา	ทุ่งนั้นสีเขียว.
fight	ต่อสู้;ทะเลาะ	พวกเขาทะเลาะกันมากเกินไป.
figure	รูป;ตัวเลข;บุคคล	ดูรูปนี้.
finally	ในที่สุด	ในที่สุดเราก็ถึงบ้าน.
finger	นิ้วมือ	นิ้วของฉันเจ็บ.
firstly	อย่างแรก;ประการแรก	อย่างแรกอ่านคำถาม.
fishing	การตกปลา	การตกปลาเป็นที่นิยมที่นี่.
fit	พอดี;เหมาะสม	รองเท้านี้พอดี.
fix	ซ่อม;แก้ไข	ซ่อมเก้าอี้ที่เสีย.
flu	ไข้หวัดใหญ่	ฉันเป็นไข้หวัดใหญ่.
flying	การบิน;บิน	การบินรวดเร็ว.
focus	จดจ่อ;โฟกัส	จดจ่อกับงานนี้.
following	ต่อไปนี้;ถัดไป	อ่านประโยคต่อไปนี้.
foreign	ต่างประเทศ;ต่างชาติ	เธอพูดภาษาต่างประเทศ.
forest	ป่า	ป่าเงียบ.
fork	ส้อม	ใช้ส้อม.
formal	เป็นทางการ	จดหมายนี้เป็นทางการ.
fortunately	โชคดีที่	โชคดีที่ไม่มีใครบาดเจ็บ.
forward	ไปข้างหน้า	เคลื่อนไปข้างหน้าอย่างช้าๆ.
fresh	สด;ใหม่	ขนมปังสด.
