source_headword	TE	example_TE
heal	నయమగు	విశ్రాంతి తీసుకోవడం వల్ల శరీరం నయమవుతుంది.
healthcare	ఆరోగ్య సంరక్షణ	ఈ సంవత్సరం ఆరోగ్య సంరక్షణ ఖర్చులు పెరిగాయి.
helmet	హెల్మెట్	బైక్‌పై హెల్మెట్ ధరించండి.
hence	అందువల్ల	అందువల్ల, మేము షెడ్యూల్‌ను మార్చాము.
herb	మూలిక	తులసి ఒక ఉపయోగకరమైన మూలిక.
hidden	దాచిన	తాళం చెవి మ్యాట్ కింద దాచబడింది.
highway	రహదారి	మంచు పడిన తర్వాత హైవే మూసివేయబడింది.
hilarious	అత్యంత హాస్యభరితమైన	ఆ సినిమా చాలా హాస్యభరితంగా ఉంది.
hip	తుంటి	ప్రాక్టీస్ సమయంలో ఆమె తుంటికి గాయమైంది.
historian	చరిత్రకారుడు	ఆ చరిత్రకారుడు పాత ఉత్తరాలను అధ్యయనం చేశాడు.
homeless	నిరాశ్రయులైన	ఆ ఆశ్రయం నిరాశ్రయులైన కుటుంబాలకు సహాయం చేస్తుంది.
honesty	నిజాయితీ	నిజాయితీ నమ్మకాన్ని పెంచుతుంది.
hook	కొక్కెం	ఆ కోటును కొక్కినికి వేలాడదీయండి.
hopefully	ఆశాజనకంగా	ఆశాజనకంగా, రైలు త్వరలో వస్తుంది.
hunger	ఆకలి	ఆకలి ఏకాగ్రతను ప్రభావితం చేస్తుంది.
hypothesis	పరికల్పన	ఆ ప్రయోగం పరికల్పనను పరీక్షించింది.
icon	చిహ్నం	ఈ రోజు యాప్ ఐకాన్ మారిపోయింది.
ID	గుర్తింపు కార్డు	రిసెప్షన్ వద్ద మీ గుర్తింపు కార్డును చూపించండి.
identical	ఒకేలా ఉన్న	కవలలు ఒకేలా ఉన్న జాకెట్లను ధరించారు.
illusion	భ్రమ	అద్దం ఒక భ్రమను సృష్టిస్తుంది.
immigration	వలస	గత సంవత్సరం వలస విధానం మారిపోయింది.
immune	రోగనిరోధక శక్తి గల	టీకా వేయడం వల్ల ప్రజలకు రోగనిరోధక శక్తి వస్తుంది.
implement	అమలు చేయు	పాఠశాల ఆ విధానాన్ని అమలు చేస్తుంది.
implication	సూచన	అంతరార్థం స్పష్టంగా ఉంది.
incentive	ప్రోత్సాహకం	బోనస్ కార్మికులకు ప్రోత్సాహకాన్ని ఇచ్చింది.
incorporate	చేర్చు	భోజనంలో మరిన్ని కూరగాయలను చేర్చండి.
incorrect	తప్పు	ఆ సమాధానం తప్పు.
independence	స్వాతంత్ర్యం	దేశం స్వాతంత్ర్యాన్ని జరుపుకుంది.
index	సూచిక	ఆ విషయం కోసం సూచికను తనిఖీ చేయండి.
indication	సూచన	ఆ చిరునవ్వు ఉపశమనానికి ఒక సూచన.
inevitable	అనివార్యమైన	కొంత ఆలస్యం అనివార్యమైంది.
inevitably	అనివార్యంగా	కొరత తర్వాత అనివార్యంగా ధరలు పెరిగాయి.
infer	ఊహించు	మనం సందర్భం నుండి సమాధానాన్ని ఊహించవచ్చు.
inflation	ద్రవ్యోల్బణం	ద్రవ్యోల్బణం ఆహార ధరలను పెంచింది.
info	సమాచారం	వెబ్‌సైట్‌లో ఉపయోగకరమైన సమాచారం ఉంది.
infrastructure	మౌలిక సదుపాయాలు	తుఫాను స్థానిక మౌలిక సదుపాయాలను దెబ్బతీసింది.
inhabitant	నివాసి	ప్రతి నివాసికి స్వచ్ఛమైన నీరు లభించింది.
inherit	వారసత్వంగా పొందు	ఆమెకు కుటుంబ ఇల్లు వారసత్వంగా వస్తుంది.
ink	సిరా	ప్రింటర్‌కు నల్ల సిరా అవసరం.
innovation	ఆవిష్కరణ	ఆవిష్కరణ పరిశ్రమను ముందుకు నడిపిస్తుంది.
innovative	వినూత్నమైన	ఆ సంస్థ ఒక వినూత్నమైన ఉత్పత్తిని ప్రారంభించింది.
input	ఇన్‌పుట్	మేనేజర్ సూచనల కోసం అడిగాడు.
insert	చొప్పించు	కార్డును మిషన్‌లో పెట్టండి.
inspector	ఇన్స్పెక్టర్	ఇన్స్పెక్టర్ భవనాన్ని తనిఖీ చేశాడు.
installation	సంస్థాపన	ఇన్‌స్టాలేషన్‌కు రెండు గంటలు పట్టింది.
instant	తక్షణ	ఆ యాప్ తక్షణ ప్రత్యుత్తరాన్ని పంపింది.
instantly	తక్షణమే	స్క్రీన్ తక్షణమే ఆన్ అయింది.
integrate	సమీకృతం చేయు	సాఫ్ట్‌వేర్ కొత్త సాధనాలను సమీకృతం చేయగలదు.
intellectual	మేధోపరమైన	ఆ చర్చ మేధోపరమైనది కానీ స్నేహపూర్వకంగా జరిగింది.
interact	పరస్పరం వ్యవహరించు	సమూహ పని సమయంలో విద్యార్థులు పరస్పరం మాట్లాడుకుంటారు.
interaction	సంభాషణ	వారి సంభాషణ మర్యాదపూర్వకంగా జరిగింది.
interpretation	వివరణ	ఆ పద్యం గురించి ఆమె వివరణ కొత్తగా ఉంది.
interval	విరామం	ప్రదర్శనల మధ్య ఒక చిన్న విరామం ఉంది.
invade	దండెత్తు	సైన్యం ఆ ద్వీపంపై దండెత్తడానికి ప్రయత్నించింది.
invasion	దండయాత్ర	దండయాత్ర వల్ల ఎన్నో పట్టణాలు దెబ్బతిన్నాయి.
investor	పెట్టుబడిదారుడు	ఆ పెట్టుబడిదారుడు కొత్త స్టార్టప్‌కు నిధులు సమకూర్చాడు.
isolate	వేరుచేయు	తీవ్రమైన ఇన్ఫెక్షన్లు ఉన్న రోగులను వైద్యులు వేరుచేస్తారు.
isolated	వేరుచేయబడిన	మంచు వల్ల ఆ గ్రామం వేరుచేయబడింది.
jail	జైలు	దొంగ జైలుకు వెళ్ళాడు.
jet	జెట్	జెట్ విమానం మధ్యాహ్నం ల్యాండ్ అయింది.
joint	ఉమ్మడి	వారు ఉమ్మడి ప్రాజెక్టును ప్రకటించారు.
journalism	జర్నలిజం	జర్నలిజానికి ఖచ్చితమైన వాస్తవాలు అవసరం.
jury	జ్యూరీ	జ్యూరీ ఒక నిర్ణయానికి వచ్చింది.
kit	కిట్	రిపేర్ కిట్‌లో స్క్రూలు ఉన్నాయి.
ladder	నిచ్చెన	ఆ నిచ్చెన గోడకు ఆనుకుని ఉంది.
landing	ల్యాండింగ్	విమానం సజావుగా ల్యాండ్ అయింది.
lane	లేన్	కుడి లేన్‌లోనే ఉండండి.
lately	ఇటీవల	నేను ఇటీవల సరిగా నిద్రపోలేదు.
leaflet	కరపత్రం	ఈ కరపత్రం సేవ గురించి వివరిస్తుంది.
legend	పురాణ కథ	ఈ పురాణ కథ దాచిన నగరం గురించి చెబుతుంది.
lens	కటకం	కెమెరా లెన్స్‌ను జాగ్రత్తగా శుభ్రం చేయండి.
lifetime	జీవితకాలం	అతడు జీవితకాలం పాటు డబ్బు ఆదా చేశాడు.
lighting	వెలుతురు	మంచి వెలుతురు గదిని మెరుగుపరుస్తుంది.
likewise	అదేవిధంగా	ఆమె నవ్వింది; అతను కూడా అదేవిధంగా చేశాడు.
limitation	పరిమితి	ఆ ప్రణాళికలో ఒక పరిమితి ఉంది.
literally	అక్షరాలా	ఆమె అక్షరాలా బస్సుకు పరిగెత్తింది.
literary	సాహిత్య	ఆ పండుగ సాహిత్య పనిని గౌరవిస్తుంది.
litre	లీటరు	ఒక లీటరు పాలు కొనండి.
litter	చెత్త	చెత్త వేయకండి.
logo	లోగో	లోగో ప్రతి పేజీలో కనిపిస్తుంది.
lottery	లాటరీ	అతడు ఒక చిన్న లాటరీ బహుమతిని గెలుచుకున్నాడు.
loyal	నమ్మకమైన	ఆ కుక్క తన యజమానికి నమ్మకంగా ఉంది.
lyric	గీతం	ఆ గీతం ప్రధాన ఆలోచనను పునరావృతం చేసింది.
magnificent	అద్భుతమైన	ఆ భవనం అద్భుతంగా కనిపించింది.
make-up	మేకప్	ఆమె సాధారణ మేకప్ వేసుకుంది.
making	తయారీ	ఆ సినిమా రూపకల్పన కష్టంగా జరిగింది.
manufacture	తయారు చేయు	ఫ్యాక్టరీ ఫోన్లను తయారు చేస్తుంది.
manufacturing	తయారీ రంగం	స్థానికంగా తయారీ ఉద్యోగాలు పెరిగాయి.
marathon	మారథాన్	ఆమె మారథాన్ పూర్తి చేసింది.
margin	అంచు	అంచులో నోట్స్ రాయండి.
marker	మార్కర్	లేబుల్ కోసం మార్కర్ వాడండి.
martial	యుద్ధ సంబంధిత	అతడు మార్షల్ ఆర్ట్స్ నేర్చుకుంటున్నాడు.
mate	స్నేహితుడు	నిన్న నా పాత స్కూల్ స్నేహితుడు కాల్ చేశాడు.
mayor	మేయర్	మేయర్ గ్రంథాలయాన్ని ప్రారంభించారు.
mechanic	మెకానిక్	మెకానిక్ బస్సును బాగుచేశాడు.
mechanical	యాంత్రిక	ఆ గడియారంలో ఒక యాంత్రిక లోపం ఉంది.
mechanism	యంత్రాంగం	తాళం యంత్రాంగం చాలా సులభం.
medal	పతకం	ఆమె బంగారు పతకం గెలుచుకుంది.
medication	మందు	మందులను నీటితో వేసుకోండి.
membership	సభ్యత్వం	ఆన్‌లైన్‌లో జిమ్ సభ్యత్వం తక్కువ ఖర్చుతో వస్తుంది.
memorable	స్మరణీయమైన	ఆ ప్రయాణం స్మరణీయమైనది.
metaphor	రూపకాలంకారం	ఆ కవిత బలమైన రూపకాలంకారాన్ని ఉపయోగిస్తుంది.
miner	గని కార్మికుడు	గని కార్మికుడు భూమి అడుగున పనిచేశాడు.
miserable	దయనీయమైన	వర్షం పిక్నిక్‌ను దయనీయంగా మార్చింది.
mode	విధానం	కెమెరాను నైట్ మోడ్‌కు మార్చండి.
modest	నిరాడంబరమైన	వారు నిరాడంబరమైన ఇంట్లో నివసిస్తున్నారు.
monster	రాక్షసుడు	ఈ కథలో భయంకరమైన రాక్షసుడు ఉన్నాడు.
monthly	నెలవారీ	మేము నెలవారీగా అద్దె చెల్లిస్తాము.
monument	స్మారక కట్టడం	స్మారక కట్టడం నది దగ్గర ఉంది.
moreover	అంతేకాకుండా	అంతేకాకుండా, ఈ ప్రణాళిక డబ్బును ఆదా చేస్తుంది.
mortgage	తనఖా	వారు తనఖా కోసం దరఖాస్తు చేసుకున్నారు.
mosque	మసీదు	మసీదు మార్కెట్ దగ్గర ఉంది.
motion	కదలిక	సెన్సార్ కదలికను గుర్తిస్తుంది.
motivate	ప్రేరేపించడం	ప్రశంసలు విద్యార్థులను ప్రేరేపిస్తాయి.
motivation	ప్రేరణ	ఆమె ప్రేరణ బలంగా ఉంది.
moving	కదిలించే	ఆ ప్రసంగం కదిలించేలా ఉంది.
myth	పురాణగాథ	పురాణగాథ పర్వతం పేరును వివరిస్తుంది.
naked	నగ్నంగా	స్నానం తర్వాత శిశువు నగ్నంగా ఉంది.
nasty	అసహ్యకరమైన	ఆ గాయం అసహ్యకరంగా కనిపించింది.
navigation	దిశానిర్దేశం	యాప్ దిశానిర్దేశాన్ని మెరుగుపరుస్తుంది.
nearby	సమీపంలోని	సమీపంలోని కేఫ్ త్వరగా తెరుచుకుంటుంది.
necessity	ఆవశ్యకత	స్వచ్ఛమైన నీరు ఒక ఆవశ్యకత.
negotiate	చర్చలు జరపడం	వారు రేపు ఒప్పందం గురించి చర్చలు జరుపుతారు.
negotiation	చర్చలు	చర్చలు ఉదయం అంతా జరిగాయి.
neutral	తటస్థ	న్యాయమూర్తి తటస్థంగా ఉన్నారు.
newly	కొత్తగా	కొత్తగా వేసిన రంగుల తలుపు ప్రకాశవంతంగా కనిపించింది.
norm	ఆనవాయితీ	రిమోట్ పని ఆనవాయితీగా మారింది.
notebook	నోట్‌బుక్	మీ నోట్‌బుక్‌లో నోట్స్ రాయండి.
novelist	నవలా రచయిత	నవలా రచయిత్రి తన పుస్తకంపై సంతకం చేసింది.
nowadays	ఈ రోజుల్లో	ఈ రోజుల్లో, చాలా మంది ఆన్‌లైన్‌లో పనిచేస్తున్నారు.
nursing	నర్సింగ్	ఆమె నర్సింగ్ చదువుతోంది.
nutrition	పోషకాహారం	మంచి పోషకాహారం ఆరోగ్యానికి తోడ్పడుతుంది.
obesity	ఊబకాయం	ఊబకాయం ఆరోగ్య ప్రమాదాలను పెంచుతుంది.
observer	పరిశీలకుడు	పరిశీలకుడు ఫలితాలను నమోదు చేశాడు.
obstacle	అడ్డంకి	పడిపోయిన చెట్టు ఒక అడ్డంకిగా మారింది.
occupation	వృత్తి	దయచేసి ఇక్కడ మీ వృత్తిని రాయండి.
occupy	ఆక్రమించడం	ఆ కుటుంబం అపార్ట్‌మెంట్‌లో నివసిస్తుంది.
offender	నేరస్థుడు	నేరస్థుడు కోర్టులో క్షమాపణ చెప్పాడు.
ongoing	కొనసాగుతున్న	దర్యాప్తు కొనసాగుతోంది.
openly	బహిరంగంగా	ఆమె తన భయాల గురించి బహిరంగంగా మాట్లాడింది.
opera	ఒపెరా	మేము మిలన్‌లో ఒక ఒపెరా చూశాము.
operator	ఆపరేటర్	ఆపరేటర్ కాల్ కనెక్ట్ చేశాడు.
optimistic	ఆశావాద	ఆమె భవిష్యత్తు గురించి ఆశావాదంతో ఉంది.
orchestra	వాద్యబృందం	వాద్యబృందం మృదువుగా వాయించింది.
organic	సేంద్రీయ	వారు సేంద్రీయ కూరగాయలను కొనుగోలు చేశారు.
outfit	దుస్తులు	ఆమె దుస్తులు ఆ సందర్భానికి సరిపోయాయి.
output	ఉత్పత్తి	యంత్రం యొక్క ఉత్పత్తి పెరిగింది.
outstanding	అద్భుతమైన	అతని ప్రదర్శన అద్భుతంగా ఉంది.
overcome	అధిగమించడం	వారు కలిసి సమస్యలను అధిగమిస్తారు.
overnight	రాత్రిపూట	ప్యాకేజీ రాత్రిపూట చేరుకుంది.
overseas	విదేశాలలో	అతను విదేశాలలో ఉద్యోగం పొందాడు.
ownership	యాజమాన్యం	భూమి యాజమాన్యం మారింది.
oxygen	ఆక్సిజన్	మొక్కలు ఆక్సిజన్‌ను ఉత్పత్తి చేస్తాయి.
packet	ప్యాకెట్	ప్యాకెట్‌ను జాగ్రత్తగా తెరవండి.
palm	అరచేయి	నాణేన్ని మీ అరచేతిలో పట్టుకోండి.
panic	భయాందోళన	ప్రజలలో భయాందోళన వ్యాపించింది.
parade	కవాతు	కవాతు మధ్యాహ్నం ప్రారంభమైంది.
parallel	సమాంతర	రోడ్లు సమాంతరంగా ఉంటాయి.
participation	పాల్గొనడం	తరగతిలో పాల్గొనడం మెరుగుపడింది.
partnership	భాగస్వామ్యం	భాగస్వామ్యం రెండు సంస్థలకు సహాయపడింది.
part-time	పార్ట్-టైమ్	ఆమెకు పార్ట్-టైమ్ ఉద్యోగం దొరికింది.
passionate	అత్యంత ఆసక్తిగల	అతనికి సంగీతం పట్ల చాలా ఆసక్తి ఉంది.
password	పాస్‌వర్డ్	బలమైన పాస్‌వర్డ్‌ను ఎంచుకోండి.
patience	సహనం	చిన్న పిల్లలకు బోధించడానికి సహనం అవసరం.
pause	విరామం ఇవ్వడం	వీడియోను ఇప్పుడు ఆపండి.
peer	తోటివారు	తోటివారి ఒత్తిడి అతని ఎంపికపై ప్రభావం చూపింది.
penalty	జరిమానా	ఆటగాడికి జరిమానా విధించబడింది.
perceive	గ్రహించడం	ప్రజలు ప్రమాదాన్ని భిన్నంగా గ్రహిస్తారు.
perception	అవగాహన	ప్రమాదం పట్ల అతని అవగాహన మారింది.
permanently	శాశ్వతంగా	ఆ దుకాణం శాశ్వతంగా మూసివేయబడింది.
pill	మాత్ర	అల్పాహారం తర్వాత ఒక మాత్ర తీసుకోండి.
pity	జాలి	ఇది చాలా విచారకరం.
placement	అమరిక	సోఫాను ఉంచే విధానం ముఖ్యం.
portion	భాగం	చిన్న భాగం అన్నం వడ్డించండి.
potentially	సంభావ్యంగా	ఈ మార్పు సంభావ్యంగా ఉపయోగపడుతుంది.
precede	ముందు రావడం	నల్లని మేఘాలు తరచుగా వర్షానికి ముందు వస్తాయి.
precious	విలువైన	ఆ ఉంగరం విలువైనది.
precise	ఖచ్చితమైన	సూచనలు ఖచ్చితమైనవి.
precisely	ఖచ్చితంగా	దూరాన్ని ఖచ్చితంగా కొలవండి.
predictable	ఊహించదగిన	ముగింపు ఊహించదగినది.
preference	ప్రాధాన్యత	ఆమె టీ పట్ల ప్రాధాన్యతను వ్యక్తం చేసింది.
pride	గర్వం	పని పూర్తి చేసిన తర్వాత అతను గర్వంగా భావించాడు.
primarily	ప్రధానంగా	ఈ కోర్సు ప్రధానంగా ఆన్‌లైన్‌లో ఉంటుంది.
principal	ప్రిన్సిపాల్	ప్రిన్సిపాల్ కొత్త విద్యార్థులను పలకరించారు.
prior	ముందస్తు	మాకు ముందస్తు ఆమోదం కావాలి.
probability	సంభావ్యత	వర్షం వచ్చే సంభావ్యత ఎక్కువగా ఉంది.
probable	అవకాశం ఉన్న	ఈ రాత్రికి వర్షం వచ్చే అవకాశం ఉంది.
proceed	కొనసాగించడం	దయచేసి తదుపరి గదికి వెళ్లండి.
programming	ప్రోగ్రామింగ్	ప్రోగ్రామింగ్‌కు సాధన అవసరం.
progressive	ప్రగతిశీల	ఆ విధానం దాని కాలానికి ప్రగతిశీలమైనది.
prohibit	నిషేధించడం	నియమాలు ధూమపానాన్ని నిషేధిస్తాయి.
promising	ఆశాజనకమైన	ఫలితాలు ఆశాజనకంగా ఉన్నాయి.
promotion	పదోన్నతి	ఆమెకు పనిలో పదోన్నతి లభించింది.
prompt	తక్షణ	తక్షణ స్పందన సమయాన్ని ఆదా చేసింది.
proportion	నిష్పత్తి	పెద్ద సంఖ్యలో ప్రజలు అవును అని ఓటు వేశారు.
protein	ప్రోటీన్	బీన్స్‌లో ప్రోటీన్ ఉంటుంది.
protester	నిరసనకారుడు	నిరసనకారుడు ఒక బోర్డును పట్టుకున్నాడు.
psychological	మానసిక	ఆ ప్రమాదం మానసిక ఒత్తిడికి గురిచేసింది.
publicity	ప్రచారం	ఈ కార్యక్రమానికి ప్రచారం లభించింది.
publishing	ప్రచురణ	ఆమె ప్రచురణ రంగంలో పనిచేస్తోంది.
punk	పంక్	అక్కడ పంక్ సంగీతం ప్రజాదరణ పొందింది.
