source_headword	TE	example_TE
civic	పౌర	పౌర నాయకులు సమావేశానికి హాజరయ్యారు.
civilian	పౌరుడు	పౌరుల ఇళ్లు అనేకం దెబ్బతిన్నాయి.
clarity	స్పష్టత	రేఖాచిత్రం నివేదికకు స్పష్టతను జోడించింది.
clash	ఘర్షణ	ర్యాలీ తర్వాత ఘర్షణ ప్రారంభమైంది.
classification	వర్గీకరణ	వర్గీకరణ పరిమాణంపై ఆధారపడి ఉంటుంది.
cling	అంటిపెట్టుకుని ఉండు	తడి బట్టలు చర్మానికి అంటిపెట్టుకుని ఉంటాయి.
clinical	క్లినికల్	క్లినికల్ ట్రయల్ వచ్చే నెలలో ప్రారంభమవుతుంది.
closure	ముగింపు	కేసు తర్వాత కుటుంబం ఒక ముగింపును కోరుకుంది.
cluster	సమూహం	ఇళ్ల సమూహం సమీపంలో ఉంది.
coalition	సంకీర్ణ	సంకీర్ణ ప్రభుత్వం మెజారిటీని కోల్పోయింది.
coastal	తీరప్రాంత	తీరప్రాంత గ్రామాలు వరదలకు సిద్ధమయ్యాయి.
cocktail	కాక్‌టెయిల్	ఆమె ఒక పండ్ల కాక్‌టెయిల్ ఆర్డర్ చేసింది.
cognitive	అభిజ్ఞా	అభ్యాసంతో అభిజ్ఞా నైపుణ్యాలు మెరుగుపడతాయి.
coincide	ఏకీభవించు	పండుగ మరియు గ్రాడ్యుయేషన్ ఒకే సమయంలో జరుగుతాయి.
collaborate	సహకరించు	జట్లు సాఫ్ట్‌వేర్‌పై సహకరిస్తాయి.
collaboration	సహకారం	వారి సహకారం బలమైన ఫలితాలను ఇచ్చింది.
collective	సమిష్టి	ఈ నిర్ణయం ఒక సమిష్టి కృషి.
collision	ఢీకొనడం	ఢీకొనడం వల్ల హైవే మూసుకుపోయింది.
colonial	వలసవాద	ఈ భవనానికి వలసవాద వాస్తుశిల్పం ఉంది.
columnist	కాలమిస్ట్	కాలమిస్ట్ విధానాన్ని విమర్శించారు.
combat	పోరాటం	సైనికులు యుద్ధం కోసం శిక్షణ పొందారు.
commence	ప్రారంభమవుతుంది	వేడుక మధ్యాహ్నం ప్రారంభమవుతుంది.
commentary	వ్యాఖ్యానం	మ్యాచ్ వ్యాఖ్యానం ఉత్సాహంగా ఉంది.
commentator	వ్యాఖ్యాత	వ్యాఖ్యాత నిర్ణయాన్ని వివరించారు.
commerce	వాణిజ్యం	ఆన్‌లైన్ వాణిజ్యం వేగంగా పెరిగింది.
commissioner	కమిషనర్	కమిషనర్ కొత్త నిబంధనలను ప్రకటించారు.
commodity	సరుకు	గోధుమ ఒక ముఖ్యమైన సరుకు.
communist	కమ్యూనిస్ట్	కమ్యూనిస్ట్ పార్టీ సమావేశం నిర్వహించింది.
companion	తోడు	ఆమె కుక్క ఒక నమ్మకమైన తోడు.
comparable	పోల్చదగిన	రెండు నగరాలు పరిమాణంలో పోల్చదగినవి.
compassion	కరుణ	నర్సు ఎంతో కరుణ చూపింది.
compel	బలవంతం చేయడం	ఆధారాలు ప్రతిస్పందనను బలవంతం చేయవచ్చు.
compelling	ఆకట్టుకునే	డాక్యుమెంటరీ ఒక ఆకట్టుకునే వాదనను చేసింది.
compensate	పరిహారం చెల్లించడం	ప్రభావిత కస్టమర్లకు కంపెనీ పరిహారం చెల్లిస్తుంది.
compensation	పరిహారం	కార్మికులు న్యాయమైన పరిహారం డిమాండ్ చేశారు.
competence	సామర్థ్యం	ఈ పరీక్ష వృత్తిపరమైన సామర్థ్యాన్ని కొలుస్తుంది.
competent	సమర్థురాలైన	ఆమె సమర్థురాలైన ఇంజనీర్.
compile	సంకలనం చేయడం	పరిశోధకులు ఆసుపత్రుల నుండి డేటాను సంకలనం చేస్తారు.
complement	పూర్తి చేయడం	వైన్ భోజనానికి పరిపూర్ణతనిస్తుంది.
complexity	సంక్లిష్టత	ప్రాజెక్ట్ ఊహించని సంక్లిష్టతను కలిగి ఉంది.
compliance	పాటించడం	ఆడిట్ చట్టపరమైన సమ్మతిని తనిఖీ చేసింది.
complication	సమస్య	శస్త్రచికిత్సలో ఒక సమస్య వచ్చింది.
comply	పాటించడం	కంపెనీలు నిబంధనలను పాటించాలి.
composition	కూర్పు	ఈ కూర్పులో వయోలిన్ మరియు పియానో ఉన్నాయి.
compromise	రాజీ	రాజీ రెండు పక్షాలను సంతృప్తిపరిచింది.
compute	లెక్కించడం	ప్రోగ్రామ్ మొత్తం లెక్కించగలదు.
conceal	దాచడం	అతను నష్టాన్ని దాచడానికి ప్రయత్నించాడు.
concede	అంగీకరించడం	మంత్రి ఓటమిని అంగీకరించడానికి నిరాకరించారు.
conceive	ఊహించడం	వారు మెరుగైన ప్రణాళికను ఊహించలేకపోయారు.
conception	భావన	ఈ చిత్రం చరిత్ర పట్ల నా భావనను మార్చింది.
concession	రాయితీ	కంపెనీ ఒక రాయితీ ఇచ్చింది.
condemn	ఖండించడం	నాయకులు దాడిని బహిరంగంగా ఖండించారు.
confer	ప్రదానం చేయడం	అవార్డు ప్రతిష్ఠను ఇస్తుంది.
confession	నేరాంగీకారం	అతని నేరాంగీకారం కోర్టును ఆశ్చర్యపరిచింది.
configuration	ఆకృతీకరణ	ఆకృతీకరణ నెట్‌వర్క్ యాక్సెస్‌ను నియంత్రిస్తుంది.
confine	పరిమితం చేయడం	నియమాలు కుక్కలను ఈ ప్రాంతానికి పరిమితం చేస్తాయి.
confirmation	నిర్ధారణ	మాకు ఇమెయిల్ ద్వారా నిర్ధారణ అందింది.
confront	ఎదుర్కోవడం	ఆమె సమస్యను ఎదుర్కోవాలని నిర్ణయించుకుంది.
confrontation	ఘర్షణ	ఘర్షణ హింస లేకుండా ముగిసింది.
congratulate	అభినందించడం	నా సోదరిని అభినందించడానికి నేను ఫోన్ చేశాను.
congregation	సభ	సభ కలిసి పాడింది.
congressional	కాంగ్రెస్	కాంగ్రెస్ విచారణ గంటలపాటు కొనసాగింది.
conquer	జయించడం	ఆ జట్టు మార్కెట్‌ను జయించాలని ఆశిస్తోంది.
conscience	అంతరాత్మ	అతని అంతరాత్మ అబద్ధాలను అనుమతించదు.
consciousness	స్పృహ	ప్రమాదం అతని స్పృహను దెబ్బతీసింది.
consecutive	వరుసగా	ఆమె వరుసగా మూడు మ్యాచ్‌లు గెలిచింది.
consensus	ఏకాభిప్రాయం	కమిటీ త్వరగా ఏకాభిప్రాయానికి వచ్చింది.
consent	అంగీకారం	వ్రాతపూర్వక అంగీకారం అవసరం.
conserve	సంరక్షించడం	కరువు సమయంలో మనం నీటిని సంరక్షిస్తాము.
consistency	స్థిరత్వం	భాషా అధ్యయనంలో స్థిరత్వం ముఖ్యం.
consolidate	ఏకీకృతం చేయడం	కంపెనీ రెండు కార్యాలయాలను ఏకీకృతం చేస్తుంది.
constituency	నియోజకవర్గం	అభ్యర్థి ప్రతి నియోజకవర్గాన్ని సందర్శించారు.
constitute	కలిగి ఉండటం	కమిటీలో సగం మంది మహిళలు ఉన్నారు.
constitution	రాజ్యాంగం	రాజ్యాంగం వాక్ స్వాతంత్ర్యానికి హామీ ఇస్తుంది.
constitutional	రాజ్యాంగబద్ధమైన	కోర్టు రాజ్యాంగ హక్కులను సమీక్షించింది.
constraint	పరిమితి	బడ్జెట్ పరిమితి ప్రాజెక్ట్‌ను పరిమితం చేసింది.
consultation	సంప్రదింపులు	సంప్రదింపులు రెండు వారాల పాటు కొనసాగాయి.
contemplate	ఆలోచించడం	ఆమె ఆఫర్ గురించి ఆలోచించడానికి ఆగింది.
contempt	ధిక్కారం	అతను నిబంధనల పట్ల ధిక్కారాన్ని ప్రదర్శించాడు.
contend	పోటీ పడటం	కాంట్రాక్ట్ కోసం అనేక సంస్థలు పోటీ పడుతున్నాయి.
contender	పోటీదారు	ఆమె బలమైన పోటీదారు.
content2	సంతృప్తిగా	అతను ఫలితంతో సంతృప్తి చెందాడు.
contention	వివాదం	ప్రధాన వివాదం నిధుల గురించి.
continually	నిరంతరం	సిస్టమ్ నిరంతరం లోపాలను తనిఖీ చేస్తుంది.
contractor	కాంట్రాక్టర్	కాంట్రాక్టర్ పైకప్పును బాగుచేశాడు.
contradiction	వైరుధ్యం	అతని ప్రకటనలో వైరుధ్యం ఉంది.
contrary	విరుద్ధమైన	విరుద్ధమైన ఆధారాలు కేసును మార్చాయి.
contributor	సహాయకారి	ఆమె క్రమం తప్పకుండా రచనలు చేస్తుంది.
conversion	మార్పిడి	మార్పిడి డాలర్లను యూరోలుగా మార్చింది.
convict	నేరస్థుడిగా నిర్ధారించడం	జ్యూరీ అనుమానితుడిని దోషిగా నిర్ధారించవచ్చు.
conviction	నేర నిర్ధారణ	అతనిపై నేర నిర్ధారణ ప్రజలను దిగ్భ్రాంతికి గురి చేసింది.
cooperate	సహకరించడం	దయచేసి దర్యాప్తుకు సహకరించండి.
cooperative	సహకార	సిబ్బంది సహకరించారు మరియు ప్రశాంతంగా ఉన్నారు.
coordinate	సమన్వయం చేయడం	వారు ప్రతిరోజూ ఉదయం డెలివరీలను సమన్వయం చేస్తారు.
coordination	సమన్వయం	మంచి సమన్వయం సమయాన్ని ఆదా చేసింది.
coordinator	సమన్వయకర్త	సమన్వయకర్త ప్రతి పనిని అప్పగించారు.
cop	పోలీసు	స్టేషన్ వెలుపల ఒక పోలీసు నిలబడ్డాడు.
copper	రాగి	ఈ పైపు రాగితో తయారు చేయబడింది.
copyright	కాపీరైట్	చిత్రం కాపీరైట్ ద్వారా రక్షించబడింది.
correction	దిద్దుబాటు	ఉపాధ్యాయుడు ఒక సవరణ చేశాడు.
correlate	పరస్పర సంబంధం కలిగి ఉండటం	అధిక ఒత్తిడి అనారోగ్యంతో సంబంధం కలిగి ఉంటుంది.
correlation	సహసంబంధం	అధ్యయనంలో బలమైన సహసంబంధం కనుగొనబడింది.
correspond	సరిపోలడం	ఈ సంఖ్యలు లేబుల్‌లకు సరిపోలుతాయి.
correspondence	ఉత్తరప్రత్యుత్తరాలు	వారి ఉత్తరప్రత్యుత్తరాలు ఏళ్ల తరబడి కొనసాగాయి.
correspondent	విలేకరి	విలేకరి కైరో నుండి నివేదించారు.
corresponding	దానికి సంబంధించిన	ప్రతి బటన్‌కు సంబంధించిన లైట్ ఉంటుంది.
corrupt	అవినీతి	అవినీతి అధికారి డబ్బు తీసుకున్నాడు.
corruption	అవినీతి	అవినీతి ప్రజల నమ్మకాన్ని బలహీనపరిచింది.
costly	ఖరీదైన	ఈ లోపం జట్టుకు భారీ నష్టాన్ని కలిగించింది.
councillor	కౌన్సిలర్	కౌన్సిలర్ నివాసితుల ప్రశ్నలకు సమాధానమిచ్చారు.
counselling	కౌన్సెలింగ్	ప్రమాదం తర్వాత ఆమె కౌన్సెలింగ్ తీసుకుంది.
counsellor	కౌన్సెలర్	కౌన్సెలర్ కొత్త విద్యార్థులకు సహాయం చేశారు.
counter (argue against)	తిప్పికొట్టడం	ఆమె అతని వాదనను తిప్పికొట్టడానికి ప్రయత్నించింది.
counterpart	ప్రతిరూపం	అతను తన జపనీస్ ప్రతినిధిని కలిశాడు.
countless	లెక్కలేనన్ని	లెక్కలేనంత మంది వాలంటీర్లు అన్వేషణలో చేరారు.
coup	తిరుగుబాటు	ఈ తిరుగుబాటు అధ్యక్షుడిని తొలగించింది.
courtesy	మర్యాద	ఆమె వారి మర్యాదకు కృతజ్ఞతలు తెలిపింది.
