source_headword	SV	example_SV
absolutely	absolut	Jag håller absolut med dig.
academic	akademisk	Det akademiska året börjar i september.
access	tillgång	Studenter behöver tillgång till biblioteket.
accommodation	boende	Vi bokade boende nära stationen.
account	ett konto	Hon öppnade ett nytt bankkonto.
achievement	en prestation	Att avsluta kursen var en stor prestation.
ad	en annons	Annonsen visade en ny telefon.
addition	ett tillskott	Poolen är ett nyttigt tillskott.
admire	beundra	Jag beundrar hennes lugna attityd.
admit	erkänna	Han erkände sitt misstag.
advanced	avancerad	Det här är en avancerad engelsklektion.
advise	råda	Läkare råder till regelbunden motion.
afford	ha råd med	Vi har inte råd med en taxi.
aged	i åldern	Kursen är för barn i åldern tio år.
agent	en reseagent	Reseagenten ändrade våra biljetter.
agreement	en överenskommelse	De nådde en överenskommelse i dag.
ahead	framför	Vägen framför oss är fri.
aim	sikta	Vi siktar på att bli klara snart.
alarm	ett larm	Larmet ringde klockan sex.
album	ett album	Det här albumet har tio låtar.
alcohol	alkohol	Hotellet serverar inte alkohol.
alcoholic	alkoholhaltig	Den här drycken är inte alkoholhaltig.
amazed	förvånad	Hon blev förvånad över resultatet.
ambition	en ambition	Hans ambition är att bli pilot.
ambitious	ambitiös	Hon har en ambitiös plan.
analyse	analysera	Vi behöver analysera resultaten.
analysis	en analys	Hennes analys var tydlig och noggrann.
announce	meddela	De meddelar vinnaren i morgon.
announcement	ett meddelande	Meddelandet överraskade alla.
annoy	irritera	Hög musik kan irritera grannar.
annoyed	irriterad	Han såg irriterad ut efter förseningen.
annoying	irriterande	Det där ljudet är verkligen irriterande.
apart	isär	Husen ligger två meter isär.
apologize	be om ursäkt	Jag ber om ursäkt för att jag är sen.
application	en ansökan	Fyll i ansökan online.
appointment	en tid	Jag har en tandläkartid i morgon.
appreciate	uppskatta	Jag uppskattar din hjälp.
approximately	ungefär	Promenaden tar ungefär tjugo minuter.
arrest	gripa	Polisen grep föraren.
arrival	en ankomst	Vår ankomst var senare än väntat.
assignment	en uppgift	Uppgiften ska vara klar på fredag.
assist	assistera	Sjuksköterskor assisterar läkaren.
atmosphere	en stämning	Kaféet har en avslappnad stämning.
attach	bifoga	Bifoga filen till ditt mejl.
attitude	en attityd	Hennes attityd förändrades efter mötet.
attract	locka	Starka blommor lockar bin.
attraction	en attraktion	Slottet är en populär attraktion.
authority	en myndighet	Den lokala myndigheten lagade vägen.
aware	medveten	Hon är medveten om risken.
backwards	bakåt	Han gick försiktigt bakåt.
bake	baka	Jag bakar bröd varje söndag.
balance	balans	Bra skor hjälper din balans.
ban	förbjuda	Staden kommer att förbjuda bilar.
bank (river)	en flodbank	Vi satt på flodbanken.
base	en bas	Laget återvände till basen.
basic	grundläggande	Alla behöver grundläggande datorkunskaper.
basis	en grund	Förtroende är grunden för vänskap.
battery	ett batteri	Mitt telefonbatteri är lågt.
battle	en strid	Striden varade hela natten.
beauty	skönhet	Vi beundrade bergens skönhet.
bee	ett bi	Ett bi landade på blomman.
belief	en tro	Hans tro gav honom mod.
bell	en klocka	Skolklockan ringde högt.
bend	böja	Böj knäna när du lyfter.
bite	bita	Hunden kan bita främlingar.
block	blockera	Ett fallet träd blockerade vägen.
bomb	en bomb	Bomben skadade flera byggnader.
border	en gräns	De korsade gränsen på natten.
bother	störa	Stör inte din syster, snälla.
branch	en gren	En gren bröts i stormen.
brand	ett märke	Det här märket är populärt bland studenter.
brave	modig	Den modige mannen räddade barnet.
breath	ett andetag	Ta ett djupt andetag.
breathe	andas	Jag kan inte andas i den här röken.
breathing	andning	Hennes andning var långsam.
bride	en brud	Bruden bar en vit klänning.
bubble	en bubbla	En bubbla svävade över glaset.
bury	begrava	De begravde lådan i sand.
calm	lugn	Förbli lugn under provet.
campaign	en kampanj	Kampanjen samlade in pengar till skolor.
campus	ett campus	Studenter bor nära campus.
candidate	en kandidat	Varje kandidat svarade på tre frågor.
cap	en keps	Han bar en basebollkeps.
captain	en kapten	Kaptenen talade med laget.
careless	slarvig	Ett slarvigt misstag kostade oss tid.
category	en kategori	Välj rätt kategori.
ceiling	ett innertak	Innertaket målades vitt.
celebration	ett firande	Firandet varade hela kvällen.
central	central	Hotellet har ett centralt läge.
ceremony	en ceremoni	Ceremonin började vid middagstid.
chain	en kedja	Hon bar en silverkedja.
challenge	en utmaning	Det här projektet är en riktig utmaning.
champion	en mästare	Mästaren tackade sin tränare.
channel	en kanal	Byt kanal, snälla.
chapter	ett kapitel	Läs nästa kapitel i kväll.
charge	en avgift	Det finns ingen avgift för barn.
cheat	fuska	Fuska inte på provet.
cheerful	glad	Hon lät glad i morse.
chemical	kemisk	Den kemiska lukten var stark.
chest	ett bröst	Hans bröst gjorde ont efter löpningen.
childhood	en barndom	Jag minns mitt barndomshem.
claim	påstå	De påstår att produkten är säker.
clause	en klausul	Den här klausulen ändrar betydelsen.
click	klicka	Klicka på den blå knappen.
client	en klient	Klienten bad om fler detaljer.
cloth	en trasa	Torka bordet med den här trasan.
clue	en ledtråd	Ledtråden hjälpte oss lösa det.
coal	kol	Det gamla tåget använde kol.
coin	ett mynt	Han hittade ett mynt på golvet.
collection	en samling	Hennes frimärkssamling är stor.
coloured	färgad	Hon bar en färgad halsduk.
combine	kombinera	Kombinera mjölet och vattnet.
commercial	reklam	Reklampausen varade fem minuter.
commit	förbinda sig	Vi måste förbinda oss till planen.
communication	kommunikation	Bra kommunikation förhindrar misstag.
comparison	en jämförelse	Den här jämförelsen är användbar.
competitive	konkurrensutsatt	Marknaden är mycket konkurrensutsatt.
competitor	en konkurrent	Vår största konkurrent sänkte priserna.
complaint	ett klagomål	Hon gjorde ett klagomål om buller.
complex	komplex	Instruktionerna är för komplexa.
concentrate	koncentrera sig	Jag kan inte koncentrera mig med musik.
conclude	avsluta	Vi avslutar mötet nu.
conclusion	en slutsats	Hans slutsats verkade rimlig.
confident	självsäker	Hon kände sig självsäker före intervjun.
confirm	bekräfta	Bekräfta din e-postadress, snälla.
confuse	förvirra	De här två namnen förvirrar mig.
confused	förvirrad	Jag blev förvirrad av kartan.
connection	en anslutning	Internetanslutningen är långsam.
consequence	en konsekvens	För lite sömn har en konsekvens.
consist	bestå	Måltiden består av tre rätter.
consume	förbruka	Stora bilar förbrukar mer bränsle.
consumer	en konsument	Konsumenten vill ha tydlig information.
contact	kontakta	Kontakta mig efter lunch.
container	en behållare	Lägg soppan i en behållare.
content1	innehåll	Kursens innehåll är användbart.
continuous	kontinuerlig	Maskinen gjorde ett kontinuerligt ljud.
contrast	en kontrast	Kontrasten mellan dem är tydlig.
convenient	praktisk	Stationen ligger mycket praktiskt.
convince	övertyga	Hon övertygade honom att försöka igen.
costume	en dräkt	Han bar en piratdräkt.
cottage	en stuga	De hyrde en liten stuga.
cotton	bomull	Den här skjortan är gjord av bomull.
countryside	landsbygden	Vi vandrade genom landsbygden.
court	en domstol	Fallet gick till domstol.
covered	täckt	Bordet var täckt med papper.
cruel	grym	Det var grymt att skratta.
cultural	kulturell	Museet erbjuder kulturella evenemang.
currency	en valuta	Den lokala valutan är euro.
current	aktuell	Den aktuella situationen är svår.
currently	för närvarande	Hon studerar för närvarande utomlands.
curtain	en gardin	Dra för gardinen på natten.
custom	en sed	Den här seden är mycket gammal.
damage	en skada	Stormen orsakade allvarlig skada.
decade	ett årtionde	De bodde där i ett årtionde.
decorate	dekorera	Vi dekorerar rummet tillsammans.
define	definiera	Kan du definiera den här termen?
definite	bestämd	Vi behöver ett bestämt svar.
definition	en definition	Skriv definitionen i din anteckningsbok.
deliver	leverera	De levererar mat till vårt hus.
departure	en avgång	Avgångstiden ändrades.
despite	trots	Trots regnet gick vi.
destination	en destination	Paris var deras slutdestination.
determine	avgöra	Prov avgör din nivå.
determined	beslutsam	Hon var beslutsam att lyckas.
development	en utveckling	Stadens utveckling gick snabbt.
diagram	ett diagram	Rita ett enkelt diagram.
diamond	en diamant	Ringen hade en liten diamant.
difficulty	en svårighet	Han hade svårt att öppna dörren.
directly	direkt	Tala direkt till mig, snälla.
dirt	smuts	Hans skor var täckta av smuts.
disadvantage	en nackdel	Den långa resan är en nackdel.
disappointed	besviken	Hon blev besviken över resultatet.
disappointing	besvikande	Slutet var besvikande.
discount	en rabatt	Studenter får rabatt här.
dislike	ogilla	Jag ogillar mycket hög musik.
divide	dela	Dela kakan i bitar.
documentary	en dokumentär	Vi såg en dokumentär om rymden.
donate	donera	Många människor donerar gamla kläder.
doubt	tvivel	Jag har inget tvivel om det.
dressed	klädd	Han var klädd i svart.
drum	en trumma	Trumman hördes över rummet.
drunk	berusad	Föraren var berusad.
due	ska lämnas in	Rapporten ska lämnas in i morgon.
dust	damm	Damm täckte de gamla böckerna.
duty	en plikt	Det är min plikt att hjälpa till.
earthquake	en jordbävning	Jordbävningen skadade bron.
eastern	östlig	Den östra kusten är blåsig.
economic	ekonomisk	Landet har ekonomiska problem.
economy	ekonomin	Ekonomin växte i år.
edge	en kant	Stå inte nära kanten.
editor	en redaktör	Redaktören kontrollerade artikeln.
educate	utbilda	Skolor utbildar unga människor.
educated	utbildad	Hon är högutbildad.
educational	lärorik	Spelet är lärorikt.
effective	effektiv	Den här medicinen är effektiv.
effectively	effektivt	Hon förklarade regeln effektivt.
effort	en ansträngning	Din ansträngning gjorde skillnad.
election	ett val	Valresultatet var jämnt.
element	ett element	Förtroende är ett viktigt element.
embarrassed	generad	Han kände sig generad efter fallet.
embarrassing	pinsam	Det var ett pinsamt misstag.
emergency	ett nödfall	Ring det här numret vid nödfall.
emotion	en känsla	Rädsla är en stark känsla.
employment	sysselsättning	Sysselsättningen ökade denna månad.
encourage	uppmuntra	Lärare uppmuntrar studenter att läsa.
enemy	en fiende	De två länderna var fiender.
engaged	förlovad	De förlovade sig förra våren.
engineering	teknik	Hon studerar teknik på universitetet.
entertain	underhålla	Sångaren ska underhålla gästerna.
entertainment	underhållning	Staden erbjuder kvällsunderhållning.
entrance	en ingång	Möt mig vid ingången.
entry	inträde	Inträde är gratis för barn.
environmental	miljömässig	Vi diskuterade miljömässiga problem.
episode	ett avsnitt	Det sista avsnittet var spännande.
equal	lika	De får lika lön.
equally	lika	Arbetet delas lika.
escape	fly	Fångarna försökte fly.
essential	nödvändig	Vatten är nödvändigt för livet.
eventually	till slut	Till slut hittade vi hotellet.
examine	undersöka	Läkaren undersökte min arm.
exchange	ett byte	Vi gjorde ett byte i butiken.
excitement	spänning	Matchen var full av spänning.
exhibition	en utställning	Konstutställningen öppnar i morgon.
expand	expandera	Företaget planerar att expandera.
expected	förväntad	Den förväntade kostnaden är hög.
expedition	en expedition	Expeditionen korsade öknen.
experienced	erfaren	Hon är en erfaren sjuksköterska.
explode	explodera	Flaskan kan explodera av värme.
explore	utforska	Vi utforskade den gamla staden.
explosion	en explosion	Explosionen krossade flera fönster.
export	en export	Kaffe är en viktig export.
fairly	ganska	Provet var ganska lätt.
familiar	bekant	Hennes ansikte såg bekant ut.
fancy	ha lust med	Vill du ha kaffe?
fascinating	fascinerande	Berättelsen var fascinerande.
fashionable	modern	De där skorna är moderna.
fasten	spänna fast	Spänn fast säkerhetsbältet.
favour	en tjänst	Kan du göra mig en tjänst?
fence	ett staket	Staketet omger trädgården.
fighting	strider	Striderna upphörde i gryningen.
file	en fil	Spara filen innan du stänger.
financial	finansiell	Hon behöver finansiell rådgivning.
fitness	kondition	Löpning förbättrar din kondition.
fixed	fast	Priset är fast.
flag	en flagga	Flaggan vajade ovanför skolan.
flood	en översvämning	Översvämningen skadade många hem.
flour	mjöl	Tillsätt mjöl i skålen.
flow	rinna	Floden rinner genom staden.
fold	vika	Vik papperet på mitten.
folk	folk	Folkmusik fyllde salen.
force	en kraft	Vinden hade stor kraft.
forever	för alltid	Jag kommer att minnas detta för alltid.
frame	en ram	Fotot behöver en ram.
freeze	frysa	Vatten kommer att frysa under natten.
frequently	ofta	Han besöker sina föräldrar ofta.
friendship	vänskap	Deras vänskap varade i många år.
frighten	skrämma	Höga ljud skrämmer barnet.
frightened	rädd	Barnet såg rädd ut.
frightening	skrämmande	Stormen var skrämmande.
frozen	frusen	Sjön var frusen.
fry	steka	Stek löken i fem minuter.
fuel	bränsle	Bilen behöver mer bränsle.
function	en funktion	Den här knappen har en funktion.
fur	päls	Katten har mjuk päls.
garage	ett garage	Bilen står i garaget.
gather	samlas	Vi samlades runt bordet.
generally	vanligtvis	Hon kommer vanligtvis tidigt.
generation	en generation	Varje generation möter nya problem.
generous	generös	Han är generös med sin tid.
gentle	mild	Använd en mild röst.
gentleman	en herre	Herren öppnade dörren.
ghost	ett spöke	Berättelsen nämner ett spöke.
giant	jättestor	En jättestor skärm fyllde scenen.
glad	glad	Jag är glad att du kom.
global	global	Klimatförändringar är en global fråga.
glove	en handske	Jag tappade en handske.
goods	varor	Varorna kom sent.
grade	ett betyg	Hon fick ett högt betyg.
graduate	en nyutexaminerad	Han är nyutexaminerad.
grain	ett korn	Ett riskorn föll.
grateful	tacksam	Jag är tacksam för ditt stöd.
growth	tillväxt	Växten visade stadig tillväxt.
guard	en vakt	Vakten kontrollerade våra biljetter.
guilty	skyldig	Han kände sig skyldig för lögnen.
hang	hänga	Häng din jacka här.
happiness	lycka	Pengar kan inte köpa lycka.
hardly	knappt	Jag kunde knappt höra dig.
headline	en rubrik	Rubriken fångade min uppmärksamhet.
heating	värmen	Värmen slutade fungera.
heavily	kraftigt	Det regnade kraftigt hela natten.
helicopter	en helikopter	En helikopter landade i närheten.
highlight	markera	Markera huvudidén, snälla.
highly	mycket	Hon är mycket respekterad.
hire	hyra	Vi behöver hyra en bil.
historic	historisk	Vi besökte en historisk byggnad.
historical	historisk	Hon älskar historiska romaner.
honest	ärlig	Ge ett ärligt svar, snälla.
horrible	hemsk	Lukten var hemsk.
horror	skräck	Han gillar skräckfilmer.
host	en värd	Värden välkomnade varje gäst.
