source_headword	TA	example_TA
monk	துறவி	துறவி மௌனமாக வாழ்ந்தார்.
monopoly	முற்றுரிமை	நிறுவனம் முற்றுரிமை கொண்டிருந்தது.
morality	ஒழுக்கம்	பாடநெறி பொது ஒழுக்கத்தை ஆராய்கிறது.
motive	நோக்கம்	காவல்துறை அவரது நோக்கத்தை கேள்வி எழுப்பியது.
motorist	வாகன ஓட்டி	வாகன ஓட்டி சிவப்பு விளக்கில் நிறுத்தினார்.
municipal	நகராட்சி	இந்த ஆண்டு நகராட்சி சேவைகள் மேம்பட்டன.
mutual	பரஸ்பர	அவர்கள் ஒரு பரஸ்பர ஒப்பந்தத்தை எட்டினர்.
namely	அதாவது	ஒரு பிரச்சனை உள்ளது, அதாவது நிதி.
nationwide	நாடு தழுவிய	வேலைநிறுத்தம் நாடு தழுவிய தாமதங்களை ஏற்படுத்தியது.
naval	கடற்படை	கடற்படை தளம் கடந்த ஆண்டு மூடப்பட்டது.
neglect	புறக்கணி	அடிப்படை பாதுகாப்பை புறக்கணிக்காதீர்கள்.
neighbouring	அண்டை	அண்டை நகரங்கள் மருத்துவமனையைப் பகிர்ந்து கொண்டன.
nest	கூடு	பறவை ஒரு கூட்டைக் கட்டியது.
net	நிகர	நிகர லாபம் கூர்மையாக உயர்ந்தது.
newsletter	செய்திமடல்	செய்திமடல் ஒவ்வொரு வெள்ளிக்கிழமையும் வரும்.
niche	முக்கிய இடம்	நிறுவனம் ஒரு லாபகரமான முக்கிய இடத்தைக் கண்டுபிடித்தது.
noble	உன்னதமான	அவளது உன்னதமான செயல் அனைவரையும் கவர்ந்தது.
nod	தலையசை	உங்களுக்குப் புரிந்தால் தயவுசெய்து தலையசைக்கவும்.
nominate	பரிந்துரை	அவர்கள் ஒரு புதிய தலைவரைப் பரிந்துரைப்பார்கள்.
nomination	பரிந்துரை	அவரது பரிந்துரை குழுவை ஆச்சரியப்படுத்தியது.
nominee	பரிந்துரைக்கப்பட்டவர்	பரிந்துரைக்கப்பட்டவர் கடினமான கேள்விகளுக்கு பதிலளித்தார்.
nonetheless	இருப்பினும்	இருப்பினும், திட்டம் முன்னேறியது.
non-profit	இலாப நோக்கற்ற	அவர் ஒரு இலாப நோக்கற்ற கிளினிக்கில் பணிபுரிகிறார்.
nonsense	முட்டாள்தனம்	அந்த வதந்தி ஒரு முழுமையான முட்டாள்தனம்.
noon	நண்பகல்	கூட்டம் நண்பகலில் தொடங்குகிறது.
notable	குறிப்பிடத்தக்க	அறிக்கை குறிப்பிடத்தக்க முன்னேற்றத்தை ஏற்படுத்தியது.
notably	குறிப்பாக	குறிப்பாக, மே மாதத்தில் செலவுகள் குறைந்தன.
notify	தெரிவி	வெளியேறுவதற்கு முன் ஊழியர்களுக்குத் தெரிவிக்கவும்.
notorious	இழிபுகழ்பெற்ற	இந்த சாலை விபத்துக்களுக்கு இழிபுகழ்பெற்றது.
novel	புதிய	அவர்கள் ஒரு புதிய தீர்வை முன்மொழிந்தனர்.
nursery	மழலையர் பள்ளி	மழலையர் பள்ளி குழந்தைகளை கவனித்துக்கொள்கிறது.
objection	ஆட்சேபனை	வழக்கறிஞர் ஆட்சேபனை தெரிவித்தார்.
oblige	கடமைப்படுத்து	விதிகள் ஓட்டுனர்களை நிறுத்த கட்டாயப்படுத்துகின்றன.
obsess	வெறி	சிறிய பிழைகளை நினைத்து வெறிகொள்ள வேண்டாம்.
obsession	வெறி	அவரது வெறி அவரது வேலையை பாதித்தது.
occasional	அவ்வப்போது	அவ்வப்போது தாமதங்கள் எதிர்பார்க்கப்படுகின்றன.
occurrence	நிகழ்வு	அத்தகைய நிகழ்வு அரிதானது.
odds	வாய்ப்புகள்	வெற்றிக்கான வாய்ப்புகள் மேம்பட்டன.
offering	சலுகை	பல்கலைக்கழகம் அதன் சலுகையை விரிவுபடுத்தியது.
offspring	சந்ததி	நரி அதன் சந்ததியைப் பாதுகாத்தது.
operational	செயல்பாட்டு	புதிய அமைப்பு செயல்பாட்டில் உள்ளது.
opt	தேர்வு செய்	பல மாணவர்கள் ஆன்லைன் வகுப்புகளைத் தேர்வு செய்கிறார்கள்.
optical	ஒளியியல்	ஒளியியல் லென்ஸை சுத்தம் செய்ய வேண்டும்.
optimism	சுபநம்பிக்கை	அறிவிப்புக்கு பிறகு சுபநம்பிக்கை திரும்பியது.
oral	வாய்வழி	வாய்வழி தேர்வு நாளை தொடங்குகிறது.
organizational	நிறுவன	நிறுவன மாற்றங்கள் உடனடியாக தொடங்கின.
orientation	நோக்குநிலை	பட்டறையில் பணியாளர் நோக்குநிலை இடம்பெற்றது.
originate	தோன்றும்	பல மரபுகள் கிராமப்புற கிராமங்களில் இருந்து தோன்றுகின்றன.
outbreak	வெடிப்பு	வெடிப்பு நகரம் முழுவதும் பரவியது.
outing	உல்லாசப் பயணம்	வகுப்பு அருங்காட்சியக உல்லாசப் பயணத்தை அனுபவித்தது.
outlet	விற்பனையகம்	விற்பனையகம் தள்ளுபடி செய்யப்பட்ட ஆடைகளை விற்கிறது.
outlook	கண்ணோட்டம்	பொருளாதார கண்ணோட்டம் நிச்சயமற்றதாகவே உள்ளது.
outrage	ஆத்திரம்	இந்த முடிவு பொதுமக்களின் ஆத்திரத்தை ஏற்படுத்தியது.
outsider	வெளியாள்	ஒரு வெளியாளாக, அவள் பிரச்சினைகளை கவனித்தாள்.
overlook	கவனிக்கத் தவறு	சிறிய விவரங்களை கவனிக்கத் தவறாதீர்கள்.
overly	அதிகப்படியான	வழிமுறைகள் மிகவும் சிக்கலானவை.
oversee	மேற்பார்வை செய்	அவர் திட்டத்தை மேற்பார்வையிடுவார்.
overturn	ரத்து செய்	நீதிமன்றம் தீர்ப்பை ரத்து செய்யலாம்.
overwhelm	திணறடி	அதிகமான தகவல்கள் கற்பவர்களை திணறடிக்கலாம்.
overwhelming	பெரும்	சான்றுகள் பெருமளவில் இருந்தன.
pad	திண்டு	முழங்கால்களைப் பாதுகாக்க திண்டைப் பயன்படுத்தவும்.
parameter	அளவுரு	ஒரு நேரத்தில் ஒரு அளவுருவை சரிசெய்யவும்.
parental	பெற்றோர்	பெற்றோர் ஆதரவு வருகையை மேம்படுத்தியது.
parish	திருச்சபை	திருச்சபை தொண்டு இரவு உணவை ஏற்பாடு செய்தது.
parliamentary	நாடாளுமன்ற	நாடாளுமன்ற விவாதம் மணிக்கணக்கில் நீடித்தது.
partial	பகுதி	அறிக்கை ஒரு பகுதி பதிலை அளித்தது.
partially	ஓரளவு	ஜன்னல் ஓரளவு திறந்திருந்தது.
passing	இறப்பு	அவளது இறப்பு திடீரென நிகழ்ந்தது.
passive	செயலற்ற	செயலற்ற முதலீட்டாளர்கள் நிலையான வருமானத்தை ஏற்றுக்கொண்டனர்.
pastor	போதகர்	போதகர் குடும்பத்தை பார்வையிட்டார்.
patch	ஒட்டு	ஜாக்கெட்டுக்கு ஒரு சிறிய ஒட்டு தேவை.
patent	காப்புரிமை	நிறுவனம் ஒரு காப்புரிமையை தாக்கல் செய்தது.
pathway	பாதை	இந்த பாதை சான்றிதழுக்கு வழிவகுக்கிறது.
patrol	ரோந்து	இரவில் போலீசார் அப்பகுதியில் ரோந்து செல்கின்றனர்.
patron	புரவலர்	அருங்காட்சியகம் அதன் புரவலருக்கு நன்றி தெரிவித்தது.
peak	உச்சம்	தேவை குளிர்கால உச்சத்தை எட்டியது.
peasant	விவசாயி	விவசாயிக்கு கொஞ்சம் நிலம் இருந்தது.
peculiar	விசித்திரமான	அறையில் ஒரு விசித்திரமான வாசனை இருந்தது.
persist	தொடர்கிறது	அறிகுறிகள் பல நாட்களுக்கு தொடரலாம்.
persistent	தொடர்ச்சியான	ஒரு தொடர்ச்சியான இருமலுக்கு கவனம் தேவை.
personnel	பணியாளர்	பணியாளர் பதிவுகள் ரகசியமானவை.
petition	மனு	இந்த மனு ஆயிரக்கணக்கான கையெழுத்துக்களை சேகரித்தது.
philosopher	தத்துவவாதி	தத்துவவாதி பொதுவான அனுமானங்களை கேள்வி எழுப்பினார்.
philosophical	தத்துவார்த்த	விவாதம் தத்துவார்த்தமானது.
physician	மருத்துவர்	மருத்துவர் இரத்த பரிசோதனைகளுக்கு உத்தரவிட்டார்.
pioneer	முன்னோடி	அவர் மருத்துவத்தில் ஒரு முன்னோடியாக ஆனார்.
pipeline	குழாய்	குழாய் நிலத்தடியில் வாயுவை கொண்டு செல்கிறது.
pirate	கடற்கொள்ளையர்	கடற்கொள்ளையர் கப்பல் கரையில் தோன்றியது.
pit	குழி	தொழிலாளர்கள் ஆழமான குழியை தோண்டினர்.
plea	வேண்டுகோள்	உதவிக்கான அவரது வேண்டுகோள் புறக்கணிக்கப்பட்டது.
plead	குற்றத்தை ஒப்புக்கொள்	சந்தேகநபர் குற்றத்தை ஒப்புக்கொள்வார்.
pledge	உறுதிமொழி	சீர்திருத்தங்களுக்கு ஆதரவளிக்க அவர்கள் உறுதிமொழி அளிக்கின்றனர்.
plug	செருகு	கேபிளை சாக்கெட்டில் செருகவும்.
plunge	வீழ்ச்சி	ஊழலுக்குப் பிறகு விலைகள் வீழ்ச்சியடையலாம்.
pole	கம்பம்	ஒரு கம்பத்தில் கொடி தொங்கியது.
poll	வாக்கெடுப்பு	வாக்கெடுப்பு மாறும் கருத்துக்களைக் காட்டியது.
pond	குளம்	உறைந்த குளத்தை வாத்துகள் கடந்தன.
pop	வெடி	கூர்மையான பொருட்களின் அருகே பலூன்கள் வெடிக்கின்றன.
portfolio	இலாகா	அவரது இலாகாவில் பல ஸ்டார்ட்அப்கள் உள்ளன.
portray	சித்தரிக்கும்	இந்த திரைப்படம் கிராமப்புற வாழ்க்கையை சித்தரிக்கும்.
postpone	ஒத்திவை	அவர்கள் விசாரணையை ஒத்திவைக்க முடிவு செய்தனர்.
post-war	போருக்குப் பிந்தைய	போருக்குப் பிந்தைய வீட்டுவசதி அவசரமாக தேவைப்பட்டது.
practitioner	பயிற்சியாளர்	பயிற்சியாளர் சிகிச்சையை விளக்கினார்.
preach	போதி	போதகர் ஞாயிற்றுக்கிழமை போதிப்பார்.
precedent	முன்னுதாரணம்	தீர்ப்பு ஒரு முக்கியமான முன்னுதாரணத்தை அமைத்தது.
precision	துல்லியம்	இயந்திரம் துல்லியமாக வெட்டுகிறது.
predator	வேட்டையாடும் விலங்கு	வேட்டையாடும் விலங்கு ஆற்றின் அருகே காத்திருந்தது.
predecessor	முன்னோடி	அவரது முன்னோடி விரிவான குறிப்புகளை விட்டுச் சென்றார்.
predominantly	முக்கியமாக	இப்பகுதி முக்கியமாக குடியிருப்பு ஆகும்.
pregnancy	கர்ப்பம்	கர்ப்பத்திற்கு வழக்கமான மருத்துவ பராமரிப்பு தேவைப்படுகிறது.
prejudice	பாரபட்சம்	பிரச்சாரம் இன பாரபட்சத்திற்கு சவால் விட்டது.
preliminary	ஆரம்ப	ஆரம்ப முடிவுகள் நம்பிக்கைக்குரியதாகத் தெரிகின்றன.
premier	பிரதமர்	பிரதமர் இன்று நாடாளுமன்றத்தில் உரையாற்றினார்.
premise	முன்மாதிரி	வாதம் தவறான முன்மாதிரியை அடிப்படையாகக் கொண்டது.
premium	பிரீமியம்	வாடிக்கையாளர்கள் வேகத்திற்கு பிரீமியம் செலுத்தினர்.
prescribe	பரிந்துரைக்கிறார்கள்	மருத்துவர்கள் நுண்ணுயிர் எதிர்ப்பிகளை கவனமாக பரிந்துரைக்கிறார்கள்.
prescription	மருந்து சீட்டு	மருந்து சீட்டு அடுத்த மாதம் முடிவடைகிறது.
presently	தற்போது	அவர் தற்போது கிடைக்கவில்லை.
preservation	பாதுகாப்பு	பாதுகாப்பு வரலாற்று கட்டிடங்களை பாதுகாக்கிறது.
preside	தலைமை தாங்குவார்	நீதிபதி விசாரணைக்கு தலைமை தாங்குவார்.
presidency	ஜனாதிபதி பதவி	அவரது ஜனாதிபதி பதவி எட்டு ஆண்டுகள் நீடித்தது.
presidential	ஜனாதிபதி	ஜனாதிபதி தேர்தல் கவனத்தை ஈர்த்தது.
prestigious	மதிப்புமிக்க	அவள் ஒரு மதிப்புமிக்க உதவித்தொகையை வென்றாள்.
presumably	அநேகமாக	அலுவலகம் அநேகமாக இன்று மூடப்பட்டிருக்கும்.
presume	கருதுகிறோம்	ஆவணங்கள் உண்மையானவை என்று நாங்கள் கருதுகிறோம்.
prevail	மேலோங்கும்	பொது அறிவு மேலோங்க வேண்டும்.
prevalence	பரவல்	ஆஸ்துமாவின் பரவல் அதிகரித்துள்ளது.
prevention	தடுப்பு	பழுதுபார்ப்பதை விட தடுப்பு மலிவானது.
