source_headword	BN	example_BN
export	রপ্তানি	কফি একটি গুরুত্বপূর্ণ রপ্তানি পণ্য।
fairly	মোটামুটি	পরীক্ষাটি মোটামুটি সহজ ছিল।
familiar	পরিচিত	তার মুখ পরিচিত লাগছিল।
fancy	চাওয়া	তুমি কি কফি চাও?
fascinating	মনোমুগ্ধকর	গল্পটি মনোমুগ্ধকর ছিল।
fashionable	ফ্যাশনেবল	ওই জুতাগুলো ফ্যাশনেবল।
fasten	বাঁধা	তোমার সিট বেল্ট বাঁধো।
favour	উপকার	তুমি কি আমাকে একটি উপকার করবে?
fence	বেড়া	বেড়াটি বাগান ঘিরে রেখেছে।
fighting	লড়াই	ভোরে লড়াই থেমে গেল।
file	ফাইল	বন্ধ করার আগে ফাইলটি সংরক্ষণ করো।
financial	আর্থিক	তার আর্থিক পরামর্শ দরকার।
fitness	ফিটনেস	দৌড়ানো তোমার ফিটনেস বাড়ায়।
fixed	স্থির	দামটি স্থির।
flag	পতাকা	পতাকাটি স্কুলের ওপরে উড়ছিল।
flood	বন্যা	বন্যায় অনেক বাড়ি ক্ষতিগ্রস্ত হলো।
flour	ময়দা	বাটিতে ময়দা যোগ করো।
flow	প্রবাহিত হওয়া	নদীটি শহরের মধ্য দিয়ে প্রবাহিত হয়।
fold	ভাঁজ করা	কাগজটি অর্ধেক ভাঁজ করো।
folk	লোকসংগীত	হলে লোকসংগীত বাজছিল।
force	শক্তি	বাতাসের শক্তি খুব বেশি ছিল।
forever	চিরকাল	আমি এটি চিরকাল মনে রাখব।
frame	ফ্রেম	ছবিটির জন্য একটি ফ্রেম দরকার।
freeze	জমে যাওয়া	রাতারাতি পানি জমে যাবে।
frequently	প্রায়ই	সে প্রায়ই বাবা-মাকে দেখতে যায়।
friendship	বন্ধুত্ব	তাদের বন্ধুত্ব বহু বছর স্থায়ী ছিল।
frighten	ভয় দেখানো	জোরে শব্দ শিশুটিকে ভয় দেখায়।
frightened	ভীত	শিশুটিকে ভীত দেখাচ্ছিল।
frightening	ভয়ংকর	ঝড়টি ভয়ংকর ছিল।
frozen	জমাট বাঁধা	হ্রদটি জমাট বাঁধা ছিল।
fry	ভাজা	পেঁয়াজ পাঁচ মিনিট ভাজো।
fuel	জ্বালানি	গাড়ির আরও জ্বালানি দরকার।
function	কাজ	এই বোতামের একটি কাজ আছে।
fur	পশম	বিড়ালের নরম পশম আছে।
garage	গ্যারেজ	গাড়িটি গ্যারেজে আছে।
gather	জড়ো হওয়া	আমরা টেবিলের চারপাশে জড়ো হলাম।
generally	সাধারণত	সে সাধারণত তাড়াতাড়ি আসে।
generation	প্রজন্ম	প্রতিটি প্রজন্ম নতুন সমস্যার মুখোমুখি হয়।
generous	উদার	সে নিজের সময় নিয়ে উদার।
gentle	কোমল	কোমল স্বর ব্যবহার করো।
gentleman	ভদ্রলোক	ভদ্রলোকটি দরজা খুলে দিলেন।
ghost	ভূত	গল্পটিতে একটি ভূতের কথা আছে।
giant	বিশাল	একটি বিশাল পর্দা মঞ্চ ভরেছিল।
glad	খুশি	তুমি এসেছ বলে আমি খুশি।
global	বৈশ্বিক	জলবায়ু পরিবর্তন একটি বৈশ্বিক সমস্যা।
glove	দস্তানা	আমি একটি দস্তানা হারিয়েছি।
goods	পণ্য	পণ্যগুলো দেরিতে পৌঁছেছে।
grade	নম্বর	সে উচ্চ নম্বর পেয়েছে।
graduate	স্নাতক	সে সাম্প্রতিক স্নাতক।
grain	দানা	একটি চালের দানা পড়ে গেল।
grateful	কৃতজ্ঞ	তোমার সহায়তার জন্য আমি কৃতজ্ঞ।
growth	বৃদ্ধি	গাছটি স্থির বৃদ্ধি দেখাল।
guard	প্রহরী	প্রহরী আমাদের টিকিট পরীক্ষা করল।
guilty	দোষী	মিথ্যা বলার জন্য সে দোষী বোধ করল।
hang	ঝোলানো	তোমার কোট এখানে ঝোলাও।
happiness	সুখ	টাকা সুখ কিনতে পারে না।
hardly	কষ্টে	আমি তোমাকে কষ্টে শুনতে পাচ্ছিলাম।
headline	শিরোনাম	শিরোনামটি আমার দৃষ্টি আকর্ষণ করল।
heating	গরম করার ব্যবস্থা	গরম করার ব্যবস্থা বন্ধ হয়ে গেল।
heavily	ভারীভাবে	সারা রাত ভারীভাবে বৃষ্টি হলো।
helicopter	হেলিকপ্টার	কাছে একটি হেলিকপ্টার নামল।
highlight	তুলে ধরা	দয়া করে মূল ধারণাটি তুলে ধরো।
highly	অত্যন্ত	সে অত্যন্ত সম্মানিত।
hire	ভাড়া করা	আমাদের একটি গাড়ি ভাড়া করতে হবে।
historic	ঐতিহাসিক	আমরা একটি ঐতিহাসিক ভবন দেখলাম।
historical	ঐতিহাসিক	সে ঐতিহাসিক উপন্যাস ভালোবাসে।
honest	সৎ	দয়া করে সৎ উত্তর দাও।
horrible	ভয়ানক	গন্ধটি ভয়ানক ছিল।
horror	ভৌতিক	সে ভৌতিক চলচ্চিত্র উপভোগ করে।
host	আয়োজক	আয়োজক প্রত্যেক অতিথিকে স্বাগত জানাল।
