source_headword	TA	example_TA
incur	ஏற்படுத்து	தாமதங்கள் கூடுதல் செலவுகளை ஏற்படுத்தலாம்.
indicator	குறிகாட்டி	வேலையின்மை ஒரு பொருளாதாரக் குறிகாட்டியாகும்.
indictment	குற்றப்பத்திரிகை	குற்றப்பத்திரிகையில் மூன்று குற்றச்சாட்டுகள் இருந்தன.
indigenous	உள்நாட்டு	உள்நாட்டு தாவரங்கள் இங்கு நன்றாக வளரும்.
induce	தூண்டு	இந்த மருந்து தூக்கத்தைத் தூண்டும்.
indulge	ஈடுபடு	அவள் விலையுயர்ந்த பழக்கங்களில் ஈடுபடுவதில்லை.
inequality	சமத்துவமின்மை	வருமானச் சமத்துவமின்மை ஒரு பெரிய பிரச்சினையாக உள்ளது.
infamous	மோசமான பெயர் பெற்ற	சிறைச்சாலை உலகம் முழுவதும் மோசமான பெயர் பெற்றது.
infant	சிசு	சிசு கட்டிலில் தூங்கியது.
infect	தொற்றிக்கொள்	வைரஸ் ஆரோக்கியமான செல்களைத் தொற்றிக்கொள்ளும்.
inflict	ஏற்படுத்து	விலங்குகளுக்கு வலியை ஏற்படுத்தாதீர்கள்.
influential	செல்வாக்குள்ள	அவர் ஒரு செல்வாக்குள்ள சட்ட அறிஞர்.
inherent	இயல்பான	வடிவமைப்பில் இயல்பான அபாயங்கள் உள்ளன.
inhibit	தடு	பயம் நேர்மையான விவாதத்தைத் தடுக்கலாம்.
initiate	தொடங்கு	மேலாளர் மதிப்பாய்வைத் தொடங்குவார்.
inject	ஊசி போடு	செவிலியர் தடுப்பூசி போடுவார்.
injection	ஊசி	ஊசி வலியைக் குறைத்தது.
injustice	அநீதி	தீர்ப்பு ஒரு தெளிவான அநீதியை வெளிப்படுத்தியது.
inmate	கைதி	கைதி சட்ட ஆலோசனை கோரினார்.
insertion	சேர்த்தல்	படிவத்தில் ஒரு உரையைச் சேர்க்க வேண்டும்.
insider	உள்ளாள்	உள்ளாள் ஒருவர் அறிக்கையை கசியவிட்டார்.
inspect	ஆய்வு செய்	அதிகாரிகள் ஆண்டுதோறும் பாலத்தை ஆய்வு செய்கின்றனர்.
inspection	ஆய்வு	ஆய்வில் கடுமையான சேதம் காணப்பட்டது.
inspiration	உத்வேகம்	அவளது உரை எனக்கு உத்வேகம் அளித்தது.
instinct	உள்ளுணர்வு	அவரது முதல் உள்ளுணர்வு உதவுவதாகும்.
institutional	நிறுவன	நிறுவன விதிகள் முடிவை வடிவமைத்தன.
instruct	அறிவுறுத்து	கையேடு புதிய ஊழியர்களுக்கு அறிவுறுத்தும்.
instrumental	கருவியாக	பேச்சுவார்த்தைகளில் அவரது ஆலோசனை கருவியாக இருந்தது.
insufficient	போதாத	குற்றச்சாட்டுகளுக்கு ஆதாரம் போதாது.
insult	அவமானம்	அவரது அவமானம் உரையாடலை முடித்தது.
intact	சேதமடையாத	பழமையான சுவர் சேதமடையாமல் இருந்தது.
intake	உட்கொள்ளல்	சர்க்கரை உட்கொள்ளல் மிதமாக இருக்க வேண்டும்.
integral	ஒருங்கிணைந்த	அணிக்கு நம்பிக்கை ஒருங்கிணைந்தது.
integrated	ஒருங்கிணைக்கப்பட்ட	பள்ளி ஒருங்கிணைக்கப்பட்ட ஆதரவை வழங்குகிறது.
integration	ஒருங்கிணைப்பு	ஒருங்கிணைப்பு முழு அமைப்பையும் மேம்படுத்தியது.
integrity	நேர்மை	நீதிபதி மிகுந்த நேர்மையைக் காட்டினார்.
intensify	தீவிரமடை	புயல் ஒரே இரவில் தீவிரமடையலாம்.
intensity	தீவிரம்	பயிற்சியின் தீவிரம் அதிகரித்தது.
intensive	தீவிர	அவர்கள் தீவிர மொழிப் பயிற்சியை முடித்தனர்.
intent	நோக்கம்	அவரது நோக்கத்தை நிரூபிக்க கடினமாக இருந்தது.
interactive	ஊடாடும்	அருங்காட்சியகத்தில் ஊடாடும் காட்சிகள் உள்ளன.
interface	இடைமுகம்	இடைமுகம் பயன்படுத்த எளிதானது.
interfere	தலையிடு	விசாரணையில் தலையிட வேண்டாம்.
interference	குறுக்கீடு	சிக்னல் குறுக்கீடு அழைப்பைத் தடை செய்தது.
interim	இடைக்கால	இடைக்கால அறிக்கை நாளை வரும்.
interior	உட்புற	உட்புறச் சுவர்களுக்கு வண்ணம் தீட்ட வேண்டும்.
intermediate	இடைநிலை	அவர் இடைநிலை வகுப்பில் சேர்ந்தார்.
intervene	தலையிடு	காவல்துறை விரைவாக தலையிட வேண்டியிருந்தது.
intervention	தலையீடு	ஆரம்பகால தலையீடு நோயாளிக்கு உதவியது.
intimate	நெருக்கமான	அவர்கள் ஒரு நெருக்கமான குடும்ப விழாவை நடத்தினர்.
intriguing	சுவாரஸ்யமான	தரவு ஒரு சுவாரஸ்யமான வடிவத்தை வெளிப்படுத்தியது.
investigator	புலனாய்வாளர்	புலனாய்வாளர் ஒவ்வொரு சாட்சியிடமும் பேட்டி கண்டார்.
invisible	கண்ணுக்குத் தெரியாத	வாயு கண்ணுக்குத் தெரியாதது மற்றும் ஆபத்தானது.
invoke	செயல்படுத்து	வழக்கறிஞர் முன்னுதாரணத்தை செயல்படுத்த முயன்றார்.
involvement	ஈடுபாடு	அவரது ஈடுபாடு தெளிவாக இல்லை.
ironic	முரண்பாடான	முரண்பாடான கருத்து அனைவரையும் சிரிக்க வைத்தது.
ironically	முரண்பாடாக	முரண்பாடாக, பாதை அதிக நேரம் எடுத்தது.
irony	முரண்பாடு	முரண்பாடு அனைவருக்கும் தெளிவாக இருந்தது.
irrelevant	பொருத்தமற்ற	அந்த விவரம் இங்கு பொருத்தமற்றது.
isolation	தனிமைப்படுத்தல்	தனிமைப்படுத்தல் மன ஆரோக்கியத்திற்கு தீங்கு விளைவிக்கும்.
judicial	நீதித்துறை	நீதித்துறை மதிப்பாய்வு திங்கள் கிழமை தொடங்குகிறது.
junction	சந்திப்பு	சந்திப்பில் இடதுபுறம் திரும்பவும்.
jurisdiction	அதிகார வரம்பு	நீதிமன்றத்திற்கு வரையறுக்கப்பட்ட அதிகார வரம்பு உள்ளது.
just	நியாயமான	நீதிபதி ஒரு நியாயமான முடிவை எடுத்தார்.
justification	நியாயப்படுத்தல்	செலவு செய்வதற்கு தெளிவான நியாயப்படுத்தல் தேவை.
kidnap	கடத்து	குற்றவாளிகள் இராஜதந்திரியை கடத்த முயன்றனர்.
kidney	சிறுநீரகம்	அவரது சிறுநீரக செயல்பாடு மேம்பட்டது.
kingdom	ராஜ்யம்	அவரது ஆட்சியின் கீழ் ராஜ்யம் விரிவடைந்தது.
lad	சிறுவன்	இளம் சிறுவன் பைகளை எடுத்துச் சென்றான்.
landlord	வீட்டு உரிமையாளர்	வீட்டு உரிமையாளர் வெப்பமாக்கல் அமைப்பை சரிசெய்தார்.
landmark	முக்கிய இடம்	கோபுரம் நகரின் முக்கிய இடமாக மாறியது.
lap	மடி	குழந்தை அவள் மடியில் அமர்ந்தது.
large-scale	பெரிய அளவிலான	நகரம் பெரிய அளவிலான பழுதுபார்ப்புகளைத் திட்டமிட்டது.
laser	லேசர்	லேசர் தூரத்தை அளந்தது.
latter	பிந்தைய	பிந்தைய விருப்பம் பாதுகாப்பானதாகத் தெரிகிறது.
lawn	புல்வெளி	குழந்தைகள் புல்வெளியில் விளையாடினர்.
lawsuit	வழக்கு	நிறுவனம் வழக்கை பைசல் செய்தது.
layout	தளவமைப்பு	பக்கத் தளவமைப்பு தெளிவாகத் தெரிகிறது.
leak	கசிவு	குழாய் கசிவு சமையலறையில் வெள்ளத்தை ஏற்படுத்தியது.
leap	பாய்ச்சல்	விற்பனை திடீர் பாய்ச்சலைச் செய்தது.
legacy	பாரம்பரியம்	அவரது பாரம்பரியம் பல்கலைக்கழகத்தை வடிவமைத்தது.
legendary	புகழ்பெற்ற	புகழ்பெற்ற பாடகர் மீண்டும் மேடைக்குத் திரும்பினார்.
legislation	சட்டம்	புதிய சட்டம் குத்தகைதாரர்களைப் பாதுகாக்கிறது.
legislative	சட்டமன்ற	சட்டமன்றக் குழு இன்று கூடியது.
legislature	சட்டமன்றம்	சட்டமன்றம் பட்ஜெட்டுக்கு ஒப்புதல் அளித்தது.
legitimate	சட்டபூர்வமான	அவர்கள் சட்டபூர்வமான கவலைகளை எழுப்பினர்.
lengthy	நீண்ட	நீண்ட விவாதம் வாக்கெடுப்பைத் தாமதப்படுத்தியது.
lesbian	தன்பாலின ஈர்ப்பாளர்	தன்பாலின ஈர்ப்பாளர் செயற்பாட்டாளர் மன்றத்தில் பேசினார்.
lesser	குறைவான	குறைவான அபாயத்தைத் தேர்வுசெய்யவும்.
lethal	மரணத்தை விளைவிக்கும்	ரசாயனம் மரணத்தை விளைவிக்கும்.
liable	பொறுப்பான	சேதங்களுக்கு ஓட்டுநர்களே பொறுப்பு.
liberal	தாராளவாத	அவர் தாராளவாத சமூகக் கொள்கைகளை ஆதரிக்கிறார்.
liberation	விடுதலை	விடுதலை நாட்டின் எதிர்காலத்தை மாற்றியது.
liberty	சுதந்திரம்	சட்டம் தனிப்பட்ட சுதந்திரத்தைப் பாதுகாக்கிறது.
license	உரிமம் வழங்கு	அரசு புதிய கிளினிக்குகளுக்கு உரிமம் வழங்கலாம்.
lifelong	வாழ்நாள்	அவள் அங்கே வாழ்நாள் நண்பர்களை உருவாக்கினாள்.
likelihood	சாத்தியம்	மழை பெய்வதற்கான சாத்தியம் அதிகரித்துள்ளது.
limb	உறுப்பு	காயமடைந்த உறுப்பு மெதுவாக குணமடைந்தது.
linear	நேரியல்	வரைபடம் ஒரு நேரியல் போக்கைக் காட்டுகிறது.
line-up	வரிசை	திருவிழா வரிசையில் உள்ளூர் இசைக்குழுக்கள் அடங்கும்.
linger	தங்கியிரு	வாசனை மணிக்கணக்கில் தங்கியிருக்கலாம்.
listing	பட்டியல்	அபார்ட்மெண்ட் பட்டியல் துல்லியமாகத் தெரிந்தது.
literacy	எழுத்தறிவு	வயது வந்தோர் எழுத்தறிவுத் திட்டங்கள் விரிவுபடுத்தப்பட்டன.
liver	கல்லீரல்	கல்லீரல் தீங்கு விளைவிக்கும் பொருட்களை வடிகட்டுகிறது.
lobby	காத்திருப்பு அறை	நண்பகலுக்குப் பிறகு காத்திருப்பு அறை கூட்டமாக இருந்தது.
log	பதிவு	கணினி தினசரி பதிவை வைத்திருக்கிறது.
logic	தர்க்கம்	அவரது வாதத்தின் தர்க்கம் தோல்வியடைந்தது.
long-standing	நீண்டகால	அவர்கள் ஒரு நீண்டகால தகராறைத் தீர்த்தனர்.
long-time	நீண்டகால	அவர் ஒரு நீண்டகால தன்னார்வலர்.
loom	தோன்று	பள்ளத்தாக்கின் மீது கருமேகங்கள் தோன்றுகின்றன.
loop	வளையம்	பாதை ஒரு வளையத்தை உருவாக்குகிறது.
loyalty	விசுவாசம்	அவரது விசுவாசம் அணியை ஈர்த்தது.
machinery	இயந்திரங்கள்	தொழிற்சாலை புதிய இயந்திரங்களை நிறுவியது.
magical	மாயாஜாலமான	தோட்டம் இரவில் மாயாஜாலமாக காட்சியளித்தது.
magistrate	மாஜிஸ்திரேட்	மாஜிஸ்திரேட் வழக்கை விசாரித்தார்.
magnetic	காந்த	காந்தப்புலம் திசைகாட்டி மீது தாக்கத்தை ஏற்படுத்தியது.
magnitude	அளவு	சேதத்தின் அளவு தெளிவாக இருந்தது.
mainland	பிரதான நிலப்பரப்பு	படகு தீவுகளை பிரதான நிலப்பரப்புடன் இணைக்கிறது.
mainstream	முக்கிய நீரோட்டம்	இந்த யோசனை முக்கிய நீரோட்ட அரசியலுக்குள் நுழைந்தது.
maintenance	பராமரிப்பு	வழக்கமான பராமரிப்பு பழுதுகளைத் தடுக்கிறது.
mandate	ஆணை	ஜனாதிபதி ஒரு வலுவான ஆணையைக் கோரினார்.
mandatory	கட்டாயமான	பயிற்சியாளர்களுக்கு வருகை கட்டாயமாகும்.
manifest	வெளிப்படு	அறிகுறிகள் வாரங்களுக்குப் பிறகு வெளிப்படலாம்.
manipulate	கையாளு	கணக்கெடுப்பு முடிவுகளை கையாள வேண்டாம்.
manipulation	கையாளுதல்	தரவு கையாளுதல் கண்டுபிடிக்கப்பட்டது.
manuscript	கையெழுத்துப் பிரதி	வெளியீட்டாளர் அவரது கையெழுத்துப் பிரதியை ஏற்றுக்கொண்டார்.
march	அணிவகுத்துச் செல்	போராட்டக்காரர்கள் நகர மையத்திற்கு அணிவகுத்துச் செல்வார்கள்.
marginal	சிறிய	மாற்றத்தால் சிறிய நன்மைகளே கிடைத்தன.
marine	கடல்	கடல்வாழ் உயிரினங்களுக்கு சுத்தமான தண்ணீர் தேவை.
marketplace	சந்தை	ஆன்லைன் சந்தை விரைவாக விரிவடைந்தது.
mask	முகமூடி	தொழிலாளர்கள் முகமூடி அணிய வேண்டும்.
massacre	படுகொலை	படுகொலை முழு பிராந்தியத்தையும் அதிர்ச்சிக்குள்ளாக்கியது.
mathematical	கணித	கணித மாதிரி தேவையை கணித்தது.
mature	முதிர்ந்த	முதிர்ந்த மரங்கள் நிழல் தருகின்றன.
maximize	அதிகப்படுத்து	புதுப்பிப்பு பேட்டரி ஆயுளை அதிகப்படுத்தும்.
meaningful	அர்த்தமுள்ள	அவர்கள் ஒரு அர்த்தமுள்ள உரையாடலை நடத்தினர்.
meantime	இதற்கிடையில்	இதற்கிடையில், வெளியே காத்திருக்கவும்.
medieval	இடைக்கால	கோட்டையில் இடைக்கால சுவர்கள் உள்ளன.
meditation	தியானம்	தினசரி தியானம் அவள் மனதை அமைதிப்படுத்துகிறது.
melody	மெல்லிசை	மெல்லிசை என் தலையில் தங்கியிருந்தது.
memo	குறிப்பாணை	குறிப்பாணை கொள்கையை விளக்கியது.
memoir	நினைவுக்குறிப்பு	அவரது நினைவுக்குறிப்பு குழந்தைப்பருவ நாடுகடத்தலை விவரிக்கிறது.
memorial	நினைவிடம்	நினைவிடம் உள்ளூர் வீரர்களை கௌரவிக்கிறது.
mentor	வழிகாட்டி	அவரது வழிகாட்டி முன்மொழிவை மதிப்பாய்வு செய்தார்.
merchant	வியாபாரி	வியாபாரி பட்டு மற்றும் மசாலாப் பொருட்களை விற்றார்.
mercy	கருணை	நீதிபதி கருணை காட்டினார்.
mere	வெறும்	ஒரு வெறும் பார்வை பிழையை வெளிப்படுத்தியது.
merely	வெறுமனே	அவள் வெறுமனே வழிமுறைகளைத் திரும்பக் கூறினாள்.
merge	இணை	இரண்டு நிறுவனங்களும் இணையவுள்ளன.
merger	இணைப்பு	இணைப்பு ஒரு பெரிய வங்கியை உருவாக்கியது.
merit	தகுதி	முன்மொழிவில் தெளிவான தகுதி உள்ளது.
methodology	முறைமை	ஆய்வு அதன் முறைமையை விளக்குகிறது.
midst	மத்தியில்	அவர்கள் குழப்பத்தின் மத்தியில் வேலை செய்தனர்.
migration	இடம்பெயர்வு	பருவகால இடம்பெயர்வு உள்ளூர் வேலைகளை பாதிக்கிறது.
militant	தீவிரவாதி	தீவிரவாதக் குழு பேச்சுவார்த்தையை நிராகரித்தது.
militia	போராளிகள்	போராளிகள் சாலையை கட்டுப்படுத்தினர்.
mill	ஆலை	பழைய ஆலை ஒரு அருங்காட்சியகமாக மாறியது.
minimal	குறைந்தபட்ச	திட்டத்திற்கு குறைந்தபட்ச முயற்சி தேவை.
minimize	குறை	தேவையற்ற ஆபத்தை நாம் குறைக்க வேண்டும்.
mining	சுரங்கத் தொழில்	சுரங்கத் தொழில் நதி பள்ளத்தாக்கை சேதப்படுத்தியது.
ministry	அமைச்சகம்	அமைச்சகம் புதிய விதிகளை அறிவித்தது.
minute2	மிகச்சிறிய	கண்ணாடியில் ஒரு மிகச்சிறிய விரிசல் தோன்றியது.
miracle	அற்புதம்	அவர் குணமடைந்தது ஒரு அற்புதம் போல் தெரிந்தது.
misery	துன்பம்	அகதிகள் பல வருடங்கள் துன்பத்தை அனுபவித்தனர்.
misleading	தவறான வழிகாட்டும்	தவறான வழிகாட்டும் விளக்கப்படம் வாசகர்களைக் குழப்பியது.
missile	ஏவுகணை	ஏவுகணை சோதனை பதட்டங்களை அதிகரித்தது.
mob	கும்பல்	கோபமான கும்பல் போக்குவரத்தை தடுத்தது.
mobility	இயக்கம்	சிறந்த பேருந்துகள் நகர்ப்புற இயக்கத்தை மேம்படுத்துகின்றன.
mobilize	திரட்டு	தலைவர்கள் தன்னார்வலர்களை விரைவாக திரட்டுகிறார்கள்.
moderate	மிதமான	வேட்பாளர் மிதமான கருத்துக்களைக் கொண்டுள்ளார்.
modification	மாற்றம்	வடிவமைப்பிற்கு ஒரு மாற்றம் தேவை.
momentum	உத்வேகம்	பிரச்சாரம் விரைவாக உத்வேகம் பெற்றது.
