source_headword	TE	example_TE
abolish	రద్దు చేయు	చట్టం పాత రుసుమును రద్దు చేస్తుంది.
abortion	అబార్షన్	అబార్షన్ ఒక సున్నితమైన వైద్య సమస్యగా మిగిలిపోయింది.
absence	గైరుహాజరీ	ఆమె గైరుహాజరీ తుది నిర్ణయాన్ని ఆలస్యం చేసింది.
absent	హాజరుకాని	ఇద్దరు సభ్యులు తరగతికి హాజరుకాలేదు.
absurd	అసంబద్ధమైన	ఆ వాదన అందరికీ అసంబద్ధంగా అనిపించింది.
abundance	సమృద్ధి	లోయలో సమృద్ధిగా నీరు ఉంది.
abuse	దుర్వినియోగం	నివేదిక కార్యాలయంలోని దుర్వినియోగాన్ని వివరించింది.
academy	అకాడమీ	అకాడమీ యువ సంగీతకారులకు శిక్షణ ఇస్తుంది.
accelerate	వేగవంతం చేయు	కొత్త నిధులు పరిశోధనను వేగవంతం చేస్తాయి.
acceptance	అంగీకారం	విమర్శలను అతను అంగీకరించడం నన్ను ఆకట్టుకుంది.
accessible	అందుబాటులో ఉన్న	మ్యూజియం వీల్‌చైర్ వినియోగదారులకు అందుబాటులో ఉంది.
accomplishment	ఘనకార్యం	పుస్తకాన్ని పూర్తి చేయడం నిజమైన ఘనకార్యం.
accordance	అనుగుణంగా	విధానానికి అనుగుణంగా పని జరిగింది.
accordingly	తదనుగుణంగా	ఆధారాలు మారాయి, మేము తదనుగుణంగా వ్యవహరించాము.
accountability	జవాబుదారీతనం	ఈ విధానం నిర్వాహకులకు జవాబుదారీతనాన్ని పెంచుతుంది.
accountable	జవాబుదారీగా	భద్రతకు నిర్వాహకులు జవాబుదారీగా ఉంటారు.
accumulate	కూడబెట్టు	స్క్రీన్ వెనుక దుమ్ము పేరుకుపోతుంది.
accumulation	సంచితం	డేటా సంచితానికి నెలల సమయం పట్టింది.
accusation	ఆరోపణ	ఈ ఆరోపణ కమిటీని దిగ్భ్రాంతికి గురిచేసింది.
accused	నిందితుడు	నిందితుడు కోర్టుకు హాజరయ్యాడు.
acquisition	కొనుగోలు	కొనుగోలు ద్వారా కంపెనీ వేగంగా విస్తరించింది.
acre	ఎకరం	పొలం ఒక ఎకరం విస్తీర్ణంలో ఉంది.
activation	యాక్టివేషన్	కార్డ్ యాక్టివేషన్ నిమిషాల్లో జరుగుతుంది.
activist	కార్యకర్త	ర్యాలీలో కార్యకర్త మాట్లాడారు.
acute	తీవ్రమైన	పరుగెత్తిన తర్వాత ఆమె తీవ్రమైన నొప్పితో బాధపడింది.
adaptation	అనుసరణ	అనుసరణ నవల ముగింపును మార్చింది.
adhere	కట్టుబడి ఉండు	సిబ్బంది భద్రతా నిబంధనలకు కట్టుబడి ఉండాలి.
adjacent	ప్రక్కనే ఉన్న	హోటల్ స్టేషన్ ప్రక్కనే ఉంది.
adjustment	సర్దుబాటు	చిన్న సర్దుబాటు సమస్యను పరిష్కరించింది.
administer	నిర్వహించు	నర్సులు టీకాను జాగ్రత్తగా నిర్వహిస్తారు.
administrative	పరిపాలనా	పరిపాలనా సిబ్బంది ఫారమ్‌లను నిర్వహిస్తారు.
administrator	నిర్వాహకుడు	నిర్వాహకుడు నా పాస్‌వర్డ్‌ని రీసెట్ చేశారు.
admission	ప్రవేశం	మ్యూజియంలోకి ప్రవేశం ఉచితం.
adolescent	కౌమారదశలో ఉన్నవారు	కౌమారదశలో ఉన్నవారికి అదనపు మద్దతు అవసరం.
adoption	దత్తత	దత్తత బిడ్డకు స్థిరమైన ఇల్లు ఇచ్చింది.
adverse	ప్రతికూల	మందు ప్రతికూల ప్రభావాలను కలిగించింది.
advocate	న్యాయవాది	న్యాయవాది అద్దెదారుల హక్కులను సమర్థించారు.
aesthetic	సౌందర్య	గది ప్రశాంతమైన సౌందర్య శైలిని కలిగి ఉంది.
affection	ఆప్యాయత	ఆమె తన కుటుంబంపై ఆప్యాయత చూపింది.
aftermath	పర్యవసానం	తుఫాను పర్యవసానం కష్టంగా ఉంది.
aggression	దూకుడు	విరామ సమయంలో ఉపాధ్యాయుడు దూకుడును గమనించారు.
agricultural	వ్యవసాయ	ఈ సంవత్సరం వ్యవసాయ ఎగుమతులు పెరిగాయి.
aide	సహాయకుడు	సహాయకుడు మంత్రి షెడ్యూల్‌ను ఏర్పాటు చేశారు.
albeit	అయినప్పటికీ	ప్రణాళిక పనిచేసింది, అయినప్పటికీ నెమ్మదిగా.
alert	అప్రమత్తం చేయు	దయచేసి వెంటనే సిబ్బందిని అప్రమత్తం చేయండి.
align	సమలేఖనం చేయు	బాణాలు రహదారితో సమలేఖనం చేయబడ్డాయి.
alignment	అమరిక	చక్రాల అమరిక కారు పనితీరును మెరుగుపరిచింది.
alike	ఒకేలా	కవలలు వారాంతాల్లో ఒకేలా దుస్తులు ధరిస్తారు.
allegation	ఆరోపణ	వార్తాపత్రికలో ఆరోపణ వచ్చింది.
allege	ఆరోపించు	నిధులు పోయాయని వారు ఆరోపిస్తున్నారు.
allegedly	ఆరోపించిన విధంగా	డ్రైవర్ ఆరోపించిన విధంగా హెచ్చరికను పట్టించుకోలేదు.
alliance	కూటమి	పార్టీలు తాత్కాలిక కూటమిని ఏర్పాటు చేశాయి.
allocate	కేటాయించు	నగరంలోని పాఠశాలలకు నగదు కేటాయిస్తారు.
allocation	కేటాయింపు	సీట్ల కేటాయింపు అన్యాయంగా జరిగింది.
allowance	భత్యం	ఆమె భత్యం భోజనం మరియు రవాణాను కవర్ చేస్తుంది.
ally	మిత్రదేశం	కెనడా సన్నిహిత మిత్రదేశంగా మారింది.
aluminium	అల్యూమినియం	ఫ్రేమ్ అల్యూమినియంతో తయారు చేయబడింది.
amateur	ఔత్సాహిక	ఒక ఔత్సాహిక ఫోటోగ్రాఫర్ చిత్రాన్ని తీశారు.
ambassador	రాయబారి	రాయబారి స్థానిక విద్యార్థులను కలుసుకున్నారు.
amend	సవరించు	చట్టాన్ని సవరించాలని పార్లమెంటు ఓటు వేసింది.
amendment	సవరణ	సవరణ ఒక పేరాను మార్చింది.
amid	మధ్య	పెరుగుతున్న ఉద్రిక్తతల మధ్య ఈ ప్రసంగం వచ్చింది.
analogy	సారూప్యత	ఉపాధ్యాయుడు ఒక సాధారణ సారూప్యతను ఉపయోగించారు.
anchor	యాంకర్	పడవ ద్వీపం దగ్గర యాంకర్ వేసింది.
angel	దేవదూత	బిడ్డ దేవదూత దుస్తులు ధరించింది.
anonymous	అజ్ఞాత	ఫిర్యాదు అజ్ఞాతంగా వచ్చింది.
apparatus	పరికరం	ప్రయోగశాల పరికరాన్ని శుభ్రం చేయాలి.
appealing	ఆకర్షణీయమైన	ఆఫర్ విద్యార్థులకు ఆకర్షణీయంగా కనిపిస్తోంది.
appetite	ఆకలి	వ్యాయామం అతని ఆకలిని పెంచింది.
applaud	చప్పట్లు కొట్టు	ప్రేక్షకులు బిగ్గరగా చప్పట్లు కొట్టడం ప్రారంభించారు.
applicable	వర్తించే	డిస్కౌంట్ ఈ రోజు వర్తిస్తుంది.
appoint	నియమించు	బోర్డు ఒక డైరెక్టర్‌ను నియమిస్తుంది.
appreciation	ప్రశంసలు	వారి సహాయానికి ఆమె తన ప్రశంసలు వ్యక్తం చేసింది.
arbitrary	ఏకపక్ష	గడువు సిబ్బందికి ఏకపక్షంగా అనిపించింది.
architectural	నిర్మాణ	నగరం దాని నిర్మాణ వారసత్వాన్ని కాపాడుతుంది.
archive	ఆర్కైవ్	ఆర్కైవ్ పాత ఛాయాచిత్రాలను నిల్వ చేస్తుంది.
arena	అరేనా	చర్చ పబ్లిక్ అరేనాలోకి ప్రవేశించింది.
arguably	బహుశా	బహుశా ఇది అతని ఉత్తమ నవల.
arm	ఆయుధాలు ఇవ్వు	కాపలాదారులు కాన్వాయ్‌కు ఆయుధాలు ఇస్తారు.
array	శ్రేణి	దుకాణం అనేక రకాల సాధనాలను అందిస్తుంది.
articulate	స్పష్టంగా వ్యక్తీకరించు	ఆమె సంక్లిష్టమైన ఆలోచనలను స్పష్టంగా వ్యక్తీకరించగలదు.
ash	బూడిద	అగ్నిప్రమాదం తర్వాత కారును బూడిద కప్పేసింది.
aspiration	ఆశయం	సర్జన్ కావాలన్నదే ఆమె ఆశయం.
aspire	ఆకాంక్షించు	చాలా మంది విద్యార్థులు విదేశాల్లో చదువుకోవాలని ఆకాంక్షిస్తారు.
assassination	హత్య	ఈ హత్య దేశ రాజకీయాలను మార్చివేసింది.
assault	దాడి	స్టేషన్ సమీపంలో దాడి జరిగింది.
assemble	సమీకరించు	కార్మికులు ఫర్నిచర్‌ను చేతితో సమీకరిస్తారు.
assembly	అసెంబ్లీ	పాఠశాల అసెంబ్లీ తొమ్మిది గంటలకు ప్రారంభమవుతుంది.
assert	నొక్కిచెప్పు	అతను తన అధికారాన్ని నొక్కిచెప్పడానికి ప్రయత్నించాడు.
assertion	వాదన	ఆమె వాదన ప్యానెల్‌ను ఆశ్చర్యపరిచింది.
assurance	భరోసా	మేనేజర్ మద్దతు ఇస్తానని భరోసా ఇచ్చారు.
asylum	ఆశ్రయం	కుటుంబం సరిహద్దులో ఆశ్రయం కోరింది.
atrocity	దారుణం	ఈ చిత్రం యుద్ధకాలపు దారుణాన్ని వివరించింది.
attain	సాధించు	కొద్ది మంది రన్నర్లు ఆ వేగాన్ని సాధిస్తారు.
attendance	హాజరు	ప్రకటన తర్వాత హాజరు మెరుగుపడింది.
attorney	న్యాయవాది	న్యాయవాది సాక్షిని ప్రశ్నించారు.
attribute	ఆపాదించు	శాస్త్రవేత్తలు పెరుగుదలను కాలుష్యానికి ఆపాదిస్తున్నారు.
audit	ఆడిట్	ఆడిట్‌లో అనేక లోపాలు కనుగొనబడ్డాయి.
authentic	ప్రామాణికమైన	రెస్టారెంట్ ప్రామాణికమైన ప్రాంతీయ ఆహారాన్ని అందిస్తుంది.
authorize	అధికారం ఇవ్వు	నిర్వాహకులు మాత్రమే వాపసులకు అధికారం ఇవ్వగలరు.
auto	ఆటో	ఆటో పరిశ్రమ వేగంగా మారింది.
autonomy	స్వయంప్రతిపత్తి	ఈ ప్రాంతం మరింత స్వయంప్రతిపత్తిని కోరుకుంటోంది.
availability	లభ్యత	సీట్ల లభ్యత పరిమితంగా ఉంది.
await	వేచి ఉండు	మీ సమాధానం కోసం చాలా సందేశాలు వేచి ఉన్నాయి.
backdrop	నేపథ్యం	పర్వతాలు ఒక అద్భుతమైన నేపథ్యాన్ని ఏర్పరిచాయి.
backing	మద్దతు	ప్రతిపాదన ఓటర్ల మద్దతు పొందింది.
backup	బ్యాకప్	సిస్టమ్ ప్రతిరోజూ బ్యాకప్‌ను సృష్టిస్తుంది.
bail	బెయిల్	న్యాయమూర్తి మధ్యాహ్నం బెయిల్ మంజూరు చేశారు.
ballot	బ్యాలెట్	ప్రతి ఓటరు బ్యాలెట్ అందుకున్నారు.
banner	బ్యానర్	ప్రవేశద్వారం పైన బ్యానర్ వేలాడుతోంది.
bare	ఖాళీ	గదిలో ఖాళీ గోడలు ఉన్నాయి.
barrel	బారెల్	బారెల్ నీటితో నిండి ఉంది.
bass1	బాస్	బాస్ శబ్దం లోతుగా మరియు వెచ్చగా ఉంది.
battlefield	యుద్ధభూమి	పాత యుద్ధభూమి స్మారక చిహ్నంగా మారింది.
bay	అఖాతం	గ్రామం ప్రశాంతమైన అఖాతం పక్కన ఉంది.
beam	దూలం	ఉక్కు దూలం పైకప్పుకు మద్దతు ఇస్తుంది.
beast	మృగం	కథ ఒక భయంకరమైన మృగాన్ని వివరిస్తుంది.
behalf	తరపున	ఆమె తన జట్టు తరపున మాట్లాడింది.
beloved	ప్రియమైన	ప్రియమైన ఉపాధ్యాయుడు ఈ రోజు పదవీ విరమణ చేశారు.
bench	బెంచ్	వారు చెక్క బెంచీపై కూర్చున్నారు.
benchmark	బెంచ్‌మార్క్	పరీక్ష పరిశ్రమకు బెంచ్‌మార్క్‌గా మారింది.
beneath	కింద	పత్రాలు ఫోల్డర్ కింద ఉన్నాయి.
beneficiary	లబ్ధిదారుడు	ఆమె కొడుకు ప్రధాన లబ్ధిదారుడు.
betray	ద్రోహం చేయు	మీ స్నేహితుని నమ్మకానికి ద్రోహం చేయకండి.
bind	కట్టుబడి ఉండు	ఒప్పందం రెండు కంపెనీలను కట్టుబడి ఉంచుతుంది.
biography	జీవిత చరిత్ర	అతని జీవిత చరిత్ర అనేక కాపీలు అమ్ముడైంది.
bishop	బిషప్	బిషప్ గ్రామ చర్చిని సందర్శించారు.
bizarre	విచిత్రమైన	సినిమా ముగింపు విచిత్రంగా ఉంది.
blade	బ్లేడ్	బ్లేడ్ తాడును కత్తిరించింది.
blast	పేలుడు	పేలుడు కారణంగా సమీపంలోని కిటికీలు పగిలిపోయాయి.
bleed	రక్తస్రావం	గాయం నుండి ఎక్కువగా రక్తం కారడం ప్రారంభమైంది.
blend	మిశ్రమం	సాస్ మృదువుగా మారే వరకు కలపండి.
bless	ఆశీర్వదించు	పూజారి ఇంటిని ఆశీర్వదిస్తారు.
blessing	ఆశీర్వాదం	మద్దతు పొందడం ఒక ఆశీర్వాదం.
boast	గొప్పలు చెప్పు	అతను డబ్బు గురించి గొప్పలు చెప్పుకోవడానికి ఇష్టపడతాడు.
bonus	బోనస్	ఉద్యోగులకు సెలవు బోనస్ లభించింది.
boom	వృద్ధి	నగరం నిర్మాణ రంగంలో వృద్ధిని సాధించింది.
bounce	బౌన్స్	బంతి చాలా ఎత్తుకు ఎగరగలదు.
boundary	సరిహద్దు	నది సరిహద్దును సూచిస్తుంది.
bow1	వంగి నమస్కరించు	నటుడు తలవంచి నమస్కరించాడు.
breach	ఉల్లంఘన	ఉల్లంఘన వ్యక్తిగత డేటాను బహిర్గతం చేసింది.
breakdown	విచ్ఛిన్నం	నివేదికలో ఖర్చుల విచ్ఛిన్నం ఉంది.
breakthrough	పురోగతి	ఈ ఆవిష్కరణ ఒక ప్రధాన పురోగతి.
breed	జాతి	ఈ పక్షులు వసంతకాలంలో సంతానోత్పత్తి చేస్తాయి.
broadband	బ్రాడ్‌బ్యాండ్	కార్యాలయానికి వేగవంతమైన బ్రాడ్‌బ్యాండ్ అవసరం.
browser	బ్రౌజర్	లాగిన్ చేయడానికి ముందు మీ బ్రౌజర్‌ను అప్‌డేట్ చేయండి.
brutal	క్రూరమైన	దాడి క్రూరంగా మరియు ఆకస్మికంగా జరిగింది.
buck	బక్	టికెట్ ధర పది బక్స్.
buddy	స్నేహితుడు	అతని స్నేహితుడు బయట వేచి ఉన్నాడు.
buffer	బఫర్	చెట్లు శబ్ద బఫర్‌ను సృష్టిస్తాయి.
bulk	పెద్దమొత్తంలో	వారు బియ్యాన్ని పెద్దమొత్తంలో కొనుగోలు చేశారు.
burden	భారం	అప్పు పెద్ద భారం అయింది.
bureaucracy	బ్యూరోక్రసీ	బ్యూరోక్రసీ వల్ల పర్మిట్ ఆలస్యమైంది.
burial	ఖననం	తెల్లవారుజామున ఖననం జరిగింది.
burst	పేలడం	ఒత్తిడి వల్ల పైపు పగిలిపోవచ్చు.
cabinet	క్యాబినెట్	క్యాబినెట్ ఈ పథకానికి ఆమోదం తెలిపింది.
calculation	లెక్కింపు	లెక్కింపుకు కొన్ని నిమిషాలు పట్టింది.
canvas	కాన్వాస్	కళాకారుడు ఒక పెద్ద కాన్వాస్‌పై చిత్రాన్ని గీశాడు.
capability	సామర్థ్యం	పరికరం వైర్‌లెస్ సామర్థ్యాన్ని కలిగి ఉంది.
capitalism	పెట్టుబడిదారీ విధానం	పెట్టుబడిదారీ విధానం ఆధునిక ఆర్థిక వ్యవస్థను రూపొందించింది.
capitalist	పెట్టుబడిదారీ	పెట్టుబడిదారీ వ్యవస్థ ప్రైవేట్ పెట్టుబడులకు బహుమతి ఇస్తుంది.
cargo	సరుకు	నౌక వైద్య సరుకులను మోసుకెళ్లింది.
carriage	క్యారేజ్	రైలు క్యారేజ్ దాదాపు ఖాళీగా ఉంది.
carve	చెక్కు	అతను చెక్కను జాగ్రత్తగా చెక్కుతాడు.
casino	క్యాసినో	హోటల్ సమీపంలో క్యాసినో ప్రారంభమైంది.
casualty	ప్రాణనష్టం	ఈ ప్రమాదంలో ఒకరు మరణించారు.
catalogue	కేటలాగ్	కేటలాగ్ ప్రతి ఉత్పత్తిని జాబితా చేస్తుంది.
cater	సేవలు అందించు	రెస్టారెంట్ పెద్ద ఈవెంట్‌లకు సేవలు అందించగలదు.
cattle	పశువులు	నది ఒడ్డున పశువులు మేస్తున్నాయి.
caution	జాగ్రత్త	మంచుతో కూడిన రోడ్లపై జాగ్రత్త వహించండి.
cautious	అప్రమత్తంగా	ఈ వారం పెట్టుబడిదారులు అప్రమత్తంగా ఉన్నారు.
cease	ఆపివేయు	ఫ్యాక్టరీ త్వరలో ఉత్పత్తిని నిలిపివేస్తుంది.
cemetery	స్మశానవాటిక	స్మశానవాటిక సముద్రం వైపు ఉంటుంది.
chamber	గది	ఓటింగ్ సమయంలో గది నిశ్శబ్దంగా ఉంది.
chaos	గందరగోళం	జాప్యం విమానాశ్రయంలో గందరగోళానికి దారితీసింది.
characterize	వర్గీకరించు	నిపుణులు ఈ పథకాన్ని ప్రమాదకరమైనదిగా వర్గీకరిస్తున్నారు.
charm	ఆకర్షణ	నగరానికి పాతకాలపు ఆకర్షణ ఉంది.
charter	చార్టర్	చార్టర్ ప్రాథమిక హక్కులను రక్షిస్తుంది.
chronic	దీర్ఘకాలిక	అతను దీర్ఘకాలిక వెన్నునొప్పితో బాధపడుతున్నాడు.
chunk	ముక్క	జున్ను ఒక ముక్కగా కత్తిరించండి.
circulate	ప్రసారం చేయు	దయచేసి ఈరోజు ఎజెండాను ప్రసారం చేయండి.
circulation	సర్క్యులేషన్	వార్తాపత్రిక సర్క్యులేషన్ బాగా పడిపోయింది.
citizenship	పౌరసత్వం	ఆమె ఫ్రెంచ్ పౌరసత్వం కోసం దరఖాస్తు చేసుకుంది.
