source_headword	HI	example_HI
firstly	सबसे पहले	सबसे पहले, प्रश्न पढ़ो.
fishing	मछली पकड़ना	मछली पकड़ना यहाँ लोकप्रिय है.
fit	ठीक आना	ये जूते ठीक आते हैं.
fix	ठीक करना	टूटी कुर्सी ठीक करो.
flu	फ्लू	मुझे फ्लू है.
flying	उड़ान	उड़ान तेज होती है.
focus	ध्यान केंद्रित करना	इस काम पर ध्यान केंद्रित करो.
following	निम्नलिखित	निम्नलिखित वाक्य पढ़ो.
foreign	विदेशी	वह विदेशी भाषा बोलती है.
forest	जंगल	जंगल शांत है.
fork	काँटा	काँटा इस्तेमाल करो.
formal	औपचारिक	यह पत्र औपचारिक है.
fortunately	सौभाग्य से	सौभाग्य से कोई घायल नहीं हुआ.
forward	आगे	धीरे-धीरे आगे बढ़ो.
fresh	ताज़ा	रोटी ताज़ा है.
