part_of_speech	source_lemma	display_ES	display_ES_419	article_ES	article_ES_419	gender	number_policy	verb_infinitive	verb_group	meaning_note	semantic_scene	topic_domain	example_ES	example_ES_419
noun	cerebro	cerebro	cerebro	el	el	masculine	singular_default	not_applicable	not_applicable	brain	body organ	body_health_clothing	El cerebro trabaja siempre.	El cerebro trabaja siempre.
noun	memoria	memoria	memoria	la	la	feminine	singular_default	not_applicable	not_applicable	memory	remembering	body_health_clothing	Mi memoria es buena.	Mi memoria es buena.
noun	lágrima	lágrima	lágrima	la	la	feminine	singular_default	not_applicable	not_applicable	tear	crying	body_health_clothing	La lágrima cae despacio.	La lágrima cae despacio.
noun	sonrisa	sonrisa	sonrisa	la	la	feminine	singular_default	not_applicable	not_applicable	smile	friendly expression	body_health_clothing	Su sonrisa es bonita.	Su sonrisa es bonita.
noun	sueño	sueño	sueño	el	el	masculine	singular_default	not_applicable	not_applicable	sleepiness or dream	feeling sleepy	body_health_clothing	Tengo sueño esta noche.	Tengo sueño esta noche.
noun	cansancio	cansancio	cansancio	el	el	masculine	singular_default	not_applicable	not_applicable	tiredness	feeling tired	body_health_clothing	El cansancio llega tarde.	El cansancio llega tarde.
noun	enfermedad	enfermedad	enfermedad	la	la	feminine	singular_default	not_applicable	not_applicable	illness	health problem	body_health_clothing	La enfermedad no es grave.	La enfermedad no es grave.
noun	síntoma	síntoma	síntoma	el	el	masculine	singular_default	not_applicable	not_applicable	symptom	health sign	body_health_clothing	El síntoma empieza hoy.	El síntoma empieza hoy.
noun	jarabe	jarabe	jarabe	el	el	masculine	singular_default	not_applicable	not_applicable	syrup	medicine syrup	body_health_clothing	El jarabe está en la cocina.	El jarabe está en la cocina.
noun	inyección	inyección	inyección	la	la	feminine	singular_default	not_applicable	not_applicable	injection	medical injection	body_health_clothing	La inyección es rápida.	La inyección es rápida.
noun	operación	operación	operación	la	la	feminine	singular_default	not_applicable	not_applicable	operation	medical operation	body_health_clothing	La operación es mañana.	La operación es mañana.
noun	urgencia	urgencia	urgencia	la	la	feminine	singular_default	not_applicable	not_applicable	emergency	urgent problem	body_health_clothing	La urgencia empieza ahora.	La urgencia empieza ahora.
noun	alcohol	alcohol	alcohol	el	el	masculine	singular_default	not_applicable	not_applicable	alcohol	cleaning liquid	body_health_clothing	El alcohol está en el botiquín.	El alcohol está en el botiquín.
noun	algodón	algodón	algodón	el	el	masculine	singular_default	not_applicable	not_applicable	cotton	medical cotton	body_health_clothing	El algodón está limpio.	El algodón está limpio.
noun	mascarilla	mascarilla	mascarilla	la	la	feminine	singular_default	not_applicable	not_applicable	mask	face mask	body_health_clothing	La mascarilla está en la bolsa.	La mascarilla está en la bolsa.
noun	esponja	esponja	esponja	la	la	feminine	singular_default	not_applicable	not_applicable	sponge	bath item	body_health_clothing	La esponja está en la ducha.	La esponja está en la ducha.
noun	secador	secador	secador	el	el	masculine	singular_default	not_applicable	not_applicable	hair dryer	bathroom item	body_health_clothing	El secador está en el baño.	El secador está en el baño.
noun	maquillaje	maquillaje	maquillaje	el	el	masculine	singular_default	not_applicable	not_applicable	makeup	personal care	body_health_clothing	El maquillaje está en la mesa.	El maquillaje está en la mesa.
noun	afeitadora	afeitadora	afeitadora	la	la	feminine	singular_default	not_applicable	not_applicable	razor	personal care	body_health_clothing	La afeitadora está apagada.	La afeitadora está apagada.
noun	cinturón	cinturón	cinturón	el	el	masculine	singular_default	not_applicable	not_applicable	belt	clothing accessory	body_health_clothing	El cinturón es negro.	El cinturón es negro.
noun	bufanda	bufanda	bufanda	la	la	feminine	singular_default	not_applicable	not_applicable	scarf	clothing accessory	body_health_clothing	La bufanda es roja.	La bufanda es roja.
noun	guante	guante	guante	el	el	masculine	singular_default	not_applicable	not_applicable	glove	clothing accessory	body_health_clothing	El guante está mojado.	El guante está mojado.
noun	pijama	pijama	pijama	el	el	masculine	singular_default	not_applicable	not_applicable	pajamas	sleep clothes	body_health_clothing	El pijama es cómodo.	El pijama es cómodo.
noun	uniforme	uniforme	uniforme	el	el	masculine	singular_default	not_applicable	not_applicable	uniform	school clothes	body_health_clothing	El uniforme está limpio.	El uniforme está limpio.
noun	bolsillo	bolsillo	bolsillo	el	el	masculine	singular_default	not_applicable	not_applicable	pocket	clothing part	body_health_clothing	La llave está en el bolsillo.	La llave está en el bolsillo.
noun	talla	talla	talla	la	la	feminine	singular_default	not_applicable	not_applicable	size	clothing size	body_health_clothing	La talla es pequeña.	La talla es pequeña.
noun	marca	marca	marca	la	la	feminine	singular_default	not_applicable	not_applicable	brand	product brand	body_health_clothing	La marca es nueva.	La marca es nueva.
noun	botón	botón	botón	el	el	masculine	singular_default	not_applicable	not_applicable	button	clothing button	body_health_clothing	El botón está roto.	El botón está roto.
noun	azotea	azotea	azotea	la	la	feminine	singular_default	not_applicable	not_applicable	roof terrace	building top	home_city_travel_nature	La azotea tiene plantas.	La azotea tiene plantas.
noun	calefacción	calefacción	calefacción	la	la	feminine	singular_default	not_applicable	not_applicable	heating	home heating	home_city_travel_nature	La calefacción está encendida.	La calefacción está encendida.
noun	ventilador	ventilador	ventilador	el	el	masculine	singular_default	not_applicable	not_applicable	fan	home appliance	home_city_travel_nature	El ventilador mueve el aire.	El ventilador mueve el aire.
noun	persiana	persiana	persiana	la	la	feminine	singular_default	not_applicable	not_applicable	blind or shutter	window covering	home_city_travel_nature	La persiana está bajada.	La persiana está bajada.
noun	interruptor	interruptor	interruptor	el	el	masculine	singular_default	not_applicable	not_applicable	light switch	wall switch	home_city_travel_nature	El interruptor está junto a la puerta.	El interruptor está junto a la puerta.
noun	mueble	mueble	mueble	el	el	masculine	singular_default	not_applicable	not_applicable	piece of furniture	home object	home_city_travel_nature	El mueble es de madera.	El mueble es de madera.
noun	colchón	colchón	colchón	el	el	masculine	singular_default	not_applicable	not_applicable	mattress	bed part	home_city_travel_nature	El colchón es cómodo.	El colchón es cómodo.
noun	sillón	sillón	sillón	el	el	masculine	singular_default	not_applicable	not_applicable	armchair	living room chair	home_city_travel_nature	El sillón está junto al sofá.	El sillón está junto al sofá.
noun	estufa	estufa	estufa	la	la	feminine	singular_default	not_applicable	not_applicable	stove or heater	heating appliance	home_city_travel_nature	La estufa calienta la sala.	La estufa calienta la sala.
noun	cuna	cuna	cuna	la	la	feminine	singular_default	not_applicable	not_applicable	crib	baby bed	home_city_travel_nature	La cuna está en el dormitorio.	La cuna está en el dormitorio.
noun	cesto	cesto	cesto	el	el	masculine	singular_default	not_applicable	not_applicable	basket	home container	home_city_travel_nature	El cesto está lleno.	El cesto está lleno.
noun	cubo	cubo	cubo	el	el	masculine	singular_default	not_applicable	not_applicable	bucket	cleaning object	home_city_travel_nature	El cubo tiene agua.	El cubo tiene agua.
noun	escoba	escoba	escoba	la	la	feminine	singular_default	not_applicable	not_applicable	broom	cleaning tool	home_city_travel_nature	La escoba está detrás de la puerta.	La escoba está detrás de la puerta.
noun	fregona	fregona	fregona	la	la	feminine	singular_default	not_applicable	not_applicable	mop	cleaning tool	home_city_travel_nature	La fregona está limpia.	La fregona está limpia.
noun	detergente	detergente	detergente	el	el	masculine	singular_default	not_applicable	not_applicable	detergent	cleaning product	home_city_travel_nature	El detergente está en la lavadora.	El detergente está en la lavadora.
noun	trastero	trastero	trastero	el	el	masculine	singular_default	not_applicable	not_applicable	storage room	storage place	home_city_travel_nature	El trastero está abajo.	El trastero está abajo.
noun	portero	portero	portero	el	el	masculine	singular_default	not_applicable	not_applicable	doorman	building worker	home_city_travel_nature	El portero abre el portal.	El portero abre el portal.
noun	vecindario	vecindario	vecindario	el	el	masculine	singular_default	not_applicable	not_applicable	neighborhood	local area	home_city_travel_nature	El vecindario es tranquilo.	El vecindario es tranquilo.
noun	barrio	barrio	barrio	el	el	masculine	singular_default	not_applicable	not_applicable	district or neighborhood	local area	home_city_travel_nature	El barrio tiene un parque.	El barrio tiene un parque.
noun	zona	zona	zona	la	la	feminine	singular_default	not_applicable	not_applicable	area or zone	city area	home_city_travel_nature	La zona es segura.	La zona es segura.
noun	señal	señal	señal	la	la	feminine	singular_default	not_applicable	not_applicable	sign	road sign	home_city_travel_nature	La señal está en la carretera.	La señal está en la carretera.
noun	cartel	cartel	cartel	el	el	masculine	singular_default	not_applicable	not_applicable	poster or sign	public sign	home_city_travel_nature	El cartel anuncia un concierto.	El cartel anuncia un concierto.
noun	carril	carril	carril	el	el	masculine	singular_default	not_applicable	not_applicable	lane	road lane	home_city_travel_nature	El carril está libre.	El carril está libre.
noun	curva	curva	curva	la	la	feminine	singular_default	not_applicable	not_applicable	curve	road curve	home_city_travel_nature	La curva es peligrosa.	La curva es peligrosa.
noun	rueda	rueda	rueda	la	la	feminine	singular_default	not_applicable	not_applicable	wheel	vehicle part	home_city_travel_nature	La rueda está rota.	La rueda está rota.
noun	motor	motor	motor	el	el	masculine	singular_default	not_applicable	not_applicable	engine	vehicle part	home_city_travel_nature	El motor no funciona.	El motor no funciona.
noun	camión	camión	camión	el	el	masculine	singular_default	not_applicable	not_applicable	truck	large vehicle	home_city_travel_nature	El camión lleva cajas.	El camión lleva cajas.
noun	motocicleta	motocicleta	motocicleta	la	la	feminine	singular_default	not_applicable	not_applicable	motorcycle	vehicle	home_city_travel_nature	La motocicleta está aparcada.	La motocicleta está aparcada.
noun	patinete	patinete	patinete	el	el	masculine	singular_default	not_applicable	not_applicable	scooter	small vehicle	home_city_travel_nature	El patinete es eléctrico.	El patinete es eléctrico.
noun	casco	casco	casco	el	el	masculine	singular_default	not_applicable	not_applicable	helmet	safety object	home_city_travel_nature	El casco protege la cabeza.	El casco protege la cabeza.
noun	vuelo	vuelo	vuelo	el	el	masculine	singular_default	not_applicable	not_applicable	flight	air travel	home_city_travel_nature	El vuelo sale a las seis.	El vuelo sale a las seis.
noun	llegada	llegada	llegada	la	la	feminine	singular_default	not_applicable	not_applicable	arrival	travel arrival	home_city_travel_nature	La llegada es a las ocho.	La llegada es a las ocho.
noun	embarque	embarque	embarque	el	el	masculine	singular_default	not_applicable	not_applicable	boarding	airport boarding	home_city_travel_nature	El embarque empieza pronto.	El embarque empieza pronto.
noun	destino	destino	destino	el	el	masculine	singular_default	not_applicable	not_applicable	destination	travel destination	home_city_travel_nature	El destino está lejos.	El destino está lejos.
noun	excursión	excursión	excursión	la	la	feminine	singular_default	not_applicable	not_applicable	excursion	short trip	home_city_travel_nature	La excursión dura un día.	La excursión dura un día.
noun	camping	camping	camping	el	el	masculine	singular_default	not_applicable	not_applicable	camping site	travel lodging	home_city_travel_nature	El camping está cerca del río.	El camping está cerca del río.
noun	desierto	desierto	desierto	el	el	masculine	singular_default	not_applicable	not_applicable	desert	natural place	home_city_travel_nature	El desierto es seco.	El desierto es seco.
noun	valle	valle	valle	el	el	masculine	singular_default	not_applicable	not_applicable	valley	natural place	home_city_travel_nature	El valle tiene un río.	El valle tiene un río.
noun	océano	océano	océano	el	el	masculine	singular_default	not_applicable	not_applicable	ocean	sea area	home_city_travel_nature	El océano es grande.	El océano es grande.
noun	planeta	planeta	planeta	el	el	masculine	singular_default	not_applicable	not_applicable	planet	space object	home_city_travel_nature	La Tierra es un planeta.	La Tierra es un planeta.
noun	luna	luna	luna	la	la	feminine	singular_default	not_applicable	not_applicable	moon	sky object	home_city_travel_nature	La luna está clara.	La luna está clara.
noun	estrella	estrella	estrella	la	la	feminine	singular_default	not_applicable	not_applicable	star	sky object	home_city_travel_nature	La estrella brilla en el cielo.	La estrella brilla en el cielo.
noun	trueno	trueno	trueno	el	el	masculine	singular_default	not_applicable	not_applicable	thunder	storm sound	home_city_travel_nature	El trueno suena fuerte.	El trueno suena fuerte.
noun	relámpago	relámpago	relámpago	el	el	masculine	singular_default	not_applicable	not_applicable	lightning	storm light	home_city_travel_nature	El relámpago ilumina la noche.	El relámpago ilumina la noche.
noun	fuego	fuego	fuego	el	el	masculine	singular_default	not_applicable	not_applicable	fire	hot flame	home_city_travel_nature	El fuego está apagado.	El fuego está apagado.
noun	humo	humo	humo	el	el	masculine	singular_default	not_applicable	not_applicable	smoke	smoke in air	home_city_travel_nature	El humo sale de la cocina.	El humo sale de la cocina.
noun	hierba	hierba	hierba	la	la	feminine	singular_default	not_applicable	not_applicable	grass	green ground	home_city_travel_nature	La hierba está mojada.	La hierba está mojada.
noun	insecto	insecto	insecto	el	el	masculine	singular_default	not_applicable	not_applicable	insect	small animal	home_city_travel_nature	El insecto está en la pared.	El insecto está en la pared.
noun	mosquito	mosquito	mosquito	el	el	masculine	singular_default	not_applicable	not_applicable	mosquito	small insect	home_city_travel_nature	El mosquito vuela cerca.	El mosquito vuela cerca.
noun	caballo	caballo	caballo	el	el	masculine	singular_default	not_applicable	not_applicable	horse	farm animal	home_city_travel_nature	El caballo corre en el campo.	El caballo corre en el campo.
noun	lenteja	lenteja	lenteja	la	la	feminine	singular_default	not_applicable	not_applicable	lentil	food ingredient	food_drink_shopping	La lenteja está en la sopa.	La lenteja está en la sopa.
noun	garbanzo	garbanzo	garbanzo	el	el	masculine	singular_default	not_applicable	not_applicable	chickpea	food ingredient	food_drink_shopping	El garbanzo está cocido.	El garbanzo está cocido.
noun	frijol	frijol	frijol	el	el	masculine	singular_default	not_applicable	not_applicable	bean	food ingredient	food_drink_shopping	El frijol está caliente.	El frijol está caliente.
noun	judía	judía	judía	la	la	feminine	singular_default	not_applicable	not_applicable	bean	food ingredient	food_drink_shopping	La judía está en la olla.	La judía está en la olla.
noun	atún	atún	atún	el	el	masculine	singular_default	not_applicable	not_applicable	tuna	fish food	food_drink_shopping	El atún está en la ensalada.	El atún está en la ensalada.
noun	bacalao	bacalao	bacalao	el	el	masculine	singular_default	not_applicable	not_applicable	cod	fish food	food_drink_shopping	El bacalao está salado.	El bacalao está salado.
noun	salmón	salmón	salmón	el	el	masculine	singular_default	not_applicable	not_applicable	salmon	fish food	food_drink_shopping	El salmón está fresco.	El salmón está fresco.
noun	ternera	ternera	ternera	la	la	feminine	singular_default	not_applicable	not_applicable	veal or beef	meat food	food_drink_shopping	La ternera está en el plato.	La ternera está en el plato.
noun	pavo	pavo	pavo	el	el	masculine	singular_default	not_applicable	not_applicable	turkey	meat food	food_drink_shopping	El pavo está en el horno.	El pavo está en el horno.
noun	cordero	cordero	cordero	el	el	masculine	singular_default	not_applicable	not_applicable	lamb	meat food	food_drink_shopping	El cordero está caliente.	El cordero está caliente.
noun	albóndiga	albóndiga	albóndiga	la	la	feminine	singular_default	not_applicable	not_applicable	meatball	food item	food_drink_shopping	La albóndiga tiene salsa.	La albóndiga tiene salsa.
noun	croqueta	croqueta	croqueta	la	la	feminine	singular_default	not_applicable	not_applicable	croquette	food item	food_drink_shopping	La croqueta está caliente.	La croqueta está caliente.
noun	empanada	empanada	empanada	la	la	feminine	singular_default	not_applicable	not_applicable	empanada	food item	food_drink_shopping	La empanada tiene carne.	La empanada tiene carne.
noun	sándwich	sándwich	sándwich	el	el	masculine	singular_default	not_applicable	not_applicable	sandwich	simple meal	food_drink_shopping	El sándwich tiene queso.	El sándwich tiene queso.
noun	tarta	tarta	tarta	la	la	feminine	singular_default	not_applicable	not_applicable	cake or tart	sweet food	food_drink_shopping	La tarta es de chocolate.	La tarta es de chocolate.
noun	pastel	pastel	pastel	el	el	masculine	singular_default	not_applicable	not_applicable	cake	sweet food	food_drink_shopping	El pastel está en la mesa.	El pastel está en la mesa.
noun	bizcocho	bizcocho	bizcocho	el	el	masculine	singular_default	not_applicable	not_applicable	sponge cake	sweet food	food_drink_shopping	El bizcocho está dulce.	El bizcocho está dulce.
noun	caramelo	caramelo	caramelo	el	el	masculine	singular_default	not_applicable	not_applicable	candy	sweet item	food_drink_shopping	El caramelo es pequeño.	El caramelo es pequeño.
noun	chicle	chicle	chicle	el	el	masculine	singular_default	not_applicable	not_applicable	chewing gum	sweet item	food_drink_shopping	El chicle está en el bolsillo.	El chicle está en el bolsillo.
noun	limonada	limonada	limonada	la	la	feminine	singular_default	not_applicable	not_applicable	lemonade	cold drink	food_drink_shopping	La limonada está fría.	La limonada está fría.
noun	refresco	refresco	refresco	el	el	masculine	singular_default	not_applicable	not_applicable	soft drink	cold drink	food_drink_shopping	El refresco tiene hielo.	El refresco tiene hielo.
noun	cerveza	cerveza	cerveza	la	la	feminine	singular_default	not_applicable	not_applicable	beer	drink	food_drink_shopping	La cerveza está fría.	La cerveza está fría.
noun	vino	vino	vino	el	el	masculine	singular_default	not_applicable	not_applicable	wine	drink	food_drink_shopping	El vino está en la copa.	El vino está en la copa.
noun	sidra	sidra	sidra	la	la	feminine	singular_default	not_applicable	not_applicable	cider	drink	food_drink_shopping	La sidra está en la botella.	La sidra está en la botella.
noun	nata	nata	nata	la	la	feminine	singular_default	not_applicable	not_applicable	cream	dairy food	food_drink_shopping	La nata está en el postre.	La nata está en el postre.
noun	yema	yema	yema	la	la	feminine	singular_default	not_applicable	not_applicable	egg yolk	egg part	food_drink_shopping	La yema es amarilla.	La yema es amarilla.
noun	clara	clara	clara	la	la	feminine	singular_default	not_applicable	not_applicable	egg white	egg part	food_drink_shopping	La clara está en el vaso.	La clara está en el vaso.
noun	masa	masa	masa	la	la	feminine	singular_default	not_applicable	not_applicable	dough	cooking ingredient	food_drink_shopping	La masa está en la mesa.	La masa está en la mesa.
noun	fideo	fideo	fideo	el	el	masculine	singular_default	not_applicable	not_applicable	noodle	food item	food_drink_shopping	El fideo está en la sopa.	El fideo está en la sopa.
noun	caldo	caldo	caldo	el	el	masculine	singular_default	not_applicable	not_applicable	broth	food liquid	food_drink_shopping	El caldo está caliente.	El caldo está caliente.
noun	aperitivo	aperitivo	aperitivo	el	el	masculine	singular_default	not_applicable	not_applicable	appetizer	small food	food_drink_shopping	El aperitivo llega primero.	El aperitivo llega primero.
noun	aceituna	aceituna	aceituna	la	la	feminine	singular_default	not_applicable	not_applicable	olive	food item	food_drink_shopping	La aceituna está en la tapa.	La aceituna está en la tapa.
noun	aguacate	aguacate	aguacate	el	el	masculine	singular_default	not_applicable	not_applicable	avocado	fruit food	food_drink_shopping	El aguacate está maduro.	El aguacate está maduro.
noun	coco	coco	coco	el	el	masculine	singular_default	not_applicable	not_applicable	coconut	fruit food	food_drink_shopping	El coco está abierto.	El coco está abierto.
noun	papaya	papaya	papaya	la	la	feminine	singular_default	not_applicable	not_applicable	papaya	fruit food	food_drink_shopping	La papaya está dulce.	La papaya está dulce.
verb	saludar	saludar	saludar	not_applicable	not_applicable	not_applicable	not_applicable	saludar	-ar	to greet	greeting someone	core_verbs_part004	Saludo a mi vecino.	Saludo a mi vecino.
verb	despedirse	despedirse	despedirse	not_applicable	not_applicable	not_applicable	not_applicable	despedirse	irregular	to say goodbye	leaving someone	core_verbs_part004	Me despido en la puerta.	Me despido en la puerta.
verb	disculparse	disculparse	disculparse	not_applicable	not_applicable	not_applicable	not_applicable	disculparse	-ar	to apologize	saying sorry	core_verbs_part004	Me disculpo por llegar tarde.	Me disculpo por llegar tarde.
verb	agradecer	agradecer	agradecer	not_applicable	not_applicable	not_applicable	not_applicable	agradecer	irregular	to thank	thanking someone	core_verbs_part004	Agradezco la ayuda.	Agradezco la ayuda.
verb	intentar	intentar	intentar	not_applicable	not_applicable	not_applicable	not_applicable	intentar	-ar	to try	trying an action	core_verbs_part004	Intento hablar despacio.	Intento hablar despacio.
verb	decidir	decidir	decidir	not_applicable	not_applicable	not_applicable	not_applicable	decidir	-ir	to decide	choosing a plan	core_verbs_part004	Decido viajar mañana.	Decido viajar mañana.
verb	comprobar	comprobar	comprobar	not_applicable	not_applicable	not_applicable	not_applicable	comprobar	irregular	to check	checking a fact	core_verbs_part004	Compruebo la dirección.	Compruebo la dirección.
verb	comparar	comparar	comparar	not_applicable	not_applicable	not_applicable	not_applicable	comparar	-ar	to compare	comparing prices	core_verbs_part004	Comparo dos precios.	Comparo dos precios.
verb	utilizar	utilizar	utilizar	not_applicable	not_applicable	not_applicable	not_applicable	utilizar	-ar	to use	using a tool	core_verbs_part004	Utilizo el teclado.	Utilizo el teclado.
verb	funcionar	funcionar	funcionar	not_applicable	not_applicable	not_applicable	not_applicable	funcionar	-ar	to work or function	device working	core_verbs_part004	La impresora funciona bien.	La impresora funciona bien.
verb	costar	costar	costar	not_applicable	not_applicable	not_applicable	not_applicable	costar	irregular	to cost	price	core_verbs_part004	El billete cuesta poco.	El billete cuesta poco.
verb	medir	medir	medir	not_applicable	not_applicable	not_applicable	not_applicable	medir	irregular	to measure	measuring size	core_verbs_part004	Mido la mesa con la regla.	Mido la mesa con la regla.
verb	pesar	pesar	pesar	not_applicable	not_applicable	not_applicable	not_applicable	pesar	-ar	to weigh	weighing food	core_verbs_part004	Peso la fruta en la tienda.	Peso la fruta en la tienda.
verb	faltar	faltar	faltar	not_applicable	not_applicable	not_applicable	not_applicable	faltar	-ar	to be missing	missing item	core_verbs_part004	Falta una silla.	Falta una silla.
verb	sobrar	sobrar	sobrar	not_applicable	not_applicable	not_applicable	not_applicable	sobrar	-ar	to be left over	extra amount	core_verbs_part004	Sobra un poco de arroz.	Sobra un poco de arroz.
verb	organizar	organizar	organizar	not_applicable	not_applicable	not_applicable	not_applicable	organizar	-ar	to organize	organizing a plan	core_verbs_part004	Organizo la reunión.	Organizo la reunión.
verb	planear	planear	planear	not_applicable	not_applicable	not_applicable	not_applicable	planear	-ar	to plan	planning travel	core_verbs_part004	Planeo una excursión.	Planeo una excursión.
verb	revisar	revisar	revisar	not_applicable	not_applicable	not_applicable	not_applicable	revisar	-ar	to review or check	checking a document	core_verbs_part004	Reviso el contrato.	Reviso el contrato.
verb	traducir	traducir	traducir	not_applicable	not_applicable	not_applicable	not_applicable	traducir	irregular	to translate	translating a word	core_verbs_part004	Traduzco una frase.	Traduzco una frase.
verb	pronunciar	pronunciar	pronunciar	not_applicable	not_applicable	not_applicable	not_applicable	pronunciar	-ar	to pronounce	pronouncing a word	core_verbs_part004	Pronuncio la palabra despacio.	Pronuncio la palabra despacio.
verb	deletrear	deletrear	deletrear	not_applicable	not_applicable	not_applicable	not_applicable	deletrear	-ar	to spell	spelling a name	core_verbs_part004	Deletreo mi apellido.	Deletreo mi apellido.
verb	mejorar	mejorar	mejorar	not_applicable	not_applicable	not_applicable	not_applicable	mejorar	-ar	to improve	getting better	core_verbs_part004	Mejoro mi español cada día.	Mejoro mi español cada día.
