part_of_speech	source_lemma	display_ES	display_ES_419	article_ES	article_ES_419	gender	number_policy	verb_infinitive	verb_group	meaning_note	semantic_scene	topic_domain	example_ES	example_ES_419
interjection	pues	pues	pues	not_applicable	not_applicable	not_applicable	not_applicable	not_applicable	not_applicable	well or then	softening a reply	grammar_function_words	Pues, necesito más tiempo.	Pues, necesito más tiempo.
adverb	realmente	realmente	realmente	not_applicable	not_applicable	not_applicable	not_applicable	not_applicable	not_applicable	really	emphasizing a fact	grammar_function_words	Realmente quiero aprender.	Realmente quiero aprender.
adverb	normalmente	normalmente	normalmente	not_applicable	not_applicable	not_applicable	not_applicable	not_applicable	not_applicable	normally	usual routine	time_frequency	Normalmente como en casa.	Normalmente como en casa.
adverb	generalmente	generalmente	generalmente	not_applicable	not_applicable	not_applicable	not_applicable	not_applicable	not_applicable	generally	usual habit	time_frequency	Generalmente camino al trabajo.	Generalmente camino al trabajo.
adverb	especialmente	especialmente	especialmente	not_applicable	not_applicable	not_applicable	not_applicable	not_applicable	not_applicable	especially	special preference	degree_manner	Me gusta especialmente esta canción.	Me gusta especialmente esta canción.
adverb	solamente	solamente	solamente	not_applicable	not_applicable	not_applicable	not_applicable	not_applicable	not_applicable	only	limiting a choice	degree_manner	Solamente tengo un minuto.	Solamente tengo un minuto.
adverb	rápidamente	rápidamente	rápidamente	not_applicable	not_applicable	not_applicable	not_applicable	not_applicable	not_applicable	quickly	fast action	degree_manner	Respondo rápidamente al mensaje.	Respondo rápidamente al mensaje.
adverb	lentamente	lentamente	lentamente	not_applicable	not_applicable	not_applicable	not_applicable	not_applicable	not_applicable	slowly	slow action	degree_manner	Camino lentamente por la calle.	Camino lentamente por la calle.
adverb	fácilmente	fácilmente	fácilmente	not_applicable	not_applicable	not_applicable	not_applicable	not_applicable	not_applicable	easily	easy result	degree_manner	Entiendo fácilmente la palabra.	Entiendo fácilmente la palabra.
adverb	allá	allá	allá	not_applicable	not_applicable	not_applicable	not_applicable	not_applicable	not_applicable	over there	pointing far away	location_direction	La montaña está allá.	La montaña está allá.
adverb	acá	acá	acá	not_applicable	not_applicable	not_applicable	not_applicable	not_applicable	not_applicable	over here	calling someone here	location_direction	Ven acá un momento.	Ven acá un momento.
adverb	encima	encima	encima	not_applicable	not_applicable	not_applicable	not_applicable	not_applicable	not_applicable	on top	place above	location_direction	El vaso está encima.	El vaso está encima.
adverb	debajo	debajo	debajo	not_applicable	not_applicable	not_applicable	not_applicable	not_applicable	not_applicable	underneath	place below	location_direction	La caja está debajo.	La caja está debajo.
adverb	afuera	afuera	afuera	not_applicable	not_applicable	not_applicable	not_applicable	not_applicable	not_applicable	outside	outside a place	location_direction	Los niños están afuera.	Los niños están afuera.
adverb	adentro	adentro	adentro	not_applicable	not_applicable	not_applicable	not_applicable	not_applicable	not_applicable	inside	inside a place	location_direction	El perro está adentro.	El perro está adentro.
adverb	enseguida	enseguida	enseguida	not_applicable	not_applicable	not_applicable	not_applicable	not_applicable	not_applicable	right away	immediate action	time_sequence	Voy enseguida a la puerta.	Voy enseguida a la puerta.
adverb	finalmente	finalmente	finalmente	not_applicable	not_applicable	not_applicable	not_applicable	not_applicable	not_applicable	finally	last step	time_sequence	Finalmente llegamos al hotel.	Finalmente llegamos al hotel.
adverb	recientemente	recientemente	recientemente	not_applicable	not_applicable	not_applicable	not_applicable	not_applicable	not_applicable	recently	recent event	time_sequence	Recientemente cambié de trabajo.	Recientemente cambié de trabajo.
adverb	aproximadamente	aproximadamente	aproximadamente	not_applicable	not_applicable	not_applicable	not_applicable	not_applicable	not_applicable	approximately	estimated amount	degree_manner	Cuesta aproximadamente diez euros.	Cuesta aproximadamente diez euros.
adverb	directamente	directamente	directamente	not_applicable	not_applicable	not_applicable	not_applicable	not_applicable	not_applicable	directly	direct route	degree_manner	Voy directamente al banco.	Voy directamente al banco.
ordinal	cuarto	cuarto	cuarto	not_applicable	not_applicable	not_applicable	not_applicable	not_applicable	not_applicable	fourth	order in a line	numbers_order	Soy el cuarto en la fila.	Soy el cuarto en la fila.
ordinal	quinto	quinto	quinto	not_applicable	not_applicable	not_applicable	not_applicable	not_applicable	not_applicable	fifth	order in a list	numbers_order	El quinto ejercicio es fácil.	El quinto ejercicio es fácil.
ordinal	sexto	sexto	sexto	not_applicable	not_applicable	not_applicable	not_applicable	not_applicable	not_applicable	sixth	order in a list	numbers_order	Vivo en el sexto piso.	Vivo en el sexto piso.
ordinal	séptimo	séptimo	séptimo	not_applicable	not_applicable	not_applicable	not_applicable	not_applicable	not_applicable	seventh	order in a list	numbers_order	El séptimo día descanso.	El séptimo día descanso.
ordinal	octavo	octavo	octavo	not_applicable	not_applicable	not_applicable	not_applicable	not_applicable	not_applicable	eighth	order in a list	numbers_order	El octavo capítulo es corto.	El octavo capítulo es corto.
ordinal	noveno	noveno	noveno	not_applicable	not_applicable	not_applicable	not_applicable	not_applicable	not_applicable	ninth	order in a list	numbers_order	El noveno tren llega tarde.	El noveno tren llega tarde.
ordinal	décimo	décimo	décimo	not_applicable	not_applicable	not_applicable	not_applicable	not_applicable	not_applicable	tenth	order in a list	numbers_order	El décimo alumno lee la frase.	El décimo alumno lee la frase.
numeral	cuarenta	cuarenta	cuarenta	not_applicable	not_applicable	not_applicable	not_applicable	not_applicable	not_applicable	forty	counting euros	numbers_order	El abrigo cuesta cuarenta euros.	El abrigo cuesta cuarenta euros.
numeral	cincuenta	cincuenta	cincuenta	not_applicable	not_applicable	not_applicable	not_applicable	not_applicable	not_applicable	fifty	counting minutes	numbers_order	El viaje dura cincuenta minutos.	El viaje dura cincuenta minutos.
numeral	sesenta	sesenta	sesenta	not_applicable	not_applicable	not_applicable	not_applicable	not_applicable	not_applicable	sixty	counting minutes	numbers_order	La clase dura sesenta minutos.	La clase dura sesenta minutos.
numeral	setenta	setenta	setenta	not_applicable	not_applicable	not_applicable	not_applicable	not_applicable	not_applicable	seventy	counting euros	numbers_order	La cuenta es de setenta euros.	La cuenta es de setenta euros.
numeral	ochenta	ochenta	ochenta	not_applicable	not_applicable	not_applicable	not_applicable	not_applicable	not_applicable	eighty	counting kilometers	numbers_order	La ciudad está a ochenta kilómetros.	La ciudad está a ochenta kilómetros.
numeral	noventa	noventa	noventa	not_applicable	not_applicable	not_applicable	not_applicable	not_applicable	not_applicable	ninety	counting minutes	numbers_order	El vuelo dura noventa minutos.	El vuelo dura noventa minutos.
numeral	cien	cien	cien	not_applicable	not_applicable	not_applicable	not_applicable	not_applicable	not_applicable	one hundred	counting units	numbers_order	Hay cien personas en la plaza.	Hay cien personas en la plaza.
numeral	mil	mil	mil	not_applicable	not_applicable	not_applicable	not_applicable	not_applicable	not_applicable	one thousand	large number	numbers_order	El pueblo tiene mil habitantes.	El pueblo tiene mil habitantes.
noun	mitad	mitad	mitad	la	la	feminine	singular_default	not_applicable	not_applicable	half	half portion	grammar_function_words	Quiero la mitad del pan.	Quiero la mitad del pan.
noun	vez	vez	vez	la	la	feminine	singular_default	not_applicable	not_applicable	time or occasion	one occasion	time_sequence	Esta vez voy contigo.	Esta vez voy contigo.
noun	final	final	final	el	el	masculine	singular_default	not_applicable	not_applicable	end	end of a route	time_sequence	El final del camino está cerca.	El final del camino está cerca.
noun	principio	principio	principio	el	el	masculine	singular_default	not_applicable	not_applicable	beginning	beginning of a lesson	time_sequence	El principio de la clase es fácil.	El principio de la clase es fácil.
noun	futuro	futuro	futuro	el	el	masculine	singular_default	not_applicable	not_applicable	future	future plan	time_sequence	El futuro parece tranquilo.	El futuro parece tranquilo.
noun	pasado	pasado	pasado	el	el	masculine	singular_default	not_applicable	not_applicable	past	past time	time_sequence	El pasado queda atrás.	El pasado queda atrás.
noun	presente	presente	presente	el	el	masculine	singular_default	not_applicable	not_applicable	present	current time	time_sequence	Vivo en el presente.	Vivo en el presente.
noun	orden	orden	orden	el	el	masculine	singular_default	not_applicable	not_applicable	order	correct order	grammar_function_words	El orden de la lista es claro.	El orden de la lista es claro.
noun	ejemplo	ejemplo	ejemplo	el	el	masculine	singular_default	not_applicable	not_applicable	example	example sentence	learning_basics	El ejemplo ayuda mucho.	El ejemplo ayuda mucho.
noun	idea	idea	idea	la	la	feminine	singular_default	not_applicable	not_applicable	idea	simple idea	learning_basics	La idea es buena.	La idea es buena.
noun	bebé	bebé	bebé	el	el	masculine	singular_default	not_applicable	not_applicable	baby	baby at home	people_family	El bebé duerme en la cuna.	El bebé duerme en la cuna.
noun	adulto	adulto	adulto	el	el	masculine	singular_default	not_applicable	not_applicable	adult man	adult person	people_family	El adulto firma el papel.	El adulto firma el papel.
noun	adulta	adulta	adulta	la	la	feminine	singular_default	not_applicable	not_applicable	adult woman	adult person	people_family	La adulta ayuda al niño.	La adulta ayuda al niño.
noun	adolescente	adolescente	adolescente	not_applicable	not_applicable	common	singular_default	not_applicable	not_applicable	teenager	teenager at school	people_family	El adolescente lee en clase.	El adolescente lee en clase.
noun	anciano	anciano	anciano	el	el	masculine	singular_default	not_applicable	not_applicable	elderly man	older person	people_family	El anciano camina despacio.	El anciano camina despacio.
noun	anciana	anciana	anciana	la	la	feminine	singular_default	not_applicable	not_applicable	elderly woman	older person	people_family	La anciana toma té.	La anciana toma té.
noun	novio	novio	novio	el	el	masculine	singular_default	not_applicable	not_applicable	boyfriend or groom	partner	people_family	Mi novio trabaja hoy.	Mi novio trabaja hoy.
noun	novia	novia	novia	la	la	feminine	singular_default	not_applicable	not_applicable	girlfriend or bride	partner	people_family	Mi novia estudia español.	Mi novia estudia español.
noun	marido	marido	marido	el	el	masculine	singular_default	not_applicable	not_applicable	husband	family relation	people_family	Mi marido cocina arroz.	Mi marido cocina arroz.
noun	esposa	esposa	esposa	la	la	feminine	singular_default	not_applicable	not_applicable	wife	family relation	people_family	Mi esposa lee un libro.	Mi esposa lee un libro.
noun	suegro	suegro	suegro	el	el	masculine	singular_default	not_applicable	not_applicable	father-in-law	family relation	people_family	Mi suegro vive cerca.	Mi suegro vive cerca.
noun	suegra	suegra	suegra	la	la	feminine	singular_default	not_applicable	not_applicable	mother-in-law	family relation	people_family	Mi suegra llama por teléfono.	Mi suegra llama por teléfono.
noun	cuñado	cuñado	cuñado	el	el	masculine	singular_default	not_applicable	not_applicable	brother-in-law	family relation	people_family	Mi cuñado trabaja en una tienda.	Mi cuñado trabaja en una tienda.
noun	cuñada	cuñada	cuñada	la	la	feminine	singular_default	not_applicable	not_applicable	sister-in-law	family relation	people_family	Mi cuñada prepara café.	Mi cuñada prepara café.
noun	abogado	abogado	abogado	el	el	masculine	singular_default	not_applicable	not_applicable	lawyer	work role	people_work	El abogado revisa el contrato.	El abogado revisa el contrato.
noun	abogada	abogada	abogada	la	la	feminine	singular_default	not_applicable	not_applicable	female lawyer	work role	people_work	La abogada lee el documento.	La abogada lee el documento.
noun	arquitecto	arquitecto	arquitecto	el	el	masculine	singular_default	not_applicable	not_applicable	architect	work role	people_work	El arquitecto dibuja una casa.	El arquitecto dibuja una casa.
noun	arquitecta	arquitecta	arquitecta	la	la	feminine	singular_default	not_applicable	not_applicable	female architect	work role	people_work	La arquitecta mira el plano.	La arquitecta mira el plano.
noun	ingeniero	ingeniero	ingeniero	el	el	masculine	singular_default	not_applicable	not_applicable	engineer	work role	people_work	El ingeniero arregla la máquina.	El ingeniero arregla la máquina.
noun	ingeniera	ingeniera	ingeniera	la	la	feminine	singular_default	not_applicable	not_applicable	female engineer	work role	people_work	La ingeniera prueba el motor.	La ingeniera prueba el motor.
noun	taxista	taxista	taxista	not_applicable	not_applicable	common	singular_default	not_applicable	not_applicable	taxi driver	driver role	people_transport	La taxista espera en la parada.	La taxista espera en la parada.
noun	soldado	soldado	soldado	not_applicable	not_applicable	common	singular_default	not_applicable	not_applicable	soldier	work role	people_work	El soldado está en la puerta.	El soldado está en la puerta.
noun	bombero	bombero	bombero	el	el	masculine	singular_default	not_applicable	not_applicable	firefighter	work role	people_work	El bombero ayuda en la calle.	El bombero ayuda en la calle.
noun	bombera	bombera	bombera	la	la	feminine	singular_default	not_applicable	not_applicable	female firefighter	work role	people_work	La bombera lleva agua.	La bombera lleva agua.
noun	peluquero	peluquero	peluquero	el	el	masculine	singular_default	not_applicable	not_applicable	hairdresser	service role	people_services	El peluquero corta el pelo.	El peluquero corta el pelo.
noun	peluquera	peluquera	peluquera	la	la	feminine	singular_default	not_applicable	not_applicable	female hairdresser	service role	people_services	La peluquera lava el pelo.	La peluquera lava el pelo.
noun	vendedor	vendedor	vendedor	el	el	masculine	singular_default	not_applicable	not_applicable	salesman	shop role	people_services	El vendedor muestra una chaqueta.	El vendedor muestra una chaqueta.
noun	vendedora	vendedora	vendedora	la	la	feminine	singular_default	not_applicable	not_applicable	saleswoman	shop role	people_services	La vendedora cobra en la caja.	La vendedora cobra en la caja.
noun	panadero	panadero	panadero	el	el	masculine	singular_default	not_applicable	not_applicable	baker	food job	people_food_services	El panadero hace pan.	El panadero hace pan.
noun	panadera	panadera	panadera	la	la	feminine	singular_default	not_applicable	not_applicable	female baker	food job	people_food_services	La panadera vende pasteles.	La panadera vende pasteles.
noun	carnicero	carnicero	carnicero	el	el	masculine	singular_default	not_applicable	not_applicable	butcher	food job	people_food_services	El carnicero corta carne.	El carnicero corta carne.
noun	carnicera	carnicera	carnicera	la	la	feminine	singular_default	not_applicable	not_applicable	female butcher	food job	people_food_services	La carnicera pesa el pollo.	La carnicera pesa el pollo.
noun	mecánico	mecánico	mecánico	el	el	masculine	singular_default	not_applicable	not_applicable	mechanic	repair role	people_services	El mecánico revisa el coche.	El mecánico revisa el coche.
noun	mecánica	mecánica	mecánica	la	la	feminine	singular_default	not_applicable	not_applicable	female mechanic	repair role	people_services	La mecánica cambia una rueda.	La mecánica cambia una rueda.
noun	cajera	cajera	cajera	la	la	feminine	singular_default	not_applicable	not_applicable	cashier	cash desk role	people_services	La cajera da el recibo.	La cajera da el recibo.
noun	agenda	agenda	agenda	la	la	feminine	singular_default	not_applicable	not_applicable	planner	planning object	study_office_digital	La agenda tiene una cita.	La agenda tiene una cita.
noun	carpeta	carpeta	carpeta	la	la	feminine	singular_default	not_applicable	not_applicable	folder	office object	study_office_digital	La carpeta está en el escritorio.	La carpeta está en el escritorio.
noun	archivo	archivo	archivo	el	el	masculine	singular_default	not_applicable	not_applicable	file	digital file	study_office_digital	El archivo está en la computadora.	El archivo está en la computadora.
noun	papel	papel	papel	el	el	masculine	singular_default	not_applicable	not_applicable	paper	writing material	study_office_digital	El papel está sobre la mesa.	El papel está sobre la mesa.
noun	lápiz	lápiz	lápiz	el	el	masculine	singular_default	not_applicable	not_applicable	pencil	writing tool	study_office_digital	El lápiz escribe bien.	El lápiz escribe bien.
noun	goma	goma	goma	la	la	feminine	singular_default	not_applicable	not_applicable	eraser	school object	study_office_digital	La goma borra la palabra.	La goma borra la palabra.
noun	regla	regla	regla	la	la	feminine	singular_default	not_applicable	not_applicable	ruler	school object	study_office_digital	La regla está en la mochila.	La regla está en la mochila.
noun	pizarra	pizarra	pizarra	la	la	feminine	singular_default	not_applicable	not_applicable	board	classroom object	study_office_digital	La pizarra está limpia.	La pizarra está limpia.
noun	escritorio	escritorio	escritorio	el	el	masculine	singular_default	not_applicable	not_applicable	desk	work furniture	study_office_digital	El escritorio tiene una lámpara.	El escritorio tiene una lámpara.
noun	pantalla	pantalla	pantalla	la	la	feminine	singular_default	not_applicable	not_applicable	screen	computer screen	study_office_digital	La pantalla está encendida.	La pantalla está encendida.
noun	teclado	teclado	teclado	el	el	masculine	singular_default	not_applicable	not_applicable	keyboard	computer object	study_office_digital	El teclado está limpio.	El teclado está limpio.
noun	ratón	ratón	ratón	el	el	masculine	singular_default	not_applicable	not_applicable	computer mouse	computer object	study_office_digital	El ratón está junto al teclado.	El ratón está junto al teclado.
noun	impresora	impresora	impresora	la	la	feminine	singular_default	not_applicable	not_applicable	printer	office machine	study_office_digital	La impresora no funciona.	La impresora no funciona.
noun	cable	cable	cable	el	el	masculine	singular_default	not_applicable	not_applicable	cable	tech object	study_office_digital	El cable está en la bolsa.	El cable está en la bolsa.
noun	cargador	cargador	cargador	el	el	masculine	singular_default	not_applicable	not_applicable	charger	phone charger	study_office_digital	El cargador está en la mesa.	El cargador está en la mesa.
noun	batería	batería	batería	la	la	feminine	singular_default	not_applicable	not_applicable	battery	device power	study_office_digital	La batería está baja.	La batería está baja.
noun	contraseña	contraseña	contraseña	la	la	feminine	singular_default	not_applicable	not_applicable	password	login word	study_office_digital	La contraseña es corta.	La contraseña es corta.
noun	mensaje	mensaje	mensaje	el	el	masculine	singular_default	not_applicable	not_applicable	message	phone message	study_office_digital	El mensaje llega ahora.	El mensaje llega ahora.
noun	llamada	llamada	llamada	la	la	feminine	singular_default	not_applicable	not_applicable	call	phone call	study_office_digital	La llamada dura poco.	La llamada dura poco.
noun	página	página	página	la	la	feminine	singular_default	not_applicable	not_applicable	page	book page	study_office_digital	La página tiene una foto.	La página tiene una foto.
noun	aplicación	aplicación	aplicación	la	la	feminine	singular_default	not_applicable	not_applicable	application	phone app	study_office_digital	La aplicación abre rápido.	La aplicación abre rápido.
noun	cámara	cámara	cámara	la	la	feminine	singular_default	not_applicable	not_applicable	camera	taking a photo	study_office_digital	La cámara está en la mochila.	La cámara está en la mochila.
noun	vídeo	vídeo	vídeo	el	el	masculine	singular_default	not_applicable	not_applicable	video	watching a video	study_office_digital	El vídeo dura dos minutos.	El vídeo dura dos minutos.
noun	internet	internet	internet	el	el	masculine	singular_default	not_applicable	not_applicable	internet	online access	study_office_digital	El internet funciona bien.	El internet funciona bien.
noun	computadora	computadora	computadora	la	la	feminine	singular_default	not_applicable	not_applicable	computer	computer on a desk	study_office_digital	La computadora está encendida.	La computadora está encendida.
noun	tableta	tableta	tableta	la	la	feminine	singular_default	not_applicable	not_applicable	tablet	tablet device	study_office_digital	La tableta tiene una aplicación.	La tableta tiene una aplicación.
noun	auricular	auricular	auricular	el	el	masculine	singular_default	not_applicable	not_applicable	earbud or earphone	audio object	study_office_digital	El auricular está en la bolsa.	El auricular está en la bolsa.
noun	altavoz	altavoz	altavoz	el	el	masculine	singular_default	not_applicable	not_applicable	speaker	audio device	study_office_digital	El altavoz suena fuerte.	El altavoz suena fuerte.
noun	micrófono	micrófono	micrófono	el	el	masculine	singular_default	not_applicable	not_applicable	microphone	audio device	study_office_digital	El micrófono está abierto.	El micrófono está abierto.
noun	fotocopia	fotocopia	fotocopia	la	la	feminine	singular_default	not_applicable	not_applicable	photocopy	copy on paper	study_office_digital	La fotocopia está lista.	La fotocopia está lista.
noun	copia	copia	copia	la	la	feminine	singular_default	not_applicable	not_applicable	copy	copy of a document	study_office_digital	Necesito una copia del documento.	Necesito una copia del documento.
noun	tinta	tinta	tinta	la	la	feminine	singular_default	not_applicable	not_applicable	ink	printer ink	study_office_digital	La tinta es negra.	La tinta es negra.
noun	contrato	contrato	contrato	el	el	masculine	singular_default	not_applicable	not_applicable	contract	work contract	admin_services	El contrato está firmado.	El contrato está firmado.
noun	factura	factura	factura	la	la	feminine	singular_default	not_applicable	not_applicable	invoice or bill	service bill	admin_services	La factura llega por correo.	La factura llega por correo.
noun	impuesto	impuesto	impuesto	el	el	masculine	singular_default	not_applicable	not_applicable	tax	payment duty	admin_services	El impuesto es alto.	El impuesto es alto.
noun	multa	multa	multa	la	la	feminine	singular_default	not_applicable	not_applicable	fine	traffic fine	admin_services	La multa cuesta mucho.	La multa cuesta mucho.
noun	turno	turno	turno	el	el	masculine	singular_default	not_applicable	not_applicable	turn or shift	waiting turn	admin_services	Mi turno empieza ahora.	Mi turno empieza ahora.
noun	cola	cola	cola	la	la	feminine	singular_default	not_applicable	not_applicable	queue or line	waiting line	admin_services	La cola es larga.	La cola es larga.
noun	permiso	permiso	permiso	el	el	masculine	singular_default	not_applicable	not_applicable	permit or permission	official permission	admin_services	Necesito permiso para entrar.	Necesito permiso para entrar.
noun	anuncio	anuncio	anuncio	el	el	masculine	singular_default	not_applicable	not_applicable	advertisement or announcement	public notice	media_leisure	El anuncio está en la pared.	El anuncio está en la pared.
noun	noticia	noticia	noticia	la	la	feminine	singular_default	not_applicable	not_applicable	news item	news story	media_leisure	La noticia es importante.	La noticia es importante.
noun	artículo	artículo	artículo	el	el	masculine	singular_default	not_applicable	not_applicable	article	written article	media_leisure	El artículo es corto.	El artículo es corto.
noun	sección	sección	sección	la	la	feminine	singular_default	not_applicable	not_applicable	section	book section	media_leisure	La sección empieza aquí.	La sección empieza aquí.
noun	capítulo	capítulo	capítulo	el	el	masculine	singular_default	not_applicable	not_applicable	chapter	book chapter	media_leisure	El capítulo termina hoy.	El capítulo termina hoy.
noun	frente	frente	frente	la	la	feminine	singular_default	not_applicable	not_applicable	forehead	body part	body_health_clothing	Me duele la frente.	Me duele la frente.
noun	mejilla	mejilla	mejilla	la	la	feminine	singular_default	not_applicable	not_applicable	cheek	body part	body_health_clothing	La mejilla está roja.	La mejilla está roja.
noun	codo	codo	codo	el	el	masculine	singular_default	not_applicable	not_applicable	elbow	body part	body_health_clothing	Me duele el codo.	Me duele el codo.
noun	muñeca	muñeca	muñeca	la	la	feminine	singular_default	not_applicable	not_applicable	wrist	body part	body_health_clothing	La muñeca está hinchada.	La muñeca está hinchada.
noun	vientre	vientre	vientre	el	el	masculine	singular_default	not_applicable	not_applicable	belly	body part	body_health_clothing	Me duele el vientre.	Me duele el vientre.
noun	pulmón	pulmón	pulmón	el	el	masculine	singular_default	not_applicable	not_applicable	lung	body organ	body_health_clothing	El pulmón necesita aire.	El pulmón necesita aire.
noun	hígado	hígado	hígado	el	el	masculine	singular_default	not_applicable	not_applicable	liver	body organ	body_health_clothing	El hígado está en el cuerpo.	El hígado está en el cuerpo.
